input	target
Awǎjijɛ sín nǔ wɛ é nyí ɖɔ ɖò bǐbɛ̌mɛ 1941 tɔn ɔ ,è ɖè Nicolas nyite ,hwenu e ahwankpá ɖé lɛ xò yeɖée kplé bo tɔ́n ahwan Grèce é .	Jambo zuri ni kwamba mapema katika 1941 ,kwa muda mfupi majeshi ya Muungano yaliingia nchini Ugiriki ,na Nicolas akaachiliwa kutoka gerezani .
Ðò 1942 ɔ ,nɔví sunnu kpo nɔví nyɔnu kpo e ɖó xwè 15 jɛ 25 lɛ é tɛnnɛ wɛ ɖò agun Karítsa tɔn mɛ .	Mwaka 1942 ,Kutaniko la Kartsa lilikuwa na ndugu na dada vijana wenye umri wa kati ya miaka 15 na 25 .
Hwenu e ye byɔ gletoxo mǐtɔn mɛ é ɔ ,ye wlí Kúnnuɖetɔ́ dɔnkpɛvu atɔAntonio Tsoukaris ,Ilias ,kpo nyɛ kpo .	Walipovamia kijiji chetu ,waliniteka nyara pamoja na Mashahidi wengine wawili vijana ,Antonio Tsoukaris na Ilias .
Tɔtɛntinto ɖé wɛ nú Makrónisos ɔ bɔ akú nɔ ɖó ɖ’emɛ tawun ,bo ɖò Attique sín xá mɛ lobo ɖó kilomɛtlu 50 mɔ̌ dó Athènes .	Kisiwa cha Makrnisos kilikuwa kikavu ,chenye jua kali ,na hali ngumu ,kilikuwa juu ya mwamba kwenye eneo la pwani ya Attica ,kilomita 50 hivi kutoka Athene .
Kilomɛtlu 13 jɛn tɔtɛntinto ɔ ɖiga na bo ɖó kilomɛtlu vlɔɖówe mɔ̌ ɖò fí e é gbló ɖè ganji é .	Kisiwa hicho kina urefu wa kilomita 13 ,na sehemu pana zaidi ya kisiwa hicho ni kilomita mbili na nusu .
Hwenu e un wá ɖò bǐbɛ̌mɛ 1949 tɔn é ɔ ,è má gantɔ́ lɛ dó sla vovo lɛ mɛ .	Nilipowasili huko mapema mwaka 1949 ,wafungwa walikuwa wamegawanywa katika kambi kadhaa .
Mǐ mɛ 40 mɔ̌ wɛ nɔ mlɔ́ kɔ́mɛ ɖò goxɔ e è bló nú gbɛtɔ́ 10 mɔ̌ é ɖé mɛ .	Watu 40 hivi kati yetu walilala ardhini ndani ya hema ambalo lilikusudiwa kutoshea watu 10 .
Ðò dɔ̌n ɔ ,ye sɛ́ mì dó Giáros ,tɔtɛntinto ɖé wɛ bo ɖò kilomɛtlu 50 mɔ̌ dó Makrónisos ɖò zǎnzǎnhweji ,bonu má yì sɛ̀n gan nú xwè atɔn .	Nilihukumiwa kifungo cha miaka mitatu kwenye gereza la Yaros Gyaros ,kisiwa kilicho kilomita 50 hivi mashariki mwa Makrnisos .
Hwenu e è ɖè mǐ mɛ Kúnnuɖetɔ́ lɛ nyite ɖò bǐbɛ̌mɛ 1951 tɔn é ɔ ,è ɖè é lɔ nyite .	Mashahidi walipoachiliwa mapema katika 1951 ,yeye pia aliachiliwa .
Égbé dìn e un ko ɖó hugǎn xwè 90 é ɔ ,un kpò ɖò mɛxo agun tɔn nyí wɛ bɔ hlɔnhlɔn kpó ɖò wǔ’ye .	Leo ,nina umri wa zaidi ya miaka 90 ,na bado natumikia nikiwa mzee wa kutaniko .
É ɖò mɔ̌ có ,un kudeji bo na nyí ahwanfuntɔ́ Klisu tɔn ’ ɖé . 2 Tim .	Hata hivyo ,nimeazimia kuendelea kuwa askari - jeshi .wa Kristo .2 Tim .
a Etɛ Elifazi kpo Biludadi kpo ka ɖɔ dó sinsɛnzɔ́ e mǐ nɔ wà nú Mawu é wu	a Elifazi na Bildadi walidai nini kuhusu jinsi Mungu anavyoona utumishi wetu kwake
GBƐTƆ́ sixu jɛ alɔ nú Mawu à	JE ,MWANAMUME anaweza kuwa na faida kwa Mungu mwenyewe ,kwamba mtu mwenye ufahamu awe na faida kwake
Hagbɛ̌ tɔn Biludadi Cuwaxinu ɔ tlɛ dɔn nǔ ɖɔ é gló gbɛtɔ́ lɛ bɔ ye na nyí hwɛjijɔnɔ ɖò Mawu nukɔn . Xà Jɔbu 254 .	Mwandamani wake Bildadi Mshua ,hata alidai kwamba wanadamu hawawezi kuwa na msimamo wa uadilifu mbele za Mungu .Soma Ayubu 254 .
Jehovah bló bɔ è tuùn linlin tɔn hwenu e é gbɛ́ nǔ nú Elifazi ,Biludadi kpo Sofáa kpo ,ɖó adingban e ye ɖó é wu é ,amɔ̌ ,xomɛ hun i dó Jɔbu wu bɔ é ylɔ ɛ ɖɔ ,mɛsɛntɔ́ ce .	Yehova alionyesha hisia zake alipowakaripia Elifazi ,Bildadi ,na Sofari kwa sababu walisema uwongo ,lakini akapendezwa na Ayubu na kumwita ,mtumishi wangu .
Mɛ e nɔ na nǔ wamamɔnɔ ɔ ,nǔ wɛ é nya nú Mawu Mavɔmavɔ Mawu na na ajɔ tɔn ɛ ,wɛ Nùnywɛxó 1917 ɖɔ .	Methali 1917 Anayemwonyesha kibali mtu wa hali ya chini anamkopesha Yehova ,na Yeye atamlipa matendo yake .
Ganji ,xó e Vǐ Mawu tɔn ɖesunɔ ɖɔ é tlɛ xlɛ́ mɔ̌ . Xà Luki .	Ndiyo ,na jambo hilo lilionyeshwa wazi na mwana wa Mungu .Soma Luka .
Axɔsu Kanáa tɔn Yavini kpa acɛ gannaganna ’ nú Izlayɛli - ví lɛ nú xwè 20 .	Waisraeli walikuwa wamekandamizwa kwa ukali ’ na Mfalme Yabini wa Kanaani kwa miaka 20 .
Ðò ahwan kɔli ɔ ,ɖě ɖò ɖě nú ye ǎ ,ye ɖó hwǎn nabi ɖé ǎ ,ye ka lɛ́ ɖó gǎglónú nabi ɖé ǎ ,loɔ ,kɛntɔ́ yetɔn lɛ ka ɖó ahwankɛkɛví gannɔ 900 . Hwɛ .	Kwa kufikiria mambo kwa njia ya kijeshi ,hawakuwa na zana za kivita ,wala silaha za kupigana au kujilinda ilhali maadui zao walikuwa na magari 900 ya vita yaliyokuwa na miundu ya chuma .Amu .
a Alixlɛ́mɛ tɛ lɛ Jehovah ka na Balaaki dó nukɔn	a Mwanzoni Yehova alimpa Baraka maagizo gani
Xà Hwɛɖɔtɔ́ lɛ .	Soma Waamuzi .
Balaaki nya ahwankpá Sisela tɔn gbɔn ali e yì Halocɛti - Goyimu é jí nú kilomɛtlu 24 .	Baraka akafuatilia jeshi la Sisera hadi Haroshethi ,umbali wa kilomita 24 .
Tinmɛ tɛ lɛ Hwɛɖɔtɔ́ lɛ ka na dó ahwan e è fun xá Sisela é jí	Kitabu cha Waamuzi kina habari gani kuhusu pigano dhidi ya Sisera
È ɖó na kplɔ́n Hwɛɖɔtɔ́ lɛ wemata 4 kpo 5 kpo ɖó kpɔ́ ,ɖó tinmɛ ɖé lɛ tíìn bɔ è mɔ ɖò ɖě mɛ bo ka mɔ ɖò ɖě ɔ mɛ ǎ .	Kitabu cha Waamuzi sura ya 4 na ya 5 zinapaswa kuchunguzwa pamoja ,kwa kuwa kila sura hufunua habari tofauti .
Ði kpɔ́ndéwú ɔ ,Hwɛɖɔtɔ́ lɛ ɖɔ Sunví lɛ lɔmɔ̌ fun ahwan ɔ sín jixwé ye nɔ fí e ye nɔ gbɔn lɛ bo fun ahwan xá Sisela .	Kwa mfano ,Waamuzi Nyota zilipigana zikiwa mbinguni ,zikiwa kwenye mizunguko yao zilipigana na Sisera .
Amɔ̌ ,nǔ ɖevo tɛ ka lɛ́ sixu zɔ́n bɔ jǐ ɖaxó enɛ na ja ɖò tɛn enɛ mɛ pɛ́ɛ́ ,ɖò hwe enɛ nu pɛ́ɛ́ bo na ɖí bú ahwankɛkɛ 900 ,zɛ alɔdo Mawu tɔn wu	Ni wazi kwamba ni kwa mwongozo wa Mungu tu mvua kubwa ilinyesha mahali na wakati fulani hususa ,na hivyo kufagilia mbali magari 900 ya vita .
Azɔn atɔn wɛ Hwɛɖɔtɔ́ lɛ dó gesí Jehovah ɖi mɛ e zɔ́n bɔ ye ɖu ɖ’eji é .	Ushindi huo ulielekezwa kwa Yehova mara tatu ,katika Waamuzi .
Ðò Hwɛɖɔtɔ́ lɛ Traduction du monde nouveau mɛ ɔ ,mǐ mɔ vogbingbɔn ɖevo ɖò linlin e mɛ ɖěɖee xwedó Balaaki lɛ é kpo mɛ ɖěɖee ma xwedó è ǎ lɛ é kpo ɖó é tɛntin .	Katika andiko la Waamuzi ,tunaona tofauti nyingine ya mtazamo kati ya wale walioandamana na Baraka na wale waliokataa .
Debola kpo Balaaki kpo kpa ahwangán Izlayɛli tɔn .ɖěɖee zé yeɖée jó bo xwedó togun ɔ lɛ é .	Debora na Baraka waliwapongeza viongozi wa Israeli ,waliojitolea kati ya watu .
Etɛ Hwɛɖɔtɔ́ lɛ 531 ka ɖexlɛ́ dó sɔgudo wu	Andiko la Waamuzi 531 linaashiria nini kuhusu wakati ujao
a Nǔ agɔ tɛ è ka wà xá Nabɔti kpo vǐ sunnu tɔn lɛ kpo	a Nabothi na wanawe walikabili ukosefu gani wa haki
Xà 1 Axɔsu lɛ .	Soma 1 Wafalme .
È na wà nǔ e è wà xá Nabɔti é pɛ́ɛ́ xá Akabu ,asì tɔn ,kpo vǐ sunnu tɔn lɛ kpo . 1 Axɔ .	Ahabu ,mke wake ,na wanawe wangetendewa kama walivyowatendea Nabothi na wanawe .1 Fal .
Etɛwu mɛɖesɔhwe ka na ko cyɔn alɔ hɛnnumɔ Nabɔti tɔn lɛ kpo xɔ́ntɔn tɔn lɛ kpo jí	Kwa nini sifa ya unyenyekevu ingeweza kuwalinda watu wa familia ya Nabothi na rafiki zake
Xà Sɛ́nflínmɛ .	Soma Kumbukumbu la Torati .
Enɛ wu ɔ ,mɛɖesɔhwe nɔ cyɔn alɔ xomɛvɔnɔ lɛ jí bɔ ye nɔ j’ayǐ ɖò gbigbɔ lixo ǎ .	Hivyo ,sifa ya unyenyekevu huwalinda watu wasio na hatia wasipatwe na msiba wa kiroho .
a Ninɔmɛ tɛ lɛ ka sixu tɛ́n nùɖiɖi mǐtɔn kpɔ́n	a Maoni yetu kuhusu haki huenda yakajaribiwa chini ya hali gani
b Ali tɛ lɛ nu mɛɖesɔhwe ka na cyɔn alɔ mǐ jí ɖè	b Sifa ya unyenyekevu itatulinda kwa njia gani
Enyi mɛxo agun tɔn lɛ wá gbeta ɖé kɔn bɔ a ma yí gbè na ǎ ɔ ,nɛ̌ a ka na wà nǔ gbɔn Kpɔ́n akpáxwé 10 kpo 11 kpo	Utatendaje wazee wanapotangaza uamuzi ambao hukubaliani nao Tazama fungu la 10 na 11
É ɖò wɛn ɖɔ ,nǔwiwa kpo mɛɖesɔhwe kpo na wà ɖagbe nú mɛ ɖěɖee ninɔmɛ ɖé kàn lɛ é bǐ ɖò gbigbɔ lixo . Xà 1 Piyɛ́ɛ 55 .	Kwa hakika ,kuonyesha sifa ya unyenyekevu huwasaidia wote wanaohusika .Soma 1 Petro 55 .
Ðò xwè 49 H.M .tɔn ɔ ,mɛsɛ́dó lɛ kpo mɛxo agun tɔn e ɖò Jeluzalɛmu lɛ é kpo kplé bo na kpɔ́n ɖɔ Kosi e wá huzu Klisanwun lɛ é ɖó na gbò ada alǒ gbɔ wɛ à jí .	Katika 49 W.K .,mitume na wanaume wazee huko Yerusalemu walikutana ili kuchunguza ikiwa Watu wa Mataifa waliogeuza imani na kuwa Wakristo walipaswa kutahiriwa .
Lee Piyɛ́ɛ xwlé nǔ e jɛ lɛ é ye kpo adɔgbigbo kpo gbɔn é na ko sù Jwifu lɛ kpo Kosi e wá huzu Klisanwun lɛ é kpo nukúnmɛ .	Inaelekea kwamba Wayahudi na Watu wa Mataifa waliogeuza imani na kuwa Wakristo walithamini ujasiri wa Petro wa kuzungumzia mambo aliyojionea .
Táan klewun ɖé gudo ɖò kplé e ye bló ɖò xwè 49 H.M .tɔn é gudo ɔ ,Piyɛ́ɛ yì Antyɔci Silíi tɔn .	Muda mfupi baada ya mkutano huo uliofanywa mwaka 49 W.K .,Petro alitembelea Siria ya Antiokia .
É ɖò wɛn ɖɔ ,nǔ e Piyɛ́ɛ tuùn lɛ é kpo nǔ e é ko mɔ kpɔ́n lɛ é kpo hɛn lè wá nú ye tawun .	Bila shaka ,walinufaika na ujuzi na uzoefu wa Petro .
Xà Galatinu lɛ .	Soma Wagalatia .
Jlǒ sísɔ́ dó sɔ́ hwɛ kɛ mɛ na ɖexlɛ́ ganji ɖɔ a ɖó linlin e Jehovah nɔ ɖó dó nǔjlɔjlɔwiwa wu é . Xà Matie .	Utayari wako wa kusamehe unaweza kuonyesha una maoni ya Yehova kuhusu haki .Soma Mathayo .
Alɔdido Jonɔ lɛ nú Ye Na Sɛ̀n Jehovah kpo Xomɛhunhun Kpo	Kuwasaidia Wakaaji Wageni Wamtumikie Yehova kwa Kushangilia
Alɔdido Vǐ Jonɔ lɛ Tɔn	Kuwasaidia Watoto wa Wakaaji Wageni
Tan Gbɛzán TɔTokunɔ E Un Nyí É Zɔ́n Bonu Un Gɔn Nǔ Kplɔ́n Mɛ Ðevo lɛ Ǎ	Simulizi la Maisha Kuwa Kiziwi Hakujanizuia Kuwafundisha Wengine
Ma nú Wanyiyi Towe Ðekpo Ó	Usiruhusu Upendo Wako Upoe
A Yí Wǎn nú Mì Hú Elɔ lɛ À	Je ,Unanipenda Kuliko Hawa
Lee Gayiwusi D’alɔ Nɔví Tɔn lɛ Gbɔn É	Jinsi Gayo Alivyowasaidia Ndugu Zake
Awǎjijɛ E È Nɔ Mɔ Ðò Gbɛzán E Bɔkun É ɖé Zinzan Mɛ É	Shangwe ya Kuishi Maisha Rahisi
Dɔkun E Ðò Nǔ Xóxó Sɛxwetɛn Mǐtɔn lɛ É	Hifadhi Yetu ya Vitu Vya Kale
a Mɛtɛnkpɔn tɛ lɛ ka nɔ kpannukɔn ɖé lɛ ɖò nɔví sunnu kpo nɔví nyɔnu mǐtɔn lɛ kpo mɛ	a Baadhi ya ndugu na dada zetu wanakabili majaribu gani
b Nùkanbyɔ tɛ lɛ ka fɔ́n nyite	b Ni maswali gani yanayozuka
Mɛjitɔ́ ce lɛ kpo nɔví mǐtɔn 11 kpo hɔn dó gbɛ̀ yetɔn jí nǔ kwínwe ɖé jɛn ye hɛn .	Wazazi wetu na sote watoto 11 tulikimbia ili kuokoa maisha yetu tukiwa tumebeba vitu vichache sana .
Awovinú tɛ lɛ mɛ lɛ ka nɔ mɔ hwenu e a ye ɖò hìnhɔ́n wɛ é	Wakimbizi hukabili hatari gani a wanapokuwa njiani wakikimbia
Xwè 12 wɛ un ɖó hwe ɔ nu .	Nilikuwa na umri wa miaka 12 .
Ye ɖó linlin e sɔgbe é ,bo nɔ flín ɖɔ Izlayɛli - ví e ɖi zɔnlin gbɔn gbetótló mɛ lɛ é ɖɔhun ɔ ,emi na wá gosin sla bibɛtɛn tɔn mɛ gbè ɖokpo . 2 Kɔ .	Walidumisha mtazamo mzuri kwa kukumbuka kwamba ,kama Waisraeli ambao walivuka nyika ,siku moja wangeondoka kambini .2 Kor .
a Nɛ̌ wanyiyi Mawu tɔn ka sísɛ́ Klisanwun lɛ bɔ ye wà nǔ xá nɔví yetɔn e ɖò hudo mɛ lɛ é gbɔn	a Kumpenda Mungu kunawachocheaje Wakristo kuwasaidia ndugu walio na uhitaji
Xà 1 Jaan .	Soma 1 Yohana .
a Wuvɛ̌ tɛ lɛ ka sixu kpannukɔn mɛ ɖěɖee hɔn sín tò yetɔn mɛ lɛ é ɖò tò yɔyɔ̌ ɖevo mɛ	a Wakimbizi wanaweza kukabili changamoto gani katika nchi ya kigeni
Wuvɛ̌sexámɛ mǐtɔn kpo alɔ tawun tawun e mǐ na dó ye lɛ é kpo sixu hɛn nùɖiɖi yetɔn lidǒ . Nùx .	Tunaweza kuimarisha imani yao tunapowajali na kuwasaidia .Met .
a Nɛ̌ mǐ ka sixu d’alɔ tawun tawun lɛ mɛ e hɔn sín tò yetɔn mɛ lɛ é gbɔn	a Tunaweza kuwasaidia wakimbizi katika njia zipi
Nǔ e sín hudo mi ɖó é bǐ ɖíe ’ ​ — Xà 1 Timɔtée 68 .	Huu tu ndio mnaohitaji ’ Soma 1 Timotheo 68 .
a Nú è xlɛ́ wanyiyi Klisanwun tɔn mɛ ɖěɖee hɔn sín tò yetɔn mɛ lɛ é ɔ ,ɖagbe tɛ ka nɔ tɔ́n sín mɛ	a Tunapata matokeo gani mazuri tunapowaonyesha wakimbizi upendo wa Kikristo
Kúnnuɖetɔ́ Jehovah tɔn lɛ kɛɖɛ jɛn sixu wà mɔ̌ ​ — Xà Jaan 1335 .	Ni Mashahidi wa Yehova pekee Soma Yohana 1335 .
Sɔgbe kpo xó e Haut commissariat des nations unies pour les réfugiés ɖɔ é kpo ɔ ,gbɔn gbɛ̀ ɔ bǐ mɛ ɔ ,gbɛtɔ́ 1 ɖò 113 jí nɔ sɛ̀ tɛn gannugánnú .	Kulingana na Tume ya Umoja wa Mataifa Inayoshughulikia Wakimbizi UNHCR ,leo mtu 1 kati ya watu 113 ulimwenguni pote amelazimishwa kukimbia kutoka mahali anapoishi .
Kpɔ́n xota Mi Flín Ðɔ Mi Ðó Na Yí Ye Mɛ E Nɔ Wá Ba Jonɔ Mi lɛ É Ganji ee tɔ́n ɖò Atɔxwɛ Octobre 2016 tɔn mɛ é ,wex .	Tazama makala Msisahau Ukaribishaji - Wageni katika gazeti Mnara wa Mlinzi la Oktoba 2016 ,uku .
Nú mɛ ɖěɖee hɔn sín tò yetɔn mɛ lɛ é wá tò mǐtɔn mɛ gudo tlolo ɔ ,mɛxo lɛ ɖó na xwedó alixlɛ́mɛ e ɖò Mí Yin Tito - Basina Nado Wà Ojlo Jehovah Tọn mɛ é ,wemata 8 ,akpáxwé 30 .	Baada tu ya mkimbizi kufika eneo la kigeni ,wazee wanapaswa kufuata mwongozo unaopatikana katika kitabu Tengenezo Linalofanya Mapenzi ya Yehova ,sura ya 8 ,fungu la 30 .
Nɛ̌ mɛjitɔ́ lɛ ka sixu sɔ́ kpɔ́ndéwú ɖagbe ɖ’ayǐ nú vǐ yetɔn lɛ gbɔn	Wazazi wanaweza kuwawekeaje watoto wao mfano mzuri
Nɛ̌ mɛ ɖevo lɛ ka sixu d’alɔ mɛjitɔ́ e gosin jɔtɛn yetɔn bo ɖò tò ɖevo mɛ lɛ é kpo vǐ yetɔn lɛ kpo gbɔn	Wengine wanaweza kuwasaidiaje wazazi ambao ni wahamiaji pamoja na watoto wao
a Wuvɛ̌ tɛ gègě vǐ e gosin jɔtɛn yetɔn bo ɖò tò ɖevo mɛ lɛ é tɔn ka nɔ mɔ	a Watoto wengi wahamiaji hukabili tatizo lipi
a Nɛ̌ mɛjitɔ́ lɛ ka sixu sɔ́ kpɔ́ndéwú ɖagbe ɖ’ayǐ nú vǐ yetɔn lɛ gbɔn	a Wazazi wanaweza kuwawekeaje watoto wao mfano mzuri
Flín ,enyi vǐ lɛ wɛ na sɔ́ nǔ e ye ɖó lɛ dó tɔ́jú mɛjitɔ́ yetɔn lɛ na ǎ loɔ ,mɛjitɔ́ lɛ wɛ na sɔ́ nǔ e ye ɖó lɛ dó tɔ́jú vǐ yetɔn lɛ na . 2 Kɔ .	Kumbukeni ,watoto hawapaswi kuweka akiba kwa ajili ya wazazi wao ,bali wazazi kwa ajili ya watoto wao .2 Kor .
a Mɛ̌ ka na wá gbeta ɔ kɔn ɖɔ gbè lě mɛ wɛ xwédo ɔ na nɔ yì kplé dó	a Ni nani anayepaswa kuamua familia itashirikiana na kutaniko la lugha gani
Nugbodòdó tɛ lɛ é ka na zán	Ni kanuni gani zinazohusika
a Etɛ gbè ka sixu wà nú lee vǐ lɛ na kplɔ́n nǔ gbɔn ɖò kplé lɛ jí é	a Lugha inaweza kuathirije kile ambacho mtoto anajifunza mikutanoni
Xà 1 Kɔlɛntinu lɛ .	Soma 1 Wakorintho .
Etɛ mɛjitɔ́ e jó jɔtɛn yetɔn lɛ dó bo ɖò tò ɖevo mɛ lɛ é ka sixu wà	Wazazi wahamiaji wanaweza kufanya nini
a Etɛwu asú kpo asì kpo e gosin jɔtɛn yetɔn bo ɖò tò ɖevo mɛ é ɖé ka wá gbeta ɔ kɔn bɔ xwédo yetɔn jɛ kplé lɛ yì jí ɖò agun e nɔ dó gbè xá ɔ mɛ tɔn é ɖé mɛ	a Kwa nini wazazi fulani wahamiaji walihamia kutaniko la lugha ya wenyeji pamoja na familia yao
Hwenu e un ɖó xwè 12 é ɔ ,un yì kpléɖókpɔ́ ɖaxó ɖé dó gbè e mǐ nɔ dó ɖò wemaxɔmɛ é mɛ .	Nilipokuwa na umri wa miaka 12 ,nilihudhuria kusanyiko lililotumia lugha niliyozungumza shuleni .
Xà Nùnywɛxó 18 ,28 .	Soma Methali 18 ,28 .
Vǐ lɛ kpo mɛjitɔ́ yetɔn lɛ kpo bǐ nɔ ɖu lè gbɛ̌dido xá agun ɔ tɔn Kpɔ́n akpáxwé	Watoto na wazazi hunufaika kwa kushirikiana na kutaniko Tazama fungu la 18 na 19
a Nɛ̌ nɔví sunnu kpo nɔví nyɔnu kpo ɖěɖee ɖó linlin ɖagbe lɛ é ka sixu bló gbɔn bɔ mɛ winnyawinnya lɛ na ɖu lè yetɔn	a Ndugu na dada waliokomaa kiroho wanaweza kuwanufaishaje vijana
Xà 2 Tan 157 .	Soma 2 Mambo ya Nyakati 157 .
Mars 2007 tɔn mɛ ,wexwɛ .	la Machi 2007 ,uku .
Mɛ e tɔn wɛ éWalter Markin	Limesimuliwa na Walter Markin
Un bló baptɛm ɖò 1941 ,hwenu e un ɖó xwè 12 é .	Nilibatizwa mwaka 1941 nikiwa na umri wa miaka 12 .
Amɔ̌ ,kaka 1946 wɛ un wá mɔ nukúnnú jɛ nugbǒ Biblu tɔn mɛ tawun .	Lakini mwaka 1946 ndipo nilipoelewa vizuri kweli ya Biblia .
ÐÒ 1910 mɔ̌ ɔ ,mɛjitɔ́ ce lɛ sɛ̀ tɛn sín Tbilisi ,Georgie yì Canada ,bo cí gletoxo kpɛví e ɖò fí faɖaɖa ɖé ,bo sɛkpɔ Pelly ,Saskatchewan é ɖò gbadahweji Canada tɔn .	KATIKA miaka ya 1910 ,wazazi wangu walihamia Kanada kutoka Tbilisi ,Georgia ,na kuishi katika nyumba ndogo iliyo mashambani karibu na Pelly ,Saskatchewan ,magharibi mwa Kanada .
È jì mì ɖò 1928 ,bɔ un nyí kpodé nú vǐ ayizɛ́n e mɛjitɔ́ ce lɛ jì é .	Nilizaliwa mwaka 1928 ,nikiwa wa mwisho kati ya watoto sita .
É sɔ́ lín ǎ bɔ dada ce ɖaxó bǐ e nyí Lucy é lɔ kú ,hwenu e é ɖó xwè 17 é .	Lucy ,dada yangu mkubwa ,alikufa muda mfupi baada ya hapo ,akiwa na umri wa miaka 17 .
É sɔ́ lín ǎ bɔ un jló na bló baptɛm ,bɔ ɖò 5 Septembre 1941 ɔ ,Bill bló baptɛm nú mì ,ɖò balíi e mɛ è dun dotɔmɛsin dó b’ɛ gɔ́ é mɛ .	Muda mfupi baadaye ,nilitaka kubatizwa ,na Septemba ,Bill alinibatiza kwenye tangi la chuma lililokuwa na maji yaliyotolewa kwenye kisima .
Un ɖò kplékplé tokunɔ lɛ tɔn ɖé mɛ ɖò kpléɖókpɔ́ ɖaxó ɖé jí ɖò Cleveland ,Ohio ,ɖò 1946	Nikiwa na kikundi cha viziwi katika kusanyiko huko Cleveland ,Ohio ,mwaka 1946
Ðò 1946 ɔ ,un lɛkɔ yì xwé ɖò gbɔjɛyiyi aluùn mɛ tɔn ɔ hwenu mǐ yì kpléɖókpɔ́ ɖaxó ɖé ɖò Cleveland ,Ohio ,États - Unis .	Mnamo 1946 niliporudi nyumbani wakati wa majira ya joto ,tulihudhuria kusanyiko huko Cleveland ,Ohio ,Marekani .
Azɔ̌mɛvígbɛ́ ce lɛ ,ɖi Larry Androsoff ,Norman Dittrick ,kpo Emil Schneider kpo wá yí nugbǒ ɔ ,bɔ ye ɖò Jehovah sɛ̀n wɛ kpo gbejininɔ kpo kaka jɛ égbé .	Mwishowe wanafunzi wenzangu Larry Androsoff ,Norman Dittrick ,na Emil Schneider walikubali kweli ,na wanamtumikia Yehova kwa ushikamanifu hadi leo .
Ðò 1950 ɔ ,un sɛ̀ tɛn yì Vancouver .	Mwaka 1950 ,nilihamia Vancouver .
Ðokpo ɖò ye mɛ wɛ nyí Eunice Colin .	Mmoja wao alikuwa Eunice Colin .
Nyɛ kpo Eunice kpo ɖò 1960 kpo 1989 kpo	Mimi na Eunice mwaka 1960 na mwaka 1989
Hwenu e Eunice ɖó hwe 17 é ɔ ,é tɔ́n sín xwégbe ,bɔ xwédo e ɖò xá ɔ mɛ bo nyí Kúnnuɖetɔ́ é ɖé nyɔ́ xomɛ ,bo yí i ,lobo kpé nukún dó wutu tɔn .	Alipokuwa na umri wa miaka 17 ,Eunice aliondoka nyumbani ,na familia moja ya Mashahidi ikamchukua na kuishi naye .
Hwenu e mǐ wlí alɔ ɖò 1960 é ɔ ,mɛjitɔ́ tɔn lɛ wá alɔwliwli ɔ tɛnmɛ ǎ .	Tulipofunga ndoa mwaka 1960 ,wazazi wake hawakuhudhuria arusi yetu .
É kpo sun ɖokpo bɔ alɔwliwli mǐtɔn na kpé xwè 40 é ɔ ,Eunice kú ɖó kansɛ́ɛzɔn wu .	Mwezi mmoja kabla ya kuadhimisha miaka 40 ya ndoa yetu ,Eunice alikufa kwa sababu ya kansa .
Faye kpo James kpo ,Jerry kpo Evelyn kpo ,Shannan kpo Steven kpo	Faye na James Jerry na Evelyn Shannan na Steven
Ðò Février 2012 ɔ ,un j’ayǐ bo wɛ́n alin bɔ é wá ɖò wɛn ɖɔ un ɖó hudo alɔdo tɔn .	Katika Februari 2012 ,nilianguka na kuvunjika nyonga ,na ikawa wazi kwamba ningehitaji msaada .
Agun glɛnsigbe tɔn ɖé mɛ ninɔ ɖò xwè enɛ lɛ bǐ vlamɛ ,sín 1946 ,nɛ̌ un ka kpéwú bo nɔ ganji ɖò gbigbɔ lixo gbɔn	Niliwezaje kuwa na hali nzuri ya kiroho licha ya kuwa katika kutaniko la Kiingereza tangu mwaka 1946
Un ɖò wemaxɔmɛ gbexosin - alijitɔ́ lɛ tɔn jí dó tokunɔgbe Amɛlika tɔn mɛ hwenu e un ɖó xwè 79 é	Nilipohudhuria shule ya mapainia katika Lugha ya Ishara ya Marekani nikiwa na umri wa miaka 79
Watch Tower Bible and Tract Society of Pennsylvania	Watch Tower Bible and Tract Society of Pennsylvania
MƐ NABI E WÁ FLǏN É 2016	HUDHURIO LA UKUMBUSHO 2016
Adanuwiwa na kpé fí bǐ bɔ nùɖitɔ́ gègě sín wanyiyi na ɖekpo . MAT .	Kwa sababu ya kuongezeka kwa uasi - sheria upendo wa walio wengi zaidi utapoa .MT .
WUNTUN e xlɛ́ hwenu e gbɛ̀ elɔ na vɔ dó ɔ sín akpáxwé ɖokpo wɛ nyí ɖɔ nùɖitɔ́ gègě sín wanyiyi na ɖekpo .	SEHEMU moja ya ishara ambayo Yesu alitoa kuhusu umalizio wa mfumo wa mambo ni kuwa upendo wa walio wengi zaidi ungepoa .
a Ali tɛ lɛ nu wanyiyi ka nɔ ɖekpo ɖè ɖò azǎn mǐtɔn gbè	a Katika siku zetu ,upendo umepoa katika njia zipi
Xà Ðɛhan 9710 .	Soma Zaburi 9710 .
b Jiɖe tɛ mǐ ka mɔ ɖò Ðɛhan 136gɔ́ ɔ mɛ	b Tunapata kitia moyo gani katika Zaburi 136
Mǐ mɔ xó mɔhun lɛ ɖò Ðɛhan 13623 mɛ ,é ɖɔ É wɛ flín mǐ hwenu e adǎn ɖò mǐ gbò wɛ é ɖó xomɛnyínyɔ́ tɔn ɖò te kaka sɔyi .	Tunasoma maneno kama hayo katika andiko la Zaburi 13623Kwa maana fadhili zake zenye upendo ni za mpaka wakati usio na kipimo .
Pɔlu wlan ɖɔ Aklunɔ wɛ nyí mɛ e nɔ d’alɔ mǐ é .	Yehova ni msaidizi wangu sitaogopa .
Xà Ðɛhan .	Soma Zaburi .
Nɛ̌ mǐ ka sixu bló gbɔn bɔ wanyiyi mǐtɔn nú nugbǒ Biblu tɔn na gɔ́ngɔ́n	Tunaweza kuongezaje upendo wetu kwa kweli za Biblia
a Sɔgbe xá Jaan ɔ ,etɛ mǐ ka ɖó na bló	a Tuna jukumu gani kulingana na Yohana
Enɛ wu ɔ ,mi bonu mǐ ni ma lɔn gbeɖé bonu wanyiyi mǐtɔn ɖekpo ó	Kwa hiyo ,tusiruhusu kamwe upendo wetu upoe
Nɛ̌ mǐ ka sixu sɔ́ agbazazɔ́ ɖó tɛn e jɛxa ɛ é mɛ gbɔn	Tunawezaje kuwa na usawaziko kuhusu kazi ya kimwili
Piyɛ́ɛ na xósin bo ɖɔ Ɛɛn Aklunɔ a tuùn ɖɔ un yí wǎn nú we .	Ndiyo ,Bwana ,unajua ninakupenda .
a Mɛ̌ mǐ ka ɖu gbejininɔ mǐtɔn sín axɔ dó jɛ nukɔn	a Tunapaswa kuwa washikamanifu kwa nani kwanza
Un xoɖɛ sɛ́dó Jehovah bo byɔ ɛ ɖɔ é ni d’alɔ mì ,bonu má ɖu ɖ’eji lobonu nǔ e nya wɛ un ɖè ,bo na mɔ táan gègě nú nǔ gbigbɔ tɔn lɛ é ni kpa mì .	Nilisali kwa Yehova na kumwomba anisaidie kukabiliana na hali hiyo ,na kufikia lengo la kuwa na muda zaidi wa kufanya mambo ya kiroho .
Nǔ e ɖò taji hugǎn é wɛ nyí ɖɔ ,dìn ɔ ,un mɔ ɖɔ un sɛkpɔ Jehovah hugǎn . Xà Matie ,nwt .	Na jambo muhimu hata zaidi ,sasa ninahisi nikiwa karibu sana na Yehova .Soma Mathayo .
Nugbǒ ɔ ,gbɔjɛyiyi kpo ayiɖeɖayi kpo nɔ sú dò taji ɖé .	Kwa kweli ,kuwa na tafrija na burudani ni muhimu .
É ka byɔ ɖɔ a ni bló huzuhuzu ɖé wɛ à ​ — Xà Efɛzinu lɛ .	Je ,unahitaji kupunguza kitinda mlo Soma Waefeso .
Mawu wɛ na ayiɖeɖayi ɖagbe lɛ .	Burudani inayofaa ni zawadi ya Mungu .
a Ali tɛ nu agbaza sín nǔ lɛ gbé nyinya ka sixu huzu mɔ ɖé nú Klisanwun ɖé ɖè	a Ni kwa njia gani kupenda vitu vya kimwili kunaweza kuwa mtego kwa Mkristo
É ɖɔ gɔ́ na ɖɔ Mi sixu sɛ̀n Mawu bo lɛ́ sɛ̀n dɔkun ǎ .	Hamwezi kutumikia Mungu na Utajiri .
b Etɛ ka na d’alɔ mǐ bɔ mǐ na fun ahwan xá jlǒ agbazanú lɛ gbé nyinya tɔn	b Ni nini kinachotusaidia kupambana na tamaa ya kupenda vitu vya kimwili
Xà 1 Kɔlɛntinu lɛ 214 .	Soma 1 Wakorintho 214 .
ɖò Atɔxwɛ Gungbe 15 Octobre 2011 mɛ ,wex .,akpá .	katika gazeti Mnara wa Mlinzi la Oktoba ,uku .,fu .
Wema - sɛ́dó - mɛ e mɛsɛ́dó ɔ wlan ɖò 98 H.M .tɔn é tɔ́n ɖò Akpáxwé Biblu Tɔn E È Wlan Dó Glɛkigbe Mɛ É mɛ ,bo nyí Wema Atɔngɔ E Jaan Wlan É .	Barua hiyo ya mtume Yohana iliyoandikwa 98 W.K .hivi ,inajulikana katika Maandiko ya Kigiriki ya Kikristo kuwa Barua ya Tatu ya Yohana .
Enɛ wu wɛ Jaan wlan ɖɔ Mǐ ɖó na d’alɔ gbɛtɔ́ mɔhun lɛ ,bo na sixu wà azɔ̌ xá ye ,nú nugbǒ ɔ na yì nukɔn . 3 Jaan 8 .	Sisi tuna wajibu wa kuwakaribisha watu wa namna hiyo ,ili tuwe wafanyakazi wenzi katika kweli .3 Yoh .
Gudo mɛ ɔ ,Jehovah na bló bɔ ye na lɛkɔ sín hwɛ yetɔn lɛ gudo ,bo na mɔ nukúnnú jɛ nugbǒ ɔ wu . 2 Tim .	Na huenda Yehova akawapa toba inayoongoza kwenye ujuzi sahihi juu ya kweli .2 Tim .
Ðò nùwlanwlan Glɛkigbe tɔn dòdó ɔ mɛ ɔ ,xókwin 219 wɛ wema e Jaan wlan sɛ́dó Gayiwusi é ɖó ,bɔ é sín enɛ wu bɔ é nyí wema e hwe hugǎn ɖò Biblu mɛ é .	Barua ya Yohana kwa Gayo ndiyo kitabu kifupi zaidi katika Biblia ,chenye maneno 219 tu katika Kigiriki .
DANIEL KPO MIRIAM KPO wlí alɔ ɖò Septembre 2000 ,bo sɛ̀ tɛn yì toxo Barcelone tɔn mɛ ɖò Espagne .	DANIEL NA MIRIAM walifunga ndoa Septemba 2000 na kuishi katika jiji la Barcelona ,Hispania .
Ðò Mai 2007 ɔ ,Daniel kpo Miriam kpo jó azɔ̌ yetɔn lɛ dó ,bo sɛ̀ tɛn yì Panama ,tò e mɛ ye ko ɖi sà yì ɖ’ayǐ é ɖé mɛ .	Katika Mei 2007 ,Daniel na Miriam waliacha kazi zao na kwenda Panama ,nchi waliyowahi kutembelea .
Ye gbɔn tɔtɛntinto lɛ mɛ kpo batóo kpo kpodo kɛkɛ kpo ,bo flín ganji ɖɔ azɔn nukɔntɔn e emi kun kɛkɛ - afɔdokwín bo bló kilomɛtlu 32 ,ɖò só e xwete lɛ é jí ,ɖò hwesivɔ syɛnsyɛn nu é nɛ .	Walisafiri katika visiwa hivyo kwa mashua na baiskeli ,na wanakumbuka vizuri siku ya kwanza waliyosafiri kwa baiskeli ambapo walisafiri kwa kilomita 32 hivi ,na kupanda milima mirefu kukiwa na jua kali .
É sɔ́ lín ǎ ,bɔ ye ɖó Biblu kplɔnkplɔn 23 .	Muda si muda ,walikuwa wakiongoza mafunzo ya Biblia 23 .
Ðò 2015 ɔ ,huzuhuzu e wá tutoblonunu ɔ mɛ é zɔ́n bɔ è byɔ Daniel kpo Miriam kpo ɖɔ ye ni huzu gbexosin - alijitɔ́ hwebǐnu tɔn .	Katika 2015 ,kwa sababu ya mabadiliko katika tengenezo ,Daniel na Miriam waliombwa waendelee kutumikia wakiwa mapainia wa kawaida .
Ye ɖeji dó akpá e ɖò Ðɛhan 375 mɛ é Sɔ́ gbɛ̀ towe jó nú Mawu Mavɔmavɔ ,ganjɛ wǔ tɔn ,é na wà azɔ̌ tɔn .	Waliamini ahadi hii inayopatikana katika Zaburi 375 Mkabidhi Yehova njia yako ,na kumtegemea ,naye mwenyewe atatenda .
Ye ɖɔ Alɔdido mɛɖesɔhwetɔ́ lɛ bonu ye ni kplɔ́n nǔ dó Jehovah wu nyí awǎjijɛ e è ma sixu sɔ́ jlɛ́ dó nǔ ɖebǔ wu ǎ é ɖé	Kuwasaidia watu wanyenyekevu wajifunze kumhusu Yehova ni shangwe isiyo na kifani
Ray Bopp flín ɖɔ Akpàkpà sɔ́ kpléɖókpɔ́watɔ́ lɛ .	Wahudhuriaji walisisimuka .
Anna Gardner tinmɛ lee atín e è sɔ́ dó gbá xɔ ɔ na lɛ é húnhún ,ɖó asíkpɛ́ lɛ wu gbɔn é .	Anna Gardner anasimulia jinsi paa lilivyotetemeshwa na makofi ya wahudhuriaji .
Fred Twarosh ɖɔ Kpléɖókpɔ́watɔ́ lɛ bǐ site zɛɛn .	Wahudhuriaji wote walisimama pamoja .
Odessa Tuck ee ɖó xwè 18 hwenɛnu é gosin kpléɖókpɔ́ ɔ ,bo kanɖeji ɖɔ emi na sɔ ylɔ̌ e ɖɔ Mɛ̌ un ka na sɛ́dó	Odessa Tuck ,ambaye wakati huo alikuwa na umri wa miaka 18 ,aliondoka kusanyikoni akiwa ameazimia kuitikia mwito Ni nani atakayeenda
