input	target
Mǐ sixu nɔ ma ɖɔ nǔ mɔhun kpɔ́n amɔ̌ ,linlin agɔ enɛ sín kwín sixu ko ɖò ayi mǐtɔn mɛ alǒ è sixu ko dó ɖó ayi mǐtɔn mɛ b’ɛ jɛ susu jí .	Lóòótọ́ ,a lè má sọ irú ọ̀rọ̀ bẹ́ẹ̀ jáde ,àmọ́ irú èrò bẹ́ẹ̀ lè wà lọ́kàn wa ,àwọn míì sì lè mú ká máa ronú bẹ́ẹ̀ .
Nɛ̌ è ka tún kàn nú Pɔlu kpo mɛ ɖevo lɛ kpo ɖò hwɛhuhu kpo kú kpo sí gbɔn	Báwo ni Ọlọ́run ṣe gba Pọ́ọ̀lù àtàwọn Kristẹni ìgbàanì sílẹ̀ lọ́wọ́ ẹ̀ṣẹ̀ àti ikú
Ðó ,lee Pɔlu wlan gbɔn é ɔ ,Klisanwun lɛ ko kú ɖò hwɛhuhu sín alixo .	Ìdí ni pé ,Pọ́ọ̀lù sọ pé àwọn Kristẹni ti kú ní ìsopọ̀ pẹ̀lú ẹ̀ṣẹ̀ .
Xà Hlɔmanu lɛ .	Ka Róòmù .
Mɛ lɛ nɛ kpó ɖò gbɛ̀ ɖò ayikúngban jí nɛ ,bɔ etɛwu è ka sixu ɖɔ ɖɔ ye ko kú ɖò hwɛhuhu sín alixo ’	Kí nìdí tó fi sọ pé wọ́n ti kú ní ìsopọ̀ pẹ̀lú ẹ̀ṣẹ̀ nígbà tí wọ́n ṣì wà láàyè
Enyi ye nɔ gbeji ɔ ,ye na nɔ gbɛ̀ bo ɖu axɔsu xá Klisu ɖò jixwé .	Tí wọ́n bá jẹ́ olóòótọ́ sí Jèhófà ,wọ́n máa ṣàkóso pẹ̀lú Kristi lọ́run .
Amɔ̌ ,hwenu e ye kpó ɖò gbɛ̀ bo ɖò Mawu sɛ̀n wɛ ɖò ayikúngban jí é ɔ ,Pɔlu hɛn ɔ ,é na ɖɔ dó ye wu ɖɔ ye ko kú ɖò hwɛhuhu sín alixo .	Nígbà tí Pọ́ọ̀lù ń sọ̀rọ̀ nípa wọn ,ó ní wọ́n jẹ́ ‘ òkú ní ìsopọ̀ pẹ̀lú ẹ̀ṣẹ̀ ’ bó tilẹ̀ jẹ́ pé wọ́n ṣì wà láàyè tí wọ́n sì ń sin Ọlọ́run .
Gbeta tɛ kɔn mǐ mɛ ɖokpo ɖokpo ka ɖó na wá	Ìpinnu wo ni ẹnì kọ̀ọ̀kan wa gbọ́dọ̀ ṣe
Alǒ un ka ko kú ɖò hwɛhuhu sín alixo à	Ṣé mo ti di òkú ní ìsopọ̀ pẹ̀lú ẹ̀ṣẹ̀
Ye mɛ ɖé lɛ ko nyí vodunsɛntɔ́ lɛ ,agalɛtɔ́ lɛ ,sunnu e nɔ ɖó xá sunnu yetɔn ɖɔhun lɛ ,ajotɔ́ lɛ ,ahannumunɔ lɛ ,kpo nǔ mɔhun lɛ kpo .	Pọ́ọ̀lù sọ nípa wọn pé ,tẹ́lẹ̀ ọ̀pọ̀ wọn jẹ́ abọ̀rìṣà ,olè ,ọ̀mùtípara ,wọ́n ń ṣe panṣágà ,ọkùnrin ń bá ọkùnrin lò pọ̀ ,obìnrin ń bá obìnrin lò pọ̀ ,wọ́n sì ń hu àwọn ìwàkiwà míì .
Bonu mǐ na dó sixu wà mɔ̌ ɔ ,mǐ ɖó na nyì alɔ nú hwɛ syɛnsyɛn e ye mɛ e ɖò Kɔlɛnti é ɖé lɛ hu lɛ é huhu .	Tá a bá fẹ́ ṣe bẹ́ẹ̀ ,a gbọ́dọ̀ ṣọ́ra kó má di pé a mọ̀ọ́mọ̀ ń lọ́wọ́ nínú àwọn ẹ̀ṣẹ̀ tó wúwo ,irú èyí táwọn ará kan ní Kọ́ríńtì dá kí wọ́n tó di Kristẹni .
Enɛ ɔ ɖò taji ,enyi mǐ na ɖɔ ɖɔ mǐ yí fɛ́nú Mawu tɔn nugbǒ bɔ hwɛhuhu kún sɔ́ nyí gǎn nú mǐ ó ’ ɔ nɛ .	Ó ṣe pàtàkì ká fi ìmọ̀ràn yìí sílò tó bá jẹ́ pé lóòótọ́ la ti tẹ́wọ́ gba inú rere àìlẹ́tọ̀ọ́sí Ọlọ́run ,tá ò sì fẹ́ kí ẹ̀ṣẹ̀ ‘ jẹ ọ̀gá lórí wa .
Lin tamɛ dó mɛsɛ́dó Pɔlu wu .	Ẹ jẹ́ ká ronú nípa àpọ́sítélì Pọ́ọ̀lù .
Mǐ sixu kanɖeji ɖɔ é kún hu hwɛ syɛnsyɛn e xó è ɖɔ ɖò 1 Kɔlɛntinu lɛ mɛ é ó .	Ó dá wa lójú pé Pọ́ọ̀lù ò lọ́wọ́ sí irú àwọn ẹ̀ṣẹ̀ tó wúwo tá a mẹ́nu bà nínú 1 Kọ́ríńtì 6​ .
Xà Hlɔmanu lɛ .	Ka Róòmù .
Ði kpɔ́ndéwú ɔ ,mǐ ni ɖɔ xó dó nugbǒɖiɖɔ jí .	Ẹ jẹ́ ká gbé ọ̀rọ̀ jíjẹ́ olóòótọ́ yẹ̀ wò .
Nugbǒɖiɖɔ ɖò nǔ dòdó e è byɔ ɖò Klisanwun lɛ sí lɛ é mɛ .	Àwa Kristẹni gbọ́dọ̀ jẹ́ olóòótọ́ .
Xà Nùnywɛxó 145 Efɛzinu lɛ 425 .	Ka Òwe 145 Éfésù 425 .
Nɛ̌ nugbǒɖiɖɔ ka hugǎn adingban gannaganna ma ɖó gbɔn	Kí nìdí tó fi jẹ́ pé kéèyàn jẹ́ olóòótọ́ kọjá kéèyàn má parọ́
É ɖò mɔ̌ có ,Jehovah jló ɖɔ togun emitɔn ni wà nǔ hugǎn adingban gannaganna ma ɖó .	Kì í ṣe irọ́ pípa nìkan ni Jèhófà fẹ́ ká yẹra fún ,àmọ́ ó fẹ́ ká yẹra fún gbogbo ohun tó jẹ mọ́ ìwà àìṣòótọ́ .
Xó jɔ xó kpɛɖé sixu ɖò dotóo ɖó ganmɛ ’ n’i e xó é ɖɔ é mɛ ,amɔ̌ ,a ka na ɖɔ ɖɔ é ɖò nugbǒ ɖɔ wɛ dìn à	Bó tilẹ̀ jẹ́ pé ó lè yà nílé ìwòsàn lóòótọ́ ,àmọ́ ṣé a lè sọ pé ó sọ òótọ́ délẹ̀délẹ̀
Vlafo ye wà mɔ̌ bo na dó xógló tódɔnnúmɛ alǒ bo na dó táfú mɛ ɖevo lɛ .	Ìdí tí ọ̀pọ̀ wọ́n fi ń ṣe bẹ́ẹ̀ ni pé wọn ò fẹ́ kí wọ́n bá àwọn wí tàbí torí kí wọ́n lè rẹ́ àwọn míì jẹ .
Gɔ́ na ɔ ,lin tamɛ kpɔ́n dó Hlɔmanu lɛ 619 jí ,é ɖɔ Mi jó miɖée dó bǐ kannumɔ ɖɔhun nú nǔjlɔjlɔwiwa enɛ na zɔ́n bɔ mi na nɔ sixu zán gbɛ̀ mímɛ́ .	Tún ronú nípa ohun tó wà nínú Róòmù 619 tó sọ pé Ẹ jọ̀wọ́ àwọn ẹ̀yà ara yín nísinsìnyí bí ẹrú fún òdodo pẹ̀lú ìjẹ́mímọ́ níwájú .
É ɖò mɔ̌ có ,mǐ ɖó na dó gǎn bo wà mɔ̌ Pɔlu ɖɔhun .	Òótọ́ ni pé kò sí béèyàn ṣe mọ̀ ọ́n rìn ,kórí má mì ,síbẹ̀ a lè sapá láti borí ẹ̀ṣẹ̀ bí Pọ́ọ̀lù náà ti ṣe .
Gbɔn fɛ́nú Mawu tɔn gblamɛ ɔ ,è sɔ́ hwɛ mǐtɔn lɛ kɛ mǐ ,bo sixu kpó ɖò sísɔ́ kɛ mǐ wɛ .	Nípasẹ̀ inú rere àìlẹ́tọ̀ọ́sí Ọlọ́run ,Ọlọ́run ti dárí àwọn ẹ̀ṣẹ̀ wa jì wá ,yóò sì máa dárí jì wá nìṣó .
Mi nú ɖagbe e è wà nú mǐ é ni sù nukún mǐtɔn mɛ ,bonu mǐ ni dó gǎn bo ɖu ɖò nǔ ɖebǔ e mɛ ɖevo sixu ylɔ ɖɔ hwɛ kpɛví huhu é jí .	Torí náà ,ẹ jẹ́ ká fi hàn pé a mọyì inú rere àìlẹ́tọ̀ọ́sí Ọlọ́run ,ká yẹra fún àwọn ẹ̀ṣẹ̀ táwọn kan kà sí ẹ̀ṣẹ̀ kéékèèké .
Enyi mǐ na bo ɖó nukúnɖiɖo ɖebǔ ɔ ,etɛwu Hlɔmanu lɛ wemata 8gɔ́ ɔ gbígbéjé kpɔ́n ka sixu hɛn lè wá nú mǐ	Kí nìdí tí ìmọ̀ràn tó wà nínú Róòmù orí 8 fi máa ṣe wá làǹfààní yálà ayé la retí láti gbé tàbí ọ̀run
A KA ko xà Hlɔmanu lɛ ɖó kú Jezu tɔn sín nǔwiwa xwewu xwewu tɔn wutu à	NÍGBÀ Ìrántí Ikú Jésù ,a sábà máa ń ka Róòmù 8​ .
Amɔ̌ ,mɛ yí ami dó ɖè lɛ kɛɖɛ wɛ Hlɔmanu lɛ wemata 8gɔ́ ɔ ka kàn à	Ẹsẹ àkọ́kọ́nínú Róòmù orí 8 tọ́ka sí àwọn tí wọ́n wà ní ìrẹ́pọ̀ pẹ̀lú Kristi Jésù .
Alǒ é lɛ́vɔ kàn Klisanwun e ɖò nukún ɖó wɛ bá nɔ gbɛ̀ ɖò ayikúngban jí lɛ é	Àmọ́ ,ṣé àwọn ẹni àmì òróró nìkan ló lè jàǹfààní látinú Róòmù orí 8
Xà Hlɔmanu lɛ .	Ka Róòmù .
Nùkanbyɔ tɛ jí Hlɔmanu lɛ 821 ka ɖó na sísɛ́ mǐ bɔ mǐ na lin tamɛ kpɔ́n dó	Ìbéèrè wo ló yẹ ká ronú lé tá a bá ka Róòmù 821
Hlɔmanu lɛ 821 na mǐ ganjɛwu ɖɔ gbɛ̀ yɔyɔ̌ ɔ na wá jɛn wɛ .	Ìwé Róòmù 821 mú kó dá wa lójú pé ayé tuntun máa dé .
Wěɖexámɛ e na d’alɔ we bɔ nǔ na nyí mɔ̌ lɛ é ɖò Hlɔmanu lɛ wemata 8gɔ́ ɔ mɛ .	Róòmù orí 8 fún wa nímọ̀ràn tó máa ràn wá lọ́wọ́ ká lè rí ìbùkún yìí gbà .
Ðò Hlɔmanu lɛ mɛ ɔ ,nǔ titewungbe tɛ jí Pɔlu ka ɖɔ xó dó	Ọ̀rọ̀ pàtàkì wo ni Pọ́ọ̀lù sọ nínú Róòmù
Xà Hlɔmanu lɛ .	Ka Róòmù .
Etɛ ka nyí tinmɛ xógbe hwɛhuhu sín ninɔmɛ e Pɔlu zán ɖò Hlɔmanu lɛ mɛ é tɔn	b Kí ni Pọ́ọ̀lù ní lọ́kàn nígbà tó lo ọ̀rọ̀ náà ẹran ara nínú Róòmù
Etɛwu é ka sɔgbe ɖɔ è ni gb’akpá nú Klisanwun yí ami dó ɖè lɛ lɔ dó gbɛzinzan lee hwɛhuhu sín ninɔmɛ e mǐ ɖó ɔ jló gbɔn é wu	Pọ́ọ̀lù ń tọ́ka sí àwọn tó gbájú mọ́ bí wọ́n á ṣe tẹ́ ìfẹ́ ọkàn wọn lọ́rùn .
Ði kpɔ́ndéwú ɔ ,Pɔlu wlan ɖɔ nɔví Hlɔma tɔn ɖé lɛ nyí kannumɔ nú adɔgo alǒ jlǒ yeɖesunɔ tɔn lɛ .	Lóde òní ,Ọlọ́run ti sọ àwọn Kristẹni di ọ̀rẹ́ rẹ̀ ,ó sì ti kà wọ́n sí olódodo ,síbẹ̀ wọ́n gbọ́dọ̀ ṣọ́ra kí wọ́n má bàa kó sínú ewu yìí .
Etɛ lɛ akpágbánúmɛ Pɔlu tɔn e ɖò Hlɔmanu lɛ 86 mɛ é ma ka kàn ǎ	Níbàámu pẹ̀lú Róòmù 86 ,kí ni Pọ́ọ̀lù ò ní ká má ṣe
É nyí Klisanwun e nɔ wá lin tamɛ kpɔ́n dó azɔ̌ ,ayiɖeɖayi ,alǒ wanyiyi jí hweɖelɛnu é xó ɖɔ wɛ è ɖè ǎ .	Èyí kò túmọ̀ sí pé lẹ́ẹ̀kọ̀ọ̀kan Kristẹni kan ò lè ronú nípa oúnjẹ ,iṣẹ́ oúnjẹ òòjọ́ ,ìgbafẹ́ tàbí ọ̀rọ̀ lọ́kọláya .
Kpɔ́n akpáxwé 10 kpo 11 kpo	Wo ìpínrọ̀ 10 àti 11
Ðò Hlɔmanu lɛ mɛ ɔ ,etɛ ka nyí tinmɛ ayi sísɔ́ ɖó nǔ jí tɔn	Bó ṣe wà nínú Róòmù ,kí ló túmọ̀ sí tá a bá sọ pé ẹnì kan ‘ gbé èrò inú rẹ̀ ka ’ nǹkan
Etɛ ɖɔ wɛ Pɔlu ka ɖè dó ayi sísɔ́ ɖó hwɛhuhu sín nǔ lɛ jí wu lo	Kí wá ni Pọ́ọ̀lù ní lọ́kàn nígbà tó ń sọ̀rọ̀ nípa gbígbé èrò inú ka ẹran ara
É sɔ́ xwedó hwɛhuhu sín ninɔmɛ e mǐ ɖó é ɖě ǎ ,bo lɛkɔ wá ali jlɔjlɔ ɔ jí . 2 Kɔ .	Síbẹ̀ ,ó ronú pìwà dà ,ó jáwọ́ nínú ìwà náà ,wọ́n sì gbà á pa dà sínú ìjọ . 2 Kọ́r .
a Enyi è ma jló na sɔ́ ayi ɖó hwɛhuhu sín ninɔmɛ e mǐ ɖó é jí ǎ ɔ ,etɛ è ka sixu bló	a Kí ni Pọ́ọ̀lù ní ká máa gbé èrò inú wa kà
b Etɛ ayixa mɛtɔn sísɔ́ ɖó gbigbɔ ɔ sín nǔ lɛ jí ’ ma ka nyí ǎ	b Kí ni gbígbé èrò inú ka ẹ̀mí kò túmọ̀ sí
Xà Mɛsɛ́dó ,.	Ka Ìṣe ,.
Nugbǒ ɔ ,gbigbɔ ɔ sín nǔ lɛ jí wɛ gbɛzán Pɔlu tɔn jinjɔn .	Èyí fi hàn pé ìjọsìn Ọlọ́run ni Pọ́ọ̀lù gbájú mọ́ .
Xósin e Hlɔmanu lɛ 86 na é ɖò wɛ Ayixa mɛtɔn .ɖò gbigbɔ ɔ sín nǔ lɛ jí ɔ ,é nɔ kplá mɛ bɔ è nɔ mɔ gbɛ̀ ,bo nɔ mɔ fífá .	Róòmù 86 sọ pé Gbígbé èrò inú ka ẹ̀mí túmọ̀ sí ìyè àti àlàáfíà .
Mi nú mǐ ni lin tamɛ kpɔ́n dó ganjɛwu nina mɛ xó elɔ jí Ayixa mɛtɔn .ɖò gbigbɔ ɔ sín nǔ lɛ jí ɔ ,é nɔ kplá mɛ bɔ è .nɔ mɔ fífá .	Ẹ jẹ́ ká sọ̀rọ̀ nípa gbólóhùn tó ń fini lọ́kàn balẹ̀ tí Pọ́ọ̀lù sọ pé ,gbígbé èrò inú ka ẹ̀mí túmọ̀ sí .àlàáfíà .
Mɛ gègě nɔ jɛ tagba tawun bo na mɔ fífá ayi mɛ tɔn .	Ọ̀pọ̀ èèyàn ló ń kọ́kàn sókè lónìí ,tí wọ́n sì ń wá ohun táá mú kọ́kàn wọn balẹ̀ .
Etɛwu a ka na dokú nú Mawu nú wěɖexámɛ e ɖò Hlɔmanu lɛ wemata 8gɔ́ ɔ mɛ é	Kí nìdí tá a fi mọyì ìmọ̀ràn tó wà nínú Róòmù orí 8
Toñi ,ee nɔ wà nukúnkpédómɛwu sín azɔ̌ é ,xúxú hɔn ɔ ,bɔ nawe ɖé sɔ n’i .	Obìnrin kan wà tó ń jẹ́ Toñi ,iṣẹ́ tó ń ṣe ni pé kó máa tọ́jú àwọn àgbàlagbà .
Toñi gbɔhwenu ǎ .	Bẹ́ẹ̀ sì rèé ,kì í ṣe pé Toñi pẹ́ dé .
A ka na tɛnkpɔn bo fá xomɛ à	Ṣé wàá lè fi pẹ̀lẹ́tù sọ̀rọ̀ bí Toñi ṣe ṣe
Xomɛfífá sixu zɔ́n bɔ xomɛsin bú .	Ìwà tútù máa ń pẹ̀tù sí ọ̀rọ̀ .
Toñi ɖesunɔ mɔ ɖó mɔ̌ .	Bó ṣe rí lọ́rọ̀ ti Toñi gan - an nìyẹn .
NƆ NYÌ ALƆ NÚ GBIGBƆ E ÐÒ GBƐ̀ ELƆ MƐ Ɔ . 1 Kɔ .	MÁ ṢE FÀYÈ GBA Ẹ̀MÍ AYÉ . 1 Kọ́r .
Gbigbɔ gbɛ̀ elɔ tɔn sín xlɛ̌ wɛ nú linlin mɔhun ,é nyí nùnywɛ e gosin aga é ǎ .	Kí wọ́n tó lè kà ẹ́ sí ,wọ́n gbà pé o gbọ́dọ̀ le lẹ́dàá ,kò sì yẹ kó o gba gbẹ̀rẹ́ .
Mɔ̌ ɖokpo ɔ ,enyi mǐ nɔ ɖókan dó ɖɛxixo wu ɔ ,Jehovah na sè ɖɛ vívɛ́ e mǐ nɔ xò bo nɔ byɔ gbigbɔ mímɛ́ lɛ é . Hlɔ .1212 .	Jèhófà máa fún àwa náà ní ẹ̀mí mímọ́ rẹ̀ tá a bá ń tẹra mọ́ àdúrà gbígbà . Róòmù 1212 .
Un ka nɔ byɔ ɛ gbigbɔ mímɛ́ tɔn kpo nùnywɛ kpo bá wà nǔ e sɔgbe ɖò nukún tɔn mɛ é à ​ — Ðɛh .	Ṣé mo máa ń bẹ̀ ẹ́ pé kó fún mi ní ẹ̀mí mímọ́ rẹ̀ àti ọgbọ́n kí n lè máa ṣe ohun tó wù ú ​ — Sm .
Hwɛ alɔkpa tɛ xó ɖɔ wɛ Jezu ka ɖè ɖò wěɖexámɛ e ɖò Matie mɛ é mɛ	Irú ẹ̀ṣẹ̀ wo ni Jésù ń tọ́ka sí nígbà tó ń fún àwọn ọmọ ẹ̀yìn rẹ̀ ní ìmọ̀ràn tó wà nínú Mátíù
Ði kpɔ́ndéwú ɔ ,hwɛ ɔ sixu nyí jidómɛ ,alǒ é sixu nyí mɛtítáfú sín xó . w16.05 ,wex .	Irú ẹ̀ṣẹ̀ bẹ́ẹ̀ lè ní ẹ̀tàn tàbí èrú nínú ,ó sì lè ba èèyàn lórúkọ jẹ́ . w16.05 ,ojú ìwé 7 .
Jɔbu xlɛ́ ɖɔ nùnywɛ Mawu tɔn xɔ akwɛ hú siká alǒ kpatagan .	Jóòbù fi hàn pé ọgbọ́n Ọlọ́run sàn ju góòlù àti fàdákà lọ .
Mɛ e tuùn nǔ é nɔ mɔ dò nú nǔ gègě .	Ẹni tó ní ìmọ̀ lẹni tó ń kẹ́kọ̀ọ́ ,tó sì ní ọ̀pọ̀ ìsọfúnni .
Amɔ̌ ,mɛ e ɖó nùnywɛ é nɔ kpéwú bo nɔ zán nùtuùntuùn kpo nukúnnúmɔjɛnǔmɛ kpo ɖó kpɔ́ ganji . w16.10 ,wex .18 .	Àmọ́ ẹni tó ní ọgbọ́n máa ń fi òye lo ìmọ̀ tó ní láti ṣe ìpinnu tó bọ́gbọ́n mu . w16.10 ,ojú ìwé 18 .
De la Fuente ,No .	De la Fuente ,No .
Merten ,No .	Merten ,No .
Watch Tower Bible and Tract Society of Pennsylvania	Watch Tower Bible and Tract Society of Pennsylvania
MƐ NABI E WÁ FLǏN É 2015	ÀWỌN TÓ WÁ SÍBI ÌRÁNTÍ IKÚ KRISTI 2015
Watch Tower Bible and Tract Society of Pennsylvania	Watch Tower Bible and Tract Society of Pennsylvania
Sín 1879 wɛ è ko ɖò xójlawema elɔ ɖetɔ́n wɛ .	Láti ọdún 1879 la ti ń tẹ ìwé ìròyìn yìí déédéé ,kì í sì í dá sí ọ̀rọ̀ ìṣèlú .
Etɛwu È ka Ðó Na Xà Biblu	Kí Nìdí Tó Fi Yẹ Kó O Ka Bíbélì
Nɛ̌ Un ka Sixu Bɛ́ Gbɔn	Ibo Ni Mo Ti Fẹ́ Bẹ̀rẹ̀
Etɛ ka Na Zɔ́n Bɔ A Na Ðu Vivǐ Tɔn	Báwo Ni Mo Ṣe Máa Gbádùn Ẹ̀
Nɛ̌ Biblu ka Sixu Hɛn Gbɛzán Ce Kpɔ́n Te Gbɔn	Báwo Ni Bíbélì Ṣe Lè Tún Ayé Mi Ṣe
BIBLU NƆ HUZU GBƐZÁN MƐTƆN	BÍBÉLÌ MÁA Ń YÍ ÌGBÉSÍ AYÉ ÀWỌN ÈÈYÀN PA DÀ
ÐI NǓ YE ÐƆHUN HENƆCI	TẸ̀ LÉ ÀPẸẸRẸ ÌGBÀGBỌ́ WỌN ÉNỌ́KÙ
NUKÚNNÚMƆJƐNǓMƐ AGƆ KLEWUN ÐÉ KPOWUN WƐ À	EWU TÓ WÀ NÍNÚ KÉÈYÀN ṢI BÍBÉLÌ LÓYE
ETƐ BIBLU KA ÐƆ	OHUN TÍ BÍBÉLÌ SỌ
Biblu ɔ ɖesu ɖɔ Nǔ e è wlan dó Mawuxówema ɔ mɛ é bǐ wɛ gosin Mawu gɔ́n bo ɖó lè .’ ​ — 2 Timɔtée ,nwt .	Ẹ gbọ́ ohun tí Bíbélì fúnra rẹ̀ sọ ,ó ní Gbogbo Ìwé Mímọ́ ni Ọlọ́run mí sí ,ó sì ṣàǹfààní . 2 Tímótì .
Ezekiel e ko ɖó xwè 20 jɛji é ɖɔ Ð’ayǐ ɔ ,un cí mɛ e ɖò mɔ̌to kun wɛ bo ma ka tuùn fí e é xwè tawun é ǎ é ɖɔhun .	Ezekiel ,tó ṣẹ̀ṣẹ̀ lé lọ́mọ ogún 20 ọdún ,sọ pé Tẹ́lẹ̀ ,mo dà bí ẹni tó ń wa mọ́tò láìjẹ́ pé ó ní ibi kan lọ́kàn tó fẹ́ lọ .
Frieda e ko ɖó hú xwè 20 é lɔmɔ̌ tinmɛ ɖɔ Un nɔ lin tamɛ cobo nɔ wà nǔ ǎ .	Frieda ,tí òun náà ti lé lọ́mọ ogún 20 ọdún ,sọ pé Tẹ́lẹ̀ ,ńṣe ni mo máa kanra lódìlódì .
Nawe e nɔ nyí Eunice bo ɖó hú xwè 50 é ɖɔ dó Biblu ɔ wu ɖɔ ,É ɖò alɔ dó mì wɛ bɔ un ɖò te kpɔ́n d’eji wɛ ,bo ɖò jijɔ ce nyanya lɛ ɖyɔ wɛ .	Obìnrin kan tó ń jẹ́ Eunice tó ti lé lẹ́ni àádọ́ta 50 ọdún ,sọ nípa Bíbélì pé ,Bíbélì ti ràn mí lọ́wọ́ láti ní ìwà tó dáa .
Ezayíi Biblu sixu d’alɔ we bɔ 1 a na nɔ wá gbeta ɖagbe lɛ kɔn ,2 a na ɖó xɔ́ntɔn jɔ xɔ́ntɔn lɛ ,3 a na ɖí xwi xá adohu adohu ,bɔ 4 ee nyɔ́ hú bǐ é ɔ ,a na tuùn nugbǒ ɔ dó Mawu wu .	Ọ̀pọ̀ nǹkan ni Bíbélì lè ṣe fún ẹ ,lára wọn ni 1 ṣíṣe ìpinnu tó tọ́ ,2 yíyan ọ̀rẹ́ tòótọ́ ,3 fífara da ìdààmú ,4 èyí tó wá ṣe pàtàkì jù ni pé ,wàá kẹ́kọ̀ọ́ òtítọ́ nípa Ọlọ́run .
Enyi a ko ɖó linlin masɔgbe ɖebǔ dó Biblu wu hǔn ,tɛnkpɔn bo xò ye nyì kɛ́n ,enɛ ɔ ,Mawu na kplɔ́n nǔ we . Ðɛhan 254 .	Tó o bá ti ní èrò òdì nípa Bíbélì tẹ́lẹ̀ ,o ní láti gbé èrò náà tì sẹ́gbẹ̀ẹ́ kan ,kí Ọlọ́run lè kọ́ ẹ . Sáàmù 254 .
Nukɔnmɛ ɔ ,é na hun ayi towe bɔ a na mɔ nukúnnú jɛ tito Mawu tɔn e ɖò hwlahwla ɖò gɔngɔn mɛ lɛ é mɛ . 1 Kɔlɛntinu lɛ 210 .	Tó bá yá ,ẹ̀mí mímọ́ á ṣí ọkàn rẹ payá láti mọ àwọn ohun ìjìnlẹ̀ Ọlọ́run . 1 Kọ́ríńtì 210 .
Amɔ̌ ,hwe ɖokpo ɔ nu ɔ ,é ɖó na nyí Biblu e è wlíbò na bo lilɛ dó gbè ɖevo mɛ bɔ é sɔgbe é .	Lẹ́sẹ̀ kan náà ,ó gbọ́dọ̀ jẹ́ Bíbélì tí wọ́n fara balẹ̀ túmọ̀ ,tí ìtúmọ̀ rẹ̀ sì péye .
Enyi sise tɔn wɛ nɔ nyɔ́ nukún towe mɛ hú xixa tɔn ɔ ,Biblu ɔ ɖò kàn jí ɖò gbè ɖé lɛ mɛ .	Tó bá jẹ́ pé èyí tó o lè tẹ́tí sí ló rọ̀ ẹ́ lọ́rùn ,Bíbélì tí wọ́n ti kà sílẹ̀ tún wà tó o lè máa gbọ́ .
Zǎn azɔwanú Biblu kplɔnkplɔn tɔn lɛ .	Lo ohun tó o lè fi kẹ́kọ̀ọ́ Bíbélì .
Biblu enɛ e Kúnnuɖetɔ́ Jehovah Tɔn lɛ ɖetɔ́n é ɖò gbè hugǎn 130 mɛ .	Àwa Ẹlẹ́rìí Jèhófà la tẹ Bíbélì yìí ,ó sì wà ní èdè tó lé ní àádóje 130 .
Samuwɛli wemata 25	Sámúẹ́lì orí 25
Ɛsitɛ́ɛ wemata ,	Ẹ́sítérì orí ,
Jezu sín nɔ Matie wemata Luki wemata lɛ̌ kpɔ́n Jaan Mɛsɛ́dó	ìyá Jésù Mátíù orí Lúùkù orí tún wo Jòhánù 2​ Ìṣe 1​ 2​
Jozuwée wemata lɛ̌ kpɔ́n Eblée lɛ Jaki	Jóṣúà orí tún wo Hébérù 11​ Jákọ́bù 2​
Bǐbɛ̌mɛ wemata ,23 lɛ̌ kpɔ́n Eblée lɛ 1111 1 Piyɛ́ɛ	Jẹ́nẹ́sísì orí ,23 tún wo Hébérù 1111 1 Pétérù 3​
Bǐbɛ̌mɛ wemata lɛ̌ kpɔ́n	Jẹ́nẹ́sísì orí tún wo orí 25​
Samuwɛli wemata 2 Samuwɛli wemata 1 Axɔsu lɛ wemata	Sámúẹ́lì orí 2 Sámúẹ́lì orí 1 Àwọn Ọba orí
Tíntɔ́n wemata ,- 34 Kɛ́nsísɔ́ wemata ,Sɛ́nflínmɛ wemata 34	Ẹ́kísódù orí ,- 34 Númérì orí ,Diutarónómì orí 34
Mɛsɛ́dó wemata ,	Ìṣe orí ,
Matie wemata ,- Mɛsɛ́dó wemata ,	Mátíù orí ,- Ìṣe orí ,
JW.ORG ​ — Tɛn ɛntɛnɛti tɔn elɔ ɖó azɔwanú nùkplɔnkplɔn tɔn gègě kaka jɛ akpáxwé Questions Bibliques jí .	JW.ORG ​ — Ìkànnì yìí ní ọ̀pọ̀ ohun èlò téèyàn lè fi kẹ́kọ̀ọ́ Bíbélì ,irú bí apá tá a pè ní Ohun Tí Bíbélì Sọ .
La Bible ​ — Quel est son message ​ — Alɔnuwema wexwɛ 32 nɔ e sɛ̀ sìn xwè nú xota Biblu tɔn ɔ blebu é ɖé wɛ	Kí Ló Wà Nínú Bíbélì ​ — Ìwé pẹlẹbẹ olójú ìwé 32 yìí ṣe àkópọ̀ ṣókí nípa ohun tó wà nínú Bíbélì
Nugbǒ ɔ ,Biblu ɖɔ Mawuxó ɔ ɖò gbɛ̀ ,bo ɖó hlɔnhlɔn .	Bíbélì tiẹ̀ sọ pé Ọ̀rọ̀ Ọlọ́run yè ,ó sì ń sa agbára .
Biblu sixu d’alɔ mɛ ɖò tagba mɛɖesunɔ tɔn lɛ mɛ .	Bíbélì lè ràn ẹ́ lọ́wọ́ lórí ọ̀rọ̀ ìgbésí ayé rẹ .
Kancica e è na ɖó xá hagbɛ̌ xwédo tɔn mɛtɔn lɛ kpo mɛ ɖevo lɛ kpo é . Efɛzinu lɛ ,.	Àjọṣe wa pẹ̀lú àwọn ẹlòmíì . Éfésù ,.
Ganjininɔ ɖò ayi kpo agbaza kpo mɛ . Ðɛhan 378 Nùnywɛxó 1722 .	Bí nǹkan ṣe ń rí lára wa àti ìlera wa . Sáàmù 378 Òwe 1722 .
Walɔ ɖagbe lɛ ɖiɖó . 1 Kɔlɛntinu lɛ .	Ìwà rere . 1 Kọ́ríńtì .
Lee è na mɔ nǔ agbaza tɔn e sín hudo è ɖó lɛ é gbɔn é . Nùnywɛxó 104 2819 Efɛzinu lɛ 428 .	Ọ̀rọ̀ ìnáwó . Òwe 104 2819 Éfésù 428 .
Nú a wà mɔ̌ ɔ ,é nyí wěɖexámɛ tɔn lɛ kɛɖɛ sín vivǐ wɛ a na ɖu ǎ ,amɔ̌ ,a na mɔ ɖɔ emi sixu zun xɔ́ntɔn xá ɛ .	Nípa bẹ́ẹ̀ ,wàá jàǹfààní nínú àwọn ìmọ̀ràn rẹ̀ ,wàá sì tún di ọ̀rẹ́ rẹ̀ tímọ́tímọ́ .
É ɖó nùkanbyɔ gègě dó Biblu wu .	Ọ̀pọ̀ ìbéèrè ló ń jà gùdù lọ́kàn rẹ̀ nípa Bíbélì .
Nyikɔ ce Yvonne Quarrie	GẸ́GẸ́ BÍ Yvonne Quarrie ṣe sọ ọ́
È JÌ MÌ ÐÒ1964	ỌDÚN TÍ WỌ́N BÍ1964
Ðó tɔ́ ce nyí ahannumunɔ wutu ɔ ,é nɔ yì bo nɔ wá .	Ẹ̀ẹ̀kọ̀ọ̀kan la máa ń rí dádì mi torí pé ọ̀mùtí ni wọ́n .
Un jló na kú ǎ	Mi ò fẹ́ kú o
Xwè wǒ jɛn un ɖó bo jɛ nǔ dosin jí .	Ìgbà tí mo wà lọ́mọ ọdún mẹ́wàá ni mo ti bẹ̀rẹ̀ sí í yàyàkuyà .
Nukɔnmɛ ɔ ,un jɛ gěe e è nɔ ylɔ ɖɔ marijuana é nu jí .	Ní kẹ̀rẹ̀kẹ̀rẹ̀ ,mo wá ń mugbó .
Un yì cí sunnu xɔ́ntɔn ce Tony gɔ́n nú táan ɖé .	Ọ̀dọ̀ Tony ọ̀rẹ́kùnrin mi ni mo sá lọ .
É lín cobɔ un mɔ xò ǎ ,bɔ un jì vǐ sunnu mǐtɔn hwenu e un ɖò xwè 16 ɖó wɛ é .	Kò pẹ́ tí mo fi lóyún ,ọmọ ọdún mẹ́rìndínlógún 16 ni mí nígbà tí mo bí àkọ́bí mi .
Kúnnuɖetɔ́ nyɔnu wè nɔ wá ba vǐnɔ ɖé lɛ kpɔ́n hwɛhwɛ .	Àwọn Ẹlẹ́rìí méjì tí wọ́n jẹ́ obìnrin máa ń wá sọ́dọ̀ àwọn obìnrin kan tó ń dá tọ́ ọmọ níbẹ̀ .
Un jɛ nǔ ɖi jí ɖɔ un hɛn ɔ ,un na ɖó nukúnɖiɖo bo na nɔ gbɛ̀ ɖò Palaɖisi mɛ ɖò ayikúngban jí kaka sɔyi . Ðɛhan 3729 .	Ìgbà yẹn ni mo wá bẹ̀rẹ̀ sí í nírètí pé màá gbé títí láé nínú Párádísè lórí ilẹ̀ ayé . Sáàmù 3729 .
Kúnnuɖetɔ́ Jehovah Tɔn lɛ ɖè wanyiyi jɔ wanyiyi xlɛ́ mì .	Àwọn Ẹlẹ́rìí Jèhófà nífẹ̀ẹ́ mi tọkàntọkàn .
Biblu e un jɛ kpinkplɔn jí é zɔ́n bɔ un mɔ ɖɔ un ɖó na bló huzuhuzu ɖé lɛ ɖò gbɛzán ce mɛ ba dó sɔgbe xá nugbodòdó walɔ ɖagbe tɔn Mawu tɔn titewungbe lɛ .	Mo tún kẹ́kọ̀ọ́ pé mo ní láti jáwọ́ nínú àwọn ìwàkíwà tí inú Ọlọ́run kò dùn sí .
Un ba xɔ́ntɔn yɔyɔ̌ ɖevo ɖěɖee jijɔ yetɔn na d’alɔ mì ɖò gbɛzán ce yɔyɔ̌ ɔ mɛ lɛ é bo dó gbɛ̌ xá . Nùnywɛxó 1320 .	Mo wá yan àwọn ọ̀rẹ́ àtàtà tí ìgbé ayé wọn máa ní ipa rere lórí mi . Òwe 1320 .
Hwenɛnu ɔ ,Tony lɔ jɛ Biblu kplɔ́n xá Kúnnuɖetɔ́ Jehovah Tɔn lɛ jí .	Àárín àkókò yẹn náà ni Tony bẹ̀rẹ̀ sí í kẹ́kọ̀ọ́ Bíbélì lọ́dọ̀ àwọn Ẹlẹ́rìí Jèhófà .
Mǐ wlí alɔ ɖò 1982 .	Torí náà ,a ṣègbéyàwó lọ́dún 1982 .
Un sɔ́ nɔ nɔ zǎnwunzɛn bo nɔ ɖò adohu adohu jí dó sɔgudo alǒ kú wu ɖě ǎ	Oorun kì í dá lójú mi mọ́ nítorí ìbẹ̀rù ọjọ́ ọ̀la tàbí ìbẹ̀rù pé mi ò fẹ́ kú
Nyɛ kpo Tony kpo bló baptɛm bo huzu Kúnnuɖetɔ́ Jehovah Tɔn ɖò Juillet 1982 .	Ní July ọdún 1982 ,èmi àti Tony ṣe ìrìbọmi láti di ọ̀kan lara àwọn Ẹlẹ́rìí Jèhófà .
Mǐ kplɔ́n jiɖiɖe dó Mawu wu ɖò wuvɛ̌ lɛ mɛ ,bɔ mǐ mɔ ɖɔ é nɔ gudo nú xwédo mǐtɔn hwebǐnu . Ðɛhan 5523 .	Àwọn ìṣòro tá a dójú kọ tí jẹ́ ká gbára lé Ọlọ́run ,a sì ti rí i pé Jèhófà ń ràn wá lọ́wọ́ ,ó sì ń gbé wa ró . Sáàmù 5522 .
Un sɔ́ nɔ nɔ zǎnwunzɛn bo nɔ ɖò adohu adohu jí dó sɔgudo alǒ kú wu ɖě ǎ .	Oorun kì í dá lójú mi mọ́ nítorí ìbẹ̀rù ọjọ́ ọ̀la tàbí ìbẹ̀rù pé mi ò fẹ́ kú .
Tony kpo nyì kpo nɔ hɛn alɔnu mǐtɔn ján bǐ mlɛ́mlɛ́ ɖò aklunɔzán gbla ɖokpo ɖokpo mɛ bo nɔ yì dó wusyɛn lanmɛ nú agun Kúnnuɖetɔ́ Jehovah Tɔn lɛ tɔn vovo lɛ .	Ọwọ́ èmi àti Tony ọkọ mi dí gan - an bá a ṣe ń ṣèbẹ̀wò sí ọ̀kan - ò - jọ̀kan ìjọ àwọn Ẹlẹ́rìí Jèhófà lọ́sọ̀ọ̀sẹ̀ ká lè fún wọn ní ìṣírí .
É sixu vɛwǔ bɔ mǐ na ɖi nǔ na ,amɔ̌ ,nya enɛ nɔ gbɛ̀ nú xwè 365 mɔ̌ ,xwè nabi e è nɔ dɔ́ji na ɖò égbé é donu ɛnɛ jɛji wɛ nyí enɛ	ÉNỌ́KÙ ti pẹ́ láyé gan - an ,o ti lo ohun tí ó tó 365 ọdún láyé ,èyí sì lè yà wá lẹ́nu ,torí pé àwa èèyàn kì í lò tó ìdá mẹ́rin ọdún yẹn báyìí
Ðò hwe enɛ nu ɖò xwè kanweko donu 50 jɛji ɖíe ɔ ,mɛ lɛ nɔ dɔ́ji tawun hú égbé .	Bí àpẹẹrẹ ,Ádámù ti lé lẹ́ni ọgọ́rùn - ún mẹ́fà 600 ọdún nígbà tí wọ́n bí Énọ́kù .
Enɛ wu ɔ ,Henɔci ɖó xwè 365 có ,é sixu lɛ́ ɖó hlɔnhlɔn ganji ,bo cí mɛ e kpò ɖò anyǔ mɛ é ɖɔhun .	Torí náà ,ó jọ pé ara Énọ́kù ṣì le koko nígbà tó wà lẹ́ni ọdún 365 ,torí pé ó ṣì lè lo ọ̀pọ̀ ọdún sí i láyé .
É ka flín asì tɔn kpo vǐ nyɔnu tɔn lɛ kpo ,vǐ sunnu tɔn Mɛtucɛlaxi alǒ vivǔ tɔn Lamɛki wɛ à	Ó ṣeé ṣe kó máa ronú nípa ìyàwó rẹ̀ ,àwọn ọmọbìnrin rẹ̀ àti Mètúsélà ọmọkùnrin rẹ̀ ,títí kan Lámékì tó jẹ́ ọmọ ọmọ rẹ̀
Biblu tinmɛ mɛ alɔkpa e Henɔci nyí é hlɛ́nhlɛ́n ǎ .	Bíbélì kò fi bẹ́ẹ̀ sọ̀rọ̀ púpọ̀ nípa Énọ́kù .
Bǐbɛ̌mɛ Eblée lɛ 115 Judi É ɖò mɔ̌ có ,wemafɔ atɔn enɛ lɛ xlɛ́ céɖécéɖé ɖɔ nya nùɖitɔ́ ɖaxó ɖé wɛ n’i .	Síbẹ̀ ,ìwọ̀nba tí Bíbélì sọ jẹ́ ká rí i pé Énọ́kù jẹ́ ẹni tí ìgbàgbọ́ rẹ̀ lágbára .
Enyi mɔ hǔn ,nùɖiɖi Henɔci tɔn sixu kplɔ́n nǔ we tawun .	Tó bá jẹ́ bẹ́ẹ̀ ,wàá rí ọ̀pọ̀ ẹ̀kọ́ látinú àpẹẹrẹ ìgbàgbọ́ Énọ́kù .
Gbɛtɔ́ lɛ jɛ nyikɔ Jehovah tɔn ylɔ jí ,amɔ̌ ye nɔ bló mɔ̌ dó sɛ̀n ɛ na wɛ ǎ .	Àwọn èèyàn bẹ̀rẹ̀ sí í pe orúkọ Jèhófà ,àmọ́ kì í ṣe pé wọ́n bọ̀wọ̀ fún Ọlọ́run .
É ɖò wɛn ɖɔ ye nɔ zán nyikɔ mímɛ́ Mawu tɔn kpo mɛmasi kpo bo nɔ nyla nu dó wǔ tɔn . Bǐbɛ̌mɛ - 26 .	Ńṣe ni wọ́n ń pe orúkọ Ọlọ́run lọ́nà òdì ,wọ́n sì ń kẹ́gàn rẹ̀ . Jẹ́nẹ́sísì - 26 .
É na wà nǔ lee mɛ lɛ nɔ wà gbɔn ɖò hwetɔnnu é wɛ à	Ṣé ó máa dara pọ̀ mọ́ àwọn tí kò ṣe ohun tí Ọlọ́run fẹ́
Bǐbɛ̌mɛ 522 ɖɔ nú mǐ ɖɔ É nɔ yì xá Mawu .	Jẹ́nẹ́sísì 522 sọ fún wa pé Énọ́kù ń bá a lọ ní rírìn pẹ̀lú Ọlọ́run tòótọ́ .
Enɛ wu ɔ ,hwenu e Henɔci ɖó xwè 65 mɔ̌ é ɔ ,é ko nyí xwétɔ́ ɖé .	Èyí fi hàn pé Énọ́kù ti ní ìdílé nígbà tó wà lẹ́ni ọdún márùnlélọ́gọ́ta 65 .
