input	target
Xwè 200 mɔ̌ cobɔ è na jì axɔsu Silusi ɔ ,Ezayíi e nyí gbeyiɖɔ Eblée ɖé é ko ɖɔ nyikɔ tɔn kpo lee é na ɖu ɖò toxo ɖaxó Babilɔnu jí gbɔn é kpo ɖ’ayǐ .	Nǹkan bí ọgọ́rùn - ún méjì 200 ọdún ṣáájú kí wọ́n tó bí ọba yìí rárá ni wòlíì kan tó ń jẹ́ Aísáyà ti sọ pé ọba Páṣíà kan tó ń jẹ́ Kírúsì máa ṣẹ́gun ìlú Bábílónì ,wòlíì yẹn tún sọ ọ̀nà tó máa gbà ṣe bẹ́ẹ̀ .
Ezayíi ,28 Xó e Jehovah ɖɔ ɔ ɖí.	Aísáyà ,28 Èyí ni ohun tí Jèhófà wí ,.
Ee Silusi yí toxo ɔ gudo é ɔ ,é jó kàn Jwifu ɖěɖee ɖò kannumɔgbenu ɖò Babilɔnu lɛ é ,bo na gbè ye bɔ ye lɛkɔ yì Jeluzalɛmu e è ko sú kún dó na sín xwè 70 ɖíe é bo vɔ́ gbá .	Ó ní kí wọ́n lọ tún Jerúsálẹ́mù kọ́ ,ìlú tó jẹ́ pé ó ti tó àádọ́rin 70 ọdún tó ti pa run .
Ezayíi 451 Mawu Mavɔmavɔ ɖɔ nú Silusi ,axɔsu e é sɔ́ é ɖɔ Un na na ganjɛwu we ,bo na bɛ́ akɔta lɛ dó acɛ towe glɔ́ ,un na yí acɛ sín axɔsu lɛ sí un na hun toxo lɛ sín hɔntogbo e ɖò súsú lɛ nú we .’	Aísáyà 451 Èyí ni ohun tí Jèhófà wí fún ẹni àmì òróró rẹ̀ ,fún Kírúsì ,ẹni tí mo di ọwọ́ ọ̀tún rẹ̀ mú ,láti tẹ àwọn orílẹ̀ - èdè lórí ba níwájú rẹ̀ ,kí n lè tú àmùrè ìgbáròkó àwọn ọba pàápàá láti ṣí àwọn ilẹ̀kùn aláwẹ́ méjì níwájú rẹ̀ ,tí yóò fi jẹ́ pé ,àwọn ẹnubodè pàápàá ni a kì yóò tì .
Amɔ̌ ,ɖokpo kpowun wɛ nǔɖɔɖ’ayǐ enɛ nyí ɖò maxamaxa ɖěɖee ɖò Biblu mɛ bo ko jɛnu tɛnwin lɛnwin lɛ é mɛ .	Èyí wulẹ̀ jẹ́ ọ̀kan nínú ọ̀pọ̀ àsọtẹ́lẹ̀ àgbàyanu tí Bíbélì sọ ,tó sì ní ìmúṣẹ gẹ́lẹ́ bó ṣe sọ ọ́ .
Nǔ e ma ko jɛ ǎ ,bo ka na wá jɛ ɔ ,un ko ɖɔ ɖ’ayǐ sín tɛgbɛ . Ezayíi 4610 .	Àmọ́ ní ti àwọn àsọtẹ́lẹ̀ tó wà nínú Bíbélì ,wọ́n wá látọ̀dọ̀ Ẹni tí ó ń ti ìbẹ̀rẹ̀pẹ̀pẹ̀ sọ paríparí òpin ,tí ó sì ń ti ìgbà pípẹ́ sẹ́yìn sọ àwọn nǹkan tí a kò tíì ṣe . Aísáyà 4610 .
Mi nú mǐ ni gbéjé nǔɖɔɖ’ayǐ ɖěɖee ɖɔ xó dó azǎn gudogudo tɔn lɛ wu é klewun ɖé kpɔ́n .	Ẹ jẹ́ ká ṣàyẹ̀wò díẹ̀ lára àwọn àsọtẹ́lẹ̀ tó máa jẹ́ ká mọ àmì àwọn ọjọ́ ìkẹyìn .
Matie Mi na wá sè ahwanfunfun sín zingidi ɖò fí e sɛkpɔ mi lɛ ,bo na nɔ sè ahwanfunfun sín xó ɖò fí e lín dó mi lɛ .	Mátíù Ẹ óò gbọ́ nípa àwọn ogun àti ìròyìn nípa àwọn ogun .
Sɔgbe kpo nǔlinlɛn ɖé kpo ɔ ,mɛ nabi e ahwan lɛ kpo tohwan lɛ kpo ko hu sín 1914 é hú livi 100 ,kɛ́n enɛ zɛ toví e ɖò tò gègě mɛ lɛ é bǐ sín kɛ́n wu .	Ìwádìí fi hàn pé láti ọdún 1914 ,ó lé ní ọgọ́rùn - ún 100 mílíọ̀nù èèyàn tí ogun pa .
Matie 247 Adɔ na tɔ́n .	Mátíù 247‘ Àìtó oúnjẹ yóò wà .
Luki 2111 Ayikúngban na danwǔ ɖesu .	Lúùkù 2111‘ Ìsẹ̀lẹ̀ yóò wà .
Xwewu xwewu ɔ ,ayikúngban danwǔ ɖaxó ɖaxó 50 000 mɔ̌ nɔ wà nǔ dó gbɛtɔ́ lɛ wu .	Ó ju ẹgbẹ̀rún lọ́nà àádọ́ta 50,000 ìsẹ̀lẹ̀ ,ìyẹn ìmìtìtì ilẹ̀ tó ń wáyé lọ́dọọdún .
Ayikúngban danwǔ 100 mɔ̌ nɔ hɛn xɔ lɛ gblé tawun ,bɔ ayikúngban danwǔ ɖaxó ɖokpo nɔ tíìn xwewu xwewu .	Nǹkan bíi ọgọ́rùn ún 100 nínú wọn ló sì ba odindi ilé jẹ́ ,ó fẹ́rẹ̀ẹ́ jẹ́ pé ọdọọdún làwọn ìmìtìtì ilẹ̀ tó lágbára gan - an máa ń wáyé .
Kúnnuɖetɔ́ Jehovah tɔn lɛ e kɛ́n yetɔn hú livi tantɔn é ko ɖò Axɔsuɖuto Mawu tɔn sín wɛnɖagbe jla wɛ ,bo lɛ́ ɖò kúnnu ɖè na wɛ gbɔn ayikúngban ɔ bǐ jí ɖò tò 240 mɔ̌ mɛ .	Àwọn Ẹlẹ́rìí Jèhófà lé ní mílíọ̀nù mẹ́jọ ,wọ́n sì ń wàásù ìhìn rere Ìjọba Ọlọ́run ní ọgọ́rùn - ún méjì ó lé ogójì 240 ilẹ̀ .
Kpɔ́n xota Kúnnuɖenú Nǔɖɔɖ’ayǐ E Sɔgbe É ɖé Tɔn .	Wo àpilẹ̀kọ náà Ohun Kan Tó Jẹ́ Ẹ̀rí Pé Àsọtẹ́lẹ̀ Bíbélì Péye .
Amɔ̌ ,ɖò 33 H.M .tɔn ɔ ,Jezu Klisu ɖɔ ɖɔ awě ɖé na wá xò Jeluzalɛmu .	Àmọ́ ní ọdún 33 Sànmánì Kristẹni ,ìyàlẹ́nu gbáà ló jẹ́ fún wọn bí Jésù ṣe sọ pé Jerúsálẹ́mù máa pa run láìpẹ́ .
É ɖò mɔ̌ có ,Jezu ɖɔ Nǔ enɛ lɛ e mɔ wɛ mi ɖè dìn ɔ ,hweɖenu na wá sù ,bɔ awinnya lɛ ɖě sɔ́ na kpò ɖò ɖě jí ǎ bǐ wɛ è na mu . Maki 131 Luki 216 .	Síbẹ̀ ,Jésù sọ fún wọn pé Ní ti nǹkan wọ̀nyí tí ẹ ń wò ,àwọn ọjọ́ yóò dé nínú èyí tí a kì yóò fi òkúta kan sílẹ̀ lórí òkúta kan níhìn - ín ,tí a kì yóò wó palẹ̀ . Máàkù 131 Lúùkù 216 .
Amɔ̌ ,ɖò 66 H.M tɔn ,hwenu e tokpɔngán Hlɔma tɔn Gessius Florus ,ee kp’acɛ dó Judée nu é wá bɛ́ akwɛ ɖò tɛmpli mímɛ́ ɔ sín akwɛgbá mɛ é ɔ ,xomɛ sìn Jwifu lɛ tawun .	Àmọ́ lọ́dún 66 Sànmàní Kristẹni ,Gessius Florus tó jẹ́ agbowó orí fún ìjọba Róòmù ní Jùdíà lọ mú lára owó tó wà nínú àpótí ọrẹ inú tẹ́ńpìlì ,ni àwọn Júù bá gbaná jẹ .
Hlɔmanu lɛ yawu byɔ toxo ɔ mɛ bo wɔ dǒ e ɖò tɛmpli ɔ gudo lɛ é .	Gbàrà táwọn ọmọ ogun Róòmù dé Jerúsálẹ́mù ,wọ́n bẹ̀rẹ̀ sí í fọ́ ògiri tẹ́ńpìlì .
Hwenu e ahwanfuntɔ́ Hlɔma tɔn lɛ kpo Jwifu gǔfɔntɔ́ lɛ kpo jó toxo ɔ dó é ɔ ,Klisanwun ɖěɖee hɛn akpágbánúmɛ Jezu tɔn ayi mɛ lɛ é hɔn sín Jeluzalɛmu bo tunta só lɛ jí ɖò Judɛ́ɛn Tɔ̀ ɔ gudo . Matie .	Bí àwọn Kristẹni ṣe rí i pé ìjà yẹn ti rọlẹ̀ ,wọ́n tẹ̀ lé ìkìlọ̀ Jésù ,wọ́n sá kúrò ní Jerúsálẹ́mù ,wọ́n sì lọ sáàárín àwọn òkè ní ìkọjá Odò Jọ́dánì . Mátíù 24​ .
Ðò 71 H.M .tɔn ɔ ,Titus lɛkɔ yì Italie bɔ toví Hlɔma tɔn lɛ xɔ susu ɖaxó ɖé n’i .	Lọdún 71 Sànmánì Kristẹni ,Titus pa dà sí Ítálì ,àwọn ará ìlú sì fi ìlù àti ijó kí i káàbọ̀ .
Titus jɛ tɔ́ tɔn Vespasien sín tɛnmɛ ɖò 79 H.M .tɔn bo nyí dada .	Lọ́dún 79 Sànmánì Kristẹni ,Vespasian tó jẹ́ olú ọba kú ,Titus ọmọ rẹ̀ sì rọ́pò rẹ̀ .
Ðɛhan 4610 Mawu wɛ sú ahwan kún dó gbɔn gbɛ̀ ɔ bǐ mɛ .	Sáàmù 469 Ọlọ́run mú kí ogun kásẹ̀ nílẹ̀ títí dé ìkángun ilẹ̀ ayé .
É wɛ́n gǎ lɛ ,é lɔ́ hwǎn lɛ ,é dó ahwankɛkɛ lɛ zo .	Ó ṣẹ́ ọrun sí wẹ́wẹ́ ,ó sì ké ọ̀kọ̀ sí wẹ́wẹ́ ó sun àwọn kẹ̀kẹ́ nínú iná .
Ezayíi 3324 Toví ɖé sɔ́ na ɖɔ Un ɖò azɔn jɛ wɛ ’ ǎ .	Aísáyà 3324 Kò sì sí olùgbé kankan tí yóò sọ pé‘ Àìsàn ń ṣe mí .’
Ðɛhan 7216 Jì ni jɛ ɖò tò ɔ mɛ kaka bo túnflá .	Sáàmù 7216 Ọ̀pọ̀ rẹpẹtẹ ọkà yóò wá wà lórí ilẹ̀ àkúnwọ́sílẹ̀ yóò wà ní orí àwọn òkè ńlá .
Adɔ kpo nùɖuɖuhwedomɛ kpo sɔ́ na tíìn ǎ .	Ìṣípayá 214 Ọlọ́run yóò sì nu omijé gbogbo nù kúrò ní ojú wọn ,ikú kì yóò sì sí mọ́ ,bẹ́ẹ̀ ni kì yóò sí ọ̀fọ̀ tàbí igbe ẹkún tàbí ìrora mọ́ .
Gbɔn nɛ̌ é	Báwo la ṣe mọ̀ bẹ́ẹ̀
Mawu gbejinɔtɔ́ wɛ .	Àmọ́ ìyẹn yàtọ̀ pátápátá sí ohun tí Bíbélì sọ nípa Ọlọ́run .
É jlɔ́ bo ɖò xwi jí . Sɛ́nflínmɛ 324 .	Ọlọ́run ìṣòtítọ́ ,ẹni tí kò sí àìṣèdájọ́ òdodo lọ́dọ̀ rẹ̀ olódodo àti adúróṣánṣán ni . Diutarónómì 324 .
Jixwé ɔ ,jixwé Mawu Mavɔmavɔ ɖokponɔ géé tɔn wɛ ,loɔ ,é na ayikúngban ɔ gbɛtɔ́ lɛ . Ðɛhan 11516	Ní ti ọ̀run ,ti Jèhófà ni ọ̀run ,ṣùgbọ́n ilẹ̀ ayé ni ó fi fún àwọn ọmọ ènìyàn . Sáàmù 11516
Ye hɛn gbɛ̀ mavɔmavɔ ɖò Palaɖisi mɛ ɖò ayikúngban jí sín nukúnɖiɖo bú . Bǐbɛ̌mɛ 217 55 .	Bó ṣe di pé wọn ò lè wà láàyè títí láé nìyẹn . Jẹ́nẹ́sísì 217 3​ 55 .
Enɛ ɔ ,gbɛtɔ́ lɛ bǐ nɔ kú .	Ìdí tá a fi ń kú ni pé a ti jogún ẹ̀ṣẹ̀ látọ̀dọ̀ àwọn òbí wa àkọ́kọ́ ,kì í ṣe pé Ọlọ́run ti dá ikú mọ́ wa ,Ọlọ́run ò sì fẹ́ kó máa rí bẹ́ẹ̀ .
Gǔfínfɔ́n Edɛni mɛ tɔn zɔ́n bonu linlin e Mawu ɖó ɖò bǐbɛ̌mɛ dó gbɛtɔ́ lɛ kpo ayikúngban ɔ kpo wu é cifo ǎ .	Nítorí pé Ọlọ́run nífẹ̀ẹ́ wa ,ó sì jẹ́ onídàájọ́ òdodo ,ó fún wa lóhun tó máa jẹ́ ká bọ́ lọ́wọ́ ikú àti ẹ̀ṣẹ̀ tá a ti jogún .
Dìn ɔ ,mi sɔ́ gbɛ̀ ɔ . Sɛ́nflínmɛ 3019	Èmi ti fi ìyè àti ikú sí iwájú rẹ ,ìbùkún àti ìfiré kí o sì yan ìyè . Diutarónómì 3019
Amɔ̌ ,nǔ enɛ lɛ bǐ na jɛnu dó ye wu kpowun ǎ .	Àmọ́ wọ́n gbọ́dọ̀ ṣe nǹkan kan kí wọ́n tó lè gbádùn àwọn ìbùkún yìí .
Enyi ye na mɔ nyɔna enɛ lɛ ɔ ,ye ɖó na sɔ́ gbɛ̀ .	Wọ́n gbọ́dọ̀ yan ìyè .
Wǎn e Jehovah yí nú gbɛtɔ́ lɛ é cí wǎn e mɛjitɔ́ lɛ nɔ yí nú vǐ yetɔn lɛ é ɖɔhun .	Bó tilẹ̀ jẹ́ pé àwọn òbí kì í ṣe ẹni pípé ,síbẹ̀ wọ́n nífẹ̀ẹ́ àwọn ọmọ wọn ,wọ́n máa ń tọ́ wọn sọ́nà ,wọ́n máa ń gbóríyìn fún wọn ,wọ́n máa ń tọ́jú wọn ,wọ́n sì tún máa ń bá wọn wí nígbà tó bá yẹ .
Enɛ wu ɔ ,tó ɖiɖó gbè Mawu tɔn nɔ byɔ nùkplɔnkplɔn kpo tónúsíse nú nǔ e é ɖɔ lɛ é kpo .	Torí náà ,tẹ́nì kan bá máa fetí sílẹ̀ sí ohun tí Ọlọ́run ń sọ ,àfi kẹ́ni náà máa kẹ́kọ̀ọ́ nípa Ọlọ́run ,kó sì máa ṣe ohun tí Ọlọ́run bá sọ .
Mǐ sixu sè gbè Mawu tɔn tlɔlɔ ǎ có ,mǐ ka nɔ ɖótó è gbɔn Xó tɔn Biblu ɔ xixa kpo nǔ e ɖ’emɛ lɛ é zinzan kpo gblamɛ . 1 Jaan 53 .	Àmọ́ a ò lè gbọ́ ohùn Ọlọ́run bá a ṣe ń gbọ́ ohùn èèyàn ,tá a bá fẹ́ gbọ́ ohùn Ọlọ́run ,a gbọ́dọ̀ máa ka Bíbélì ,ká sì máa fi ohun tá à ń kà ṣèwà hù . 1 Jòhánù 53 .
A na nɔ yí wǎn nú nǔwiwa kpo xomɛnyínyɔ́ kpo ,bo na nɔ zán gbɛ̀ ɖò mɛɖesɔhwe mɛ ɖò Mawu towe nukɔn . Micée 68 .	Kí sì ni ohun tí Jèhófà ń béèrè láti ọ̀dọ̀ rẹ bí kò ṣe pé kí o ṣe ìdájọ́ òdodo ,kí o sì nífẹ̀ẹ́ inú rere ,kí o sì jẹ́ ẹni tí ó mẹ̀tọ́mọ̀wà ní bíbá Ọlọ́run rẹ rìn ​ — Míkà 68 .
Nɛ̌ mǐ ka ɖó na wà nǔ xá mɛ ɖěɖee nɔ xò daka mǐ wǔ lɛ é gbɔn ​ — Wemafɔ .	Kí ló yẹ ká ṣe táwọn èèyàn bá ń ni wá lára ​ — Ẹsẹ 1 àti 2 .
Etɛ ka na jɛ dó mɛdídá lɛ wu ​ — Wemafɔ 10 .	Kí ló máa ṣẹlẹ̀ sí àwọn ẹni burúkú ​ — Ẹsẹ 10 .
Sɔgudo tɛ ka ɖò te kpɔ́n nǔjlɔjlɔwatɔ́ lɛ ​ — Wemafɔ .	Báwo ni ọjọ́ ọ̀la àwọn tó ń hùwà rere ṣe máa rí ​ — Ẹsẹ 11 àti 29 .
Etɛ mǐ ka ɖó na wà dìn ​ — Wemafɔ 34 .	Kí ló yẹ ká máa ṣe báyìí ​ — Ẹsẹ 34 .
Watch Tower Bible and Tract Society of Pennsylvania	Watch Tower Bible and Tract Society of Pennsylvania
Sín 1879 wɛ è ko ɖò xójlawema elɔ ɖetɔ́n wɛ .	Láti ọdún 1879 la ti ń tẹ ìwé ìròyìn yìí déédéé ,kì í sì í dá sí ọ̀rọ̀ ìṣèlú .
Fitɛ Mawu ka Ðè	Kí Ni Ọlọ́run Ń Wò
Mawu ka Nɔ Ðó Kɛ́n Jǐ Towe À	Ṣé Ọlọ́run Ń Kíyè Sí Rẹ
Mawu ka Nɔ Mɔ Nukúnnú Jɛ Wǔ We À	Ṣé Ọ̀rọ̀ Rẹ Yé Ọlọ́run
Mawu ka Nɔ Sè Wuvɛ̌ Xá Mɛ À	Ṣé Ọlọ́run Mọ Bí Nǹkan Ṣe Máa Ń Rí Lára Wa
Wuvɛ̌ MimɔTódɔnnúmɛ Mawu Tɔn Wɛ À	Tẹ́nì Kan Bá Ń Jìyà Ṣé Ọlọ́run Ló Fà Á
Mɛ̌ Wu Wuvɛ̌ Mimɔ ka Sín	Ta Ló Fà Á
Mawu Na Ðó Nǔ Wuvɛ̌ lɛ Bǐ Nu Zaanɖé	Ọlọ́run Máa Tó Mú Gbogbo Ìyà Kúrò
Lee A Sixu Ðu Nukúnkpédómɛwu Mawu Tɔn Sín Lè Gbɔn É	Wàá Jàǹfààní Tó O Bá Mọ̀ Pé Ọlọ́run Bìkítà Nípa Rẹ
Etɛ Mawu ka Nɔ Lin Dó Wuvɛ̌ E Mɔ Wɛ A Ðè lɛ É Wu	Báwo Ló Ṣe Máa Ń Rí Lára Ọlọ́run Tó O Bá Ń Jìyà
Ee a na ɖò tuùntuùn ’ i d’eji wɛ gbɔn nùɖíɖó tɔn lɛ kpo Xó tɔn kpo gblamɛ é ɔ ,mɔ̌ wɛ a na ɖò jiɖe ɖó d’eji wɛ ɖɔ é ɖò nukún kpé dó wǔ we wɛ é nɛ . 1 Jaan 23 1 Piyɛ́ɛ 57 .	Bí ìṣẹ̀dá àti Bíbélì ṣe túbọ̀ ń jẹ́ kó o mọ Ọlọ́run ,á túbọ̀ se kedere sí ẹ pé ó bìkítà fún ẹ . 1 Jòhánù 23 1 Pétérù 57
You are worth more . MATTHEW 1031	Ẹ níye lórí púpọ̀ . MÁTÍÙ 1031
Hǔn ,mi bo ma ɖi xɛsi ó ,ɖó mi xɔ akwɛ hú gboli gègě . Matie .	Nítorí náà ,ẹ má bẹ̀rùẹ níye lórí púpọ̀ ju ọ̀pọ̀ ológoṣẹ́ lọ . Mátíù .
Mawu Mavɔmavɔ sín nukún mɔ nǔ jɛ fí bǐ é nɔ ɖò mɛdídá kpo mɛ ɖagbe kpo kpɔ́n wɛ . NÙNYWƐXÓ 153 .	Ojú Jèhófà ń bẹ ní ibi gbogbo ,ó ń ṣọ́ àwọn ẹni búburú àti àwọn ẹni rere . ÒWE 153 .
É ɖò mɔ có ,Hannah sɔ́ nɔ xò nǔ kpɔ́n ɖɔ Jehovah nɔ ɖó ayi emi wu alǒ yí wǎn nú emi à jí ǎ .	Àmọ́ ,ní báyìí ,Hannah ti wá mọ̀ pé Ọlọ́run nífẹ̀ẹ́ òun .
Etɛ ka zɔ́n bɔ é huzu linlin	Kí ló jẹ́ kó mọ̀ bẹ́ẹ̀
Jehovah wɛ Mawu nɔ nyí bɔ Biblu ɖexlɛ́ . Ðɛhan 8318 ,nwt .	Jèhófà ni orúkọ Ọlọ́run bó ṣe wà nínú Bíbélì . Sáàmù 8318 .
Hwenu e kɛ́n jɛ nɔ ce wu é jɛn a ko mɔ mì . ÐƐHAN 13916	Ojú rẹ rí ọlẹ̀ mi . SÁÀMÙ 13916
Etɛ ka zɔ́n bɔ kancica bunɔ enɛ dó tíìn	Kí ló jẹ́ kí ọ̀rọ̀ wọn yé ara wọn tó bẹ́ẹ̀
Aklunɔ sín nukún ɖò mɛ e nɔ wà nǔ jlɔjlɔ lɛ jí ,é ɖò gbesisɔmɛ ,bo na ɖótó ɖɛ yetɔn . 1 PIYƐ́Ɛ 312 .	Ojú Jèhófà ń bẹ lára àwọn olódodo ,etí rẹ̀ sì ṣí sí ìrawọ́ ẹ̀bẹ̀ wọn . 1 PÉTÉRÙ 312 .
Jaki 511 na ganjɛwu mǐ ɖɔ Mǐ nɔ ylɔ ye ɖɔ nǔnyɔnanɔ ,ɖó ye dɛ ɖò ya e ye jì lɛ nu .	Jákọ́bù 511 jẹ́ kó dá wa lójú pé‘ Àwọn tí wọ́n lo ìfaradà ni a ń pè ní aláyọ̀ .
Enɛ wu ɔ ,enyi wuvɛ̌sexámɛ nɔ sísɛ́ gbɛtɔ́ lɛ bonu ye nɔ d’alɔ mɛ ɖevo lɛ hǔn ,wuvɛ̌sexámɛ Gbɛɖotɔ́ yetɔn Jehovah Mawu tɔn xwedó wɛ ye ɖè nɛ . Nùnywɛxó 1431 .	Torí náà ,tí ìfẹ́ bá mú ká fi ọ̀rọ̀ ẹnì kan ro ara wa wò tá a sì ràn án lọ́wọ́ ,ńṣe la fìwà jọ Ẹlẹ́dàá wa aláàánú ,Jèhófà Ọlọ́run . Òwe 1431 .
Tíntɔ́n 37 Nú mɛɖé ɖó alɔ mi wu hǔn ,nukúnzin ce wu wɛ é ɖó alɔ ,wɛ Mawu ɖɔ .	Ọlọ́run tún sọ pé Ẹni tí ó bá fọwọ́ kàn yín ń fọwọ́ kan ẹyinjú mi .
A súxó bo byɔ alɔgɔ́ ɔ ,é na ɖɔ nú we ɖɔ Un ɖò fí .’ ​ — EZAYÍI 589 .	​ — AÍSÁYÀ 589 .‘ Nítorí èmi fúnra mi mọ àwọn èrò tí mo ń rò nípa yín ní àmọ̀dunjú ,’ ni àsọjáde Jèhófà ,‘ àwọn èrò àlàáfíà ,kì í ṣe ti ìyọnu àjálù ,láti fún yín ní ọjọ́ ọ̀la kan àti ìrètí kan .
Hwenɛnu ɔ ,mi na súxó ylɔ mì ,bo na xwedó mì ,lobo na savo nú mì ,bɔ un na ɖótó mi . JELEMÍI .	​ — JEREMÁYÀ .
A ma ka ko wlan bǐ dó wema towe mɛ à ​ — ÐƐHAN 569 .	Wọn kò ha sí nínú ìwé rẹ ​ — SÁÀMÙ 568 .
É wɛ nyí 1 Jaan ,é ɖɔ Mawu hugǎn ayi mǐtɔn ,lobo tuùn nǔ bǐ .	Lẹ́yìn tó ti fara balẹ̀ tẹ́tí sí mi fún wákàtí mélòó kan tí kò sì dá ọ̀rọ̀ mọ́ mi lẹ́nu ,ó ka ẹsẹ Bíbélì kan tó wọ̀ mí lọ́kàn gan - an ,ìyẹn 1 Jòhánù 3​ ,tó sọ pé‘ Ọlọ́run tóbi ju ọkàn - àyà wa lọ ,ó sì mọ ohun gbogbo .
Enɛ wu ɔ ,un xà Ðɛhan 9419 ,é ɖɔ Enyi nǔ gègě ɖò hǔn mɛ nú mì ɔ ,gbɔ e a nɔ dó nú mì é wɛ nɔ dó xomɛhunhun nú mì .	Lẹ́yìn náà ,mo ka Sáàmù 94​ 19 ,tó sọ pé‘ Nígbà tí ìrònú tí ń gbé mi lọ́kàn sókè di púpọ̀ nínú mi ,ìtùnú tìrẹ ni ó bẹ̀rẹ̀ sí ṣìkẹ́ ọkàn mi .
Hwenu e Luzia ɖó xwè 16 é ɔ ,nawe e é nɔ wà azɔ̌ na é ɖé ɖɔ n’i ɖɔ Mawu dɔn tó nú we bɔ a bɛ́ kplíbɔzɔn ɖó a setónú nú nɔ towe ǎ ,bo lɛ́ xò daka wǔ tɔn wutu .	Nígbà tí Luzia wà ní ọmọ ọdún mẹ́rìndínlógún 16 ,obìnrin kan tó ń bá ṣiṣẹ́ sọ fún un pé Ọlọ́run ló ń fi ìyà jẹ ẹ́ torí pé o jẹ́ aláìgbọ́ràn ,o sì máa ń mú inú bí ìyá rẹ .
Xwè kanweko mɔkpan ɖò Klisu gudo ɔ ,Medieval Medicine and the Plague ɖɔ mɛɖé lɛ lin ɖɔ Mawu sɛ́ azɔn baɖabaɖa lɛ dó bo dó dɔn tó nú emi ɖó hwɛhuhu emitɔn lɛ wutu .	Bákan náà ,ìwé Medieval Medicine and the Plague jẹ́ ká mọ̀ pé ní àkókò tí ọ̀làjú bẹ̀rẹ̀ láàárín ọdún 476 Sànmánì Kristẹni sí nǹkan bí ọdún 1500 Sànmánì Kristẹni ,àwọn kan gbà gbọ́ pé Ọlọ́run ló ń fi àrùn jẹ àwọn níyà nítorí ẹ̀ṣẹ̀ àwọn .
É ɖɔ Nǔ e nyɔ́ nukún tɔn mɛ ɔ wɛ un nɔ bló tɛgbɛ bo nɔ wà nǔ lee Tɔ́ ɔ zɔ́n mì gbɔn é . Jaan 829 1431 .	Ó sọ pé Nígbà gbogbo ni mo ń ṣe ohun tí ó wù ú ,àti pé gẹ́gẹ́ bí Baba ti fi àṣẹ fún mi láti ṣe ,bẹ́ẹ̀ ni mo ń ṣe . Jòhánù 829 1431 .
Bǐbɛ̌mɛ Biblu lɛ́vɔ ɖɔ ɖɔ Mawu kún nɔ wà nǔ nyanya ó lé é kún nɔ wà nǔ agɔ ó . Jɔbu .	Bíbélì tún jẹ́ ká mọ̀ pé Ọlọ́run kì í ṣe burúkú ,bẹ́ẹ̀ ni ,kì í hùwà lọ́nà tí kò bá ìdájọ́ òdodo mu ​ — Jóòbù .
Jezu sín ahwanvu lɛ kanbyɔ Jezu ɖɔ Mɛ̌si ,mɛ̌ wɛ hu hwɛ bɔ è ka jì nya elɔ nukúntíntɔ́nnɔ tɔn mɔ̌	Àwọn ọmọ ẹ̀yìn rẹ̀ béèrè lọ́wọ́ rẹ̀ pé Rábì ,ta ni ó ṣẹ̀ ,ọkùnrin yìí ni tàbí àwọn òbí rẹ̀ ,tí a fi bí i ní afọ́jú
Éɖesu wɛ hu hwɛ à ,abǐ mɛ e jì i lɛ ɖě wɛ hu hwɛ	Jésù dáhùn pé Kì í ṣe ọkùnrin yìí ni ó ṣẹ̀ ,bẹ́ẹ̀ ni kì í ṣe àwọn òbí rẹ̀ ,ṣùgbọ́n ó jẹ́ kí a lè fi àwọn iṣẹ́ Ọlọ́run hàn kedere nínú ọ̀ràn rẹ̀ .
Jezu ka yí gbè nú ye ɖɔ Éɖesunɔ ɔ hu hwɛ wu wɛ ǎ ,mɛ e jì i lɛ ɖě ka hu hwɛ wu wɛ ǎ é tɔ́n nukún ,bonu Mawu na dó ɖè hlɔnhlɔn tɔn xlɛ́ dó wutu tɔn .’ ​ — Jaan .	​ — Jòhánù .
Hwenu kpo Nǔmaɖónukún lɛ Kpo .	Ìgbà àti ìṣẹ̀lẹ̀ tí a kò rí tẹ́lẹ̀ .
Amɔ̌ ,Biblu ɖɔ Mawu ɔ ,wanyiyi wɛ é nyí .	Àmọ́ ,Bíbélì sọ pé Ọlọ́run jẹ́ ìfẹ́ .
Mawu na jiɖe Xabakuku ɖɔ emi ko sɔ́ hwenu ɖé bo na ɖó nǔ wuvɛ̌ lɛ nu . Xabakuku .	Ọlọ́run fi dá Hábákúkù lójú pé òun ti yan àkókò kan tí òun máa mú ìyà kúrò . Hábákúkù .
Loɔ ,é nɔ ɖó suúlu dó mi wu ɖó é jló ɖɔ mɛɖebǔ ni dɔn ǎ é nyɔ́ wà ɔ ,é jló ɖɔ mɛ bǐ ni mɔ ali ,bo lɛkɔ sín nǔnyanyawiwa gudo . 2 Piyɛ́ɛ 39 .	Àmọ́ ,Bíbélì fi wá lọ́kàn balẹ̀ pé Jèhófà kò fi nǹkan falẹ̀ ní ti ìlérí rẹ̀ ,gẹ́gẹ́ bí àwọn ènìyàn kan ti ka ìfi - nǹkan - falẹ̀ sí ,ṣùgbọ́n ó ń mú sùúrù fún yín nítorí pé kò fẹ́ kí ẹnikẹ́ni pa run ṣùgbọ́n ó fẹ́ kí gbogbo ènìyàn wá sí ìrònúpìwàdà . 2 Pétérù 39 .
Jɔhɔn ɔ xwɛ ,bɔ fí bǐ cí tóó . Maki .	Ẹ̀fúùfù náà sì rọlẹ̀ ,ìparọ́rọ́ ńláǹlà sì dé . Máàkù .
É gbɔ azɔn nú azinzɔnnɔ lɛ bǐ . Matie 816 .	Jésù yanjú ìṣòro gbogbo àwọn tó ń jìyà . Mátíù 816 .
Biblu ɖɔ ɖɔ azɔn wè wɛ é na nùɖuɖu gbɛtɔ́ afatɔ́n mɔkpan ɖò sinsɛnzɔ́ tɔn hwenu . Matie .	Nígbà tí Jésù wà láyé ,ìgbà méjì ni Bíbélì ròyìn pé ó bọ́ ẹgbẹẹgbẹ̀rún èèyàn . Mátíù .
Mɛ ɖěɖee é fɔ́n sín kú wá gbɛ̀ lɛ é ɖokpo ko kú bɔ é bló azǎn ɛnɛ có ,é ka fɔ́n ɛ . Maki Luki Jaan .	Ẹnì kan tiẹ̀ wà tó ti kú fún ọjọ́ mẹ́rin kí Jésù tó jí i dìde . Máàkù Lúùkù Jòhánù .
Un na na akɔnkpinkpan we un na gɔ́ alɔ nú we .	Èmi yóò ràn ọ́ lọ́wọ́ ní ti tòótọ́ .
É lɛ́ ɖɔ gɔ́ na ɖɔ Mɛ e nɔ na hlɔnhlɔn mì ɔ wɛ nɔ zɔ́n ,bɔ un nɔ sixu kpé nǔ enɛ lɛ bǐ wu . Filipunu lɛ ,.	Pọ́ọ̀lù tún fi kún un pé Mo ní okun fún ohun gbogbo nípasẹ̀ agbára ìtóye ẹni tí ń fi agbára fún mi . Fílípì ,.
Ði kpɔ́ndéwú ɔ ,Nǔɖexlɛ́mɛ ɖɔ nǔ e é na wá wà é kpo nǔ e wu mǐ sixu ɖeji dó wǔ tɔn ɖɔ é na bló é kpo nú mǐ	Bí àpẹẹrẹ ,Ìṣípayá sọ ohun tí Ọlọ́run máa ṣe àti ìdí tó fi yẹ ká gbẹ́kẹ̀ lé e
É lɛ́ ɖɔ nú mì ɖɔ Wlǎn ,ɖó xó nugbǒ wɛ nyí xó enɛ lɛ ,bo nyí xó e wu è na ɖeji dó lɛ .’ ​ — Nǔɖexlɛ́mɛ .	Pẹ̀lúpẹ̀lù ,ó wí pé Kọ̀wé rẹ̀ ,nítorí pé ọ̀rọ̀ wọ̀nyí ṣeé gbíyè lé ,wọ́n sì jẹ́ òótọ́ .’ ​ — Ìṣípayá .
Nùɖíɖó lɛ nɔ sísɛ́ mǐ bonu mǐ na huzu xɔ́ntɔn Mawu tɔn có ,Biblu ɔ ka ɖɔ tlɔlɔ ɖɔ Mi sɛkpɔ Mawu enɛ ɔ é na sɛkpɔ mi .	Láìsọ̀rọ̀ ,àwọn ìṣẹ̀dá ń jẹ́ ká mọ irú ẹni tí Ọlọ́run jẹ́ ,ó tún jẹ́ ká rí i pé a lè sún mọ́ ọn bí ọ̀rẹ́ kòríkòsùn ,àmọ́ ńṣe ni Bíbélì ń rọ̀ wá ní tààràtà pé Ẹ sún mọ́ Ọlọ́run ,yóò sì sún mọ́ yín .
Jaki 48 Mɛsɛ́dó 1727 ɖɔ Mawu ka sɔ́ lín dó ɖokpo ɖokpo mǐtɔn ǎ .	Ìṣe 1727 sọ pé Kò jìnnà sí ẹnì kọ̀ọ̀kan wa .
Amɔ̌ ,ee Toru kpo asì tɔn Hannah kpo kplɔ́n Biblu é ɔ ,é bló huzuhuzu jiwǔ ɖé ɖò gbɛzán tɔn kpo linlin tɔn kpo mɛ .	Àmọ́ nígbà tó yá ,Toru àti Hannah ìyàwó rẹ̀ bẹ̀rẹ̀ sí í kẹ́kọ̀ọ́ Bíbélì ,ìgbé ayé rẹ̀ yí pa dà sí rere ,ó sì bẹ̀rẹ̀ sí í ronú lọ́nà tó tọ́ .
É nɔ kpé nukún dó mǐ wu ,bo nɔ hwlɛn mǐ gán hwenu e adǎn ɖò mǐ gbò wɛ é . Ðɛhan 13623 .	Ó máa ń bójú tó wa ,nígbà tá a bá sorí kọ́ . Sáàmù 13623 .
Mawu Mavɔmavɔ mɔ ɖɔ dakaxixo gbɛtɔ́ tɔn sukpɔ́ .bɔ akpɔ̀ ɖó é . Bǐbɛ̌mɛ .	Jèhófà rí i pé ìwà búburú ènìyàn pọ̀ yanturu ní ilẹ̀ ayé .,ó sì dùn ún ní ọkàn - àyà rẹ̀ . Jẹ́nẹ́sísì .
Tò ɔ ka na nyí mɛ e nɔ sɔ́ yeɖée hwe lɛ tɔn ,bɔ fífá ma ɖó dogbó e ye na mɔ ɔ wɛ na nyí nǔ e na nɔ víví nú ye é . Ðɛhan .	Ṣùgbọ́n àwọn ọlọ́kàn tútù ni yóò ni ilẹ̀ ayé ,ní tòótọ́ ,wọn yóò sì rí inú dídùn kíkọyọyọ nínú ọ̀pọ̀ yanturu àlàáfíà . Sáàmù .
Hwenɛnu ɔ ,mi na súxó ylɔ mì ,bo na xwedó mì ,lobo na savo nú mì ,bɔ un na ɖótó mi . Jelemíi .	Dájúdájú ,ẹ ó sì pè mí ,ẹ ó sì wá gbàdúrà sí mi ,èmi yóò sì fetí sí yín . Jeremáyà .
Mi sɛkpɔ Mawu enɛ ɔ é na sɛkpɔ mi . Jaki 48 .	Ẹ sún mọ́ Ọlọ́run ,yóò sì sún mọ́ yín . Jákọ́bù 48 .
Ye Zé Yeɖée Jó kpo Jlǒ Kpo — Ðò Madagascar	Wọ́n Yọ̀ǹda Ara Wọn Tinútinú ​ — Ní Madagásíkà
É Nɔ Na Hlɔnhlɔn Ðevo Mɛ E Nǔ Cikɔ Na É	Ó Ń Fi Agbára fún Ẹni Tí Ó Ti Rẹ̀
Xota elɔ ɖɔ xó dó xota xwè 2018 tɔn mǐtɔn wu ,bo xlɛ́ nǔ e wu mǐ ɖó na jó Jehovah dó bɔ é na mɔ ali bo dó wusyɛn lanmɛ nú mǐ é kpo lee é na wà mɔ̌ gbɔn é kpo .	Àpilẹ̀kọ yìí jíròrò ẹsẹ Ìwé Mímọ́ wa ti ọdún 2018 ,ó sì sọ ìdí tó fi yẹ ká jẹ́ kí Jèhófà ràn wá lọ́wọ́ ká lè fara dà á àti bó ṣe máa ṣe bẹ́ẹ̀ .
Flǐn ɔ Nɔ Zɔ́n Bɔ Togun Mawu Tɔn Nɔ Nɔ Bǔ	Ìrántí Ikú Kristi Ń Mú Ká Wà Níṣọ̀kan
È na bló Flǐn kú Klisu tɔn tɔn ɖò Samedi 31 Mars 2018 .	Saturday ,March la máa ṣe Ìrántí Ikú Kristi tọdún yìí .
Etɛwu È ka Na Na Nǔ Mɛ E Ko Ðó Nǔ Bǐ É	Kí Nìdí Tó Fi Yẹ Ká Máa Fún Ẹni Tó Ni Ohun Gbogbo Ní Nǹkan
Wanyiyi Alɔkpa Tɛ ka Nɔ Na Awǎjijɛ Adodwé ɔ Mɛ	Ìfẹ́ Wo Ló Ń Mú Kéèyàn Ní Ojúlówó Ayọ̀
Mɔ Vogbingbɔn ɔ Ðò Gbɛtɔ́ lɛ Tɛntin	Ìyàtọ̀ Tó Wà Láàárín Àwọn Tó Ń Sin Ọlọ́run Àtàwọn Tí Kò Sìn Ín
A ka Tuùn À	ǸJẸ́ O MỌ̀
Perrine kpo Louis kpo	Perrine àti Louis
Louis kpo Perrine kpo e nyí asú kpo asì kpo ɖé ,bo ɖó xwè 30 jɛji é gosin France bo yì Madagascar .	Tọkọtaya kan tó ń jẹ́ Louis àti Perrine tí wọ́n ti lé lẹ́ni ọgbọ̀n 30 ọdún ṣí lọ sí Madagásíkà láti ilẹ̀ Faransé .
Nú xwè mɔkpan ɔ ,ye nɔ ɖò tamɛ lin dó lee ye sixu gbló ada nú sinsɛnzɔ́ yetɔn ,gbɔn tɛnsisɛ yì gbě ɖevo jí gblamɛ é jí wɛ ,bɔ Perrine ka nɔ ɖò nǔ xò kpɔ́n dó tɛnsisɛ ɔ wu wɛ .	Ọ̀pọ̀ ọdún ni wọ́n ti ń ronú àtiṣí lọ sórílẹ̀ - èdè míì kí wọ́n lè ṣe púpọ̀ sí i lẹ́nu iṣẹ́ òjíṣẹ́ wọn ,àmọ́ àyà Perrine ń já .
Ðò 2012 ɔ ,Perrine sɔnǔ nú akɔnkpinkpan bɔ é kpo Louis kpo sɛ̀ tɛn .	Àmọ́ lọ́dún 2012 ,Perrine ṣọkàn akin ,àwọn méjèèjì sì gbéra .
Louis ɖɔ gɔ́ na ɖɔ Dǒ nukún Flǐn nukɔntɔn e mǐ bló ɖò Madagascar é mɛ kpɔ́n ,Biblu kplɔntɔ́ mǐtɔn wǒ wɛ wá tɛn tɔn mɛ	Louis wá sọ pé Ẹ wo bí inú wa ti dùn tó nígbà tí mẹ́wàá lára àwọn tá à ń kọ́ lẹ́kọ̀ọ́ wá sí Ìrántí Ikú Kristi tá a kọ́kọ́ bá wọn ṣe ní Madagásíkà
Louis ɖɔ Ðò Octobre 2014 ɔ ,mǐ yì Wemaxɔmɛ Biblu Kpinkplɔn Tɔn nú Asú kpo Asì kpo Lɛ ɖò France .	Louis sọ pé Ní October 2014 ,a lọ sí Ilé Ẹ̀kọ́ Bíbélì fún Àwọn Tọkọtaya nílẹ̀ Faransé .
Ðò kúnnuɖewema ɔ yíyí hwenu ɔ ,xomɛ hun asú kpo asì kpo ɔ ɖɔ è lɛ́ sɛ́ ye dó Madagascar .	Nígbà tí wọ́n kẹ́kọ̀ọ́ yege ,inú wọn dùn gan - an nígbà tí ètò Ọlọ́run ní kí wọ́n máa bá iṣẹ́ wọn lọ lórílẹ̀ - èdè Madagásíkà .
Nadine kpo Didier kpo	Nadine àti Didier
