input	target
Ðò hwe enɛ nu ɖò xwè kanweko donu 50 jɛji ɖíe ɔ ,mɛ lɛ nɔ dɔ́ji tawun hú égbé .	Siku hizo ,zaidi ya karne 50 zilizopita ,watu waliishi miaka mingi sana kuliko ilivyo leo .
Enɛ wu ɔ ,Henɔci ɖó xwè 365 có ,é sixu lɛ́ ɖó hlɔnhlɔn ganji ,bo cí mɛ e kpò ɖò anyǔ mɛ é ɖɔhun .	Kwa hiyo ,akiwa na miaka 365 ,Enoko alionekana kuwa mwanamume mwenye nguvu ,ambaye angeishi miaka mingi tu zaidi ya hiyo .
Ye gbɛ́ wǎn nú wɛn tɔn ,bo lɛ́ gbɛ́ wǎn nú Mawu e sɛ́ ɛ dó é .	Waliuchukia ujumbe wa Enoko ,na walimchukia Mungu aliyemtuma .
Bǐbɛ̌mɛ ,25 Vɔ jɛn é ko vɔ nɛ à	Je ,huo ndio ungekuwa mwisho wa maisha yake
É ɖò wɛn ɖɔ ye nɔ zán nyikɔ mímɛ́ Mawu tɔn kpo mɛmasi kpo bo nɔ nyla nu dó wǔ tɔn . Bǐbɛ̌mɛ - 26 .	Ni wazi kwamba walikufuru jina takatifu la Mungu ,na kulitumia kwa njia isiyofaa .Mwanzo - 26 .
Enɛ wu ɔ ,hwenu e Henɔci ɖó xwè 65 mɔ̌ é ɔ ,é ko nyí xwétɔ́ ɖé .	Kwa hiyo ,Enoko alikuwa na familia alipokuwa na umri wa miaka 65 hivi .
É ɖó asì ɖokpo ,Mawuxówema ɔ ka ɖɔ nyikɔ tɔn ǎ ,lobo jì vǐ sunnu bo jì vǐ nyɔnu .	Alikuwa na mke ,ambaye Maandiko hayataji jina lake ,na pia akawa na wana na mabinti .
Amɔ̌ Henɔci jó gǔ ɖaxó ɖé dó .	Lakini Enoko aliwaachia wazao wake kielelezo kizuri .
Nɔwée sín tɔ́ Lamɛki alǒ tɔ́gbó tɔn Mɛtucɛlaxi alǒ boya Henɔci sín tɔ́ Yɛlɛdi e kú hwenu e Nɔwée ɖó xwè 366 é wɛ sixu ko kplɔ́n nǔ Nɔwée dó gǔ enɛ wu . Bǐbɛ̌mɛ 69 91 .	Huenda Noa alijifunza kuhusu imani ya Enoko kutoka kwa baba yake ,Lameki ,au kutoka kwa babu yake ,Methusela ,au labda kutoka kwa baba ya Enoko aliyeitwa Yaredi ,ambaye alikufa Noa alipokuwa na umri wa miaka 366 .Mwanzo 69 91 .
Henɔci nyí hwɛhutɔ́ có ,é yì xá Mawu lobo jó nùɖiɖi sín gǔ dó nú kúnkan tɔn .	Enoko hakuwa mkamilifu ,lakini alitembea na Mungu na kuwaachia wazao wake kielelezo cha imani .
Adamu kú hwenu e Henɔci ɖó xwè 308 é .	Adamu alikufa Enoko alipokuwa na umri wa miaka 308 .
É na bo nyí gbɔn ɖebǔ ɔ ,Henɔci nɔ yì xá Mawu . Bǐbɛ̌mɛ 524 .	Vyovyote vile ,Enoko aliendelea kutembea pamoja na Mungu wa kweli .Mwanzo 524 .
Amɔ̌ ,Mawu tɔn Jehovah ka ɖ’ayi wǔ tɔn à	Lakini je ,Yehova Mungu ,alitambua imani yake
Nǔ ɔ wɛ nyí ɖɔGbeyiɖɔ ɔ ɖò xó ɖɔ dó nǔ e jí é kú dó ɖɔ é na jɛ dandan é ɖé wu wɛ ɖó alɔkpa ɖé bɔ é cí ɖɔ nǔ ɔ ko jɛ wɛ ɖɔhun ​ — Ezayíi 4610 .	Uhakika wa kutimia kwa jambo linalozungumziwa ni mkubwa sana hivi kwamba linaelezwa kana kwamba tayari limetukia Isaya 4610 .
Mɛɖé ka sɔ́ mɔ ɛ ǎ ,ɖó Mawu sɔ́ ɛ yì .	Kisha ,hakuwapo tena ,kwa maana Mungu alimchukua .
Biblu ɖexlɛ́ ɖɔ Jezu Klisu wɛ nyí mɛ nukɔntɔn e è fɔ́n dó jixwé é . Jaan 313 .	Biblia inaonyesha kwamba Yesu Kristo ndiye mtu wa kwanza kufufuliwa na kwenda mbinguni .Yohana 313 .
Nǔ ɖokpo ɔ wɛ Mawu na ko bló nú cyɔ Mɔyizi kpo Jezu kpo tɔn ,bonu è ni ma sɔ́ ye dó wà nǔ masɔgbe mɔhun lɛ na ó . Sɛ́nflínmɛ Luki Judi 9 .	Vivyo hivyo ,inaelekea Mungu alihakikisha kwamba mwili wa Musa na wa Yesu hautumiwi kwa njia isiyofaa .Kumbukumbu la Torati Luka Yuda 9 .
Sísí ɖó nú Xó Mawu Tɔn na sísɛ́ mǐ bɔ mǐ na nyì alɔ nú walɔ nyanya lɛ ɖi ahannumu kpo nùblibliwiwa kpo . 1 Kɔlɛntinu lɛ .	Kwa mfano ,ikiwa tunaliheshimu Neno la Mungu tutaepuka mazoea yanayoweza kuathiri afya yetu kama vile kunywa pombe kupita kiasi na ukosefu wa maadili .1 Wakorintho .
Aniwu é ma ka wà mɔ̌ ǎ	Kwa nini hakufanya hivyo
Gbigbɔ mímɛ́ ɔ nɔ lɛ́vɔ sísɛ́ Klisanwun e mɔ nukúnnú jɛ nǔ wu ganji lɛ é bɔ ye nɔ d’alɔ mɛ ɖěɖee ɖò biba wɛ bá mɔ nukúnnú jɛ nǔ mɛ d’eji lɛ é . Mɛsɛ́dó .	Pia ,roho takatifu huwachochea Wakristo wenye ujuzi zaidi wa Biblia kuwasaidia wale wanaotaka kuielewa kwa kina .Matendo .
Mɔ̌ mɛ ɔ ,ye ɖi nǔ ɖɔ emi nɔ wà nǔ mɛsɛ́dó Klisu tɔn lɛ ɖɔhun ,yedɛɛ lɛ nɔ sɔ́ yeɖée hwe bo nɔ jla linlin yetɔn lɛ ɖó hweɖebǔnu e Jezu gbɛ́ nǔ nú ye é . Mɛsɛ́dó .	Wanaamini kwamba ,kwa kufanya hivyo ,wanawaiga mitume wa Kristo ambao walibadili maoni yao kila mara Yesu alipowarekebisha .Matendo .
Biblu d’akpá ɖɔ Ylɔ̌ nùtuùntuùn ɖɔ é ni wá gɔ́ alɔ nú emi ,.enɛ ɔ ,.a na mɔ nǔ jɛ lee è nɔ tuùn Mawu gbɔn é wu . Nùnywɛxó .	Ikiwa utaita uelewaji .,utapata kumjua Mungu .Methali .
Satáan Awovi ,axɔsu gbɛ̀ elɔ tɔn ɔ wɛ nyí mɛ taji e nɔ zɔ́n wuvɛ̌ mimɔ lɛ é . Jaan 1430 .	Shetani Ibilisi ,mtawala wa ulimwengu ,ndiye chanzo kikuu cha kuteseka .Yohana 1430 .
Wuvɛ̌ mimɔ lɛ kpo nǔ nyanya lɛ kpo nɔ lɛ́ sín gbeta nyanya e kɔn gbɛtɔ́ lɛ nɔ wá é wu hwɛhwɛ . Jaki .	Nyakati nyingine ,maovu na kuteseka husababishwa na maamuzi mabaya ambayo huenda mtu akafanya .Yakobo .
Kú sɔ́ na tíìn ǎ ,aluwɛ sɔ́ na tíìn ǎ ,alěnina sɔ́ na tíìn ǎ ,wuvɛ̌ mimɔ sɔ́ na tíìn ǎ . Nǔɖexlɛ́mɛ .	Kifo hakitakuwapo tena ,wala maombolezo wala kilio wala maumivu hayatakuwapo tena .Ufunuo .
Mawu na zán Jezu dó jla wuvɛ̌ mimɔ ɖěɖee Awovi zɔ́n lɛ é ɖó . 1 Jaan 38 .	Mungu atamtumia Yesu kukomesha kuteseka kunakosababishwa na Ibilisi .1 Yohana 38 .
Mɛ ɖagbe lɛ na nɔ ayikúngban jí ɖò fífá mɛ kaka sɔyi . Ðɛhan ,29 .	Watu wanaofanya mambo mema wataishi duniani milele .Zaburi ,29 .
Watch Tower Bible and Tract Society of Pennsylvania	Watch Tower Bible and Tract Society of Pennsylvania
Sín 1879 wɛ è ko ɖò xójlawema elɔ ɖetɔ́n wɛ .	Gazeti hili limekuwa likichapishwa tangu 1879 na si la kisiasa .
Nùnina E Ma Kpé Wè Ǎ É Ðé	Zawadi ya Pekee Sana
Nùnina Mawu Tɔn E Hugǎn Bǐ ÉEtɛwu É ka Xɔ Akwɛ Sɔmɔ̌	Zawadi Bora Zaidi ya Mungu Kwa Nini Ni Yenye Thamani Sana
Nɛ̌ A ka Na Yí Gbè nú Nùnina Ðaxó Hugǎn Bǐ E Mawu Na Mǐ É Gbɔn	Jinsi ya Kuithamini Zawadi Bora Zaidi ya Mungu
DANDAN WƐ SINSƐNZƆ́WATƆ́ KLISANWUN LƐ NA NƆ TLƐNMƐ À	JE ,USEJA NI TAKWA LA WAHUDUMU WAKRISTO
KANNUMƆÐÒ HWEXÓNU KPO ÉGBÉ KPO	KUTOKA UTUMWANI NYAKATI ZA KALE NA SASA
ÐU VIVǏ LÈ E NÙNAMƐ NƆ HƐN WÁ LƐ É TƆN	FURAHIA FAIDA ZA KUWA MKARIMU
Biblu ɖɔ Mawu yí wǎn nú gbɛtɔ́ sɔmɔ̌ ,bo sɔ́ Vǐɖokponɔ tɔn jó . Jaan 316 .	Mungu aliupenda ulimwengu sana hivi kwamba akamtoa Mwana wake mzaliwa - pekee .Yohana 316 .
Biblu tinmɛ nùnina e akwɛ ma sixu xɔ ǎ é ɖé ɖò xógbe elɔ lɛ mɛ Mawu yí wǎn nú gbɛtɔ́ sɔmɔ̌ ,bo sɔ́ Vǐɖokponɔ tɔn jó ,bonu mɛ e na ɖi nǔ n’i lɛ ɖebǔ ma dɔn ó loɔ ,ye bǐ ni mɔ gbɛ̀ mavɔmavɔ . Jaan 316 .	Mungu aliupenda ulimwengu sana hivi kwamba akamtoa Mwana wake mzaliwa - pekee ,ili kila mtu anayemwamini asiangamizwe bali awe na uzima wa milele .Yohana 316 .
Gbɔn vɔsisa enɛ e è nɔ ylɔ ɖɔ gbɛxixɔ ɔ ’ é gblamɛ ɔ ,mɛ ɖěɖee ɖi nǔ nú Jezu lɛ é bǐ na mɔ gbɛ̀ mavɔmavɔ . Hlɔmanu lɛ 324 .	Kwa msingi wa dhabihu hiyo ,inayoitwa fidia ,wote wanaomwamini Yesu watapata uzima wa milele .Waroma 324 .
Jezu sɔ jlǒ dó sɔ́ gbɛ̀ tɔn jó dó ta mǐtɔn mɛ .	Kwa hiari ,Yesu aliitoa nafsi yake kwa ajili yetu .
Nɛ̌ è ka sixu jlɛ́ enɛ dó gbɛxixɔ ɔ sín nùnina wu gbɔn	Hilo linahusianaje na zawadi ya fidia
Fɛ́nú Mawu tɔn sín xlɛ̌ wɛ nyí gbɛxixɔ sín axɔ e Klisu Jezu sú é . Hlɔmanu lɛ 324 ,nwt .	Fidia ambayo Kristo Yesu alilipa ni wonyesho wa Mungu wa fadhili zake zisizostahiliwa .Waroma 324 .
Kpɔ́n WEMA LƐ VIDEO LƐ glɔ .	Tafuta kwenye MACHAPISHO VIDEO .
É kú dó mɛ bǐ tamɛ ,bonu mɛ e ɖò gbɛ̀ lɛ ɔ ,ye ma sɔ́ nɔ gbɛ̀ nú yeɖesunɔ ó loɔ ,ye ni nɔ gbɛ̀ nú mɛ e kú dó ye tamɛ é . 2 Kɔlɛntinu lɛ .	Alikufa kwa ajili ya wote ili wale wanaoishi wasiishi tena kwa ajili yao wenyewe ,bali kwa ajili ya yeye aliyekufa kwa ajili yao .2 Wakorintho .
Biblu dó wusyɛn lanmɛ nú mǐ ɖɔ Mi sɛkpɔ Mawu enɛ ɔ é na sɛkpɔ mi . Jaki 48 .	Mkaribieni Mungu ,naye atawakaribia ninyi .Yakobo 48 .
Ði nǔ nú gbɛxixɔ ɔ .	Uwe na imani katika fidia .
Enyi a ɖi nǔ nú gbɛxixɔ ɔ ɔ ,a na ɖó nukún bo na nɔ fífá ,ayijayǐ kpo vivo kpo mɛ kaka sɔyi ɖò sɔgudo . Eblée lɛ 111 .	Mkaribie Mungu ukiwa na uhakika kabisa kwamba kuwa na imani katika fidia kutatuwezesha tupate uzima ,amani ,usalama na ufanisi wakati ujao Waebrania 111 .
Ðò xwè e wá yì é mɛ ɔ ,gbɛtɔ́ livi 20 mɔ̌ wɛ wá Flǐn tɛnmɛ .	Mwaka uliopita ,karibu watu milioni 20 walihudhuria Ukumbusho ulimwenguni pote .
È wlí i dó gankpa mɛ lobo dó gɛdɛ ɛ . Bǐbɛ̌mɛ Ðɛhan .	Kisha ,akatupwa gerezani na kufungwa katika vyuma .Mwanzo Zaburi .
Ði kpɔ́ndéwú ɔ ,kannumɔ Hlɔma tɔn e è nɔ zán dó ba ayǐdɔkun na lɛ é dɔ́ji dín ɔ wɛ nyí xwè 30 mɔ̌ .	Kwa mfano ,urefu wa maisha ya watumwa katika migodi ya Waroma ,ulikadiriwa kuwa miaka 30 tu .
Gbeɖiɖó UNESCO tɔn ɖé ɖɔ ɖɔ sunnu ,nyɔnu ,kpo yɔkpɔvu kpo livi 25 jɛ 30 mɔ̌ wɛ è wlí gannugánnú bo sà .	Inakadiriwa kwamba kati ya wanaume ,wanawake ,na watoto milioni 25 hadi 30 walitekwa na kuuzwa .
Sɔgbe kpo OIT Organisation internationale du travail kpo ɔ ,sunnu ,nyɔnu ,kpo yɔkpɔvu kpo livi 21 mɔ̌ wɛ kpó ɖò kannumɔ nyí wɛ ,bo sixu hɔn ǎ ,bɔ è nɔ sú akwɛ kpɛɖé ye alǒ è nɔ lɛ́ nɔ akwɛ ɖebǔ má sú ye lɔ .	Kulingana na Shirika la Kimataifa la Wafanyakazi ILO ,wanaume ,wanawake ,na watoto milioni 21 hivi bado wanafanya kazi wakiwa watumwa ,baadhi yao wakilipwa pesa kidogo sana na wengine hawalipwi kabisa .
Daka e xò kannumɔ lɛ wu wɛ è ɖè ɖò lekegbo lɛ mɛ é zɔ́n bɔ è fun tohwan ɖé nú xwè 13 ,bɔ gudo mɛ ɔ ,è wá ɖó tò Haïti tɔn e jɛ éɖesu sí é ayǐ ɖò 1804 .	Kwa sababu ya kutendewa kikatili katika mashamba ya miwa ,walianzisha vita vilivyodumu kwa miaka 13 na hatimaye taifa la Haiti lilipata uhuru wake mwaka wa 1804 .
Gudo mɛ ɔ ,Mawu d’alɔ Jozɛfu kpo Blessing kpo bɔ ye gosin kannumɔgbenu ɖò ali vovo lɛ nu .	Mungu alimsaidia Yosefu na Blessing kutoka utumwani katika njia zilizotofautiana .
A sixu mɔ tan Jozɛfu tɔn e jiwǔ tawun é ɖò wema Biblu tɔn e nyí Bǐbɛ̌mɛ é wemata 39 jɛ 41 mɛ .	Unaweza kusoma simulizi lenye kuvutia la Yosefu katika sura ya 39 hadi 41 ya kitabu cha Biblia cha Mwanzo .
Gbè ɖokpo ɔ ,Blessing sín gǎn ylɔ ɛ .	Siku moja ,Blessing alipigiwa simu na yule mwajiri wake wa awali .
Mawu dó jinukúnsin yɔyɔ̌ kpo ayikúngban yɔyɔ̌ kpo sín akpá finɛ wɛ è na nɔ wà nǔ kpodo hwɛjijɔ kpan ɖè nǔ e mǐ ɖò te kpɔ́n ɔ nɛ . 2 Piyɛ́ɛ 313	Kulingana na ahadi yake tunangojea mbingu mpya na dunia mpya ,na humo uadilifu utakaa .2 Petro 313
Ee Alonso nyí kannumɔ nú gěe nunu nú xwé 30 gudo é ɔ ,é wá jɛ Biblu kplɔ́n xá Kúnnuɖetɔ́ Jehovah tɔn lɛ jí .	Baada ya kuwa mtumwa wa dawa za kulevya kwa miaka 30 ,Alonso alianza kujifunza Biblia na Mashahidi wa Yehova .
Jezu yì ba Piyɛ́ɛ sín asinɔ kpɔ́n bo gbɔ azɔn n’i . Matie Maki	Yesu alimtembelea mama - mkwe wa Petro na akamponya .Mathayo Marko
Ðò xóɖiɖɔ e Pápà Benoît XVI xwlé Sinsɛngán Katolika Hlɔma tɔn tɔn lɛ ɖò 2006 é mɛ ɔ ,é ɖɔ ɖɔ tlɛnmɛninɔ dandan ɔ nyí aca ɖé bɔ è ko ɖò xwixwedó wɛ sín hwenu e mɛsɛ́dó lɛ kú gudo tlolo é ɖokpoo .	Alipokuwa akihutubia Roman Curia mwaka wa 2006 ,Papa Benedict wa XVI alisema kwamba sheria ya useja kwa viongozi wa kidini ni desturi ambayo imekuwepo tangu zamani ,karibu na kipindi cha Mitume .
Ðò Vaxɔ Latran tɔn e è bló ɖò Rome ɖò 1123 kpo 1139 kpo é hwenu ɔ ,è lɛ́ dó zǒgbe tlɛnmɛninɔ yɛhwenɔ lɛ tɔn jí ,bɔ gbeta enɛ jí wɛ Sinsɛn Katolika Hlɔma tɔn ɔ kpó ɖè kaka wá jɛ égbé .	Mpango wa useja kwa viongozi wa kidini ulipitishwa rasmi kwenye Mabaraza ya Lateran ya mwaka wa 1123 na 1139 ,yaliyofanywa jijini Roma ,na zoea hilo limefuatwa na Kanisa Katoliki mpaka leo .
Matie 1912 Ðò ali ɖokpo ɔ nu ɔ ,mɛsɛ́dó Pɔlu ɖɔ xó dó Klisanwun ɖěɖee jló bo xwedó tlɛnmɛninɔ sín kpɔ́ndéwú éyɛtɔn ,ɖó wɛnɖagbe ɔ wu lɛ é wu . 1 Kɔlɛntinu lɛ 923 .	Vivyo hivyo ,mtume Paulo alizungumza kuhusu Wakristo waliofuata mfano wake na kubaki waseja kwa ajili ya habari njema .1 Wakorintho 923 .
Tlɛnnɔ lɛ sixu sɔ́ yeɖée jó hugǎn ɖó ye nɔ mɔ tagba e mɛ ɖěɖee wlí alɔ lɛ é nɔ mɔ lɛ é ǎ wutu . 1 Kɔlɛntinu lɛ .	Waseja wanaweza kujitoa zaidi kwa kuwa wao hawana mahangaiko yanayowakabili wale waliofunga ndoa .1 Wakorintho .
Claudia ɖɔ gɔ́ na ɖɔ A wlí alɔ oo ,a nɔ tlɛnmɛ oo ,a na ɖó awǎjijɛ ,enyi a wà nǔ e wu a kpé é bǐ nú Jehovah Mawu ɔ nɛ . Ðɛhan .	Vyovyote vile ,iwe umefunga ndoa au ni mseja ,utakuwa na furaha ikiwa utajitoa kabisa kwa Yehova Mungu .Zaburi .
Gudo mɛ ɔ ,é wá yí gbè nú xó e nya ɔ ɖɔ lɛ é ,amɔ̌ ,é ɖɔ ɖɔ nya ɔ ɖó na sú akwɛ ɖé ɖó wema e é ma ɖó ǎ é wu .	Hatimaye ,askari huyo alikubali maelezo ya mwanaume huyo ,lakini alimpiga faini kwa kukosa kuwa na vitambulisho vinavyofaa .
Ðó é ma ɖó akwɛ ɖě ǎ wutu ɔ ,Alexandra nya ɖɔ̌la Amɛlika tɔn 20 caki 12 mɔ̌ n’i .	Kwa kuwa mwanaume huyo hakuwa na pesa ,Alexandra alijitolea kumwazima dola 20 .
Nya ɔ tuùn lee é na dó gbè tɔn ɛ gbɔn é ǎ ,bo ɖɔ emi na sú axɔ ɛ hú ɖɔ̌la Amɛlika tɔn 20 ɔ .	Mwanaume huyo alimshukuru sana na aliahidi atamlipa zaidi ya dola 20 .
Biblu na xósin ɔ bo ɖɔ ɖɔ è dá gbɛtɔ́ lɛ ɖó akpajlɛ Mawu tɔn mɛ ’ ,enɛ wɛ nyí ɖɔ ye ɖó jijɔ dòdó Mawu tɔn lɛ . Bǐbɛ̌mɛ 127 .	Biblia inatoa jibu inaposema kuwa wanadamu waliumbwa kwa mfano wa Mungu ,na hilo linamaanisha kwamba wana uwezo wa kuonyesha sifa kama za Mungu .Mwanzo 127 .
Ahwan ,adɔ ,ayikúngban danwǔ ,kpo jɛmɛji lɛ kpo na tíìn ɖò azǎn gudogudo tɔn lɛ mɛ . Matie Luki 2111 .	Vita ,njaa ,matetemeko ,na magonjwa hatari ya kuambukiza ,ni mambo yanayothibitisha kwamba hizi ni siku za mwisho .Mathayo Luka 2111 .
Ðò azǎn gudogudo tɔn lɛ mɛ ɔ ,ninɔmɛ gbɛtɔ́ lɛ tɔn na gblé tawun ɖò walɔ ɖagbe kpo gbigbɔ kpo linu . 2 Timɔtée .	Katika siku hizi za mwisho ,jamii ya wanadamu imekumbwa na hali mbaya ya kiadili na watu hawajali uhusiano wao na Mungu .2 Timotheo .
Tò ɔ alǒ ayikúngban ɔ na nyí hwɛjijɔnɔ lɛ tɔn ,bɔ ye na nɔ mɛ kaka sɔyi . Ðɛhan 3729	Waadilifu wenyewe wataimiliki dunia ,nao watakaa milele juu yake .Zaburi 3729 .
Azǎn gudogudo tɔn lɛ na wá vivɔnu hwenu e è na ɖè nǔnyanyawiwa bǐ síìn é . 1 Jaan 217 .	Siku za mwisho zitakoma uovu wote utakapoondolewa .1 Yohana 217 .
Ayikúngban ɔ na huzu Palaɖisi ɖé . Ezayíi .	Dunia itageuzwa iwe paradiso .Isaya .
Watch Tower Bible and Tract Society of Pennsylvania	Watch Tower Bible and Tract Society of Pennsylvania
Sín 1879 wɛ è ko ɖò xójlawema elɔ ɖetɔ́n wɛ .	Gazeti hili limekuwa likichapishwa tangu 1879 na si la kisiasa .
Sɔ́xátɔ́ Ɛnɛ lɛ kpo Hwi Kpo	Wapanda Farasi Wanne Jinsi Wanavyokuhusu
Sɔ́xátɔ́ Ɛnɛ LɛMɛ̌ Mɛ̌ É ka nú Ye	Wapanda Farasi Wanne Wanamaanisha Nini
BIBLU NƆ HUZU GBƐZÁN MƐTƆN	BIBLIA INABADILI MAISHA
ÐI NǓ YE ÐƆHUN SALA	IGENI IMANI YAO SARA
ETƐ BIBLU KA ÐƆ	BIBLIA INASEMA NINI
Nǔ nyɔ́ nú mɛ e ɖò wema elɔ xà wɛ ɔ ,bo nyɔ́ nú mɛ e ɖò tó ɖó wɛn elɔ lɛ e Mawu dó gbɔn gbeyiɖɔ tɔn lɛ jí é . Nǔɖexlɛ́mɛ 13 .	Mwenye furaha ni yeye anayesoma kwa sauti na wale wanaosikia maneno ya unabii huu .Ufunuo 13 .
Bɔ Yɔdo ,fí e gbɛtɔ́ lɛ bǐ nɔ yì é ɖò gudo tɔn tútútú bo ɖò gbɛtɔ́ lɛ bɛ́ wɛ mɔhunkɔtɔn ​ — Nǔɖexlɛ́mɛ .	Nalo Kaburi ,linafuata kwa ukaribu ,likivuna idadi kubwa ya watu Ufunuo .
Mawu d’akpá ɖɔ enyi a nɔ xà nǔ e è wlan dó wema nǔɖɔɖ’ayǐ tɔn enɛ mɛ é ,bo nɔ kplɔ́n ,lobo nɔ zán gbɛ̀ sɔgbe xá ɔ ,a na ɖó awǎjijɛ . Nǔɖexlɛ́mɛ .	Mungu anaahidi kwamba unaweza kuwa na furaha ya kweli kwa kusoma ,kujifunza na kuishi kupatana na mambo yaliyoandikwa katika kitabu hicho cha kinabii .Ufunuo .
É ɖido mɛ ko ɖu ɖ’eji ɖɔhun ,bo na ɖu ɖ’eji . Nǔɖexlɛ́mɛ 62 .	farasi mweupe na yule anayeketi juu yake alikuwa na upinde naye akapewa taji ,naye akaenda akishinda na kukamilisha ushindi wake .Ufunuo 62 .
Jaan Gɔ́ na ɔ ,è ylɔ ɛ ɖɔ Axɔsu axɔsu lɛ tɔn Aklunɔ aklunɔ lɛ tɔn bo lɛ́ ɖɔ dó wǔ tɔn ɖɔ é nɔ nyí Gbejinɔtɔ́ ,bo nɔ nyí Titewungbe .	Kwa kuongezea ,yeye huitwa Mfalme wa wafalme na Bwana wa mabwana na pia anaitwa Mwaminifu na wa Kweli .
Sɔ́ wewé ɔ nyí nùjlɛdonǔwu ɖé bo sɔgbe xá ahwan hwɛjijɔ tɔn e Vǐ Mawu tɔn ɔ na fun é ,ɖó hwɛhwɛ ɔ ,Mawuxówema ɔ nɔ zán sinmɛ wewé dó ɖè nǔjlɔjlɔwiwa xlɛ́ . Nǔɖexlɛ́mɛ 34 ,14 .	Farasi mweupe anawakilisha vita vya haki vinavyotekelezwa na Mwana wa Mungu ,kwa kuwa mara nyingi Maandiko hutumia rangi nyeupe kuwakilisha uadilifu .Ufunuo 34 ,14 .
Ahwan na tɔ́n ,adɔ na tɔ́n ,bɔ jɛmɛji lɛ na gbà nǔ .	Kungekuwa na vita ,upungufu wa chakula ,na magonjwa .
Amɔ̌ ,etɛwu è ka sɔ́ Jezu axɔsu ɖò 1914 bɔ nǔ lɛ ma ka kpɔ́n te ǎ ,bɔ ninɔmɛ lɛ ka tlɛ́n asá	Hata hivyo ,kwa nini hali duniani zimekuwa mbaya tangu Yesu alipowekwa kuwa Mfalme mwaka wa 1914
È sɔ́ hwi ɖaxó ɖokpo dó así n’i . Nǔɖexlɛ́mɛ 64 .	Na mwingine akatokea ,farasi mwenye rangi ya moto ,na yeye anayeketi juu yake akapewa ruhusa ya kuondoa amani duniani ili wauane ,naye akapewa upanga mkubwa .Ufunuo 64 .
Ðò 1914 ɔ ,azɔn nukɔntɔn e è fun ahwan ɖé gbɔn gbɛ̀ ɔ bǐ mɛ ɖò hwenuxó mɛ é nɛ .	Mwaka wa 1914 ,kwa mara ya kwanza katika historia ,kulitokea vita ambavyo vilienea duniani kote .
Gbeɖiɖó ɖé lɛ ɖɔ ɖɔ gbɛtɔ́ e ahwanfunfun hu gbɔn gbɛ̀ ɔ mɛ sín 1914 é hú livi 100	Takwimu fulani hukadiria kwamba zaidi ya watu milioni 100 wamekufa kutokana na vita na mapigano tangu mwaka wa 1914
Amɔ̌ ,ma ɖ’alɔ ami kpo vɛɛn kpo wu ó .’ ​ — Nǔɖexlɛ́mɛ .	Kibaba cha ngano kwa dinari moja ,na vibaba vitatu vya shayiri kwa dinari moja ,wala usidhuru mafuta ya zeituni na divai .’ Ufunuo .
Sín 1914 ɔ ,mǐ ka ko mɔ kúnnuɖenú e xlɛ́ ɖɔ mɛ e ɖò sɔ́ wiwi ɔ kun wɛ é ɖò wezun nu à	Tangu 1914 ,je ,kuna mambo yanayothibitisha kwamba mpandaji wa farasi mweusi yuko mwendoni
Ðò xwè kanweko 20gɔ́ ɔ mɛ ɔ ,gbɛtɔ́ livi 70 mɔ̌ wɛ kú adɔ kú .	Katika karne ya 20 ,watu wapatao milioni 70 walikufa kutokana na njaa .
Ðò 1914 gudo tlolo ɔ ,azɔn e nɔ nyí grippe espagnole é hu gbɛtɔ́ livi mɔkpan .	Muda mfupi baada ya mwaka wa 1914 ,homa ya Hispania iliua mamilioni ya watu .
Flín nǔ elɔJezu ɖido mɛ ko ɖu ɖ’eji ɖɔhun ɖò 1914 ,bo ko glɔ́n Satáan ɖó ayikúngban jí ,amɔ̌ ,é ko ɖu ɖ’eji bǐ mlɛ́mlɛ́ ǎ .	Yesu alienda akishinda ’ mwaka wa 1914 ,kwa kumtupa Shetani hapa duniani ,lakini Yesu hakukamilisha ushindi wake wakati huo .
Mawu na súnsún ɖasin bǐ sín nukún yetɔn mɛ kú sɔ́ na tíìn ǎ ,aluwɛ sɔ́ na tíìn ǎ ,alěnina sɔ́ na tíìn ǎ ,wuvɛ̌ mimɔ sɔ́ na tíìn ǎ . Nǔɖexlɛ́mɛ 214 .	Mungu atafuta kila chozi kutoka katika macho yao ,na kifo hakitakuwapo tena ,wala maombolezo wala kilio wala maumivu hayatakuwapo tena .Ufunuo 214 .
É jɛhun dó fífá jí ,bló nùjiwǔ dó na nùɖuɖu gbɛtɔ́ afatɔn mɔkpan ,gbɔ azɔn nú mɛ lɛ ,bo tlɛ fɔ́n mɛ sín kú . Matie 1215 2652 Jaan .	Alidumisha amani ,akawalisha maelfu ya watu ,akawaponya wagonjwa ,na kuwafufua wafu .Mathayo 1215 2652 Yohana .
É jɛ axɔsu ɖu jí ɖò 1914 bɔ zaanɖé dìn ɔ ,é na ɖu ɖ’eji bǐ mlɛ́mlɛ́ ,bo na ɖè wuvɛ̌ mimɔ bǐ síìn .	Alianza kutawala mwaka wa 1914 na hivi karibuni atakamilisha ushindi wake ,kwa kuondoa mateso yote .
Mɛ e ɖò kunkun wɛ é nɔte nú ahwan .	Mpandaji wake anawakilisha vita .
Wɛkɛ hwan lɛ kpo ahwan kpɛví kpɛví lɛ kpo ko hu gbɛtɔ́ maxamaxa lɛ sín 1914 .	Vita vya dunia na vita vidogo - vidogo vimeua idadi kubwa ya watu tangu 1914 .
Ðò 2014 ɔ ,xójlawema Biblical Archaeology Review sín xota ɖé kàn nǔ elɔ byɔ Mɛ ɖěɖee xó è ɖɔ ɖò Akpáxwé Biblu Tɔn E È Wlan Dó Ebléegbe Mɛ É nabi dobanunǔ dokunkun tɔn ka ɖekúnnu na	Katika mwaka wa 2014 ,Ni watu wangapi wanaotajwa katika Biblia ambao wachimbuzi wa vitu vya kale wamethibitisha kuwa walikuwepo
Xósin e é na é ɖí É hwe bǐ ɔ ,gbɛtɔ́ 50	Angalau watu 50
Ɛsidlasi Ðò axɔsuɖuɖu Daliwusi I tɔn hwenu ɔ J.H.M .,axɔsuzɔwatɔ́ Pɛsinu e nɔ nyí Tatunayi é ba dò nú xó ɔ .	Wakati wa utawala wa Dario 1 K.W.K .,ofisa Mwajemi aliyeitwa Tatenai aliongoza uchunguzi wa madai hayo .
Biblu ylɔ ɛ ɖɔ tokpɔngán Tatunayi e ɖò Eflati tɔ̀ ɔ sín gbadahweji é . Ɛsidlasi .	Biblia inamwita gavana wa Ng’ambo ya Mto .Ezra .
Ðò 535 J.H.M .ɔ ,Silusi Daxó ɔ vɔ́ fí e é kp’acɛ gbɔn lɛ é tò bo má ye ,bɔ tokpɔn enɛ lɛ ɖokpo wɛ è ylɔ ɖɔ Babilɔnu kpo Tɔ̀ ɔ Gudo kpo .	Katika mwaka wa 535 K.W.K .,Koreshi Mkuu aligawanya milki zake katika wilaya ,na moja ya wilaya hizo iliitwa Babiloni na Ng’ambo - ya - Mto .
Tatunayi kp’acɛ dó tokpɔn enɛ jí ɖò 520 jɛ 502 J.H.M .mɔ̌ .	Tatenai alikuwa gavana wa wilaya hiyo kuanzia mwaka wa 520 hadi 502 K.W.K .
Ɛsidlasi ,Enɛ wu ɔ ,è ɖegbe nú Tatunayi ɖɔ é ni má ɖó ye te ó ,bɔ é setónú na . Ɛsidlasi ,13 .	Hivyo ,Tatenai akaagizwa kutoingilia mradi huo ,naye akatii .Ezra ,13 .
Mɛ e tɔn wɛ éSamuel Hamilton	Llimesimuliwa na Samuel Hamilton
Hwenu e un ɖò balɔ́ɔn xò wɛ ɖò gbɛ̌ta ɔ mɛ bo ɖó xwè 20 é ɔ ,gǎn mǐtɔn lɛ ɖokpo byɔ mì ɖɔ má xò balɔ́ɔn ɖò gbɛ̌ta azɔ̌tuùntɔ́ Nicaragua tɔn ɖé mɛ .	Nilipokuwa na umri wa miaka 20 hivi ,wakati bado ninachezea ligi hiyo ,mwakilishi wa timu fulani aliniomba niende kuwa mchezaji wa kulipwa huko Nikaragua .
Un nɔ gbɛ̌ta tò ɔ tɔn mɛ sín 1949 kaka jɛ 1952 ,bo xò balɔ́ɔn agbahwlɛnhwlɛn tɔn ɖebɔdoɖewu lɛ ɖò Cuba ,Mexique kpo Nicaragua kpo .	Nilichezea timu ya taifa tangu mwaka wa 1949 hadi 1952 ,na tulicheza mechi nchini Kuba ,Mexico ,na Nikaragua .
Baseball xotɔ́ titewungbe ɖé wɛ nú mì ,bɔ un tlɛ nɔ xò akpáxwé agbahwlɛnhwlɛn tɔn ɖebɔdoɖewu 17 ma xò ɖokpo vɔ́vɔ́ nyì dò .	Nilicheza sehemu ya ulinzi na nilifanya vizuri sana ,wakati fulani nilicheza michezo 17 mfululizo bila kufanya kosa lolote .
Amɔ̌ ,ee un ɖó xwè 29 é ɔ ,un gblewu ɖaxó ɖé hwenu e un ɖò tintɛnkpɔn wɛ bá wlí balɔ́ɔn ɖò balɔ́ɔn xixo ɖé hwenu é .	Hata hivyo ,nilipokuwa na umri wa miaka 29 ,niliumia vibaya sana nilipokuwa nikijaribu kudaka mpira uwanjani .
Jezu ɖɔ Lee un na acɛ mi vɔ̌nu ɔ ,mi lɔmɔ̌ mi bo wà nǔ lɛ bǐ vɔ̌nu . Matie 108 .	Mlipokea bure ,toeni bure .Mathayo 108 .
Enɛ wu ɔ ,hwenu e un xà Maki 1021 bo mɔ xó Jezu tɔn e ɖɔ ,Wǎ ,bo xwedó mì é ɔ ,un jló na huzu Kúnnuɖetɔ́ ɖé .	Kwa hiyo niliposoma andiko la Marko 1021 na kuona mwaliko wa Yesu unaosema ,Njoo uwe mfuasi wangu ,nilitaka kuwa Shahidi .
Égbé ɔ ,xomɛ hun mì ɖɔ sín hwenu e un huzu Kúnnuɖetɔ́ ɖé ɖò 1958 é ɔ ,un tɛ́ dó huzuhuzu ɖěɖee un bló ɖò gbɛzán ce mɛ lɛ é wu kpo gbejininɔ kpo .	Leo ,ninafurahi kusema kwamba tangu niwe Shahidi mwaka wa 1958 ,nimeshikamana kikamili na mabadiliko niliyofanya katika maisha yangu .
É ka nyí mɔ̌ hǔn ,nǔ e wu wɛ é ɖò wɛn .	Ikiwa ndiyo ,ni rahisi kuelewa sababu ni kwa nini .
É na ko ɖó xwè 60 mɔ̌ có ,é na sɛ̀ tɛn yì fí e é ma tuùn ǎ lɛ é ,lobo na zán gbɛ̀ e awovinú kpodo wuvɛ̌ mimɔ kpo gɔ́ é ɖé nukúnɖiɖo ɖé ka ɖè ɖɔ é na lɛkɔ gbè ɖokpo ǎ .	Ingawa huenda alikuwa na umri wa miaka 60 ,angesafiri kwenda mahali asikokujua na kuwa tayari kuhatarisha uhai wake kwa kukabili changamoto na hatari ,bila kuwa na tumaini la kurudi tena .
Etɛ nùɖiɖi tɔn ka sixu kplɔ́n mǐ ɖò égbé	Tunaweza kujifunza nini kutokana na imani yake
Lɔti lɔ na xwedó ye hwenu e ye ɖò tónú sè nú Jehovah wɛ bo gosin Kaludéenu lɛ tomɛ é . Mɛsɛ́dó 74 .	Loti aliungana nao kutii agizo la Yehova la kutoka katika nchi ya Wakaldayo .Matendo 74 .
Ye mlɛ́ Eflati Tɔ̀ ɔ bo tó yì jɛ agban ɖó Haláani hwɛ̌ é ɖò kilomɛtlu 960 mɔ̌ ɖò totaligbé - gbadahweji .	Kwanza walifunga safari kwenda Harani ,umbali wa kilomita 960 upande wa kaskazini mashariki ,wakifuata mwambao wa mto Efrati .
Xwédo ɔ nɔ finɛ kaka jɛ hwenu e é ɖó xwè 205 bo kú é .	Waliendelea kukaa huko hadi Tera alipokufa akiwa na umri wa miaka 205 .
Bǐbɛ̌mɛ Amɔ̌ ,hwenu e ye gosin Haláani é ɔ ,Ablaxamu ko ɖó xwè 75 ,bɔ Sala ko ɖó xwè 65 ,ye ka ɖó vǐ ɖě ǎ .	Lakini walipoondoka Harani ,Abrahamu alikuwa na umri wa miaka 75 na Sara alikuwa na miaka 65 ,nao hawakuwa na mtoto .
Ee ye d’asá Eflati Tɔ̀ ɔ ɖò 14 Nisáan ,1943 J.H.M .mɔ̌ gudo é ɔ ,ye tunta tofɔligbé fí e Jehovah d’akpá tɔn nú ye é .	Walipokuwa wamevuka mto Efrati ,yapata Nisani K.W.K .,walielekea upande wa kusini katika nchi ambayo Yehova alikuwa amewaahidi .
Xókwin kúnkan ɔ na ko ɖó tinmɛ nú Ablaxamu tawun	Usemi ,uzao ,ungekuwa na maana pana sana kwa Abrahamu
Jehovah ko ɖɔ nú Ablaxamu ɖɔ akɔta e na gosin kún tɔn mɛ é na hun nyɔna lɛ sín ali nú gbɛtɔ́ lɛ bǐ ɖò ayikúngban jí . Bǐbɛ̌mɛ 315 ,.	Tayari Yehova alikuwa amemwambia Abrahamu kwamba angetokeza taifa ambalo lingewezesha wanadamu wote duniani kupata baraka .Mwanzo 315 ,.
Ablamu kpo Salayíi kpo wɛ ye nɔ nyí ɖò bǐbɛ̌mɛ ,amɔ̌ ,nyikɔ e Jehovah na ye ɖò nukɔnmɛ é wɛ è dó tuùn ye na ganji . Bǐbɛ̌mɛ .	Mwanzoni ,majina yao yalikuwa Abramu na Sarai ,lakini wanajulikana kwa majina ambayo Yehova aliwapatia baadaye .Mwanzo .
Amɔ̌ ,ɖò xwè 400 mɔ̌ gudo ɔ ,hwɛhuhu ko kp’acɛ dó gbɛtɔ́ lɛ jí bǐ nɛ .	Hata hivyo ,miaka 400 hivi baadaye ,urefu wa maisha ulikuwa sawa na ilivyo kwa wakati wetu .
