input	target
Piyɛ́ɛ na xósin bo ɖɔ Ɛɛn Aklunɔ a tuùn ɖɔ un yí wǎn nú we .	Pétérù dáhùn pé Bẹ́ẹ̀ ni ,Olúwa ,ìwọ mọ̀ pé mo ní ìfẹ́ni fún ọ .
Etɛ xó ɖěɖee Jezu ɖɔ nú Piyɛ́ɛ lɛ é ka sixu kplɔ́n mǐ	Kí la rí kọ́ nínú ọ̀rọ̀ tí Jésù sọ fún Pétérù
a Mɛ̌ mǐ ka ɖu gbejininɔ mǐtɔn sín axɔ dó jɛ nukɔn	a Ta ló yẹ kó ṣe pàtàkì jù sí wa
b Nǔ xɔ akwɛ tɛ nɔví sunnu Thaïlande tɔn ɖé ka kplɔ́n dó azɔ̌ tɔn wu	b Ẹ̀kọ́ pàtàkì wo ni arákùnrin kan lórílẹ̀ - èdè Thailand kọ́ nípa iṣẹ́ rẹ̀
Nǔ e ɖò taji hugǎn é wɛ nyí ɖɔ ,dìn ɔ ,un mɔ ɖɔ un sɛkpɔ Jehovah hugǎn . Xà Matie ,nwt .	Àmọ́ ,ohun tó fún mi láyọ̀ jù ni pé mo túbọ̀ sún mọ́ Jèhófà . Ka Mátíù .
Nǔ xɔ akwɛ tɛ Jezu ka kplɔ́n mɛ dó nǔ e è na sɔ́ ɖó tɛn nukɔntɔn ɔ mɛ é wu	Ẹ̀kọ́ pàtàkì wo ni Jésù kọ́ wa
Lin tamɛ dó nùjlɛdonǔwu elɔ jíMǐ mɛ gègě nɔ ba na ɖu nǔ e víví lɛ é ɖò hweɖelɛnu ,loɔ ,mǐ mɔ ɖɔ nǔ víví ɖuɖu dingan na dó azɔn agbaza mǐtɔn .	Ẹ jẹ́ ká lo àpèjúwe yìí náỌ̀pọ̀ wa ló fẹ́ràn ká máa jẹ ìpápánu lẹ́ẹ̀kọ̀ọ̀kan ,àmọ́ tó bá jẹ́ ìpápánu bíi bisikíìtì ,súìtì tàbí kéèkì lẹnì kan kúndùn ,ó máa ṣàkóbá fún ìlera rẹ̀ .
Nú mǐ na nyì alɔ nú enɛ ɔ ,mǐ na nɔ ɖ’alɔ ɖò azɔ̌ Axɔsuɖuto ɔ tɔn lɛ mɛ ɖò gbesisɔmɛ .	Tá ò bá fẹ́ kírú ẹ̀ ṣẹlẹ̀ sí wa ,ṣe ló yẹ ká máa lọ́wọ́ nínú àwọn ohun tó jẹ mọ́ ìjọsìn Ọlọ́run déédéé .
É ka byɔ ɖɔ a ni bló huzuhuzu ɖé wɛ à ​ — Xà Efɛzinu lɛ .	Ǹjẹ́ kò ní gba pé ká dín iye àkókò tá à ń lò nídìí eré ìnàjú àti ìgbafẹ́ kù ​ — Ka Éfésù .
a Ali tɛ nu agbaza sín nǔ lɛ gbé nyinya ka sixu huzu mɔ ɖé nú Klisanwun ɖé ɖè	a Báwo la ṣe lè mọ̀ bóyá ohun ìní tara ti ń gbà wá lọ́kàn
Jezu ɖɔ Mɛɖé sixu sɛ̀n gǎn wè ǎ .	Jésù sọ pé kò sí ẹnì kan tí ó lè sìnrú fún ọ̀gá méjì .
b Etɛ ka na d’alɔ mǐ bɔ mǐ na fun ahwan xá jlǒ agbazanú lɛ gbé nyinya tɔn	b Kí ni kò ní jẹ́ ká máa lépa àwọn ohun ìní tara
Xà 1 Kɔlɛntinu lɛ 214 .	Ka 1 Kọ́ríńtì 214 .
Wema - sɛ́dó - mɛ e mɛsɛ́dó ɔ wlan ɖò 98 H.M .tɔn é tɔ́n ɖò Akpáxwé Biblu Tɔn E È Wlan Dó Glɛkigbe Mɛ É mɛ ,bo nyí Wema Atɔngɔ E Jaan Wlan É .	Nǹkan bí ọdún 98 Sànmánì Kristẹni ni àpọ́sítélì Jòhánù kọ lẹ́tà yìí ,òun la mọ̀ sí Ìwé Kẹta Jòhánù nínú Ìwé Mímọ́ Kristẹni Lédè Gíríìkì .
Nɛ̌ é ka ɖè gbejininɔ tɔn xlɛ́ gbɔn	Kí ló ṣe tó fi hàn pé ó jẹ́ olóòótọ́
Xókwin Glɛkigbe tɔn dòdó ɔ sixu lɛ́ nyí sunnu mɛxomɔ ɔ .	Èyí mú kí Gáyọ́sì ọmọ rẹ̀ ọ̀wọ́n nípa tẹ̀mí mọ̀ pé àpọ́sítélì Jòhánù ni .
Jaan mɔ enɛ dó mɔ wuntun e xlɛ́ ɖɔ Gayiwusi nyí gbejinɔtɔ́ é ,ɖó jonɔyiyi nɔ ɖè mɛsɛntɔ́ Mawu tɔn lɛ xlɛ́ tɛgbɛ . Bǐb .	Èyí jẹ́ kí Jòhánù mọ̀ pé Gáyọ́sì ń fòótọ́ inú sin Jèhófà torí pé àwọn ìránṣẹ́ Ọlọ́run máa ń lẹ́mìí aájò àlejò . Jẹ́n .
Vlafo enɛ wu wɛ tomɛyitɔ́ nùnywɛtɔ́ lɛ nɔ ba na nɔ xɔ́ntɔn lɛ xwégbe ,bɔ tomɛyitɔ́ Klisanwun lɛ nɔ ba na nɔ Klisanwun lɛ xwégbe .	Torí náà ọ̀pọ̀ àwọn tó ń rìnrìn - àjò sábà máa ń dé sọ́dọ̀ àwọn ọ̀rẹ́ wọn ,àwọn Kristẹni náà sì máa ń dé sọ́dọ̀ àwọn ará .
É tlɛ lɛ́ tɛ́n kpɔ́n bo na glɔ́n ali nú mɛ ɖevo lɛ bonu ye na wà mɔ̌ . 3 Jaan .	Bákan náà ,kò fẹ́ káwọn míì nínú ìjọ ṣe wọ́n lálejò . 3 Jòh .
Jaan 12 É sixu ko nyí ɖɔ é byɔ ɖɔ Gayiwusi ni dó alɔ Demɛtliwusi ,lobɔ mɛsɛ́dó Jaan sixu ko wlan Jaan Atɔngɔ ɔ dó ɖè Demɛtliwusi xlɛ́ ɛ bo lɛ́ kpa ɛ .	Ó ṣeé ṣe kó jẹ́ pé Dímẹ́tíríù nílò ìrànlọ́wọ́ Gáyọ́sì ,ó sì lè jẹ́ pé lẹ́tà kẹta tí Jòhánù kọ yìí ló fi jẹ́ kí Gáyọ́sì mọ̀ nípa Dímẹ́tíríù tó sì fi dámọ̀ràn rẹ̀ .
É sixu ko nyí ɖɔ Demɛtliwusi ɖesu wɛ sɔ́ wema ɔ jó nú Gayiwusi .	Ó ṣeé ṣe kó jẹ́ pé Dímẹ́tíríù fúnra rẹ̀ ló fi lẹ́tà náà jíṣẹ́ fún Gáyọ́sì .
Eɖíe Gayiwusi ko nɔ yí jonɔ ɖ’ayǐ è ,bɔ etɛwu Jaan ka byɔ ɛ lo ɖɔ é ni kpó ɖò jijɔ enɛ ɖexlɛ́ wɛ	Kí wá nìdí tí Jòhánù fi sọ fún Gáyọ́sì pé kó túbọ̀ máa gba àwọn ará lálejò nígbà tó jẹ́ pé ó ti máa ń ṣe bẹ́ẹ̀ tẹ́lẹ̀
Enɛ wu ɔ ,mi nú mǐ ni nɔ yí mɛ e nɔ wá gɔ̌n mǐtɔn lɛ é ganji .’ ​ — Hlɔ .1213 1 Tim .	Torí náà ,ẹ jẹ́ kí gbogbo wa máa tẹ̀ lé ipa ọ̀nà aájò àlejò . Róòmù 1213 1 Tím .
Gudo mɛ ɔ ,Jehovah na bló bɔ ye na lɛkɔ sín hwɛ yetɔn lɛ gudo ,bo na mɔ nukúnnú jɛ nugbǒ ɔ wu . 2 Tim .	Nípa bẹ́ẹ̀ ,Jèhófà lè fún wọn ní ìrònúpìwàdà tí ń ṣamọ̀nà sí ìmọ̀ pípéye nípa òtítọ́ . 2 Tím .
É ɖò mɔ̌ có ,é xɔ akwɛ tawun nú Klisanwun égbé tɔn lɛ .	Síbẹ̀ ,àwọn ọ̀rọ̀ tó wà nínú rẹ̀ ṣàǹfààní gan - an fáwa Kristẹni lónìí .
DANIEL KPO MIRIAM KPO wlí alɔ ɖò Septembre 2000 ,bo sɛ̀ tɛn yì toxo Barcelone tɔn mɛ ɖò Espagne .	DANIEL ÀTI MIRIAM ṣègbéyàwó ní September 2000 wọ́n sì ń gbé nílùú Barcelona lórílẹ̀ - èdè Sípéènì .
Daniel tuùn ɖɔ nugbǒ wɛ enɛ nyí .	Daniel alára gbà pé òótọ́ lọ̀rọ̀ yẹn .
Nǔ e é ka wà nugbǒ é nɛ .	Ó sì ṣe bẹ́ẹ̀ .
Ðò Mai 2007 ɔ ,Daniel kpo Miriam kpo jó azɔ̌ yetɔn lɛ dó ,bo sɛ̀ tɛn yì Panama ,tò e mɛ ye ko ɖi sà yì ɖ’ayǐ é ɖé mɛ .	Ní May 2007 ,Daniel àti Miriam fi iṣẹ́ oúnjẹ òòjọ́ wọn sílẹ̀ ,wọ́n sì kó lọ sórílẹ̀ - èdè kan tí wọ́n ti lọ rí ,ìyẹn Panama .
É sɔ́ lín ǎ ,bɔ ye ɖó Biblu kplɔnkplɔn 23 .	Kò pẹ́ tí tọkọtaya náà fi bẹ̀rẹ̀ sí í kọ́ àwọn mẹ́tàlélógún 23 lẹ́kọ̀ọ́ .
Ðò 2015 ɔ ,huzuhuzu e wá tutoblonunu ɔ mɛ é zɔ́n bɔ è byɔ Daniel kpo Miriam kpo ɖɔ ye ni huzu gbexosin - alijitɔ́ hwebǐnu tɔn .	Lọ́dún 2015 ,ètò Ọlọ́run ṣe àwọn àtúntò kan ,wọ́n sì ní kí tọkọtaya náà máa ṣe aṣáájú - ọ̀nà déédéé dípò àkànṣe .
Etɛ ye ka bló	Kí ni wọ́n wá ṣe
Ye ɖeji dó akpá e ɖò Ðɛhan 375 mɛ é Sɔ́ gbɛ̀ towe jó nú Mawu Mavɔmavɔ ,ganjɛ wǔ tɔn ,é na wà azɔ̌ tɔn .	Wọ́n gbà pé ìlérí Jèhófà tó wà nínú Sáàmù 375 máa ṣẹ sáwọn lára ,pé Yí ọ̀nà rẹ lọ sọ́dọ̀ Jèhófà ,kí o sì gbójú lé e ,òun yóò sì gbé ìgbésẹ̀ .
È jihan lɛ ɖò bǐbɛ̌mɛ tuto ɔ tɔn ,enɛ gudo ɔ ,Joseph F .	Lẹ́yìn tí wọ́n ti kọ ọ̀pọ̀ orin níbẹ̀rẹ̀ àpéjọ náà ,Arákùnrin Joseph F .
Xóɖɔtɔ́ ɔ byɔ ye kpo ayi bǐ kpo ɖɔ ye ni wá junjɔn ayǐ bo ɖótó .	Olùbánisọ̀rọ̀ rọ àwọn èèyàn náà pé kí wọ́n wábi jókòó ,kí wọ́n sì tẹ́tí sílẹ̀ .
Nɔví Rutherford ɖɔ xó dó xota Axɔsuɖuto jixwé tɔn ɔ ko sɛkpɔ jí .	Àkòrí àsọyé Arákùnrin Rutherford ni Ìjọba ọ̀run kù sí dẹ̀dẹ̀ .
Ee xóɖiɖɔ tɔn ja fífó gbé é ɔ ,é kanbyɔ ɖɔ Mi ɖi nǔ ɖɔ Axɔsu susunɔ ɔ ko jɛ acɛ kpa jí à	Nígbà tó máa parí ọ̀rọ̀ rẹ̀ ,ó béèrè pé ,Ǹjẹ́ ẹ gbà gbọ́ pé Ọba ògo ti bẹ̀rẹ̀ sí í ṣàkóso
Midɛɛ lɛ wɛ nyí mɛ ɖěɖee na jla lɛ é .	Ẹ̀yin ni aṣojú tí ń polongo rẹ̀ .
Hwenɛnu ɔ ,è tún avɔ e è mlá ɖó aga é kpo ayɛ̌si kpo ,bɔ nukɛgbe elɔ ɖ’ Mi jla Axɔsu ɔ kpo Axɔsuɖuto tɔn kpo .	Ọ̀rọ̀ yẹn ló ń sọ lọ́wọ́ ,bó ṣe di pé aṣọ tí wọ́n ká jọ sókè téńté bẹ̀rẹ̀ sí í tú nìyẹn ,táwọn èèyàn sì rí ọ̀rọ̀ tí wọ́n kọ sára rẹ̀ ,pé Ẹ Fọn Rere Ọba Náà àti Ìjọba Rẹ̀ .
Ray Bopp flín ɖɔ Akpàkpà sɔ́ kpléɖókpɔ́watɔ́ lɛ .	Ray Bopp sọ pé Ńṣe ni àtẹ́wọ́ ń ró lọ́jọ́ náà .
Anna Gardner tinmɛ lee atín e è sɔ́ dó gbá xɔ ɔ na lɛ é húnhún ,ɖó asíkpɛ́ lɛ wu gbɔn é .	Anna Gardner sọ bí àtẹ́wọ́ táwọn ará pa ṣe mú káwọn igi ìrólé ibẹ̀ mì .
Fred Twarosh ɖɔ Kpléɖókpɔ́watɔ́ lɛ bǐ site zɛɛn .	Fred Twarosh sọ ohun tó ṣẹlẹ̀ lọ́jọ́ yẹn ,ó ní Ṣe ni gbogbo wa dìde dúró lẹ́ẹ̀kan náà .
Mɛ e wá kpléɖókpɔ́ enɛ jí lɛ é gègě ko nɔ jla wɛnɖagbe Axɔsuɖuto ɔ tɔn .	Bó tilẹ̀ jẹ́ pé ọ̀pọ̀ tó wà ní àpéjọ yẹn ló ti ń polongo ìhìn rere Ìjọba náà ṣáájú ìgbà yẹn ,àmọ́ ní báyìí ,ṣe ni wọ́n wá rí àkọ̀tun ìdí láti máa wàásù .
É ɖò wɛn ɖɔ kpléɖókpɔ́ ɖaxó enɛ e è bló ɖò Cedar Point ,Ohio ɖò 1922 é byɔ hwenuxó mɛ ,bo nyí nǔ manawɔn ɖé ɖò yɛhwexɔsuɖuto ɔ linu	Abájọ tí àpéjọ tá a ṣe lọ́dún 1922 ní Cedar Point ,Ohio ,fi jẹ́ mánigbàgbé nínú ìtàn àwa Ẹlẹ́rìí Jèhófà
Julia Wilcox wlan ɖɔ Un sixu tinmɛ lee akpàkpà nɔ sɔ́ mì gbɔn hweɖebǔnu e è ɖɔ Cedar Point 1922 xó ɖò wema mǐtɔn lɛ mɛ é ǎ kpowun bɔ xó fó .	Arábìnrin Julia Wilcox sọ pé Mi ò lè sọ bí inú mi ṣe máa ń dùn tó nígbàkigbà tí wọ́n bá mẹ́nu kan àpéjọ Cedar Point tọdún 1922 nínú ìwé wa .
Mǐ kàn tinmɛ wekwín enɛ lɛ tɔn byɔ ,amɔ̌ ,é cí ɖɔ mɛɖebǔ kún tuùn ó ɖɔhun ,alǒ nú ye na bo tlɛ tuùn ɔ ,ye na ɖɔ nú mǐ ǎ . Edith Brenisen .	A béèrè pé kí lọ̀rọ̀ náà dúró fún ,àmọ́ ó jọ pé kò sẹ́ni tó mọ̀ ọ́n ,bí wọ́n bá sì mọ̀ ọ́n ,wọn ò fẹ́ sọ fún wa . Edith Brenisen .
Arthur Claus kpo Nellie Claus kpo yawu wá bo na ba fí ɖagbe bo jinjɔn .	Arthur àti Nellie Claus tètè dé síbi àpéjọ náà kí wọ́n lè jókòó sọ́wọ́ iwájú .
Arthur ɖɔ Un ɖò xógbe lɛ ɖokpo ɖokpo ɖótó wɛ .	Arthur sọ pé ,Mo fara balẹ̀ tẹ́tí sí gbogbo ọ̀rọ̀ náà .
Hwenu e nɔví Rutherford ɖɔ Mi jla	Ìgbà tí Arákùnrin Rutherford bá sọ pé Ẹ fọn rere
A ka Flín À	ǸJẸ́ O RÁNTÍ
Jehovah Nɔ Dó Gbɔ nú Mǐ Ðò Mɛtɛnkpɔn Mǐtɔn lɛ Bǐ Mɛ	Jèhófà Ń Tù Wá Nínú Nínú Gbogbo Ìpọ́njú Wa
Sɔ́ Ayi Towe Ðó Dɔkun Gbigbɔ Tɔn lɛ Jí	Máa Fọkàn sí Àwọn Ìṣúra Tẹ̀mí
A ka Sixu Kpɔ́n Nǔ Zɛ Lee Mɛ lɛ Cí Ðò Wěxo É Wu À	Ọkàn Àwọn Èèyàn Ló Ṣe Pàtàkì ,Kì Í Ṣe Ìrísí Wọn
A ka Na Ðeɖɛ Hwɛgbe lɛ Lobo Xò Fífá Kàn À	Ṣé Wàá Yanjú Èdèkòyédè Kí Àlàáfíà Lè Jọba
Mawu Ni Dó nú Ayi E A Ðó Te É	Ìbùkún Ni fún Ìlóyenínú Rẹ
Sɔ́ Ayi Towe Ðó Xó Ðaxó E Ðò Atɛ Jí É Jí	Pọkàn Pọ̀ Sórí Ọ̀rọ̀ Tó Ṣe Pàtàkì Jù
Nɔ Gudo nú Nǔbǐwukpétɔ́ E Jehovah Nyí É	Fara Mọ́ Ìṣàkóso Jèhófà
A ka Tuùn À	ǸJẸ́ O MỌ̀
Mawu e nɔ dó gbɔ nú mɛ ɖò ali bǐ nu é .nɔ dó gbɔ nú mǐ ,ɖò wuvɛ̌ e mǐ nɔ mɔ lɛ bǐ mɛ . 2 KƆ .	Ọlọ́run ìtùnú gbogbo .ń tù wá nínú nínú gbogbo ìpọ́njú wa . 2 KỌ́R .
Mǐ sixu kanɖeji ɖɔ é nɔ ba nǔ e nyɔ́ hugǎn é nú mǐ ,lee é bló gbɔn nú mɛsɛntɔ́ tɔn hwexónu tɔn lɛ é . Xà Jelemíi .	Ó dá wa lójú pé ire wa ni Jèhófà ń fẹ́ bó ṣe fẹ́ ire fáwọn ìránṣẹ́ rẹ̀ nígbà àtijọ́ . Ka Jeremáyà 29​ .
Huzuhuzu gègě na ɖò dandan hwenu e è na jì vǐ ɔ é .	Wọ́n á tún ṣe ọ̀pọ̀ àyípadà lẹ́yìn tí wọ́n bá bímọ .
Ye nɔ ba vǐ kaka bo ka nɔ ba kpò .	Wọ́n lè máa wá ọmọ lójú méjèèjì ,síbẹ̀ kí wọ́n má rọ́mọ bí .
Tim .215 ,nwt Amɔ̌ enɛ xlɛ́ ɖɔ vǐjiji ,alǒ è ɖó vǐ lɛ na zɔ́n bɔ è na mɔ gbɛ̀ mavɔmavɔ ǎ .	Àmọ́ èyí ò túmọ̀ sí pé tí ẹnì kan bá bímọ ,ó máa rí ìyè àìnípẹ̀kun .
É nɔ dó gbɔ n’i tawun .	Ó máa tù ú nínú ,á sì fi í lọ́kàn balẹ̀ .
É ɖeji ɖɔ Jehovah na bló bɔ wɛnsinɔ e emi nyí é na fó gbè ɖokpo ,alǒ é na sú dò enɛ ɖò ali ɖevo nu .	Ó dá a lójú pé Jèhófà máa jẹ́ kóun rọ́mọ bí tàbí pé Jèhófà máa gbọ́ àdúrà òun lọ́nà míì .
Jaan 519 É ɖò mɔ̌ có ,é nyɔ́ tawun ɖɔ mǐ tuùn ɖɔ Jehovah nyí Mawu e nɔ dó gbɔ nú mɛ ɖò ali bǐ nu é .	Àmọ́ inú wa dùn pé Jèhófà jẹ́ Ọlọ́run ìtùnú gbogbo .
Ðò Jezu hwenu ɔ ,nyɔnu gbeyiɖɔ Ana sín asú kú ,hwenu e ye wlí alɔ b’ɛ bló xwè tɛnwe kpowun gudo é .	Lẹ́yìn tí wọ́n bí Jésù ,Bíbélì sọ̀rọ̀ nípa wòlíì obìnrin kan tó ń jẹ́ Ánà tó ti pàdánù ọkọ rẹ̀ lẹ́yìn ọdún méje péré tí wọ́n ṣègbéyàwó .
Etɛ Ana ka kpò ɖò wiwa wɛ hwenu e é ɖó xwè 84 é	Àmọ́ kí ni Ánà ń ṣe títí tó fi pé ẹni ọdún mẹ́rìnlélọ́gọ́rin 84
Luki 237 ɖɔ É nɔ cí sinsɛnxɔ mɛ ,bɔ zǎn kpodo kéze kpo ɔ ,é nɔ ɖò Mawu sɛ̀n wɛ ,ɖò nublabla kpo ɖɛxixo kpo mɛ .	Lúùkù 237 sọ pé‘ Kì í pa wíwà ní tẹ́ńpìlì jẹ ,ó sì ń ṣe iṣẹ́ ìsìn ọlọ́wọ̀ lóru àti lọ́sàn - án pẹ̀lú ààwẹ̀ àti ìrawọ́ ẹ̀bẹ̀ .
Ana mɔ gbɔdónúmɛ kpo awǎjijɛ kpo ɖò Jehovah sinsɛn mɛ .	Ó ṣe kedere pé Ánà ń láyọ̀ bó ṣe ń fòótọ́ inú sin Jèhófà ,ọkàn rẹ̀ sì balẹ̀ .
Nǔ e nya wɛ ye ɖè é wɛ nyí ɖɔ ye na sɔ́ Mawu sù gbɔn jlǒ tɔn wiwa gblamɛ .	Bí wọ́n á ṣe bọlá fún Jèhófà tí wọ́n á sì ṣèfẹ́ rẹ̀ ló jẹ wọ́n lọ́kàn .
É wá cí vǐnɔ ɖé ɖɔhun nú mɛ ɖěɖee ɖò agun Tɛsaloniki tɔn mɛ lɛ é bo lɛ́ cí tɔ́ gbigbɔ tɔn ɖé ɖɔhun nú ye . Xà 1 Tɛsalonikinu lɛ ,12 .	Ó fi ara rẹ̀ wé abiyamọ torí pé ó máa ń ṣìkẹ́ àwọn ará ìjọ Tẹsalóníkà ,ó sì tún dà bíi bàbá fún wọn . Ka 1 Tẹsalóníkà 2​ ,12 .
Mɛ yɔyɔ̌ lɛ sixu wá byɔ wɛnjlatɔ́ e ko zin lɛ é ɖɔ ye ni d’alɔ emi bonu emi na kplɔ́n nugbǒ ɔ vǐ emitɔn lɛ ,ye tlɛ sixu lɛ́ byɔ ɖɔ ye ni kplɔ́n Biblu xá mɛ winnyawinnya emitɔn lɛ .	Nígbà míì ,àwọn tí wọ́n ṣẹ̀ṣẹ̀ kẹ́kọ̀ọ́ òtítọ́ máa ń sọ fáwọn tó dàgbà dénú nínú ìjọ pé kí wọ́n bá ọmọ àwọn kẹ́kọ̀ọ́ .
É nɔ wá jɛ bɔ è nɔ byɔ Kúnnuɖetɔ́ ɖé ɖɔ é ni kplɔ́n nǔ xá vǐ ɖěɖee nugbǒ ɔ ma jló mɛjitɔ́ yetɔn lɛ ǎ é .	Àwọn ìgbà míì wà tí wọ́n lè sọ fún Ẹlẹ́rìí kan pé kó máa kọ́ ọmọ táwọn òbí rẹ̀ kò sí nínú ètò lẹ́kọ̀ọ́ .
Kúnnuɖetɔ́ ɔ ɖó na hɛn dó ayi mɛ ɖɔ emi ɖò alɔ dó vǐ lɛ wɛ ɖò gbigbɔ lixo nugbǒ ,amɔ̌ ,emi kún huzu vǐ lɛ sín mɛjitɔ́ ó .	Síbẹ̀ ó yẹ kí Ẹlẹ́rìí náà fi sọ́kàn pé òun fẹ́ kọ́ ọmọ náà lẹ́kọ̀ọ́ ni ,kì í ṣe pé òun fẹ́ di òbí ọmọ náà .
É ɖó na ɖó nukún ɖɔ é sixu wá jɛ hweɖenu ,bɔ mɛjitɔ́ lɛ na wà azɔ̌ e Mawu sɔ́ d’alɔ mɛ nú ye é ,bo na kpé nukún dó vǐ yetɔn lɛ wu ɖò gbigbɔ lixo .	Bọ́jọ́ ṣe ń gorí ọjọ́ ,àwọn òbí náà lè kẹ́kọ̀ọ́ òtítọ́ ,kí wọ́n sì bójú tó ojúṣe tí Ọlọ́run fún wọn láti kọ́ àwọn ọmọ wọn lẹ́kọ̀ọ́ òtítọ́ .
Mɛ winnyawinnya ɖěɖee kplɔ́n bo yí wǎn nú Mawu nugbǒ ɔ ,bo nɔ xwedó wěɖexámɛ tɔn é sixu huzu jɔtɛn gbɔdónúmɛ tɔn ɖé ɖò xwédo ɖé mɛ .	Táwọn ọmọ bá kẹ́kọ̀ọ́ òtítọ́ tí wọ́n sì ń tẹ̀ lé ìlànà Ọlọ́run ,wọ́n lè di orísun ìtùnú fáwọn tó wà nínú ìdílé wọn .
Ye sixu bló mɔ̌ gbɔn sísí ɖiɖó nú mɛjitɔ́ yetɔn lɛ kpo alɔdido ye ɖò nǔ agbaza tɔn lɛ mɛ kpo gblamɛ .	Wọ́n lè ṣe bẹ́ẹ̀ tí wọ́n bá ń bọ̀wọ̀ fáwọn òbí wọn ,tí wọ́n sì ń ṣèrànwọ́ fún wọn .
Xà Ðɛhan .	Ka Sáàmù 145​ .
Ee mǐ na ɖò mɔ̌ wà wɛ é ɔ ,lin tamɛ kpɔ́n dó lee hwiɖesunɔ mɛtún ɔ sixu bló ,bɔ wanyiyi e a ɖó nú dɔkun gbigbɔ tɔn enɛ lɛ é na gɔ́ngɔ́n d’eji gbɔn é jí .	Bá a ṣe ń ṣe bẹ́ẹ̀ ,máa ronú lórí ohun tó o lè ṣe táá jẹ́ kó o túbọ̀ nífẹ̀ẹ́ àwọn ìṣúra tẹ̀mí yìí .
Xà Matie .	Ka Mátíù 13​ .
Xà Maki .	Ka Máàkù 10​ .
Un na na dɔkun ce sín vlɔɖówe wamamɔnɔ lɛ ,bonu un ka hízí mɛɖé ɔ ,un na sú mɔhunkɔtɔn donu ɛnɛ mɛ ɔ .	Olúwa ,ìdajì nǹkan ìní mi ni èmi yóò fi fún àwọn òtòṣì ,ohun yòówù tí mo sì lọ́ ẹnikẹ́ni lọ́wọ́ gbà nípasẹ̀ ẹ̀sùn èké ni èmi yóò dá padà ní ìlọ́po mẹ́rin .
Amɔ̌ ,ee Rose ɖò Biblu kplɔ́n wɛ é ɔ ,é mɔ nǔ jɛ lee nugbǒ e kúnkplá Axɔsuɖuto Mawu tɔn é xɔ akwɛ sɔ́ é wu .	Àmọ́ bó ṣe n bá ìkẹ́kọ̀ọ́ rẹ̀ lọ ,ó wá mọ bí òtítọ́ nípa Ìjọba Ọlọ́run ti ṣe pàtàkì tó .
Rose bló baptɛm ɖò 2009 ,bɔ ɖò xwè e bɔ d’ewu é mɛ ɔ ,é bɛ́ gbexosin - alijitɔ́ hwebǐnu tɔn sín azɔ̌ .	Nígbà tó dọdún 2009 ,ó ṣèrìbọmi ,ó sì di aṣáájú - ọ̀nà déédéé lọ́dún tó tẹ̀ lé e .
É ɖò wɛn ɖɔ gègě mǐtɔn bló huzuhuzu ɖé lɛ cobo huzu toví Axɔsuɖuto Mawu tɔn tɔn .	Òótọ́ ni pé ọ̀pọ̀ wa ti ṣe àwọn àyípadà kan ká lè di ọmọ abẹ́ Ìjọba Ọlọ́run .
b Nɛ̌ Pɔlu ka xlɛ́ ɖɔ sinsɛnzɔ́ ɔ xɔ akwɛ nú emi gbɔn	b Kí ni Pọ́ọ̀lù ṣe tó fi hàn pé ó nífẹ̀ẹ́ iṣẹ́ ìwàásù
Nugbǒ ɔ ,wanyiyi e Pɔlu ɖó nú sinsɛnzɔ́ ɔ é sísɛ́ ɛ ,bɔ é w’azɔ̌ syɛnsyɛn bo kplɔ́n nǔ mɛ ɖevo lɛ bɔ ye huzu ahwanvu .	Torí pé Pọ́ọ̀lù nífẹ̀ẹ́ iṣẹ́ ìwàásù ,ó ṣe gbogbo ohun tó lè ṣe láti sọ àwọn èèyàn di ọmọ ẹ̀yìn .
Xà Hlɔmanu lɛ 2 Timɔtée 42 .	Ka Róòmù 1​ 2 Tímótì 42 .
Nɛ̌ mǐ ka sixu ɖó wanyiyi mɔhun nú sinsɛnzɔ́ ɔ gbɔn	Báwo làwa náà ṣe lè fi hàn pé a nífẹ̀ẹ́ iṣẹ́ ìwàásù bíi ti Pọ́ọ̀lù
Ali tɛ lɛ nu mɔ̌ mǐ ka sixu xlɛ́ ɖɔ sinsɛnzɔ́ ɔ sù nukún mǐtɔn mɛ ɖè	Àwọn ọ̀nà wo la lè gbà fi hàn pé a nífẹ̀ẹ́ iṣẹ́ ìwàásù
Mǐ sixu lɛ́ kplɔ́n gbè ɖevo ,sɛ̀ tɛn yì fí ɖevo ɖò tò mǐtɔn mɛ alǒ sɛ̀ tɛn yì tò ɖevo mɛ . Mɛ .	Bí àpẹẹrẹ ,a lè gba aṣáájú - ọ̀nà olùrànlọ́wọ́ tàbí ká tiẹ̀ bẹ̀rẹ̀ iṣẹ́ aṣáájú - ọ̀nà déédéé .
Hwenu e é jɛ mɔ̌ wà jí ɖò 1993 é ɔ ,wɛnjlatɔ́ 20 mɔ̌ jɛn ɖò kánɖó e nɔ dó Russie - gbè ɖò New York City é mɛ .	Nígbà tó bẹ̀rẹ̀ sí í wàásù fún wọn lọ́dún 1993 ,nǹkan bí akéde ogún 20 péré ló wà nínú àwùjọ tó ń sọ èdè Rọ́ṣíà nílùú New York City .
Xwè 20 mɔ̌ gudo ɔ ,Irene ko wà azɔ̌ syɛnsyɛn ɖò fí e è nɔ dó gbè enɛ ɖè é .	Nǹkan bí ogún 20 ọdún ni Irene fi ṣiṣẹ́ kára láti wàásù fáwọn tó ń sọ èdè yẹn .
Égbé ɔ ,agun e nɔ dó Russie - gbè ɔ ayizɛ́n wɛ ɖò New York City .	Ní báyìí ,ìjọ mẹ́fà ọ̀tọ̀ọ̀tọ̀ tó ń sọ èdè Rọ́ṣíà ló wà nílùú New York City .
Mɛ e Irene kplɔ́n nǔ xá é 15 ko bló baptɛm .	Mẹ́ẹ̀ẹ́dógún 15 nínú àwọn tí Irene kọ́ lẹ́kọ̀ọ́ ló ti ṣèrìbọmi .
A ka nɔ kpɔ́n sinsɛnzɔ́ towe dó mɔ dɔkun ɖé ,bo nɔ ɖè enɛ xlɛ́ ɖò tito aklunɔzán gblamɛ tɔn towe lɛ mɛ à	Ṣé o mọyì iṣẹ́ ìwàásù ,ṣé o sì máa ń wáyè láti lọ́wọ́ nínú rẹ̀ lọ́sọ̀ọ̀sẹ̀
Amɔ̌ Pɔlu ɖɔhun ɔ ,ye gbí dɔn bo kpó ɖò wɛnɖagbe ɔ jla wɛ .	Àmọ́ bíi ti Pọ́ọ̀lù ,wọ́n dúró gbọin láìyẹsẹ̀ ,wọ́n sì ń bá iṣẹ́ ìwàásù lọ .
Ðò 1943 ɔ ,Nɔví Nathan H .	Lọ́dún 1943 ,Arákùnrin Nathan H .
Amɔ̌ ,etɛ mǐ ka na kplɔ́n mɛ ɖevo lɛ	Àmọ́ ,kí la máa kọ́ àwọn èèyàn
Dɔkunsɛxwetɛn ’ tɛ xó Jezu ka ɖɔ ɖò Matie 1352 mɛ Nɛ̌ mǐ ka na bló b’ɛ na gɔ́ gbɔn	Kí ni ibi ìtọ́jú ìṣúra tí Jésù sọ nínú Mátíù 13​ 52 ,báwo la sì ṣe máa kó nǹkan sínú rẹ̀
Xà Matie 1352 .	Ka Mátíù 1352 .
Xà Nùnywɛxó .	Ka Òwe 2​ .
Nɛ̌ mǐ ka nɔ wà mɔ̌ gbɔn	Àmọ́ ,báwo la ṣe máa ṣe bẹ́ẹ̀
Ðò xixokplé wɛ ,ba ɖevo lɛ gɔ́ na .	Túbọ̀ máa kó o jọ ,kó o sì máa wá púpọ̀ sí i .
Etɛwu mǐ ka sixu ɖɔ ɖɔ nugbǒ ɖé lɛ nyí nugbǒ xóxó	Kí nìdí tá a fi lè pe àwọn òtítọ́ kan ní ògbólógbòó ,èwo ló sì wọ̀ ẹ́ lọ́kàn jù nínú wọn
Mǐ kplɔ́n ɖɔ Jehovah nyí Gbɛɖotɔ́ kpo Gbɛnamɛtɔ́ mǐtɔn kpo ,bo lɛ́ kplɔ́n ɖɔ é ɖó linlin ɖé nú gbɛtɔ́ lɛ .	A tún kẹ́kọ̀ọ́ pé Ọlọ́run tipasẹ̀ Ọmọ rẹ̀ pèsè ìràpadà fún wa ká lè bọ́ lọ́wọ́ ẹ̀ṣẹ̀ àti ikú .
Jaan Nɛ̌ enɛ ka sixu d’alɔ mǐ hwenu e mǐ ɖò wɛnɖagbe ɔ jla wɛ ɖò agbawungba é gbɔn	Báwo nìyẹn ṣe máa ṣèrànwọ́ fún àwa tá à ń kọ́ àwọn èèyàn lẹ́kọ̀ọ́ òtítọ́
Mǐ ni kpɔ́n kpɔ́ndéwú nɔví sunnu e nɔ nyí Peter é tɔn .	Ẹ jẹ́ ká wo àpẹẹrẹ arákùnrin kan tó ń jẹ́ Peter .
Ðò 1970 ɔ ,é ɖó xwè 19 ,bo bɛ́ azɔ̌wiwa ɖò Betɛli Grande - Bretagne tɔn .	Ọmọ ọdún mọ́kàndínlógún 19 ni lọ́dún 1970 ,kò sì pẹ́ tó bẹ̀rẹ̀ sí í ṣiṣẹ́ sìn ní Bẹ́tẹ́lì tó wà nílẹ̀ Gẹ̀ẹ́sì .
Peter ɖɔ È wlan akpáxwé tɔn ɖé dó Alamugbe mɛ .	Peter sọ pé Èdè Árámáíkì ni wọ́n fi kọ apá kan nínú rẹ̀ .
É sù gbè ɖokpo bɔ mǐ ɖò xó sú dó ta nú mǐɖée wɛ ,bɔ mɛ wè wá jɛ dó tɛn tɔn mɛ . CHRIS .	Lọ́jọ́ kan ,ṣe la bẹ̀rẹ̀ sí í pariwo mọ́ ara wa ,bí àwọn méjì kan ṣe wọlé nìyẹn . CHRIS .
Un ka tuùn nǔ e wu wɛ é ǎ . JANET .	Mi ò sì mọ ohun tó fà á . JANET .
Ðò agun mǐtɔn mɛ ɔ ,gbexosin - alijitɔ́ wè jɛ tagba jɛ jí .	Nínú ìjọ wa ,aáwọ̀ kan ṣẹlẹ̀ láàárín àwọn aṣáájú - ọ̀nà méjì .
Mɛ ɖokpo jɛ xó sú dó ta nú mɛ wegɔ ɔ jí .	Ni ọ̀kan bá bẹ̀rẹ̀ sí í sọ̀rọ̀ sí èkejì .
Jozɛfu ɖè wě enɛ ɔ xá nɔví sunnu tɔn ɖěɖee lɛkɔ xwè tɔ́ yetɔn gɔ́n lɛ é .	Jósẹ́fù ló fún àwọn arákùnrin rẹ̀ nímọ̀ràn yìí nígbà tí wọ́n ń pa dà sọ́dọ̀ bàbá wọn .
Nùnywɛxó tawun wɛ nyí xó tɔn	Ẹ ò rí i pé ìmọ̀ràn yẹn mọ́gbọ́n dání
Tlolo hwɛ̌ ɔ ,xóɖɔɖókpɔ́ ɔ syɛn kpɛɖé ,amɔ̌ ,nǔ lɛ wá kpɔ́n te hwenu e ye ɖɔ xó ɖó kpɔ́ dó tagba yetɔn jí kpo gbè fífá kpo é .	Ọ̀rọ̀ yẹn ò kọ́kọ́ rọrùn ,àmọ́ bí wọ́n ṣe jọ ń fi pẹ̀lẹ́tù bára wọn sọ̀rọ̀ lọ̀rọ̀ náà ń níyanjú .
Michael ɖɔ Nɔví sunnu ce sɔ́ hwɛ kɛ mì bǐ mlɛ́mlɛ́ .	Michael sọ pé Ó dárí jì mí ,ọ̀rọ̀ náà sì tán nínú rẹ̀ .
Alixlɛ́mɛ Biblu tɔn e ɖò Kolosinu lɛ mɛ é zinzan sixu nyí nǔ nukɔntɔn e sixu d’alɔ mǐ hwenu e mɛɖé wà nǔ nyì dò nú mǐ é .	Tẹ́nì kan bá ṣẹ̀ ọ́ ,á dáa kó o fi ìmọ̀ràn tó wà nínú Kólósè 3​ sílò .
Mɛ gègě mɔ ɖɔ mɛɖesɔhwe sixu d’alɔ ye ,bɔ ye na sɔ́ hwɛ kɛ mɛ ,bo wɔn nǔ e jɛ é .	Èyí gba kéèyàn lẹ́mìí ìrẹ̀lẹ̀ ,ọ̀pọ̀ sì ti rí i pé ẹ̀mí ìrẹ̀lẹ̀ máa ń mú kó rọrùn fáwọn láti dárí ji ẹni náà kọ́rọ̀ náà sì tán nínú wọn .
Nú è ka dó gǎn ɖé lɛ ,bɔ enɛ ɔ gudo ɔ ,é wá cí ɖɔ è lɛ́ ɖó hudo nǔ ɖevo lɛ tɔn ɔ ,è ka sixu zán nugbodòdó e ɖò Matie 1815 mɛ é à	Àmọ́ o ,tó o bá rí i pé ọ̀rọ̀ náà ò tán nínú rẹ ,ṣé o lè fi ìlànà tó wà nínú Mátíù 1815 sílò
Nugbǒ wɛ ɖɔ afɔ e è na ɖè hwenu e mɛɖé hu hwɛ syɛnsyɛn ɖé dó mɛ ɖevo é wɛ wěɖexámɛ Jezu tɔn elɔ dó gesí .	Bó tilẹ̀ jẹ́ pé ẹ̀ṣẹ̀ tó wúwo tẹ́nì kan ṣẹ ẹnì kejì rẹ̀ ni Jésù ń sọ nínú ẹsẹ yẹn ,síbẹ̀ á dáa kó o fi ìlànà inú rẹ̀ sílò .
Evodíi kpo Sɛntici kpo sixu ko nɔ ɖó linlin vovo ,alǒ ɖó jijɔ vovo lɛ .	Tó o bá ṣe bẹ́ẹ̀ ,ìyẹn ò ní kẹ́ ẹ di ọ̀rẹ́ kòríkòsùn ,àmọ́ ẹ̀ẹ́ mọyì ara yín ,ọkàn rẹ máa balẹ̀ ,àlàáfíà sì máa wà nínú ìjọ .
Mǐ sɔ́ lɛ́ wá jɛ tagba ɖevo ǎ .	Lẹ́yìn náà ,a dì mọ́ra wa ,a sì parí ọ̀rọ̀ náà .
Pɔlu kpo Baanabasi kpo gbɔn vo nú yeɖée có ,ye kpé nǔ wu bo wà azɔ̌ ɖó kpɔ́ cobɔ nǔ dindɔn ɔ wá fɔ́n .	Bó tilẹ̀ jẹ́ pé ìwà Pọ́ọ̀lù àti Bánábà yàtọ̀ síra ,síbẹ̀ wọ́n jọ ṣiṣẹ́ pọ̀ ṣáájú ìṣẹ̀lẹ̀ yẹn .
Watch Tower Bible and Tract Society of Pennsylvania	Watch Tower Bible and Tract Society of Pennsylvania
MƐ NABI E WÁ FLǏN É 2016	ÀWỌN TÓ WÁ SÍBI ÌRÁNTÍ IKÚ KRISTI 2016
Nabalu kpo xwédo tɔn kpo na sún sìn nǔ enɛ e é wà é tɔn . 1 Sam .	Kódà ,àti Nábálì àtàwọn aráalé ẹ̀ ló máa jẹ nínú ìyà náà . 1 Sám .
Davidi ɖɔ nú Abigayilu ɖɔ emi dokú nú Mawu ,ɖó ayi e éyɛ Abigayilu ɔ ɖó te ,bo hɛn emi ɖó te ,bɔ emi ma kɔn hun kɔn nyì ayǐ ǎ é wu . 1 Sam .	Ó sọ fún Ábígẹ́lì pé‘ Ìbùkún ni fún ìlóyenínú rẹ ,ìbùkún sì ni fún ìwọ tí o ti dá mi dúró lónìí yìí kí n má bàa wọnú ẹ̀bi ẹ̀jẹ̀ .’ ​ — 1 Sám .
Nugbǒ ɔ ,lee nǔ cí nú ɖɛhanwlantɔ́ e ɖɔ xó elɔ nú Mawu é sixu cí mɔ̌ nú mǐ lɔ Kplɔ́n ayi ɖò te kpo nùtuùntuùn kpo mì . Ðɛh .11966 ,nwt .	Àwa náà lè ṣe bíi ti onísáàmù tó bẹ Ọlọ́run pé Kọ́ mi ní ìwà rere ,ìlóyenínú àti ìmọ̀ pàápàá . Sm .11966 .
