input	target
Exode chapitres ,- 34 Nombres chapitres ,Deutéronome chapitre 34	Tíntɔ́n wemata ,- 34 Kɛ́nsísɔ́ wemata ,Sɛ́nflínmɛ wemata 34
Actes chapitres ,	Mɛsɛ́dó wemata ,
Matthieu chapitres ,- Actes chapitres ,	Matie wemata ,- Mɛsɛ́dó wemata ,
Rappelez - ​ vous alors le bel exemple d’un fonctionnaire éthiopien qui a vécu il y a 2 000 ans .	Enyi nǔ nyí mɔ̌ hǔn ,flín kpɔ́ndéwú ɖagbe axɔsuzɔwatɔ́ Etiopíinu e nɔ gbɛ̀ ɖò xwè 2 000 mɔ̌ ɖíe wá yì é ɖé tɔn .
Par Yvonne Quarrie	Nyikɔ ce Yvonne Quarrie
À 11 ans ,j’ai essayé l’alcool .	Hwenu e un ɖó xwè 11 é ɔ ,un jɛ ahan syɛnsyɛn nu jí .
Je suis très vite tombée enceinte et ,à 16 ans ,j’ai donné naissance à notre fils .	É lín cobɔ un mɔ xò ǎ ,bɔ un jì vǐ sunnu mǐtɔn hwenu e un ɖò xwè 16 ɖó wɛ é .
Nous nous sommes mariés en 1982 .	Mǐ wlí alɔ ɖò 1982 .
Nous nous sommes fait baptiser ,Tony et moi ,en juillet 1982 .	Nyɛ kpo Tony kpo bló baptɛm bo huzu Kúnnuɖetɔ́ Jehovah Tɔn ɖò Juillet 1982 .
Nous avons sûrement du mal à imaginer cela ,mais cet homme est âgé de 365 ans — plus de quatre fois ce que l’on considère aujourd’hui comme une très longue vie	É sixu vɛwǔ bɔ mǐ na ɖi nǔ na ,amɔ̌ ,nya enɛ nɔ gbɛ̀ nú xwè 365 mɔ̌ ,xwè nabi e è nɔ dɔ́ji na ɖò égbé é donu ɛnɛ jɛji wɛ nyí enɛ
En ce temps - ​ là ,il y a plus de 50 siècles ,les gens vivaient beaucoup plus longtemps qu’aujourd’hui .	Ðò hwe enɛ nu ɖò xwè kanweko donu 50 jɛji ɖíe ɔ ,mɛ lɛ nɔ dɔ́ji tawun hú égbé .
Adam ,le premier homme ,avait déjà plus de 600 ans quand Hénok est né ,et il a encore vécu 300 ans	Adamu ,gbɛtɔ́ nukɔntɔn ɔ ,nɔ gbɛ̀ nú xwè 600 jɛji cobɔ è wá jì Henɔci ,b’ɛ ka lɛ́ bló xwè 300 ɖevo d’eji
Donc ,à 365 ans ,Hénok a peut - être encore l’air en pleine forme ,comme un homme qui a une grande partie de sa vie devant lui .	Enɛ wu ɔ ,Henɔci ɖó xwè 365 có ,é sixu lɛ́ ɖó hlɔnhlɔn ganji ,bo cí mɛ e kpò ɖò anyǔ mɛ é ɖɔhun .
Êtes - ​ vous chef de famille	A nɔ kpé nukún dó xwédo ɖé wu wɛ à
Nous apprenons ici que Hénok devient père de famille à environ 65 ans .	Enɛ wu ɔ ,hwenu e Henɔci ɖó xwè 65 mɔ̌ é ɔ ,é ko nyí xwétɔ́ ɖé .
Adam est mort quand Hénok avait 308 ans .	Adamu kú hwenu e Henɔci ɖó xwè 308 é .
Nous ne le savons pas .	Mǐ tuùn ǎ .
Y a - ​ t - ​ il des contradictions dans la Bible	Y a - t - il des contradictions dans la Bible
À retrouver sous LA BIBLE ET VOUS QUESTIONS BIBLIQUES .	Zǐn LA BIBLE ET VOUS QUESTIONS BIBLIQUES
Watch Tower Bible and Tract Society of Pennsylvania	Watch Tower Bible and Tract Society of Pennsylvania
Cette revue paraît depuis 1879 .	Sín 1879 wɛ è ko ɖò xójlawema elɔ ɖetɔ́n wɛ .
Un cadeau incomparable	Nùnina E Ma Kpé Wè Ǎ É Ðé
pourquoi est - ​ il si précieux	Nùnina Mawu Tɔn E Hugǎn Bǐ ÉEtɛwu É ka Xɔ Akwɛ Sɔmɔ̌
Comment réagirez - ​ vous au plus beau des cadeaux	Nɛ̌ A ka Na Yí Gbè nú Nùnina Ðaxó Hugǎn Bǐ E Mawu Na Mǐ É Gbɔn
LE CÉLIBAT EST - ​ IL EXIGÉ DES MINISTRES CHRÉTIENS	DANDAN WƐ SINSƐNZƆ́WATƆ́ KLISANWUN LƐ NA NƆ TLƐNMƐ À
SORTIR DE L’HIER ET AUJOURD’HUI	KANNUMƆÐÒ HWEXÓNU KPO ÉGBÉ KPO
GOÛTEZ À LA JOIE DE DONNER	ÐU VIVǏ LÈ E NÙNAMƐ NƆ HƐN WÁ LƐ É TƆN
L’année dernière ,quelque 20 millions de personnes à travers le monde ont assisté au Mémorial .	Ðò xwè e wá yì é mɛ ɔ ,gbɛtɔ́ livi 20 mɔ̌ wɛ wá Flǐn tɛnmɛ .
Il y a près de 4 000 ans ,un adolescent nommé Joseph a été vendu par ses frères .	É ko ɖibla yì xwè 4 000 mɔ̌ dìn bɔ dɔnkpɛvu e nɔ nyí Jozɛfu é ɔ ,nɔví tɔn lɛ sɔ́ ɛ sà .
Le roi d’Égypte Thoutmosis III aurait ramené 90 000 prisonniers d’une campagne militaire en Canaan .	È ɖɔ dó Axɔsu Ejipu tɔn Thoutmosis III wu ɖɔ ,ɖò ahwan e é fun ɖò Kanáa é gudo ɔ ,é bɛ́ ahwankannumɔ 90 000 wá yì xwé .
Selon un rapport de l’Unesco ,entre 25 et 30 millions d’hommes ,de femmes et d’enfants auraient ainsi été enlevés et vendus .	Gbeɖiɖó UNESCO tɔn ɖé ɖɔ ɖɔ sunnu ,nyɔnu ,kpo yɔkpɔvu kpo livi 25 jɛ 30 mɔ̌ wɛ è wlí gannugánnú bo sà .
Selon l’Organisation internationale du travail ,quelque 21 millions d’hommes ,de femmes et d’enfants sont encore esclaves ,forcés à travailler tout en étant peu ou pas rémunérés .	Sɔgbe kpo OIT Organisation internationale du travail kpo ɔ ,sunnu ,nyɔnu ,kpo yɔkpɔvu kpo livi 21 mɔ̌ wɛ kpó ɖò kannumɔ nyí wɛ ,bo sixu hɔn ǎ ,bɔ è nɔ sú akwɛ kpɛɖé ye alǒ è nɔ lɛ́ nɔ akwɛ ɖebǔ má sú ye lɔ .
Les traitements effroyables qu’ils ont subis dans les plantations de canne à sucre ont déclenché une guerre civile qui a duré 13 longues années et qui a abouti à la formation de l’État indépendant d’Haïti en 1804 .	Daka e xò kannumɔ lɛ wu wɛ è ɖè ɖò lekegbo lɛ mɛ é zɔ́n bɔ è fun tohwan ɖé nú xwè 13 ,bɔ gudo mɛ ɔ ,è wá ɖó tò Haïti tɔn e jɛ éɖesu sí é ayǐ ɖò 1804 .
Vous pouvez trouver l’extraordinaire histoire de Joseph ,dans la Bible ,aux chapitres 39 à 41 du livre de la Genèse .	A sixu mɔ tan Jozɛfu tɔn e jiwǔ tawun é ɖò wema Biblu tɔn e nyí Bǐbɛ̌mɛ é wemata 39 jɛ 41 mɛ .
En 2006 ,dans un discours à la curie romaine ,le pape Benoît XVI a associé le célibat obligatoire à une tradition qui remonte à une époque proche de celle des Apôtres .	Ðò xóɖiɖɔ e Pápà Benoît XVI xwlé Sinsɛngán Katolika Hlɔma tɔn tɔn lɛ ɖò 2006 é mɛ ɔ ,é ɖɔ ɖɔ tlɛnmɛninɔ dandan ɔ nyí aca ɖé bɔ è ko ɖò xwixwedó wɛ sín hwenu e mɛsɛ́dó lɛ kú gudo tlolo é ɖokpoo .
Le célibat ecclésiastique a été imposé lors des conciles de Latran ,tenus à Rome ,en 1123 et en 1139 ,et cela est resté la position officielle de l’Église catholique jusqu’à aujourd’hui .	Ðò Vaxɔ Latran tɔn e è bló ɖò Rome ɖò 1123 kpo 1139 kpo é hwenu ɔ ,è lɛ́ dó zǒgbe tlɛnmɛninɔ yɛhwenɔ lɛ tɔn jí ,bɔ gbeta enɛ jí wɛ Sinsɛn Katolika Hlɔma tɔn ɔ kpó ɖè kaka wá jɛ égbé .
En quel sens le sacrifice de Jésus est - ​ il une rançon pour beaucoup	En quel sens le sacrifice de Jésus est - il une rançon pour beaucoup
À retrouver sous LA BIBLE ET VOUS QUESTIONS BIBLIQUES .	Kpɔ́n LA BIBLE ET VOUS QUESTIONS BIBLIQUES glɔ
Watch Tower Bible and Tract Society of Pennsylvania	Watch Tower Bible and Tract Society of Pennsylvania
Cette revue paraît depuis 1879 .	Sín 1879 wɛ è ko ɖò xójlawema elɔ ɖetɔ́n wɛ .
Les cavaliers de l’Apocalypse et vous	Sɔ́xátɔ́ Ɛnɛ lɛ kpo Hwi Kpo
Les cavaliers de l’qui sont - ​ ils	Sɔ́xátɔ́ Ɛnɛ LɛMɛ̌ Mɛ̌ É ka nú Ye
UNE PREUVE DE PLUS	KÚNNUÐENÚ KPƐVÍ ÐEVO
LA BIBLE TRANSFORME DES VIES	BIBLU NƆ HUZU GBƐZÁN MƐTƆN
IMITEZ LEUR FOI SARA	ÐI NǓ YE ÐƆHUN SALA
QUE DIT LA BIBLE	ETƐ BIBLU KA ÐƆ
Mais pourquoi voyons - ​ nous les conditions mondiales s’aggraver — et non s’améliorer — depuis le couronnement de Jésus en 1914	Amɔ̌ ,etɛwu è ka sɔ́ Jezu axɔsu ɖò 1914 bɔ nǔ lɛ ma ka kpɔ́n te ǎ ,bɔ ninɔmɛ lɛ ka tlɛ́n asá
En 1914 ,et pour la première fois de l’Histoire ,une guerre mondiale a éclaté .	Ðò 1914 ɔ ,azɔn nukɔntɔn e è fun ahwan ɖé gbɔn gbɛ̀ ɔ bǐ mɛ ɖò hwenuxó mɛ é nɛ .
On estime que le nombre de morts causées par les guerres et les conflits armés depuis 1914 s’élève à plus de 100 millions	Gbeɖiɖó ɖé lɛ ɖɔ ɖɔ gbɛtɔ́ e ahwanfunfun hu gbɔn gbɛ̀ ɔ mɛ sín 1914 é hú livi 100
Depuis 1914 ,les faits montrent - ​ ils que le cavalier sur le cheval noir a commencé sa chevauchée	Sín 1914 ɔ ,mǐ ka ko mɔ kúnnuɖenú e xlɛ́ ɖɔ mɛ e ɖò sɔ́ wiwi ɔ kun wɛ é ɖò wezun nu à
Au cours du XXsiècle ,la famine a tué environ 70 millions de personnes .	Ðò xwè kanweko 20gɔ́ ɔ mɛ ɔ ,gbɛtɔ́ livi 70 mɔ̌ wɛ kú adɔ kú .
Selon une agence des Nations unies ,805 millions de personnes — soit environ un neuvième de la population mondiale — étaient en situation de sous - alimentation chronique en .	Gǎn ɖokpo ɖɔ ɖɔ gbɛtɔ́ livi 805 gbɛtɔ́ nabi e ɖò gbɛ̀ ɔ mɛ é ɖokpo ɖò tɛnnɛ jí wɛ ma mɔ nǔ ɖu ganji ǎ ɖò .
Peu après 1914 ,la grippe espagnole a fait des dizaines de millions de morts .	Ðò 1914 gudo tlolo ɔ ,azɔn e nɔ nyí grippe espagnole é hu gbɛtɔ́ livi mɔkpan .
N’oubliez pas que Jésus est sorti en vainqueur en 1914 ,confinant Satan au voisinage de la terre ,mais qu’il n’a pas mené à terme sa victoire à ce moment - ​ là .	Flín nǔ elɔJezu ɖido mɛ ko ɖu ɖ’eji ɖɔhun ɖò 1914 ,bo ko glɔ́n Satáan ɖó ayikúngban jí ,amɔ̌ ,é ko ɖu ɖ’eji bǐ mlɛ́mlɛ́ ǎ .
Il a commencé à régner en 1914 et mènera bientôt à terme sa victoire ,mettant fin à toutes les souffrances .	É jɛ axɔsu ɖu jí ɖò 1914 bɔ zaanɖé dìn ɔ ,é na ɖu ɖ’eji bǐ mlɛ́mlɛ́ ,bo na ɖè wuvɛ̌ mimɔ bǐ síìn .
Les guerres mondiales et d’autres conflits ont emporté d’innombrables vies depuis 1914 .	Wɛkɛ hwan lɛ kpo ahwan kpɛví kpɛví lɛ kpo ko hu gbɛtɔ́ maxamaxa lɛ sín 1914 .
En 2014 ,De combien de personnages de la Bible hébraïque l’archéologie confirme - ​ t - ​ elle l’existence	Ðò 2014 ɔ ,xójlawema Biblical Archaeology Review sín xota ɖé kàn nǔ elɔ byɔ Mɛ ɖěɖee xó è ɖɔ ɖò Akpáxwé Biblu Tɔn E È Wlan Dó Ebléegbe Mɛ É nabi dobanunǔ dokunkun tɔn ka ɖekúnnu na
La ré D’au moins 50	Xósin e é na é ɖí É hwe bǐ ɔ ,gbɛtɔ́ 50
La tablette qui relie un membre de cette famille à Tattenaï correspond à un billet à ordre datant de la 20année de Darius I ,soit 502 avant notre ère .	Nùwlanwlan akpádídó tɔn ɖé wɛ ɖò zɛ̌nxwɛ ɔ jí bɔ è wlan ɖò 502 J.H.M .ɖò axɔsuɖuɖu Daliwusi I tɔn sín xwè 20gɔ́ ɔ mɛ .
En 535 avant notre ère ,Cyrus le Grand a réorganisé ses territoires en provinces .	Ðò 535 J.H.M .ɔ ,Silusi Daxó ɔ vɔ́ fí e é kp’acɛ gbɔn lɛ é tò bo má ye ,bɔ tokpɔn enɛ lɛ ɖokpo wɛ è ylɔ ɖɔ Babilɔnu kpo Tɔ̀ ɔ Gudo kpo .
Tattenaï a gouverné cette région d’environ 520 à 502 avant notre ère .	Tatunayi kp’acɛ dó tokpɔn enɛ jí ɖò 520 jɛ 502 J.H.M .mɔ̌ .
Par Samuel Hamilton	Mɛ e tɔn wɛ éSamuel Hamilton
J’ai fait partie de cette équipe de 1949 à 1952 ,et j’ai joué une série de matchs à Cuba ,au Mexique et au Nicaragua .	Un nɔ gbɛ̌ta tò ɔ tɔn mɛ sín 1949 kaka jɛ 1952 ,bo xò balɔ́ɔn agbahwlɛnhwlɛn tɔn ɖebɔdoɖewu lɛ ɖò Cuba ,Mexique kpo Nicaragua kpo .
J’étais un gardien de base plutôt douéj’ai même joué 17 matchs de suite sans faire une seule erreur .	Baseball xotɔ́ titewungbe ɖé wɛ nú mì ,bɔ un tlɛ nɔ xò akpáxwé agbahwlɛnhwlɛn tɔn ɖebɔdoɖewu 17 ma xò ɖokpo vɔ́vɔ́ nyì dò .
Mais à l’âge de 29 ans ,je me suis grièvement blessé en essayant d’attraper une balle pendant un match .	Amɔ̌ ,ee un ɖó xwè 29 é ɔ ,un gblewu ɖaxó ɖé hwenu e un ɖò tintɛnkpɔn wɛ bá wlí balɔ́ɔn ɖò balɔ́ɔn xixo ɖé hwenu é .
En 1957 ,j’ai accepté d’assister à un grand rassemblement que les Témoins de Jéhovah tenaient dans un stade où j’avais joué au baseball .	Ðò 1957 ɔ ,un yí gbè bo yì kpléɖókpɔ́ ɖaxó Kúnnuɖetɔ́ Jehovah tɔn lɛ tɔn ɖé .
Quand j’ai lu dans Marc 1021 cette invitation de Jé Viens ,suis - ​ moi ,j’ai voulu devenir Témoin .	Enɛ wu ɔ ,hwenu e un xà Maki 1021 bo mɔ xó Jezu tɔn e ɖɔ ,Wǎ ,bo xwedó mì é ɔ ,un jló na huzu Kúnnuɖetɔ́ ɖé .
J’ai donc décidé d’arrêter les jeux d’argent .	Ezayíi 6511 Kolosinu lɛ 35 Enɛ wu ɔ ,un wá gbeta ɔ kɔn bá jó akɔnyinyi dó .
Aujourd’hui ,je suis heureux de dire que depuis mon baptême ,en 1958 ,je suis resté fidèle à mon nouveau mode de vie .	Égbé ɔ ,xomɛ hun mì ɖɔ sín hwenu e un huzu Kúnnuɖetɔ́ ɖé ɖò 1958 é ɔ ,un tɛ́ dó huzuhuzu ɖěɖee un bló ɖò gbɛzán ce mɛ lɛ é wu kpo gbejininɔ kpo .
La caravane longe l’Euphrate pour se rendre d’abord à Harân ,située à quelque 960 kilomètres au nord - ouest .	Ye mlɛ́ Eflati Tɔ̀ ɔ bo tó yì jɛ agban ɖó Haláani hwɛ̌ é ɖò kilomɛtlu 960 mɔ̌ ɖò totaligbé - gbadahweji .
La famille reste là jusqu’à sa mort ,à l’âge de 205 ans .	Xwédo ɔ nɔ finɛ kaka jɛ hwenu e é ɖó xwè 205 bo kú é .
Mais quand ils partent de Harân ,Abraham a 75 ans ,et Sara 65 et ils n’ont pas d’enfant .	Bǐbɛ̌mɛ Amɔ̌ ,hwenu e ye gosin Haláani é ɔ ,Ablaxamu ko ɖó xwè 75 ,bɔ Sala ko ɖó xwè 65 ,ye ka ɖó vǐ ɖě ǎ .
Après avoir traversé l’Euphrate ,probablement le 14 Nisan 1943 avant notre ère ,Abraham et sa famille se dirigent vers le sud ,puis entrent dans le pays que Jéhovah leur a promis .	Ee ye d’asá Eflati Tɔ̀ ɔ ɖò 14 Nisáan ,1943 J.H.M .mɔ̌ gudo é ɔ ,ye tunta tofɔligbé fí e Jehovah d’akpá tɔn nú ye é .
Le livre de la Révélation ,quelle est sa signification	Le livre de la Révéquelle est sa signification
À retrouver sous LA BIBLE ET VOUS QUESTIONS BIBLIQUES .	Kpɔ́n LA BIBLE ET VOUS QUESTIONS BIBLIQUE glɔ
Watch Tower Bible and Tract Society of Pennsylvania	Watch Tower Bible and Tract Society of Pennsylvania
Cette revue paraît depuis 1879 .	Sín 1879 wɛ è ko ɖò xójlawema elɔ ɖetɔ́n wɛ .
Une question déroutante	Nùkanbyɔ Gɛ́dɛ́ Gɛ́dɛ́ Ðé
Ce que la Bible dit sur la vie et la mort	Nǔ E Biblu Ðɔ Dó Gbɛ̀ kpo Kú kpo Wu É
QUAND UN PROCHE EST EN FIN DE VIE	HWENU E MƐVÍVƐ́ ÐÉ ÐÒ KÚZƆN JƐ WƐ É
ELIAS HUTTER ET SES REMARQUABLES BIBLES EN HÉBREU	ELIAS HUTTER KPO BIBLU TƆN EBLÉEGBE TƆN NUKÚNÐEJI LƐ KPO
UNE GARANTIE PUISSANTE TIRÉE DE LA PLUS PETITE LETTRE DE L’HÉBREU	WEKWÍN EBLÉEGBE TƆN KPƐVÍ BǏ Ɔ NA GANJƐWU ÐAXÓ ÐÉ MƐ
RÊVE OU RÉALITÉ	PALAÐISI ÐÒ AYIKÚNGBAN JÍ — DLƆ̌ ALǑ NÙJƆNǓ
QUE DIT LA BIBLE	ETƐ BIBLU KA ÐƆ
Quand Alexandre le Grand a conquis le Moyen - Orient en 332 avant notre ère ,les philosophes grecs avaient déjà rendu populaire cet enseignement qui s’est ensuite rapidement répandu dans tout l’Empire grec .	Táan e mɛ Alexandre Ðaxó ɔ ɖu ɖò Gbadahweji Azíi tɔn jí ɖò 332 J.H.M .é ɔ ,tamɛnukplɔnmɛtɔ́ Grèce tɔn lɛ fúnfún nùkplɔnmɛ ɔ ,bɔ tlolo jɛn é gbakpé Axɔsuɖuto Grèce tɔn ɔ bǐ mɛ .
Notre Créateur n’avait pas prévu que les humains vivent seulement 70 ou 80 ans sur terre pour ensuite aller vivre éternellement dans un autre monde .	Gbɛɖotɔ́ mǐtɔn dó gbɛtɔ́ lɛ jí bonu ye na nɔ gbɛ̀ nú xwè 70 alǒ 80 kpowun ɖò ayikúngban jí ,lobo wá yì nɔ fí ɖevo kaka sɔyi ǎ .
Par exemple ,les chapitres 13 et 14 du livre du Lévitique montrent que les Israélites ont reçu des lois détaillées sur l’hygiène et la quarantaine ,bien avant les découvertes sur les germes et la contagion .	Ði kpɔ́ndéwú ɔ ,ɖò wema Levíi ví lɛ tɔn sín wemata 13 kpo 14 kpo mɛ ɔ ,è na sɛ́n Izlayɛli - ví lɛ dó wufifɛ kpo jɛmɛji kpo wu b’ɛ ko lín tawun cobɔ è wá mɔ nukúnnú jɛ azɔnkwín lɛ kpo lee ye nɔ d’azɔn mɛ gbɔn é kpo wu .
DOREEN a eu un choc quand on a diagnostiqué chez son mari ,Wesley ,qui n’avait alors que 54 ans ,une tumeur cérébrale extrêmement agressive .	HWENU e è mɔ nǔtitɛ taglomɛ tɔn syɛnsyɛn ɖé nú Doreen sín asú Wesley ,ee ɖó xwè 54 kpowun é ɔ ,Doreen flú bǐ .
Toutefois ,s’occuper d’un malade est loin d’être facile .	Amɔ̌ ,nukúnkpikpe dó azinzɔnnɔ wu vɛwǔ tawun .
La mort s’est donc progressivement déplacée de la maison à l’hôpital .	Mɔ̌ mɛ ɔ ,dotóoxwé wɛ mɛ lɛ nɔ kú ɖè hwɛhwɛ ,é sɔ́ nyí xwégbe ǎ .
The Metropolitan Hospice of Greater New York .	Fí e é gosin éThe Metropolitan Hospice of Greater New York
Elias Hutter est né en 1553 à Görlitz ,un petit village allemand qui se situe aujourd’hui près des frontières polonaise et tchèque .	È jì Elias Hutter ɖò 1553 ɖò Görlitz ,toxo kpɛví ɖé wɛ bo sɛkpɔ dogbó e Allemagne ɖó xá Pologne kpo République Tchèque kpo ɖò égbé é .
À tout juste 24 ans ,il a été nommé professeur d’hébreu à Leipzig .	Xwè 24 kpowun jɛn é ɖó bɔ è sɔ́ ɛ mɛ̌si kplɔnyiji - alavɔ tɔn ,bɔ é na kplɔ́n Ebléegbe mɛ ɖò Leipzig .
Page de titre de la Bible en hébreu de Hutter 1587 .	Biblu Ebléegbe tɔn e Hutter ɖetɔ́n ɖò 1587 é sín akpà
En 1587 ,Hutter a produit une édition en hébreu de ce qu’on appelle couramment l’Ancien Testament .	Ðò 1587 ɔ ,Hutter ɖè akpáxwé Biblu tɔn e è nɔ ylɔ ɖò kpaà mɛ ɖɔ Alɛnuwema Xóxó ɔ é tɔ́n dó Ebléegbe mɛ .
Cette édition s’intitulait Derekh ha - Kodesh ,un titre tiré d’Isaïe 358 ,qui signifie La Voie de la Sainteté .	Xota e ɖò wema enɛ jí é wɛ nyí Derekh ha - Kodesh bɔ è ɖè sín Ezayíi 358 mɛ bɔ tinmɛ tɔn nyí Ali Mímɛ́ ɔ .
En Ézékiel 184 ,il est précédé du préfixe ה ha ,qui signifie le ,la ou les ,formant ainsi le mot composé הנפשׁ hannèphèsh ,c’est - à - dire l’âme .	Ðò Ezekiyɛli 184 mɛ ɔ ,è gɔ́ wekwín ה ha na ɖò bǐbɛ̌mɛ bɔ tinmɛ tɔn nyí ɔ ,bɔ xókwin hukplé ɔ bló הנפשׁ hannèphèsh ,alǒ lindɔ̌n ɔ .
Sur les photos ,sont mises en évidence la police de caractères utilisée dans la Bible de Hutter en Ézékiel 184 ,et celle utilisée dans la note en bas de page du même verset dans la Bible avec notes et références .	Fɔtóo e ɖò aga lɛ é xlɛ́ wlɛnwín e è zán ɖò Biblu Ebléegbe tɔn Hutter tɔn mɛ ɖò Ezekiyɛli 184 mɛ é kpo ee Bible avec notes et références zán ɖò wemafɔ ɖokpo ɔ mɛ é kpo .
Hutter a aussi publié une édition de ce qu’on appelle couramment le Nouveau Testament ,édition contenant le texte rédigé en 12 langues .	Hutter lɛ́ zín wema e è nɔ ylɔ ɖò kpaà mɛ ɖɔ Alɛnuwema Yɔyɔ̌ ɔ é dó gbè 12 mɛ .
Cet ouvrage ,publié à Nuremberg en 1599 ,est souvent appelé la Polyglotte de Nuremberg .	È ɖè wema enɛ tɔ́n ɖò Nuremberg ɖò 1599 bɔ hwɛhwɛ ɔ ,è nɔ ylɔ ɖɔ Polyglotte de Nuremberg .
Par exemple ,son Nouveau Testament en hébreu a été révisé et réimprimé en 1661 par William Robertson ,puis de nouveau en 1798 par Richard Caddick .	Ði kpɔ́ndéwú ɔ ,William Robertson vɔ́ Alɔnuwema Yɔyɔ̌ Ebléegbe tɔn e é ɖetɔ́n é jlaɖó bo vɔ́ zín ɖò 1661 ,bɔ ɖò 1798 ɔ ,Richard Caddick lɔ wà nǔ ɖokpo ɔ .
Dibdin ,An Introduction to the Knowledge of Rare and Valuable Editions of the Greek and Latin Classics ,Harding Lepard ,1827 . Voir la deuxième note dans Ézékiel 184 et l’Appendice 3B .	Kpɔ́n tinmɛ wegɔ e ɖò dò ɖò Ezekiyɛli 184 mɛ é kpo Appendice 3B kpo ɖò Bible avec notes et références mɛ .
Praslin Seychelles ,où en 1881 ,le général Gordon a trouvé son jardin d’Éden .	Praslin ,ɖò Seychelles ,fí e ahwangán sunvinɔ Gordon mɔ jikpá Edɛni tɔn éyɛtɔn ɖè ɖò 1881 é
Par exemple ,quand il s’est rendu aux Seychelles en 1881 ,Charles Gordon ,un général de l’armée britannique ,a été si impressionné par la beauté luxuriante de la Vallée de Mai inscrite à présent au patrimoine mondial de l’humanité qu’il a déclaré avoir découvert le jardin d’Éden .	Ði kpɔ́ndéwú ɔ ,hwenu e ahwangán sunvinɔ Grande - Bretagne tɔn Charles Gordon yì Seychelles ɖò 1881 é ɔ ,tɔdo e è nɔ ylɔ ɖɔ Vallée de Mai ,b’ɛ nyí Gǔ Gbɛ̀ ɔ tɔn patrimoine mondial sín nɔtɛn ɖé dìn é sín ɖɛkpɛ jiwǔ ɖò nukún tɔn mɛ sɔmɔ̌ b’ɛ ɖɔ ɖɔ é wɛ nyí jikpá Edɛni tɔn ɔ .
Pourtant ,la Bible dit en Psaume 3729 Les justes posséderont la terre ,et sur elle ils résideront pour toujours .	É ɖò mɔ̌ có ,Biblu ɖɔ ɖò Ðɛhan 3729 mɛ ɖɔ Ayikúngban ɔ na nyí hwɛjijɔnɔ lɛ tɔn ,bɔ ye na nɔ jí kaka sɔyi .
Pourquoi meurt - ​ on	Pourquoi meurt - on
À retrouver sous LA BIBLE ET VOUS QUESTIONS BIBLIQUES .	Kpɔ́n LA BIBLE ET VOUS QUESTIONS BIBLIQUE glɔ
Watch Tower Bible and Tract Society of Pennsylvania	Watch Tower Bible and Tract Society of Pennsylvania
Cette revue paraît depuis 1879 .	Sín 1879 wɛ è ko ɖò xójlawema elɔ ɖetɔ́n wɛ .
peuvent - ​ ils influencer votre vie	Wɛnsagun LɛYe ka Sixu Ð’alɔ Ðò Gbɛzán Towe Mɛ À
La vérité sur les anges	Nǔ E Biblu Ðɔ Dó Wɛnsagun lɛ Wu É
Avez - ​ vous un ange gardien	A ka Ðó Wɛnsagun Xɛnyaɖomɛjitɔ́ ɖé Wɛ À
Y a - ​ t - ​ il des anges mauvais	Wɛnsagun Nyanya lɛ ka Ðè À
Comment les anges peuvent vous aider	Lee Wɛnsagun lɛ Sixu D’alɔ We Gbɔn É
LE SAVIEZ - ​ VOUS	A KA TUÙN À
LA BIBLE TRANSFORME DES VIES	BIBLU NƆ HUZU GBƐZÁN MƐTƆN
IMITEZ LEUR FOI SARA	ÐI NǓ YE ÐƆHUN SALA
QUE DIT LA BIBLE	ETƐ BIBLU KA ÐƆ
Une myriade est égale à 10 000 .	Wɔ̌bliba ɖokpo sixu bló 10 000 mɔ̌ .
Une myriade de fois une myriade fait donc 100 millions .	Wɔ̌bliba donu wɔ̌bliba ɖokpo bló livi 100 mɔ̌ .
La Bible enseigne que le Royaume messianique de Dieu ,un gouvernement céleste ,a été établi en 1914 .	Biblu kplɔ́n mɛ ɖɔ è ɖó Axɔsuɖuto Mawu tɔn e nyí acɛkpikpa jixwé tɔn ɖé bɔ Mɛsiya ɔ ɖ’enu é ayǐ ɖò 1914 .
Une fois que le Royaume de Dieu aura gouverné 1 000 ans sur une terre paradisiaque ,ces esprits mauvais auront la possibilité d’infliger une ultime et brève épreuve à l’humanité .	Enyi Axɔsuɖuto Mawu tɔn kpacɛ dó palaɖisi ayikúngban jí tɔn nu nú xwè 1 000 gudo ɔ ,è na jó yɛ nyanya enɛ lɛ dó nú hwenu klewun ɖé bɔ ye na tɛ́n gbɛtɔ́ lɛ kpɔ́n azɔn gudogudo tɔn .
Végèce précisait que la navigation était sûre du 27 mai au 14 septembre et que les périodes douteuses ,ou dangereuses ,allaient du 15 septembre au 11 novembre et du 11 mars au 26 mai .	Epitome of Military Science Vegetius ɖɔ ɖɔ tɔ̀ jí yiyi sín 27 Mai jɛ 14 Septembre kún ɖó awovinú ɖebǔ ó ,amɔ̌ hwenu e ɖó awovinú ɖaxó tawun lɛ é wè wɛ nyí sín 15 Septembre jɛ 11 Novembre kpo ee bɛ́sín 11 Mars jɛ 26 Mai é kpo .
Deux idéologies ont marqué les 18 premières annél’athéisme et le communisme .	Tamɛ - núkplɔnmɛ wè wɛ wà nǔ dó gbɛzán ce sín xwè 18 nukɔntɔn lɛNǔmaɖi ɖɔ Mawu tíìn athéisme kpo Communisme kpo .
Pourquoi le communisme m’attirait - ​ il	Etɛwu Communisme ka dɔn mì mɔ̌
À 14 ans ,j’ai passé beaucoup de temps à travailler sur un projet environnemental de recyclage de papier .	Hwenu e un ɖó xwè 14 é ɔ ,un nɔ zán hwenu gègě dó w’azɔ̌ ɖò tuto wema vúnvún cyancyan tɔn ɖé mɛ .
En 1989 ,le mur de Berlin est tombé ,et avec lui ,le bloc communiste d’Europe de l’Est .	Ðò 1989 ɔ ,è mu Dǒ Berlin tɔn lɛ ,b’ɛ sín enɛ wu bɔ kplékplé Communiste tɔn Zǎnzǎnhweji Elɔpu tɔn ɔ lɔmɔ̌ j’ayǐ .
Le communisme n’était - ​ il qu’une utopie	Dlɔ̌ kúkú kpowun wɛ Communisme ɔ ka nyí à
Mandy a pris dans la Bible Daniel chapitre 2 ,et ce que j’ai lu m’a stupéfait .	Mandy ɖɔ nyì ni kpɔ́n Daniyɛli wemata 2 ,bɔ nǔ e un xà ɖò finɛ é kpaca mì tawun .
Mandy m’a montré d’autres prophéties bibliques au sujet de l’avenir .	Mandy xlɛ́ nǔɖɔɖ’ayǐ Biblu tɔn e kúnkplá sɔgudo é ɖevo lɛ mì .
Psaume 379 dé Ceux qui espèrent en Jéhovah ,ceux - là posséderont la terre .	Ðɛhan 379 ɖɔ Tò ayikúngban ɔ na nyí mɛ e ɖeji dó Mawu Mavɔmavɔ wu lɛ tɔn .
Le communisme et l’athéisme m’ont façonné durant les 18 premières années de ma vie mais depuis ,la Bible transforme ma vie .	Communisme kpo nǔmaɖi ɖɔ Mawu tíìn kpo kplɔ́n mì ɖò xwè ce 18 nukɔntɔn lɛ mɛ bɔ sín hwe enɛ nu ɖido ɔ ,Biblu ko jɛ gbɛzán ce huzu jí .
En 1993 ,je me suis fait baptiser Témoin de Jéhovah et ,en 2000 ,j’ai épousé Tabitha ,une chrétienne zélée .	Ðò 1993 ɔ ,un bló baptɛm bo huzu Kúnnuɖetɔ́ Jehovah tɔn ,bɔ ɖò 2000 ɔ ,un wlí alɔ xá Tabitha ,nùɖitɔ́ hàtɔ́ tewungbeju ɖé wɛ n’i .
Notez ce que l’apôtre Paul a écrit 2 000 ans plus tard sous inspiration divine .	Ð’ayi nǔ e Mawu sɔ́ d’ayi mɛ nú mɛsɛ́dó Pɔlu b’ɛ wlan ɖò xwè 2 000 mɔ̌ gudo é wu .
À 90 ans ,Sara peut enfin savourer le moment qu’elle attendait depuis si longtemps .	Hwenu e Sala ɖó xwè 90 é ɔ ,é ɖu vivǐ nǔ e é ba kaka ɖò mɛxohwenu tɔn é tɔn .
Elle donne un fils à son cher époux ,qui a maintenant 100 ans	É jì vǐ sunnu ɖé nú asú vívɛ́ná tɔn ,ee ko ɖó xwè 100 dìn é
Yishmaël ,qui a 19 ans ,se moque du jeune Isaac .	Isimayɛli ,Hagáa sín vǐ sunnu xwè 19 mɛví ɔ fɔ́n bo ɖò Izaki cá na wɛ .
Il ne s’agit pas d’une simple taquinerie .	Nǔ enɛ nyí alisánú ɖé ǎ .
Il n’est pas étonnant que lorsqu’elle meurt à l’âge de 127 ans ,Abraham entr e pour se lamenter sur Sara et pour la pleurer .	Hwenu e é ɖó xwè 127 bo kú é ɔ ,hwɛ Ablaxamu tɔn jɔ ɖɔ é jɛ alě na jí bo jɛ Sala ví jí .
Est - ​ il nécessaire d’appartenir à une religion organisée	Est - il nécessaire d’appartenir à une religion organisée
À retrouver sous LA BIBLE ET VOUS QUESTIONS BIBLIQUES .	Kpɔ́n LA BIBLE ET VOUS QUESTIONS BIBLIQUE glɔ
Watch Tower Bible and Tract Society of Pennsylvania	Watch Tower Bible and Tract Society of Pennsylvania
Cette revue paraît depuis 1879 .	Sín 1879 wɛ è ko ɖò xójlawema elɔ ɖetɔ́n wɛ .
À la recherche du plus beau des cadeaux	Nùnina E Nyɔ́ Hugǎn É Biba
Quel est le plus beau des cadeaux	Nùnina Tɛ ka Hugǎn Bǐ
À QUOI RESSEMBLAIT RÉELLEMENT JÉSUS	NƐ̌ JEZU KA NA KO CÍ TAWUN
