input	target
En avril 1954 ,je me suis fait baptiser .	Ðò avril 1954 ɔ ,un xlɛ́ zě e un zé nyiɖée jó nú Jehovah é gbɔn baptɛm biblo gblamɛ .
En 1955 ,j’ai assisté à des assemblées internationales en Allemagne ,en France et en Angleterre .	Ðò 1955 ɔ ,un yì kpléɖókpɔ́ akɔjɔkplé tɔn ɖò Allemagne ,France kpo Angleterre kpo .
À Londres ,j’ai rencontré Albert Schroeder .	Hwenu e un ɖò Londres é ɔ ,un xò gò Albert Schroeder .
Je suis devenue évangélisatrice à plein temps le 1janvier 1956 .	Un jɛ sinsɛnzɔ́ hwebǐnu tɔn wu ɖò 1janvier 1956 .
En effet ,ma compagne de service et moi étions très difféJ’avais presque 19 ans et j’avais grandi en ville elle en avait 25 et c’était une fille de la campagne .	Nyɛ ɖó xwè 19 mɔ̌ bo gosin toxo ɔ mɛ ,éyɛ ka ɖó xwè 25 ,bo nyí tò ɔ mɛ nu .
Nous avons même été persécutées ,mais jamais abandonnées .	Yadonumɛ ɖé lɛ tlɛ lɛ́ wá ba mǐ ,amɔ̌ ,Mawu jó mǐ dó ǎ .
Rapidement ,nous avons aussi organisé dans notre chambre l’étude de livre et l’étude hebdomadaire de La Tour de Garde ,et 15 personnes y assistaient .	É sɔ́ lín ǎ bɔ ,mǐ nɔ bló kplé e nɔ nyí oplọn agunwe é ɖò xɔ mǐtɔn mɛ finɛ ,bo nɔ lɛ́ kplɔ́n Atɔxwɛ ɖò finɛ ,bɔ mɛ 15 mɔ̌ nɔ wá .
En tout ,nous sommes restées plus d’un an à Mistelbach .	Mǐ nɔ Mistelbach nú xwè ɖokpo jɛji .
Et 30 membres d’une famille à qui nous avons enseigné la Bible sont venus à la vérité	Gudo mɛ ɔ ,xwédo e mǐ kplɔ́n nǔ xá é ɖé sín hagbɛ̌ 30 mɔ̌ wá nugbǒ ɔ mɛ
J’ai été nommée au Paraguay .	Nyɛ na yì Paraguay .
Il me l’a donnée et je suis arrivée au Paraguay en mars 1959 .	Ee é na gbè mì gudo é ɔ ,un yì Paraguay ɖò mars 1959 .
À chaque fois que nous devions faire face à une difficulté ,nous lisions la promesse de Jéhovah contenue en Isaïe 4110 N’aie pas peur ,car je suis avec toi .	Enyi mǐ mɔ tagba hweɖebǔnu ɔ ,mǐ nɔ xà akpá Jehovah tɔn e ɖò Ezayíi 4110 mɛ é Ma ɖi xɛsi ó ,ɖó un ɖò kpɔ́ xá we .
Les docteurs m’avaient dit que je ne pouvais pas avoir d’enfants ,alors imaginez notre surprise quand ,en 1962 ,nous avons appris que j’étais enceinte	Dotóo ce ɖɔ nú mì ɖɔ un kún sixu jì vǐ ó ,enɛ wu ɔ ,é kpaca mǐ ,hwenu e mǐ sè ɖò 1962 ɖɔ un ɖò xò é .
Nous nous sommes installés en Floride ,dans la ville d’Hollywood ,près de la famille de Walter .	Mǐ wá yì cí Hollywood ɖò Floride sɛkpɔ Walter sín xwédo .
Malheureusement ,en 2015 ,Walter est mort d’un cancer du cerveau .	É blawu ɖɔ Walter kú ɖò 2015 ɖó kansɛ́ɛ taglomɛ tɔn ɖé wutu .
Par exemple ,Walter et moi avons eu le plaisir de voir 136 de nos étudiants se faire baptiser .	Ði kpɔ́ndéwú ɔ ,nyì kpo Walter kpo mɔ bɔ Biblu kplɔntɔ́ mǐtɔn 136 bló baptɛm .
Watch Tower Bible and Tract Society of Pennsylvania	Watch Tower Bible and Tract Society of Pennsylvania
ASSISTANTS AU MÉMORIAL 2016	MƐ NABI E WÁ FLǏN É 2016
Le Phare de la Tour de Sion du 1mars 1902 en anglais en mentionnait une .	Ði kpɔ́ndéwú ɔ ,Atɔxwɛ 1mars 1902 tɔn ɖɔ nǔ lɛ ɖokpo ,é ɖɔ Nú nǔ e kàn lee Pɔlu cí é ɔ.
Pour ce qui est de l’ . . . le livre Actes de Paul et de Thècle . . . ,écrit en 150 de notre ère ,contient une description de Paul qui est probablement la meilleure ,basée sur une tradition fiable .	Ðò Les actes de Paul et Thècle ’ .ee nyí nùwlanwlan xwè 150 H.M .tɔn ɖé é mɛ ɔ ,alɔkpa e mɛ è jlɛ́ lee Pɔlu cí é gbɔn ɖò finɛ é na ɖibla nyí ee nyɔ́ hugǎn é ,bo lɛ́ nyí aca nugbǒ ɖé .
The Oxford Dictionary of the Christian Church édition de 1997 Ce n’est pas impossible que Actes contienne des éléments de vérité historique .	The Oxford Dictionary of the Christian Church 1997 tɔn ɖɔ dó nùwlanwlan hwexónu tɔn enɛ wu ɖɔ È sixu ɖɔ ɖɔ nùɖé lɛ ɖò Les actes de Paul et Thècle ’ mɛ ,bo kún sɔgbe ɖò hwenuxó linu ó ǎ .
Parlons à pré1 Comment la discipline venant de Dieu prouve - ​ t - ​ elle qu’il nous aime	Mi nú mǐ ni ba xósin nú nùkanbyɔ taji atɔ 1 Nɛ̌ nǔgbɛnúmɛ Mawu tɔn ka nɔ ɖè wanyiyi e é ɖó nú mǐ é xlɛ́ gbɔn
Qu’apprenons - ​ nous de personnes ayant été disciplinées par Jéhovah	Etɛ mɛ e Mawu gbɛ́ nǔ na ɖò hwexónu lɛ é sín kpɔ́ndéwú ka sixu kplɔ́n mǐ
Comment imiter Jéhovah et son Fils dans la façon de discipliner les autres	Nú mǐ ɖò nǔ gbɛ́ nú mɛ wɛ ɔ ,nɛ̌ mǐ ka sixu xwedó kpɔ́ndéwú Jehovah kpo Vǐ tɔn kpo tɔn gbɔn
a Quelles leçons importantes pouvons - ​ nous tirer de l’histoire de Shebna	a Nǔ taji tɛ lɛ Cevuna sín tan ka sixu kplɔ́n mǐ
Son humilité et son obéissance attiraient les gens sincères à lui et faisaient de lui un enseignant compatissant lire Luc 422 .	Xà Luki 422 .
a Quels bienfaits nous procurons - ​ nous en acceptant la discipline qui vient de Dieu	a Nú è yí gbè nú nǔgbɛnúmɛ Mawu tɔn ɔ ,nyɔna tɛ lɛ è ka nɔ mɔ
En nous disciplinant ,Jéhovah nous prépare à vivre pour toujours dans une famille paisible et unie ,dont il sera le Père lire Isaïe 119 .	Xà Ezayíi 119 .
En effet ,nous lisons en Jacques 15 Si donc l’un de vous manque de sagesse ,qu’il la demande sans relâche à Dieu ,car il donne à tous généreusement et sans faire de reproche .	Jaki 15 ɖɔ Enyi nùnywɛ hwedo mɛɖé ɖò mi mɛ hǔn ,ni byɔ Mawu nú é na na ɛ ɖó Mawu nɔ hun alɔ dó na nǔ mɛ bǐ kpo xomɛhunhun kpo .
Proverbes Ne rejette pas ,ô mon fils ,la discipline de Jéhovah ,. . . car celui que Jéhovah aime ,il le reprend .	Nùnywɛxó ɖɔ Vǐ ce ,Jehovah dɔn tó nú we hǔn ,ma hu tɛ́ na ó ɖó Jehovah nɔ gbɛ̀ nǔ nú mɛ e é yí wǎn na é .
Pas nos propres forces ,mais l’esprit de Dieu lire Philippiens 413 .	É nyí hlɔnhlɔn éɖesunɔ tɔn ǎ ,amɔ̌ ,gbigbɔ Mawu tɔn wɛ .Xà Filipunu lɛ 413 .
a Si leur enfant est excommunié ,comment des parents chrétiens montreront - ​ ils qu’ils obéissent à Dieu	a Enyi è ɖè vǐ ɖé sín agun mɛ ɔ ,nɛ̌ mɛjitɔ́ Klisanwun lɛ ka nɔ xlɛ́ ɖɔ emi nɔ setónú nú Mawu gbɔn
a Comment tirer profit du bon travail que font les anciens	a Nɛ̌ mǐ ka sixu ɖu mɛxo agun tɔn lɛ sín lè gbɔn
Nous pouvons appliquer les conseils bibliques qu’ils nous donnent ,et imiter leur foi et leur excellent exemple lire Hébreux .	Xà Eblée lɛ .
Comment obtenir la vraie liberté	Ali E È Na Gbɔn Dó Jɛ Mɛɖée Kannu Nugbǒ Nugbǒ É
Sers Jéhovah ,le Dieu de liberté	Sɛ̀n Jehovah ,Mawu E Nɔ Na Mɛɖéekannuninɔ Mɛ É
Frères nommés ,apprenez de Timothée	Sunnu Agbanɖotananɔ lɛ Emi ​ — Kpɔ́ndéwú Timɔtée Tɔn Ni Kplɔ́n Nǔ Mi
Imitons Jéhovah ,le Dieu qui encourage	Wà Nǔ Jehovah ,Mawu E Nɔ Dó Wusyɛn Lanmɛ nú Mɛ É Ðɔhun
Encourageons - ​ nous d’autant plus	Mi Nɔ Dó Wusyɛn Lanmɛ nú Miɖée Dìn Hú Ð’ayǐ Tɔn lɛ Bǐ
Jeune ,es - ​ tu concentré sur des objectifs spirituels	Mɛ Winnyawinnya lɛ Emi ,Mi ka Ðò Ayi Mitɔn Sɔ́ Ðó Nǔ Gbigbɔ Tɔn lɛ Gbé Nyinya Jí Wɛ À
Questions des lecteurs	Nǔ E Nǔxatɔ́ lɛ Kanbyɔ lɛ É
Questions des lecteurs	Nǔ E Nǔxatɔ́ lɛ Kanbyɔ lɛ É
a Qu’est - ​ ce qui montre que beaucoup accordent une grande importance à la liberté	a Etɛ ka xlɛ́ ɖɔ gbɛtɔ́ lɛ ɖò tagba jɛ wɛ bo na nɔ yeɖée kannu
Pourquoi l’ordre de Dieu contenu en Genèse 217 n’était - ​ il pas injuste ,inutile ou déraisonnable	Etɛwu gbeɖiɖe Mawu tɔn e ɖò Bǐbɛ̌mɛ 217 mɛ é ka sɔgbe ,ɖò dandan ,alǒ ,ɖò jlɛ̌ jí
L’un d’ On déduit de l’ordre de Dieu contenu en Genèse que seul Dieu sait ce qui est bon . . . pour les humains et ce qui ne l’est pas . . . .	Ði kpɔ́ndéwú ɔ ,akɔwé ɖokpo ɖɔ Gbeɖiɖe Mawu tɔn e ɖò Bǐbɛ̌mɛ mɛ é xlɛ́ ɖɔ Mawu ɖokponɔ wɛ tuùn nǔ e nyí nǔ ɖagbe .nú gbɛtɔ́ lɛ é ,Mawu ɖokponɔ wɛ tuùn nǔ e nyí nǔ ɖagbe .nú ye é .
Explique à l’aide d’un exemple .	Jlɛ̌ dó nùɖé wu .
Cet esclavage peinait profondément l’apôtre Paul lire Romains .	Xà Hlɔmanu lɛ .
Et nous pourrons être un jour complètement libérés de l’esclavage de l’imperfection et de la mort lire Romains ,.	Xà Hlɔmanu lɛ ,.
a Pourquoi ,à l’époque de Paul ,l’esclavage et la liberté étaient - ​ ils des sujets qui préoccupaient beaucoup les gens	a Etɛwu kannumɔgbenu ninɔ kpo mɛɖéekannuninɔ kpo xó ɔ ka ɖu ayi mɛ nú mɛ lɛ ɖò mɛsɛ́dó Pɔlu hwenu
À un moment donné ,30 pour cent de sa population étaient des esclaves .	Ðò hweɖenu ɔ ,30 ɖò kanweko jí mɛ e ɖò Hlɔma lɛ é tɔn wɛ nyí kannumɔ .
a Quel est le contexte des paroles contenues en 2 Corinthiens 317	a Etɛ ka zɔ́n bɔ Pɔlu ɖɔ xó e ɖò 2 Kɔlɛntinu lɛ 317 mɛ é
a Quelle sorte de liberté l’esprit de Jéhovah procure - ​ t - ​ il	a Mɛɖéekannuninɔ alɔkpa tɛ gbigbɔ Jehovah tɔn ka nɔ na mɛ
a Quel avertissement l’apôtre Pierre a - ​ t - ​ il donné concernant l’utilisation de notre liberté	a Akpá tɛ mɛsɛ́dó Piyɛ́ɛ ka gbà nú mɛ dó mɛɖéekannuninɔ mɛtɔn zinzan wu
L’apôtre Pierre a averti qu’il serait mal d’utiliser notre liberté comme une excuse pour satisfaire nos désirs égoïstes lire 1 Pierre 216 .	Xà 1 Piyɛ́ɛ 216 .
Au cours des cinq dernières années ,il y a eu plus de 250 000 nouveaux pionniers permanents ,ce qui fait qu’ils sont maintenant plus de .	Gbeɖiɖó lɛ xlɛ́ ɖɔ ɖò xwè atɔ́ɔ́n e wá yì lɛ é mɛ ɔ ,kɛ́n gbexosin - alijitɔ́ hwebǐnu tɔn lɛ tɔn jɛji bo hugǎn ,enɛ xlɛ́ ɖɔ gbɔn gbɛ̀ ɔ bǐ mɛ ɔ ,gbɛtɔ́ 250 000 jɛji byɔ gbexosin - alijitɔ́ hwebǐnu tɔn lɛ sín ahwan mɛ .
Prenons l’exemple de John et Judith ,qui ont servi dans plusieurs pays au cours des 30 dernières années .	Mǐ ni ɖɔ xó dó John kpo Judith kpo ,ee wà sinsɛnzɔ́ ɖò tò mɔkpan mɛ ɖò xwè 30 e wá yì lɛ é mɛ é jí .
Ils se souviennent que ,quand l’École des pionniers a commencé en 1977 ,on encourageait les élèves à être prêts à se déplacer là où il y avait besoin de renfort .	Ye flín ɖɔ hwenu e è bɛ́ Wemaxɔmɛ Sinsɛnzɔ́ Gbexosin - Alijitɔ́ Tɔn ɖò 1977 é ɔ ,nǔ e jí è nɔ tɛɖɛ̌ é wɛ nyí ɖɔ mɛ lɛ ni ɖó jlǒ bo na sɛ̀ tɛn ,bo yì wà sinsɛnzɔ́ ɖò fí e hudo sukpɔ́ ɖè é .
J’ai mieux compris le passage de Jacques 48 Approchez - ​ vous de Dieu ,et il s’approchera de vous .	Dìn ɔ ,un mɔ nǔ jɛ nǔ e Jaki 48 sín tinmɛ nyí é Mi sɛkpɔ Mawu enɛ ɔ é na sɛkpɔ mi .
Par exemple ,environ 27 000 frères et sœurs ont apporté leur aide à la construction du siège mondial à Warwick .	Ði kpɔ́ndéwú ɔ ,hwenu e è ɖò hɔnkàn gbɛ̀ ɔ tɔn mǐtɔn gbá wɛ ɖò Warwick ,New York é ɔ ,nɔví sunnu kpo nɔví nyɔnu kpo 27 000 mɔ̌ wɛ d’alɔ mɛɖé lɛ wà azɔ̌ nú aklunɔzán gblamɛ wè yì jɛ xwè ɖokpo alǒ hú mɔ̌ ,ɖò fí ɖebǔ e è ɖè azɔ̌ nú ye dó é .
William ,ancien depuis plus de 20 ans et très respecté ,donne ce conseil à ceux qui viennent d’être nommé Aimez les frères .	William ,ee nyí mɛxo agun tɔn e è nɔ sí é sín xwè 20 jɛji ɖíe é ɖé nɔ ɖè wě elɔ lɛ xá nɔví sunnu agbanɖotananɔ yɔyɔ̌ lɛ Yǐ wǎn nú nɔví lɛ .
Continueras - ​ tu de progresser au service de Jéhovah	A ka na kpó ɖò nukɔn yì wɛ ɖò gbigbɔ lixo à
Watch Tower Bible and Tract Society of Pennsylvania	Watch Tower Bible and Tract Society of Pennsylvania
ASSISTANTS AU MÉMORIAL 2017	MƐ NABI E WÁ FLǏN É 2017
a Par le passé ,quel encouragement Jéhovah a - ​ t - ​ il donné à son peuple	a Wusyɛn tɛ Jehovah ka dó lanmɛ nú togun tɔn hwexónu tɔn ɔ
a Pourquoi la fille de Jephté avait - ​ elle besoin d’encouragements	a Etɛwu vǐ nyɔnu Jɛfutée tɔn ka ɖó hudo wusyɛn dó lanmɛ nú mɛ tɔn
Par exemple ,seul son Évangile contient les paroles de Jésus indiquant que l’amour serait la caractéristique de ses vrais disciples lire Jean .	Wɛnɖagbe - Wema tɔn kɛɖɛ mɛ wɛ xó e Jezu ɖɔ ,bo ɖɔ wanyiyi wɛ nyí wuntun e na zɔ́n bɔ è na tuùn ahwanvu emitɔn nugbǒ lɛ é ɖè . Xà Jaan .
De plus ,pour encourager ceux qui ne participent plus aux activités de la congrégation à reprendre de bonnes habitudes spirituelles ,le Collège central a publié en 2015 la brochure Reviens à Jéhovah .	Gɔ́ na ɔ ,ɖò 2015 ɔ ,Hagbɛ̌ Alixlɛ́mɛtɔ́ ɔ ɖè alɔnuwema Lẹkọ Wá Jehovah De tɔ́n alɔnuwema enɛ ko nyí jɔtɛn wusyɛn dó lanmɛ nú mɛ tɔn ɖaxó ɖé nú mɛ gègě gbɔn gbɛ̀ ɔ mɛ .
Il a aussi trouvé beaucoup de réconfort en lisant Psaume 46 ,Sophonie 317 et Marc .	É mɔ gbɔdónúmɛ ɖaxó ɖé hwenu e é xà Ðɛhan 46 Sofoníi 317 kpo Maki kpo é .
Quels bienfaits te procureras - ​ tu en appliquant les paroles de Proverbes 163	Nɛ̌ Nùnywɛxó 163 zinzan ka sixu hɛn lè wá nú mɛ winnyawinnya lɛ gbɔn
Toby en avait 12 quand il s’est fixé l’objectif de lire toute la Bible avant de se faire baptiser .	Hwenu e Toby ɖó xwè 12 é ɔ ,Biblu ɔ blebu xixa jɛ nukɔn nú baptɛm tɔn wɛ nyí nǔ e gbé é jɛ nyinya jí é .
Maxim avait 11 ans et sa sœur Noemi en avait 10 quand ils se sont fait baptiser .	Maxim ɖó xwè 11 bo bló baptɛm ,bɔ nɔví nyɔnu tɔn Noemi ɖó xwè 10 bo bló .
a Pourquoi disons - ​ nous que se fixer des objectifs aide à prendre de bonnes décisions	a Nɛ̌ nùɖé gbé nyinya ka sixu zɔ́n bɔ gbeta lɛ kɔn wíwá na bɔwǔ nú mɛ gbɔn
Proverbes 215 explique que l’homme qui fait des projets et qui travaille pour les réaliser obtient de bons résultats .	Nùnywɛxó 215 ɖɔ Mɛ e nɔ kú hǔn bo nɔ tò nǔ e wà gbé é ja ɔ ,nɔ mɔ nǔ gègě ɖ’emɛ .
Cela fait maintenant 20 ans que Damaris est pionnière .	Damaris ko ɖò gbexosin - alijitɔ́zɔ́ wà wɛ dìn sín xwè 20 ɖíe .
voir les paragraphes . . a Que peux - ​ tu faire pour te préparer à parler aux autres de Jéhovah	a Etɛ mɛ winnyawinnya lɛ ka sixu bló bo sɔnǔ bá ɖekúnnu
C’est ce qu’a fait Luca .	Nǔ e Luca bló é nɛ .
À 17 ans ,elle s’est fixé l’objectif de prêcher à chacun de ses collègues .	Xwè 17 wɛ Katharina ɖó hwenu e é sɔ́ kúnnuɖiɖe nú azɔ̌gbɛ́ tɔn lɛ ɖokpo ɖokpo dó ɖó nǔ e gbé é na nya é .
L’un d’eux l’a insultée plusieurs fois ,mais elle ne s’est pas découragée .	Mɛ ɖokpo ɖò ye mɛ bo zun i azɔn gègě ,amɔ̌ ,enɛ dó xɛsi i ǎ .
a Quand des jeunes t’incitent à faire comme eux ,à quoi dois - ​ tu être déterminé	a Enyi è ɖò kɔ gbidi nú mɛ winnyawinnya lɛ wɛ ɔ ,etɛ ye ka ɖó na hɛn dó ayi mɛ
Écoute les suggestions de tes parents et celles des frères et sœurs de ta congrégation lire 1 Pierre .	Mɛɖesɔhwe na zɔ́n bɔ a na yí gbè nú wě e mɛjitɔ́ towe lɛ kpo mɛ e zin ɖò gbigbɔ lixo ɖò agun ɔ mɛ lɛ é kpo ɖè xá we é . Xà 1 Piyɛ́ɛ .
a Que veut Jéhovah pour les jeunes	a Etɛ Jehovah ka ba nú mɛ winnyawinnya lɛ ɖò égbé
Les bonnes choses mentionnées aux versets 12 à 14 s’appliquaient donc aux méchants ,mentionnés dans les versets précédents .	Enɛ wu ɔ ,nǔ ɖagbe ɖěɖee xó è ɖɔ ɖò wemafɔ 12 jɛ 14 mɛ é ɔ ,mɛdídá ɖěɖee xó è ɖɔ ɖò wemafɔ e jɛ nukɔn na é mɛ lɛ é wɛ è zán na .
Alors est la traduction retenue dans l’édition révisée de 2013 et dans d’autres traductions de la Bible .	Enɛ ɔ wɛ nyí lee è lilɛ gbɔn ɖò lilɛdogbeɖevomɛ 2013 tɔn ,kpo lilɛdogbeɖevomɛ Biblu tɔn ɖevo lɛ kpo mɛ é .
De la pauvreté à la richesse	Tan Gbɛzán TɔNǔ lɛ Bɛ́ Wǔɖéwúɖé ,Bɔ Vivɔnu Tɔn ka Wá Nyɔ́ Tawun
comment la trouver	FífáNɛ̌ A ka Sixu Mɔ Gbɔn
Jéhovah aime ceux qui portent du fruit avec endurance	Jehovah Yí Wǎn nú Mɛ Ðěɖee Linsyɛnsyɛn Yetɔn Nɔ Zɔ́n ,Bɔ Ye Nɔ Na Sínsɛ́n lɛ É
Pourquoi nous continuons à porter beaucoup de fruit	Nǔ E Wu Mǐ Nɔ Na Sínsɛ́n Gègě É
Connais ton ennemi	Tuùn Kɛntɔ́ Towe
Jeune ,tiens ferme contre le Diable	Mɛ Winnyawinnya lɛ Emi ,Mi Gbí Dɔn Ðò Awovi Nukɔn
Une moisson abondante	Nǔkún - Yiya Wɔbuwɔbu Ðé
Le mien avait déjà 56 ans quand je suis né ,et ma mère ,35 .	Xwè 56 wɛ é ɖó hwenu e è jì mì é bɔ nɔ ce ɖó xwè 35 .
À 12 ans ,j’ai entendu pour la première fois parler de la Trinité .	Xwè 12 wɛ un ɖó bo sè Atɔnɖobǔ sín xó azɔn nukɔntɔn ɔ .
À 17 ans ,avant d’être incorporé dans l’armée 1952 .	— Hwenu e un ɖó xwè 17 jɛ nukɔn nú ahwan mɛ byɔbyɔ ce é
J’ai passé deux ans dans l’armée américaine .	— Un bló xwè wè ɖò ahwankpá États - Unis tɔn mɛ
Neuf mois après avoir assisté à ma première réunion ,en mars 1957 ,je me suis fait baptiser .	Ee un yì kplé nukɔn nukɔntɔn enɛ b’ɛ bló sun tɛnnɛ gudo é ɔ ,un bló baptɛm ɖò mars 1957 .
Je suis devenu pionnier l’année suivante ,en 1958 .	Un bɛ́ gbexosin - alijitɔ́zɔ́ ɖò xwè e bɔ d’ewu é mɛ ɖò 1958 .
Je faisais partie d’une famille de 17 enfants .	Un nyí ɖokpo ɖò vǐ 17 e mɛ ce lɛ jì é mɛ .
Elle est morte quand j’avais 14 ans .	É kú hwenu e un ɖó xwè 14 é .
Deux familles Témoins nous ont enseigné la Bible et nous avons été 11 enfants à nous faire baptiser .	Xwédo Kúnnuɖetɔ́ lɛ tɔn wè nɔ kplɔ́n Biblu xá mǐ ,bɔ mǐ mɛ 11 ɖò vǐ lɛ mɛ huzu Kúnnuɖetɔ́ Jehovah tɔn .
Gloria et moi nous sommes mariés en février 1959 .	Gloria kpo nyì kpo wlí alɔ ɖò février 1959 .
Nous avons été envoyés dans la congrégation de couleur ,qui n’avait que 14 proclamateurs .	È sɛ́ mǐ dó mɛwi lɛ sín agun e mɛ wɛnjlatɔ́ 14 géé ɖè é .
En 1962 ,j’ai été invité à assister à l’École du ministère du Royaume à South Lansing ,dans l’État de New York .	Ðò 1962 ɔ ,è ylɔ mì ɖɔ má wá Wemaxɔmɛ Sinsɛnzɔ́ Axɔsuɖuto ɔ tɔn ɖò South Lansing ɖò New York .
J’avais entre 15 et 20 cours bibliques .	Mɛ 15 jɛ 20 wɛ un nɔ kplɔ́n Biblu xá .
C’était en janvier 1965 .	Janvier 1965 wɛ .
En août 1997 ,notre rêve de toujours s’est réalisé .	Ðò août 1997 ɔ ,dlɔ̌ e mǐ kú nú xwè gègě é huzu dlɔ̌ aɖi .
Nous avons été invités à servir au Béthel des États - Unis . . . 38 ans après avoir fait une demande d’entrée .	È ylɔ mǐ ɖɔ mǐ ni wá wà sinsɛnzɔ́ ɖò Betɛli États - Unis tɔn ,mǐ d’alɔ wema mɛ na azɔn nukɔntɔn ɔ é ɔ ,xwè 38 mɔ̌ ɖó wɛ é ɖè nɛ .
Puis ,en 1999 ,je suis devenu membre du Collège central .	Enɛ gudo ɖò 1999 ɔ ,è sɔ́ azɔ̌ d’así nú mì bɔ un nyí ɖokpo ɖò Hagbɛ̌ Alixlɛ́mɛtɔ́ ɔ mɛ .
Depuis 1999 ,j’ai le privilège de faire partie du Collège central .	Sín 1999 ɔ ,è jɔwu mì bɔ un ɖò azɔ̌ wà wɛ ɖò Hagbɛ̌ Alixlɛ́mɛtɔ́ ɔ mɛ
Isaïe 3217 dé L’œuvre de la vraie justice deviendra la paix ,et le service de la vraie justice ,le calme et la sécurité pour des temps indéfinis .	Ezayíi 3217 ɖɔ Hwɛjijɔ na hɛn fífá wá é na na mɛ ayi jɛ ayǐ kpo jiɖiɖe kpo kaka sɔyi .
a Pourquoi sommes - ​ nous encouragés par ceux qui prêchent fidèlement dans des territoires où beaucoup n’écoutent pas	a Etɛwu kpɔ́ndéwú mɛ ɖěɖee nɔ jla wɛn ɔ ɖò fí e mɛ lɛ ma nɔ ɖó kɔ ye wu ɖè ǎ lɛ é tɔn ka nɔ dó wusyɛn lanmɛ nú mǐ
Ils ont tous les deux plus de 80 ans .	SERGIO KPO OLINDA KPO nyí asú kpo asì kpo gbexosin - alijitɔ́ ɖé ɖò États - Unis bo ɖó xwè 80 jɛji .
b Pourquoi est - ​ ce normal de nous sentir parfois découragés	b Etɛwu é ka ɖò wɛn ɖɔ awakanmɛ sixu wá kú mǐ ɖò hweɖelɛnu
Elena ,qui est pionnière depuis plus de 25 ans ,exprime ce que beaucoup d’ Je trouve difficile de prêcher .	Elena e ko nyí gbexosin - alijitɔ́ nú xwè 25 jɛji é ɖɔ xó elɔ dó nu nú gègě mǐtɔ Un mɔ ɖɔ wɛnɖagbejijlazɔ́ ɔ vɛwǔ .
Lire Jean ,8 .	Xà Jaan ,8 .
Lire Luc ,.	Xà Luki ,.
Selon Romains ,pour quelles raisons Paul n’a - ​ t - ​ il jamais renoncé à prêcher aux Juifs	Sɔgbe xá Hlɔmanu lɛ ɔ ,hwɛjijɔ tɛ lɛ wu Pɔlu ma ka jó gbè dó mɛ ɖěɖee nɔ gbɛ́ wɛn Axɔsuɖuto ɔ tɔn lɛ é wu ǎ
Carl ,un ancien qui est baptisé depuis plus de 50 ans ,Je cherche tout signe qui pourrait indiquer que la personne a un bon état d’esprit ,comme un sourire ,un regard bienveillant ou une question sincère .	Carl e nyí mɛxo agun tɔn ɖé ,bo ko bló baptɛm sín xwè 50 jɛji ɖíe é ɖɔ Un nɔ ba nǔ kpɛví kpɛví ɖebǔ e sixu xlɛ́ ɖɔ mɛɖé ɖó jlǒ é ,é sixu nyí nǔkiko yɛ́ɛ ɖé ,mɛ kpinkpɔn kpo xomɛnyínyɔ́ kpo ,alǒ ,nǔ e è kanbyɔ dó nùjɔnǔ mɛ é ɖé .
a Quelle leçon pouvons - ​ nous tirer d’Ecclésiaste 116	a Etɛ alixlɛ́mɛ e ɖò Nùnywɛtɔ́xó 116 mɛ é ka sixu kplɔ́n mǐ
Même si nous avons l’impression que les gens ne nous écoutent pas ,n’oublions pas que notre prédication peut avoir un effet puissant sur eux lire Ecclésiaste 116 .	Xà Nùnywɛtɔ́xó 116 .
Quelles raisons bibliques avons - ​ nous de continuer à prêcher	Hwɛjijɔ junjɔn Biblu jí tɛ lɛ mǐ ka ɖó ,bo na kpó ɖò wɛn ɔ jla wɛ
a Peu avant sa mort ,de quoi Jésus a - ​ t - ​ il parlé à ses apôtres	a Táan kpɛɖé jɛ nukɔn nú kú Jezu tɔn ɔ ,xó tɛ é ka ɖɔ nú ahwanvu tɔn lɛ
a De quelles façons pouvons - ​ nous sanctifier le nom de Dieu	a Ali tɛ lɛ nu mǐ ka nɔ hɛn nyikɔ Mawu tɔn ɖó mimɛ̌ jí ɖè
a Quelle raison de prêcher trouvons - ​ nous en Jean	a Hwɛjijɔ e wu mǐ na jla wɛn ɔ é ɖětɛ ka tɔ́n ɖò Jaan mɛ
a Quelle autre raison de prêcher avons - ​ nous	a Hwɛjijɔ ɖevo tɛ mǐ ka ɖó ,bo na jla wɛn ɔ
b Pourquoi les paroles d’Ézéchiel et 1823 nous encouragent - ​ elles à continuer de prêcher	b Nɛ̌ xó Jehovah tɔn e ɖò Ezekiyɛli kpo 1823 kpo mɛ é ka nɔ sísɛ́ mǐ ,bɔ mǐ na kpó ɖò wɛn jla wɛ gbɔn
a Quelle raison de prêcher Matthieu 2239 nous donne - ​ t - ​ il	a Hwɛjijɔ e wu mǐ na jla wɛn ɔ é ɖětɛ ka tɔ́n ɖò Matie 2239 mɛ
a Quel rapport y a - ​ t - ​ il entre le récit concernant le gardien de prison et notre prédication	a Nɛ̌ tan gantɔ́cɔ́tɔ́ ɔ tɔn ka kúnkplá sinsɛnzɔ́ mǐtɔn gbɔn
Ejvor ,qui est pionnière depuis 34 ans ,Aujourd’hui plus que jamais ,beaucoup se sentent déprimés .	Ejvor ,ee nyí gbexosin - alijitɔ́ ɖé sín xwè 34 ɖíe é ɖɔ Égbé ɔ ,mɛ gègě flú ɖ’ayi mɛ hú hwenu e wá yì lɛ é bǐ .
a De quel don Jean 1427 parle - ​ t - ​ il	a Nùnina tɛ xó Jaan 1427 ka ɖɔ
La paix lire Jean 1427 .	Fífá .Xà Jaan 1427 .
a De quel don Jean 1516 parle - ​ t - ​ il	a Nùnina tɛ xó Jaan 1516 ka ɖɔ
Watch Tower Bible and Tract Society of Pennsylvania	Watch Tower Bible and Tract Society of Pennsylvania
ASSISTANTS AU MÉMORIAL 2017	MƐ NABI E WÁ FLǏN É 2017
Quelle est l’étendue de l’influence de Satan	Bǎ tɛ mɛ Satáan ka sixu wà nǔ dó mǐ wu yì jɛ
b Quel avantage avons - ​ nous à connaître l’étendue de l’influence de Satan	b Enyi mǐ tuùn bǎ e mɛ Satáan sixu wà nǔ dó mǐ wu yì jɛ é ɔ ,lè tɛ ka ɖ’emɛ nú mǐ
a Comment Satan s’y est - ​ il peut - être pris pour piéger un grand nombre d’anges	a Nɛ̌ Satáan ka sixu ko ɖó mɔ dó wlí nɔví tɔn wɛnsagun lɛ gbɔn
a Quelles autres limites Satan et les démons ont - ​ ils	a Dogbó ɖevo tɛ lɛ Satáan kpo awovi tɔn lɛ kpo ka ɖó
De plus ,en bons soldats ,ils revête nt l’armure complète de Dieu afin d’être prêts à combattre lire Éphésiens .	Sɔja e è kplɔ́n azɔ̌ ganji lɛ é ɖɔhun ɔ ,ye nɔ fɔ ahwanfunnu e Mawu na ye lɛ bǐ kplá . Xà Efɛzinu lɛ .
Lire Éphésiens 614 .	Xà Efɛzinu lɛ 614 .
Abigail ,18 ans ,On pourrait penser que ça ne vaut pas toujours le coup de dire la vérité ,surtout quand un mensonge pourrait nous sortir d’une situation difficile .	Abigail ,ee ɖó xwè 18 é ɖɔ Nugbǒɖiɖɔ hwebǐnu sixu cí nǔ e ma ɖò dandan ǎ é ɖɔhun ,ɖò taji ɔ ,hwenu e adingban ɖiɖó sixu zɔ́n bɔ è na tɔ́n sín ninɔmɛ vɛwǔ ɖé mɛ é .
Victoria ,23 ans ,té Quand tu dis la vérité et que tu défends tes croyances ,tu prends le risque qu’on te harcèle .	Victoria ,ee ɖó xwè 23 é ɖɔ Enyi a nɔ ɖɔ nugbǒ bo nɔ jɛhun dó nǔ e a ɖi nǔ na lɛ é jí ɔ ,è sixu dó xɛsi we .
Les reins ceints de vérité voir les paragraphes	Nugbǒ nyí gǒjiblanú Kpɔ́n akpáxwé
Daniel ,21 ans ,Mes professeurs et mes camarades se moquaient de moi parce que je respectais les normes de la Bible .	Daniel ,ee ɖó xwè 21 é ɖɔ Mɛ̌si ce lɛ kpo azɔ̌mɛvigbɛ́ ce lɛ kpo nɔ ko mì ,ɖó un nɔ zán gbɛ̀ sɔgbe xá nugbodòdó Biblu tɔn lɛ wutu .
Madison ,15 ans ,Pour moi ,c’est un vrai combat de rester fidèle aux normes de Jéhovah plutôt que d’adopter le point de vue des autres jeunes sur ce qui est cool et amusant .	Madison ,ee ɖó xwè 15 é ɖɔ Nugbodòdó Jehovah tɔn lɛ wu títɛ́dó kpo nǔ ma wà sɔgbe xá nǔ e gbɛ̌ ce lɛ lin ɖɔ é nyɔ́ ,alǒ hwɛ́n é kpo vɛwǔ nú mì .
La cuirasse de la justice voir les paragraphes	Hwɛjijɔ nyí ganwu Kpɔ́n akpáxwé
a Quelles chaussures symboliques les chrétiens portent - ​ ils	a Afɔkpa nùjlɛdonǔwu tɔn tɛ Klisanwun lɛ ka nɔ sɔ́ dó
Lire Éphésiens 615 .	Xà Efɛzinu lɛ 615 .
Bo ,20 ans ,té J’avais peur de donner le témoignage à mes camarades .	Roberto ,ee ɖó xwè 20 é ɖɔ Xɛsi nɔ ɖi mì dó kúnnuɖiɖe nú wemaxɔmɛvigbɛ́ ce lɛ wu .
