input	target
C’était la somme qu’un ouvrier non qualifié gagnait pour 25 jours de travail .	Ði kpɔ́ndéwú ɔ ,tanwema Jwifu lɛ tɔn ɖé ɖɔ ɖɔ é wá jɛ hweɖenu ɖò xwè kanweko nukɔntɔn ɔ mɛ ,bɔ è ɖó na w’azɔ̌ nú azǎn 25 mɔ̌ cobo xɔ xwelé e è na dó savɔ̌ é wè .
Mais durant les décennies précédant 1914 ,les oints ont commencé à se libérer de Babylone .	Amɔ̌ ,xwè ɖěɖee jɛ nukɔn nú 1914 lɛ é mɛ ɔ ,mɛ yí ami dó ɖè lɛ jɛ yeɖesu sí jɛ jí . w16.11 ,wex .
En quel sens	Ebl .115 ,nwt Gbɔn nɛ é
Et pourtant ,pendant plus de 14 ans ,à chaque fois qu’il le pouvait ,Don s’efforçait patiemment de se montrer gentil avec cet homme .	Amɔ̌ ,nú xwè 14 jɛji ɔ ,Don ɖó suúlu bo wà nǔ e wu é kpé é bǐ bo nyɔ́ xomɛ dó nya enɛ e ma ɖó xɔ ta ǎ é wu .
Déjà ,il lui a demandé s’il savait que Dieu avait un nom et il lui a proposé de le lire directement dans la Bible en Psaume 8318 .	Jɛ nukɔn ɔ ,é ɖɔ nú Peter ɖɔ é ka tuùn ɖɔ Mawu ɖó nyikɔ éɖesunɔ tɔn à jí ,lobo byɔ ɛ ɖɔ é ni xà tlɔlɔ sín Biblu mɛ ɖò Ðɛhan 8318 Traduction du monde nouveau mɛ .
Ensuite ,pour montrer pourquoi il s’intéressait à lui ,Don lui a fait lire Romains ,qui explique que tout homme qui invoquera le nom de Jéhovah sera sauvé .	Enɛ gudo ɔ ,Don xlɛ́ nǔ e wu Peter sín nǔ nɔ ɖu ayi mɛ n’i é ,bo xà Hlɔmanu lɛ finɛ tinmɛ ɖɔ mɛɖebǔ ylɔ Jehovah sín nyikɔ ɔ ,mɛ ɔ na gán .
Enfin ,Don a lu Matthieu 936 ,puis a demandé à Peter de le lire dans sa tête .	Gudo mɛ ɔ ,Don xà Matie 936 bo wá byɔ Peter ɖɔ éɖesu ni xà finɛ .
Ils se sont offerts volontairement . . . en Turquie	Ye Zé Yeɖée Jó kpo Jlǒ Kpo — Ðò Turquie
Recherchons les vraies richesses	Ba Dɔkun Jɔ Dɔkun Lɛ
Pleurez avec ceux qui pleurent	Nɔ Ya Avǐ Xá Mɛ E Ðò Avǐ Ya Wɛ Lɛ
Pourquoi louer Yah	Mi Kpa Jah ’ Etɛwu
Qu’il fasse réussir tes projets	É Ni .Bló Bonu Nǔ E A Lin Na Wà lɛ Bǐ Ni Nyí Wiwa
Gagner la bataille menée contre notre esprit	Ðu Ðò Hun E Xò Dó Ayi Towe Tamɛ Wɛ A Ðè É Jí
Questions des lecteurs	Nǔ E Nǔxatɔ́ lɛ Kanbyɔ lɛ É
Environ 2 000 ans plus tard ,en 2014 ,la Turquie a de nouveau été l’objet d’une campagne spéciale de prédication .	Xwè 2 000 mɔ̌ gudo ,enɛ wɛ nyí ɖò 2014 ɔ ,è lɛ́ wá jla wɛnɖagbe ɔ ɖò ali bunɔ ɖé nu ɖò Turquie .
La proportion est donc de 1 proclamateur pour 28 000 personnes .	Enɛ ɖexlɛ́ ɖɔ wɛnjlatɔ́ 1 na jla wɛn ɔ gbɛtɔ́ 28 000 .
Environ 550 frères et sœurs parlant le turc et venant d’autres pays se sont rendus en Turquie pour prêcher avec les proclamateurs locaux .	Nɔví sunnu kpo nɔví nyɔnu kpo ɖěɖee nɔ dó Turquie - gbè bo gosin tò ɖevo lɛ mɛ lɛ é 550 mɔ̌ wɛ sɛ̀ tɛn wá Turquie ,bo jla wɛn ɔ kpo nɔví e ɖò xá ɔ mɛ lɛ é kpo ɖò nùjlajla ɔ hwenu .
Jean - David au centre	Jean - David ɖò tɛntin
Les 550 proclamateurs ont laissé environ 60 000 publications en seulement deux semaines	Mɛ 550 e ɖó alɔ ɖò nùjlajla ɔ mɛ lɛ é má wema 60 000 ɖò aklunɔzán gbla wè kpowun vlamɛ
D’ailleurs ,au cours des 12 mois qui ont suivi la campagne ,le nombre de pionniers permanents en Turquie a augmenté de 24 pour cent .	Nugbǒ ɔ ,ɖò sun 12 e bɔ dó nùjlajla ɔ wu lɛ é mɛ ɔ ,kɛ́n gbexosin - alijitɔ́ e ɖò Turquie lɛ é tɔn jɛji 24 ɖò kanweko jí .
Mais grâce à la campagne spéciale ,à l’exemple des frères locaux et à de nombreuses prières ,j’ai été capable de faire ce que je n’aurais jamais pu faire avant .	Amɔ̌ ,nùjlajla bunɔ ɔ ,kpɔ́ndéwú nɔví xá ɔ mɛ tɔn lɛ tɔn kpo ɖɛ gègě xixo kpo zɔ́n bɔ un kpéwú ,bo nɔ wà nǔ e un ma sixu wà ɖ’ayǐ ǎ é .
Les frères de Turquie veulent réellement faire connaître la vérité au plus de gens possible .	Nɔví e ɖò Turquie lɛ é ba tawun bo na jla nugbǒ ɔ gbɛtɔ́ gègě lee ye kpéwú gbɔn é .
Stéphanie au centre	Stéphanie ɖò tɛntin
Par exemple ,pendant des années ,un petit groupe isolé de 25 proclamateurs n’a compté qu’un seul ancien .	Ði kpɔ́ndéwú ɔ ,kánɖó e jɛ gblolo mɛ bɔ wɛnjlatɔ́ 25 ɖ’emɛ é ɖé ɖò xá ɖé mɛ .
Mais en 2015 ,six renforts venant d’Allemagne et des Pays - Bas ont déménagé pour venir les aider .	Dǒ nukún mɛ bo kpɔ́n awǎjijɛ e wɛnjlatɔ́ enɛ lɛ na ko ɖó ,hwenu e mɛɖéezejotɔ́ ayizɛ́n gosin Allemagne kpo Pays - Bas kpo ɖò 2015 bo wá d’alɔ ye é
C’est formidable d’être en première ligne et de prêcher à tous ces gens qui n’ont jamais entendu parler de la vérité ,dit Rudy ,un frère marié qui a près de 60 ans et qui vient des Pays - Bas .	Rudy ,nɔví sunnu e wlí alɔ bo ɖó xwè 60 mɔ̌ bo sɛ̀ tɛn sín Pays - Bas é ɖɔ Sinsɛnzɔ́ wiwa ɖò fí e hudo sukpɔ́ ɖè é nɔ na mǐ awǎjijɛ e è ma sixu jlɛ́ ǎ é ,ɖó è nɔ jla nugbǒ ɔ mɛ ɖěɖee ma ko sè kpɔ́n gbeɖé ǎ lɛ é gègě .
Voir la brochure Voyez le bon pays ,p .	Kpɔ́n alɔnuwema Voyez le bon pays ,wex .
Les riches sont de plus en plus riches ,et les pauvres de plus en plus pauvres .	Dɔkunnɔ fɔ́n bo ɖò dɔkun jɛ d’eji wɛ ,bɔ wamamɔnɔ fɔ́n bo ɖò wamamɔnɔ nyí d’eji wɛ .
a D’après l’exemple donné par Jésus ,dans quelle situation l’intendant s’est - ​ il retrouvé	a Ninɔmɛ tɛ mɛ nǔjikpɔntɔ́ e xó nùjlɛdonǔwu Jezu tɔn ɖɔ é ka wá mɔ éɖée ɖè
b Quel conseil Jésus a - ​ t - ​ il donné	b Nǔ tɛ Jezu ka byɔ ahwanvu tɔn lɛ
Lire Luc .	Xà Luki .
Quel conseil trouvons - ​ nous en Luc	Wěɖexámɛ tɛ mǐ ka mɔ ɖò Luki mɛ
Lire Luc .	Xà Luki .
a Quel conseil Paul a - ​ t - ​ il donné à Timothée	a Etɛ Pɔlu ka byɔ Timɔtée
Jéhovah bénit les humains qui sont riches en belles œuvres lire 1 Timothée .	Jehovah nɔ dó nú mɛ ɖěɖee nɔ wà nǔ ɖagbe gègě lɛ é .Xà 1 Timɔtée .
Elle a appris l’albanais ,et elle a aidé plus de 60 personnes à progresser jusqu’au baptême .	É kplɔ́n Albanie - gbè ,bo ko d’alɔ gbɛtɔ́ 60 jɛji bɔ ye zé yeɖée jó nú Mawu .
La biographie de Lucia Moussanett est parue dans Réveillez - vous	Lucia Moussanett sín tan gbɛzán tɔn tɔ́n ɖò Reveillez - vous
Bien sûr ,la principale source de consolation ,c’est Jéhovah ,notre Père céleste compatissant lire 2 Corinthiens .	É ɖò wɛn ɖɔ jɔtɛn gbɔdónúmɛ tɔn nukɔntɔn ɔ wɛ nyí Tɔ́ wuvɛ̌sexámɛtɔ́ mǐtɔn jixwé tɔn ɔ Jehovah .Xà 2 Kɔlɛntinu lɛ .
À chaque fois ,la paix de Dieu a vraiment gardé notre cœur et nos facultés mentales lire Philippiens .	Mǐ wà mɔ̌ hweɖebǔnu ɔ ,fífá Mawu tɔn nɔ bló ayixa mǐtɔn kpo linlin mǐtɔn lɛ kpo ɖó . Xà Filipunu lɛ .
Une autre source de consolation pour les endeuillés est la congrégation chrétienne lire 1 Thessaloniciens 511 .	Xà 1 Tɛsalonikinu lɛ 511 .
Les frères et sœurs peuvent apporter une grande consolation à quelqu’un pendant tout le temps qu’il lui faut pour surmonter son deuil lire 1 Thessaloniciens 37 .	Nùx .1717 ,nwt Klisanwun hàtɔ́ lɛ sixu nyí jɔtɛn gbɔdónúmɛ tɔn titewungbe ɖé nú mɛɖé kaka jɛ hwenu e mɛ ɔ na xò wuvɛ̌ ɔ zlɛ é . Xà 1 Tɛsalonikinu lɛ 37 .
Le chagrin d’un endeuillé peut être réveillé par une date anniversaire ,une musique ,une photo ,une activité ,ou même une odeur ,un son ,ou une saison .	Flín ɖɔ xwè kpé xwè nu lɛ ,han ɖé lɛ ,fɔtóo ɖé lɛ ,nǔwiwa ɖé lɛ ,wǎn tawun tawun ɖé abǐ táan xwè ɔ tɔn ɖé sixu lɛ́ bló bɔ ye sè wuvɛ̌ tawun .
La dernière fois que la Bible parle de Joseph ,c’est quand Jésus avait 12 ans .	Azɔn gudo tɔn e è ɖɔ xó dó Jozɛfu wu é wɛ nyí hwenu e Jezu ɖó xwè 12 é .
Voici d’Psaume 317 ,15 5522 Isaïe 5715 6613 Philippiens 413 1 Pierre 57 .	Wemafɔ Biblu tɔn e mɛ gègě mɔ ɖɔ ye nɔ dó gbɔ nú mɛ lɛ é wɛ nyí Ðɛhan 318 ,16 5523 Ezayíi 5715 6613 Filipunu lɛ 413 kpo 1 Piyɛ́ɛ 57 kpo .
Voir aussi l’article Comme Jésus ,consolez les endeuillés dans La Tour de Garde du 1novembre 2010 .	Lɛ̌ kpɔ́n xota ɔ Comme Jésus ,consolez les endeuillés ɖò Atɔxwɛ Flansegbe tɔn 1Novembre 2010 tɔn mɛ .
Conformément à Mika 43 ,les serviteurs de Dieu forge nt leurs épées en socs et leurs lances en cisailles .	Sɔgbe xá Micée 43 ɔ ,togun Mawu tɔn na sɔ́ hwǐ yetɔn dó tun alǐn na ,bo na sɔ́ hwǎn yetɔn dó tun gyankpa na .
du 8 mars 1993 .	Mars 1993 tɔn mɛ .
Pour plus d’informations à ce sujet ,voir La Tour de Garde du 1novembre 2005 ,p . 31 ,et La Tour de Garde du 15 octobre 1983 ,p .	È na tinmɛ ɖevo lɛ dó azɔ̌ e wiwa tɔn na byɔ ɖɔ è ni hɛn tú é jí ɖò Atɔxwɛ Gungbe 1Novembre 2005 tɔn mɛ ,wex .31 kpo Atɔxwɛ Flansegbe tɔn 15 Octobre 1983 tɔn kpo mɛ ,wex .
Watch Tower Bible and Tract Society of Pennsylvania	Watch Tower Bible and Tract Society of Pennsylvania
ASSISTANTS AU MÉMORIAL 2016	MƐ NABI E WÁ FLǏN É 2016
à comprendre que Jéhovah s’intéresse personnellement à toi	lee nǔ towe nɔ ɖu ayi mɛ nú Jehovah gbɔn é na sù nukún towe mɛ gbɛn
a Lorsque Jéhovah secourt ses serviteurs ,de quoi tient - ​ il compte	a Enyi Jehovah na hwlɛn togun tɔn sín tɛnkpɔn lɛ mɛ ɔ ,etɛ é ka nɔ hɛn ayi mɛ
Après le tsunami qui a frappé le Japon en 2011 ,sa femme et lui ont fait l’expérience du pouvoir de soutenir de Jéhovah .	Ye mɔ ɖɔ Jehovah na hlɔnhlɔn emi ɖò jɔhɔn ɖaxó e nyí tsunami bo gbà nǔ ɖò Japon ɖò 2011 é gudo .
Le seul livre qu’ils ont trouvé ,c’est l’Annuaire des Témoins de Jéhovah 2006 .	Wema ɖokpo e ye mɔ é wɛ nyí Annuaire 2006 des Témoins de Jéhovah .
Aussitôt ,Mutsuo a remarqué le titre Le tsunami le plus meurtrier jamais recensé .	Xótala Le tsunami le plus meurtrier jamais recensé jí wɛ nukún Mutsuo tɔn jɛ tlolo .
Il y était question d’un tremblement de terre survenu en 2004 à Sumatra ,et qui avait déclenché le pire tsunami de toute l’Histoire .	É ɖɔ xó dó ayikúngban e danwǔ ɖò Sumatra ɖò 2004 ,bo dɔn tsunami e hu mɛ hugǎn ɖò hwenuxó mɛ é wá é wu .
a Pour bénéficier de l’aide de Dieu ,que devons - ​ nous rejeter	a Bo na dó ɖu lè alɔdo Mawu tɔn tɔn ɔ ,etɛ mǐ ka ɖó na nyì alɔ na
As - ​ tu déjà constaté qu’il y a effectivement plus de bonheur à donner qu’à recevoir ,comme le dit Actes 2035	Nugbǒ taji ɖé wɛ enɛ nyí ɖò gbɛzán gbɛtɔ́ tɔn mɛ .
D’ailleurs ,à l’âge de 12 ans ,il a stupéfié les enseignants du temple par son intelligence et ses réponses à propos de choses spirituelles .	Hwenu e é ɖó xwè 12 é ɔ ,nùnywɛ tɔn kpodo xósin e na wɛ é ɖè dó nǔ gbigbɔ tɔn lɛ wu ɖò Tɛmpli ɔ mɛ lɛ kpan kpaca sɛnkplɔnmɛtɔ́ lɛ . Luk .
En effet ,il aimait parler de son Père céleste aux gens lire Luc 1021 .	Nǔ kplɔnkplɔn mɛ ɖevo lɛ dó Tɔ́ tɔn jixwé tɔn ɔ wu nɔ víví n’i .Xà Luki 1021 .
À 18 ans ,je suis devenu pionnier .	Hwenu e un ɖó xwè 18 é ɔ ,un bɛ́ gbexosin - alijitɔ́zɔ́ .
Ceux qui entreprennent le service à plein temps auront beaucoup de bénédictions voir les paragraphes .	Nyɔna gègě ɖò te kpɔ́n mɛ ɖěɖee byɔ sinsɛnzɔ́ hwebǐnu tɔn mɛ lɛ é Kpɔ́n akpáxwé
Je suis devenu pionnier à 19 ans .	Un wá bɛ́ gbexosin - alijitɔ́zɔ́ hwenu e un ɖó xwè 19 é .
Sois sûr que Jéhovah veut que tu saisisse s fermement un avenir heureux lire 1 Timothée .	A sixu ɖeji ɖɔ Jehovah jló ɖɔ a ni zunfan sɔgudo awǎjijɛnɔ ɖé .Xà 1 Timɔtée .
C’est à nous de la trouver par nous - ​ mêmes .	Nùɖé wɛ bɔ hwiɖesunɔ na ba .
Patientes - ​ tu volontiers	A ka Ðò Gbesisɔmɛ ,Bo Na Ðó Suúlu Bo Nɔte À
La paix de Dieu surpasse toute pensée	Fífá Mawu Tɔn .Hugǎn Nukúnnúmɔjɛnǔmɛ Gbɛtɔ́ Tɔn Bǐ
L’endurance dans les épreuves procure des bienfaits	Tan Gbɛzán TɔDidɛ Ðò Mɛtɛnkpɔn lɛ Nu Nɔ Tɔ́n Kɔ Dó Nyɔna lɛ Mɛ
Comment se dépouiller de la vieille personnalité et ne pas la remettre	Lee Mǐ Na Ðè Gbɛtɔ́ Xóxó ɔ Nyì Ayǐ Bo Sɛ̀ Ɛ Dó Zɔ nú Mǐɖée Gbɔn É
Comment revêtir la personnalité nouvelle et ne pas l’enlever	Lee Mǐ Na Sɔ́ Gbɛtɔ́ Yɔyɔ̌ ɔ Dó ,Bo Ma Na Ðè Nyì Ayǐ Ǎ Gbɔn É
L’amour ,une qualité précieuse	Jijɔ Xɔ Akwɛ Ðé
Questions des lecteurs	Nǔ E Nǔxatɔ́ lɛ Kanbyɔ lɛ É
a En quoi consiste la patience	a Etɛ lɛ suúluɖiɖo ka byɔ
Abraham a patienté volontiers parce qu’il avait foi en Jéhovah lire Hébreux .	Ablaxamu ɖò gbesisɔmɛ bo na nɔte ɖó suúlu tɔn jinjɔn nùɖiɖi e é ɖó nú Jehovah é jí .Xà Eblée lɛ .
D’abord ,à environ 17 ans ,il a été vendu en esclavage par ses frères .	Nukɔntɔn ɔ ,nɔví tɔn lɛ sà ɛ dó kannumɔgbenu hwenu e é ɖó xwè 17 mɔ̌ é .
a Qu’a eu de remarquable la patience de David	a Etɛ ka nyí nǔ nukúnɖeji ɖò suúluɖiɖo Davidi tɔn mɛ
Dans le livre de la Genèse ,15 chapitres sont consacrés à l’histoire d’Abraham .	Wemata Bǐbɛ̌mɛ tɔn 15 mɔ̌ mɛ wɛ è wlan tan Ablaxamu tɔn dó .
De plus ,les rédacteurs des Écritures grecques chrétiennes parlent d’Abraham plus de 70 fois .	Gɔ́ na ɔ ,mɛ ɖěɖee wlan Akpáxwé Biblu Tɔn E È Wlan Dó Glɛkigbe Mɛ É ɖɔ xó dó Ablaxamu wu azɔn 70 jɛji .
a En quoi notre situation pourrait - ​ elle ressembler à celle de Paul	a Nɛ̌ ninɔmɛ mǐtɔn ka sixu cí Pɔlu tɔn ɖɔhun gbɔn
Examinons d’abord ce qu’il a dit en Philippiens lire .	Mi nú mǐ ni ɖɔ xó dó xógbe Pɔlu tɔn ɖěɖee ɖò Filipunu lɛ mɛ é jí .
Donc ,même si un humain ne voit pas de solution à ses problèmes ,Jéhovah en voit une ,et il peut faire l’inimaginable lire 2 Pierre 29 .	Nugbǒ wɛ ɖɔ ,ɖò linlin gbɛtɔ́ tɔn mɛ ɔ ,mǐ sixu mɔ ali ɖé bo tɔ́n sín tagba mǐtɔn lɛ mɛ ǎ ,amɔ̌ ,Jehovah nɔ ɖè ali nú mǐ ,bo sixu wà nǔ e mǐ ma ɖó nukún tɔn ǎ é . Xà 2 Piyɛ́ɛ 29 .
a Qu’a permis l’injustice subie par Paul	a Pɔlu sè wuvɛ̌ nǔagɔwaxámɛ tɔn ɖò Filipu có ,nǔ ɖagbe tɛ lɛ mɛ nǔ e jɛ lɛ é ka tɔ́n kɔ dó
Alors ,quand tu es inquiet ,transforme tes inquiétudes en prières lire 1 Pierre .	Enɛ wu ɔ ,hwenu e mǐ ɖò adohu adohu jí é ɔ ,mǐ ɖó na ɖɔ linkpɔ́n mǐtɔn lɛ dó ɖɛ mɛ .Xà 1 Piyɛ́ɛ .
Jéhovah a envoyé un ange tuer les 185 000 soldats de Sennakérib en une nuit .	É sɛ́ wɛnsagun ɖokpo dó bɔ é sú kún dó nú ahwanfuntɔ́ Senakelibu tɔn 185 000 ɖò zǎn ɖokpo mɛ .
Mais une chose est sûle Dieu qui a fait l’inimaginable pour ses serviteurs du passé est aussi notre Dieu ,Jéhovah lire Isaïe .	Xà Ezayíi .
Watch Tower Bible and Tract Society of Pennsylvania	Watch Tower Bible and Tract Society of Pennsylvania
ASSISTANTS AU MÉMORIAL 2016	MƐ NABI E WÁ FLǏN É 2016
Par Pavel Sivulsky	Mɛ e tɔn wɛ é Pavel Sivulsky
Cette discussion a eu lieu en 1959 ,dans une prison d’Irkoutsk ,en Russie .	Gankpa toxo Irkutsk tɔn ɖé mɛ wɛ mǐ ɖɔ xó enɛ ɖè ɖò 1959 ɖò Russie .
Je suis né en Ukraine en 1933 ,dans le village de Zolotniki .	È jì mì ɖò gletoxo Zolotniki tɔn mɛ ɖò Ukraine ɖò 1933 .
Malheureusement ,en 1939 ,il est tombé gravement malade . Mais avant sa mort ,il a dit à ma mè C’est la vérité .	É blawu ɖɔ ɖò 1939 ɔ ,é bɛ́ azɔn syɛnsyɛn ɖé ,amɔ̌ ,cobonu é na kú ɔ ,é ɖɔ nú nɔ ce ɖɔ Nugbǒ ɔ ɖíe .
Après plus de 6 000 kilomètres en train ,nous sommes arrivés à Touloun ,en Sibérie .	Ee mǐ zɔn pípaan mɛ bo bló kilomɛtlu 6 000 gudo é ɔ ,mǐ wá toxo Touloun tɔn mɛ ɖò Sibérie .
Il avait été condamné à 25 ans de travaux forcés .	È ɖó hwɛ n’i b’ɛ na w’azɔ̌ syɛnsyɛn nú xwè 25 .
Aujourd’hui ,à Touloun ,il y a une congrégation de plus de 100 proclamateurs .	Égbé ɔ ,agun ɖokpo ko ɖò Touloun bo ɖó wɛnjlatɔ́ 100 jɛji .
De 1952 à 1956 ,Maria a séjourné dans un camp de travail près de Gorki aujourd’hui Nijni Novgorod ,en Russie .	Sín 1952 jɛ 1956 ɔ ,è sɔ́ Maria dó yadonumɛkpá ɖé mɛ sɛkpɔ toxo Gorkiy tɔn ee nɔ nyí Nijni Novgorod dìn é ɖò Russie bonu é na w’azɔ̌ syɛnsyɛn .
Sa santé en a souffert ,mais en 1956 ,elle a été libérée et elle est retournée à Touloun .	É sè wuvɛ̌ ɖò lanmɛ tawun ,amɔ̌ ,ɖò 1956 ɔ ,è ɖè è nyite bɔ é tun ta Touloun .
Nous nous sommes mariés en 1957 .	Mǐ wlí alɔ ɖò 1957 .
En 1959 ,j’ai été arrêté parce que j’avais imprimé des publications bibliques .	Ðò 1959 ɔ ,è wlí mì ɖó un zín wema junjɔn Biblu jí lɛ wu .
Dans un camp de travail ,en 1962 .	Hwenu e un ɖò yadonumɛkpá mɛ ɖò 1962 é
Maria et nos filles ,Olga et Irina ,en 1965 .	Maria gɔ́ nú vǐ nyɔnu mǐtɔn Olga kpo Irina kpo ,ɖò 1965
Une fois par an ,Maria me rendait visite à Saransk ,même si cela représentait un aller - retour de 12 jours de train depuis Touloun .	Ðokpo ɖò xwè ɖokpo mɛ ɔ ,Maria nɔ dó hǔn bo nɔ wá ba mì kpɔ́n ɖò Saransk nú è dó pípaan ɔ ,Touloun gigosin kpo kɔlilɛ yì kpo nɔ ɖu azǎn 12 có ,é ka nɔ wà mɔ̌ .
En 1966 ,j’ai été libéré du camp de travail et nous sommes allés vivre à Armavir ,près de la mer Noire .	Ðò 1966 ɔ ,è ɖè mì sín yadonumɛkpá ɔ mɛ ,bɔ mǐ mɛ ɛnɛ lɛ yì toxo Armavir tɔn e sɛkpɔ Xù Wiwi ɔ é mɛ .
En 1978 ,à l’âge de 45 ans ,Maria est de nouveau tombée enceinte .	Ðò 1978 hwenu e Maria ɖó xwè 45 é ɔ ,é lɛ́ mɔ xò ɖevo .
C’est là que ,contrairement aux prédictions des médecins ,Maria a accouché d’un garçon en bonne santé ,Vitaly .	Ðò tallinn ɔ ,nǔ e dotóo ɔ ɖɔ é sɔ́ wá jɛ ǎ bɔ Maria jì vǐ sunnu ɖokpo bɔ lanmɛ tɔn ɖò ganji ,b’ɛ nɔ nyí Vitaly .
Plus tard ,nous avons quitté l’Estonie pour le village de Nezlobnaïa ,dans le sud de la Russie .	Nukɔnmɛ ɔ ,mǐ sɛ̀ tɛn sín Estonie yì Nezlobnaya sín xá ɔ mɛ ɖò tofɔligbé Russie tɔn .
Nous invitions souvent des frères ayant une bonne influence sur eux ,notamment mon frère Grigory ,qui a été surveillant de circonscription de 1970 à 1995 .	Nɔví sunnu ce Grigory ee wà nukúnkpénuwutɔ́ tomɛyitɔ́ sín azɔ̌ sín 1970 yì 1995 é nɔ wá ba mǐ kpɔ́n ɖò gbesisɔmɛ .
À l’arrière ,de gauche àIaroslav ,Pavel ,Vitaly .	Sín amyɔxwé wá yì aɖisixwé ,síYaroslav ,Pavel ,Jr .,Vitaly
À l’Alyona ,Raïa ,Svetlana .	Sín nukɔAlyona ,Raya ,Svetlana
En 1987 ,notre fils Iaroslav est allé vivre à Riga ,en Lettonie ,où il pouvait prêcher plus librement .	Ðò 1987 ɔ ,vǐ sunnu mǐtɔn Yaroslav sɛ̀ tɛn yì toxo Riga tɔn mɛ ɖò Latvia ,finɛ ɔ ,é kpé nǔ wu bo ɖɔ Mawuxó d’eji .
Il n’y avait que 20 proclamateurs sur toute l’île ,et nous vivions à plus de 9 000 kilomètres de là .	Wɛnjlatɔ́ 20 kpowun wɛ ɖò tɔtɛntinto enɛ ɔ bǐ mɛ ,bɔ fí e mǐ nɔ nɔ é ɖó kilomɛtlu 9 000 mɔ̌ dó tɔtɛntinto ɔ .
Pavel est resté à Sakhaline jusqu’en 1995 .	Pavel wà sinsɛnzɔ́ ɖò Sakhalin kaka jɛ 1995 .
Il est devenu pionnier à 14 ans et nous avons eu la joie d’être pionniers ensemble pendant deux ans .	Hwenu e é ɖó xwè 14 é ɔ ,é jɛ gbexosin - alijitɔ́zɔ́ wà jí ,bɔ nyì lɔ wà azɔ̌ enɛ xá ɛ nú xwè wè .
À 19 ans ,Vitaly a quitté la maison pour être pionnier spécial .	Hwenu e Vitaly ɖó xwè 19 é ɔ ,é lɔ yì bo bɛ́ gbexosin - alijitɔ́ titewungbe tɔn sín azɔ̌ .
En 1952 ,un agent du KGB avait dit à Renoncez à votre foi ou vous passerez les dix prochaines années en prison .	Ðò 1952 ɔ ,gan KGB tɔn ɖé ɖɔ nú Maria ɖɔ Gbɛ̌ nùɖiɖi towe ,alǒ a na sɛ̀n gan nú xwè wǒ .
En 1991 ,l’œuvre des Témoins de Jéhovah a été reconnue officiellement .	Ðò 1991 ɔ ,è tuùn azɔ̌ Kúnnuɖetɔ́ Jehovah tɔn lɛ tɔn ɖò sɛ́n lixo .
Ma femme et moi ,en 2011 .	Nyì kpo asì ce kpo ɖò 2011
Malheureusement ,en 2014 ,ma chère Maria est morte .	É blawu ɖɔ asì vívɛ́ ce Maria kú ɖò 2014 .
Avant la chute du l’URSS ,en 1991 ,il y avait à peine plus de 40 000 proclamateurs .	Cobonu Union Soviétique na j’ayǐ ɖò 1991 ɔ ,wɛnjlatɔ́ 40 000 jɛji kpowun wɛ tíìn ɖò finɛ .
Aujourd’hui ,dans les pays qui appartenaient autrefois à l’Union soviétique ,il y en a au total plus de 400 000	Amɔ̌ ,ɖò égbé ɔ ,wɛnjlatɔ́ 400 000 jɛji wɛ ɖò tò e ɖò Union Soviétique mɛ ɖ’ayǐ lɛ é mɛ
J’ai maintenant 83 ans et je suis toujours ancien .	Xwè 83 wɛ un ɖó dìn bo ka lɛ́ kpó ɖò mɛxo agun tɔn nyí wɛ .
En 1939 ,ils étaient 6 000 dans les camps de concentration .	Ðò 1939 ɔ ,ye mɛ 6 000 wɛ è bɛ́ dó yadonumɛkpá ɔ mɛ .
Mais le dimanche 18 décembre 000 Témoins de différentes races d’Afrique du Sud et de pays voisins se sont rassemblés dans le plus grand stade de Johannesbourg pour profiter d’un programme spirituel .	Amɔ̌ ,ɖò Dimanche 18 Décembre 2011 ɔ ,é jiwǔ tawun ɖɔ è mɔ nɔví e ɖó sinmɛ agbaza tɔn vovo ɖò Afrique du Sud lɛ é 78 000 jɛji kpo nɔví e gosin tò e lɛlɛ̌ dó è lɛ é kpo mɛ é ,bɔ ye kplé ɖò anyǔmlímlísafɔtɛn e kló hugǎn ɖò toxo Johannesburg tɔn mɛ é ,bo ɖu vivǐ tuto gbigbɔ tɔn ɖé tɔn .
Voyons deux pratiques mauvaises citéla fornication et l’impureté lire Colossiens .	Mi nú mǐ ni gbéjé hwɛhuhu núwiwa e Pɔlu slɛ́ lɛ é wè kpɔ́n ,ye wɛ nyí agalilɛ kpo nùblibliwiwa kpo . Xà Kolosinu lɛ .
a Comment Paul montre - ​ t - ​ il qu’il faut agir énergiquement pour se dépouiller de la vieille personnalité	a Nɛ̌ xógbe Pɔlu tɔn lɛ ka xlɛ́ ɖɔ mǐ ɖó na dó gǎn tawun cobo ɖè gbɛtɔ́ xóxó ɔ nyì ayǐ gbɔn
À 15 ans ,elle a commencé à coucher avec différents partenaires pour se sentir moins seule .	Sín hwenu e é ɖó xwè 15 é ɔ ,é yí gbè bɔ sunnu vovo lɛ jɛ xó ɖó xá ɛ jí ,bonu é na mɔ tɛn dó vo ɖò mɛɖokponɔ ninɔ sí .
Elle a vécu comme cela jusqu’à ses 23 ans ,l’âge où elle a commencé à étudier la Bible avec les Témoins .	Sakura zán gbɛ̀ gbɔn mɔ̌ kaka jɛ hwenu e é ɖó xwè 23 é .
La meilleure façon de nous protéger de la pornographie ,c’est de renforcer notre amour pour Jéhovah et de haïr le mal lire Psaume 9710 .	Ali ɖagbe hugǎn e nu è sixu jó fɔtóo nùblibliwiwa tɔn kpinkpɔn dó ɖè é wɛ nyí ɖɔ è ni sɔnǔ nú wanyiyi jɔ wanyiyi nú Jehovah ,bo gbɛ́ wǎn nú nǔ e nyla é . Xà Ðɛhan 9710 .
Que s’est - ​ il passé quand Stephen s’est mis à suivre les conseils bibliques	Nɛ̌ nǔ lɛ ka wá yì gbɔn hwenu e Stephen jɛ wěɖexámɛ Biblu tɔn xwedó jí é
Beaucoup qui sont chrétiens aujourd’hui ont dû se dépouiller de ces comportements dangereux avant de pouvoir revêtir la personnalité nouvelle lire Psaume .	Mɛ gègě ɖó na jó walɔ nyanya mɔhun lɛ dó cobo sixu kpéwú bo sɔ́ gbɛtɔ́ yɔyɔ̌ ɔ dó . Xà Ðɛhan .
Prenons l’exemple de Hans ,qui est ancien dans une congrégation d’Autriche .	Mǐ ni ɖɔ xó dó kpɔ́ndéwú Hans ee nyí mɛxo agun tɔn ɖò agun Autriche tɔn ɖé mɛ é wu .
Un jour qu’il était soûl ,il a tué sa petite amie ,et il a été condamné à 20 ans de prison .	É ɖò xomɛsin jí tawun gbè ɖokpo ,ɖó ahan syɛnsyɛn e é nu é wu bo hu nyɔnu xɔ́ntɔn tɔn ,bɔ enɛ wu ɔ ,è ɖó hwɛ n’i ɖɔ é na nɔ ganmɛ nú xwè 20 .
Parmi les textes bibliques qui m’ont encouragé ,il y a Isaïe 557 Que le méchant quitte sa voie ,et 1 Corinthiens 611 ,qui dit à propos de ceux qui ont arrêté de pé Et pourtant c’est là ce qu’étaient certains d’entre vous .	Wemafɔ Biblu tɔn e dó wusyɛn lanmɛ nú mì lɛ é wɛ nyí Ezayíi 557 ,finɛ ɖɔ Mɛdídá lɛ ni jó walɔ nyanya dó ,’ kpo 1 Kɔlɛntinu lɛ 611 ee ɖɔ xó dó mɛ ɖěɖee jó hwɛhuhu sín ali e jí ye ɖè é dó lɛ é wu é kpo ,finɛ ɖɔ Nǔ e mɛɖé lɛ ɖò mi mɛ ,bo ko nyí ɖ’ayǐ ɔ nɛ .
Quand Hans a été libéré après 17 ans et demi d’enfermement ,il était un Témoin de Jéhovah baptisé .	Ee Hans nɔ ganmɛ nú xwè 17 adaɖé gudo é ɔ ,è ɖè è tɔ́n é ko bló baptɛm cobo tɔ́n sín gankpa ɔ mɛ .
Qu’étudierons - ​ nous dans l’article suivant	Etɛ jí mǐ ka na ɖɔ xó dó ɖò xota e bɔ d’ewu é mɛ
a Pourquoi nous est - ​ il possible de revêtir la personnalité nouvelle	a Etɛwu gbɛtɔ́ yɔyɔ̌ ɔ sísɔ́ dó ma ka hugǎn mǐ ǎ
b Quelles qualités de la personnalité nouvelle sont citées en Colossiens	b Akpáxwé gbɛtɔ́ yɔyɔ̌ ɔ tɔn tɛ lɛ xó è ka ɖɔ ɖò Kolosinu lɛ mɛ
Traduction du monde nouveau .	Traduction du monde nouveau mɛ .
a Comment les serviteurs de Jéhovah doivent - ​ ils traiter les autres	a Nɛ̌ Jehovah sɛntɔ́ lɛ ka ɖó na wà nǔ xá mɛ ɖevo lɛ gbɔn
a En quoi consiste le jumelage qui a été mis en place en Afrique du Sud	a Tuto tɛ lɛ è ka bló bo na dó na hlɔnhlɔn bǔninɔ e ɖò togun Mawu tɔn tɛntin é ɖò tò ɖé mɛ
Quand nous leur montrions des versets dans leur bible en portugais ,par exemple Révélation ou Psaume ,29 ,ils étaient très attentifs ,et parfois même avaient les larmes aux yeux .	Enyi mǐ xlɛ́ wemafɔ Biblu tɔn lɛ ye ,ɖi Nǔɖexlɛ́mɛ alǒ Ðɛhan ,29 sín Biblu yetɔn Portugal - gbè tɔn ɔ mɛ ɔ ,ye nɔ ɖó tó te tawun ,bɔ hweɖelɛnu ɔ ,ɖasin tlɛ nɔ wá yì dó ye .
lire Actes .	Mǐ dokú nú Jehovah tawun . Xà Mɛsɛ́dó .
a Pourquoi est - ​ ce important d’avoir la bonne motivation pour revêtir la personnalité nouvelle	a Etɛwu é ka ɖò taji tawun ɖɔ linlin e wu mǐ na sɔ́ gbɛtɔ́ yɔyɔ̌ ɔ dó é ni sɔgbe
b Qu’est - ​ ce qui nous aidera à rester humbles	b Etɛ ka na d’alɔ mǐ bɔ mǐ na sɔ́ mǐɖée hwe
Lire Proverbes 224 .	Xà Nùnywɛxó 224 .
