input	target
Cette revue paraît depuis 1879 .	Sín 1879 wɛ è ko ɖò xójlawema elɔ ɖetɔ́n wɛ .
Un besoin commun à tous 3	Mǐ Bǐ Wɛ Ðó Hudo Gbɔdónúmɛ Tɔn 3
La consolation que Dieu procure 4	Lee Mawu Nɔ Dó Gbɔ nú Mǐ Gbɔn É 4
Consolés en période d’épreuve 6	Gbɔdónúmɛ Ðò Hwenu Wuvɛ̌ Tɔn lɛ Mɛ 6
À Jéhovah appartient la bataille 9	Mawu Mavɔmavɔ Wɛ Nɔ Na Ðuɖeji Mɛ 9
J’étais violent et rempli d’amertume 14	Akpɔ̀ Nɔ Ðó Mì Bɔ Un Nɔ Xò Daka 14
Robert ,Luis ,Raquel et Julian ont trouvé la consolation ,même dans des circonstances éprouvantes .	Robert ,Luis ,Raquel kpo Julian kpo mɔ gbɔdónúmɛ ɖò ninɔmɛ wuvɛ̌ tɔn enɛ lɛ mɛ .
Depuis j’ai retrouvé un travail ,mais nous gardons une vie simple ,en accord avec le conseil de Jésus en Matthieu .	Un wá mɔ azɔ̌ dìn có ,mǐ hɛn gbɛzán mǐtɔn bɔkun sɔgbe kpo wěɖexámɛ Jezu tɔn e ɖò Matie mɛ é kpo .
Une crise économique a réduit à néant 20 ans de dur travail .	É sín akwɛyózó e ɖò tò ɔ mɛ é wu bɔ xwè 20 sín azɔ̌ syɛnsyɛn e mǐ wà é wá huzu nǔ yayǎ .
J’avais l’impression qu’il recollait tous les morceaux de mon cœur .	Un mɔ ɖɔ é na fífá ayi ce .
J’ai suivi le conseil de l’apôtre Paul en Romains 1221 Ne te laisse pas vaincre par le mal ,mais continue à vaincre le mal par le bien .	Un hɛn xó e mɛsɛ́dó Pɔlu ɖɔ ɖò Hlɔmanu lɛ 1221 mɛ é dó ayi mɛ ,é ɖɔ Ma jó hwiɖée dó nú nǔnyanyawiwa ɖu ɖò jǐ towe ó é nyɔ́ wà ɔ ,nɔ wà nǔ ɖagbe dó ɖu ɖò nǔ nyanya jí .
Il m’a montré Ecclésiaste 36 et m’a gentiment dit qu’il y a un temps où il faut se résigner à la perte .	É xlɛ́ mì Nùnywɛtɔ́xó 36 bo ɖɔ nú mì kpo xomɛnyínyɔ́ kpo ɖɔ hwenu e mǐ ɖó na hɛn nǔ bú ’ dó é ɖè .
Il a failli mourir à deux reprises et il est aujourd’hui sous oxygène 16 heures par jour .	Dìn ɔ ,é ɖó na nɔ nɔ jɔhɔn oxygène nu nú ganxixo 16 gbè ɖokpo .
Julian ,qui se bat contre une sclérose en plaques depuis presque 30 ans ,ressent la même chose .	Nǔ cí mɔ̌ nú Julian lɔmɔ̌ ,éyɛ ko ɖò xwi ɖí xá azɔn syɛnsyɛn e nɔ hu agbaza sín wǔjɔnú ɖé lɛ é ɖé wɛ sín ɖibla yì xwè 30 ɖíe .
En adressant des prières à Jéhovah ,ma femme et moi avons ressenti la paix dont parle Philippiens .	É ɖɔ Nyì kpo asì ce kpo mɔ fífá e xó è ɖɔ ɖò Filipunu lɛ mɛ é .
Mais qu’est - ​ ce qu’un jeune homme comme David peut y faire	Amɔ̌ ,etɛ Davidi mɛ e nyí yɔkpɔvu é ka sixu wà dìn
David est - ​ il vraiment un enfant	Davidi ka kpò ɖò yɔkpɔvu nugbǒ à
Alors que nous regardions la vallée ,il nous a fait lire 1 Samuel .	Ee mǐ ɖò tɔdo ɔ mɛ kpɔ́n sɛ́dó wɛ é ɔ ,é ɖɔ mǐ ni xà 1 Samuwɛli .
Dieu va - ​ t - ​ il m’exaucer	Dieu va - t - il m’exaucer
À retrouver sous LA BIBLE ET VOUS QUESTIONS BIBLIQUES .	Zǐn LA BIBLE ET VOUS QUESTIONS BIBLIQUES
Par Adrián De la Fuente	Mɛ E tɔn wɛ É Adrián De la Fuente
J’avais 16 ans quand un ami d’enfance nommé Jorge nous a rendu visite .	Hwenu e un ɖó xwè 16 é ɔ ,Jorge e kpo nyì kpo nyí xɔ́ntɔn ɖò vǔ é wá ba mǐ kpɔ́n ɖò xwégbe .
Le conseil de 1 Corinthiens 1533 m’a aidé .	Wěɖexámɛ e ɖò 1 Kɔlɛntinu lɛ 1533 mɛ é d’alɔ mì .
Un autre passage biblique qui m’a beaucoup touché est Romains .	Wemafɔ Mawuxówema ɔ tɔn ɖevo e wà ɖagbe nú mì é wɛ nyí Hlɔmanu lɛ .
J’ai continué à progresser ,et en 1991 ,je me suis fait baptiser Témoin de Jéhovah .	Un kpò ɖò nukɔn yì wɛ ,bɔ ɖò 1991 ɔ ,un bló baptɛm bo huzu Kúnnuɖetɔ́ Jehovah Tɔn .
J’ai la joie d’être ministre à plein temps depuis 23 ans .	È jɔwu mì bɔ un wà sinsɛnzɔ́ hwebǐnu tɔn sín azɔ̌ nú xwè 23 e wá yì lɛ é .
J’y ai rencontré Claudia ,une jeune chrétienne très dynamique nous nous sommes mariés en 1999 .	Hwenu e un ɖò finɛ é ɔ ,un xò gò Claudia ,ɖyɔvǐ Klisanwun azɔ̌syɛnsyɛnwatɔ́ ɖé wɛ ,bɔ mǐ wlí alɔ ɖò 1999 .
Watch Tower Bible and Tract Society of Pennsylvania	Watch Tower Bible and Tract Society of Pennsylvania
Cette revue paraît depuis 1879 .	Sín 1879 wɛ è ko ɖò xójlawema elɔ ɖetɔ́n wɛ .
C’était l’aspect de la ressemblance de la gloire de Jéhovah Ézékiel .	Susu Mawu Mavɔmavɔ tɔn sín xlɛ̌ wɛ . Ezekiyɛli .
Je contemple les cieux ouverts et le Fils de l’homme debout à la droite de Dieu Actes .	Un mɔ jixwé ɖò hunhun ,bo mɔ Gbɛtɔ́ví ɔ ɖò te ɖò ɖisixwé nú Mawu .’ ​ — Mɛsɛ́dó .
Mille milliers le servaient ,et dix mille fois dix mille se tenaient devant lui Daniel .	Mɛ wɔ̌bliba ɖò te nukɔn tɔn bo na sɛ̀n ɛ . Daniyɛli .
La Bible mentionne les anges plus de 250 fois .	Biblu ɖɔ wɛnsagun lɛ xó hugǎn azɔn 250 .
Tu Jésus as acheté pour Dieu des gens de toute tribu ,et langue ,et peuple ,et nation ,et tu as fait d’eux un royaume et des prêtres pour notre Dieu ,et ils doivent régner sur la terre Révélation .	A sɔ́ ye dó bló axɔsuɖuto ,bo sɔ́ ye dó bló vɔsanúxwlémawutɔ́ lɛ sín axɔsuɖuto na ,bonu ye na wà azɔ̌ nú Mawu mǐtɔn ,bo na ɖu axɔsu dó ayikúngban jí . Nǔɖexlɛ́mɛ .
Les choses anciennes ont disparu Révélation .	É na .súnsún ɖasin bǐ sín nukún yetɔn mɛ kú sɔ́ na tíìn ǎ ,aluwɛ sɔ́ na tíìn ǎ ,alěnina sɔ́ na tíìn ǎ ,wuvɛ̌ mimɔ sɔ́ na tíìn ǎ nǔ xóxó lɛ ko bú .’ ​ — Nǔɖexlɛ́mɛ .
IL Y A plus de 3 000 ans ,le patriarche Job a compris que les oiseaux peuvent nous en apprendre beaucoup sur les œuvres de Dieu .	SÍN xwè 3 000 jɛji ɖíe ɔ ,tɔ́gbó Jɔbu mɔ ɖɔ xɛ lɛ sixu kplɔ́n nǔ gègě mǐ dó nùɖíɖózɔ́ Mawu tɔn wu .
Au printemps ,plus de 300 000 cigognes blanches migrent depuis l’Afrique vers le nord de l’Europe en passant par la vallée du Jourdain .	Ðò Mars alǒ Avril mɛ ɔ ,aɖɔwé 300 000 jɛji wɛ nɔ gosin Aflika yì Totaligbé Elɔpu Tɔn bo nɔ gbɔn Judɛ́ɛn Tɔdo ɔ mɛ dín .
En 1509 ,Lefèvre a publié une étude comparative de cinq versions latines des Psaumes ,dont sa propre version corrigée de la Vulgate .	Ðò 1509 ɔ ,Lefèvre ɖè wema ɖé tɔ́n b’ɛ sɔ́ Ðɛhanwema e ɖò Latɛ́ɛngbe mɛ é vovo atɔ́ɔ́n jlɛ́ dó yeɖée wu ,bɔ Vulgate tɔn e éɖesunɔ jla ɖó é ɖ’emɛ .
Tableau de titres s’appliquant à Dieu dans les Psaumes ,extrait du Quincuplex psalterium ,édition de 1513 .	Akpataxwi e mɛ tɛnmɛ - nyikɔ Mawu tɔn e ɖò Ðɛhanwema mɛ lɛ é ɖè é ,ɖò Fivefold Psalter 1513 tɔn mɛ
Dans ce but ,en juin 1523 ,il a publié une version française des Évangiles en deux volumes au format de poche .	Bo na dó kpé nǔ enɛ wu ɔ ,é ɖè lilɛdogbeɖevomɛ Wɛnɖagbe Wema lɛ tɔn akpomɛ tɔn tɔ́n dó Flansegbe mɛ dó akpáxwé wè jí ɖò Juin 1523 .
Hommes et femmes désiraient tellement lire les paroles de Jésus dans leur langue maternelle que les 1 200 premiers exemplaires ont été écoulés en seulement quelques mois	Jlǒ e sunnu kpo nyɔnu kpo bǐ ɖó bo na xà xó Jezu tɔn lɛ dó anɔnugbe yetɔn mɛ é syɛn sɔmɔ̌ bɔ lilɛdogbeɖevomɛ enɛ 1 200 e è zín ɖò bǐbɛ̌mɛ é vɔ tlolo ɖò sun yɔywɛ ɖé gudo .
En août 1523 ,ils se sont élevés contre la traduction de la Bible dans les langues du peuple et contre les commentaires bibliques ,les considérant comme néfastes à l’Église .	Ðò Août 1523 ɔ ,ye gbɛ́ ɖɔ è kún sɔ́ na lilɛ Biblu ɔ dó gbè ɖevo mɛ ɖě ó ,è kún ka sɔ́ na lɛ́ bló tinmɛ lɛ dó Biblu jí bo ɖetɔ́n dó wema mɛ dó gbè ɖevo mɛ ɖě ó ,lé nǔ enɛ lɛ nyí awovinú nú Sinsɛn ɔ .
Par Bernhard Merten	Mɛ E tɔn wɛ É Bernhard Merten
Je suis né en 1960 ma mère avait alors 17 ans .	Xwè 17 wɛ nɔ ce ɖó bo jì mì ɖò 1960 .
Ma mère et moi vivions avec mes grands - parents à Burg ,une petite ville de l’ex - République démocratique allemande ,ou Allemagne de l’Est .	Nɔ ce kpo nyì kpo nɔ kpɔ́ xá mɛjitɔ́ tɔn lɛ ɖò Burg ,toxo kpɛví République démocratique allemande alǒ Allemagne de l’Est ɖ’ayǐ tɔn tɔn ɖé wɛ .
Finalement ,j’ai été envoyé à l’École pour handicapés de Birkenwerder ,un pensionnat pour enfants handicapés physiques .	Gudo mɛ ɔ ,è wá sɛ́ mì dó Wemaxɔmɛ Wɔ̌nɖowǔnanɔ lɛ Tɔn Birkenwerder Tɔn ,bɔ yɔkpɔvu wɔ̌nɖowǔnanɔ lɛ nɔ nɔ finɛ .
À 14 ans ,j’ai commencé à fumer .	Un jɛ azɔ nu jí hwenu e un ɖó xwè 14 é .
L’examen des prophéties bibliques a progressivement changé mon point de vue sur l’existence de Dieu .	Hwenu e mǐ ɖò nǔɖɔɖ’ayǐ Biblu tɔn lɛ ba dò na wɛ é ɔ ,linlin e un ɖó ɖɔ Mawu ɖě kún tíìn ó é jɛ ɖyɔɖyɔ jí .
Au cours d’une discussion ,nous avons comparé les conditions mondiales actuelles avec les prophéties consignées en Matthieu chapitre 24 ,Luc chapitre 21 et 2 Timothée chapitre 3 .	Ðò Biblu kplɔnkplɔn lɛ ɖokpo hwenu ɔ ,mǐ jlɛ́ ninɔmɛ e mɛ gbɛ̀ ɔ ɖè dìn lɛ é dó nǔɖɔɖ’ayǐ e ɖò Matie wemata 24 ,Luki wemata 21 ,kpo 2 Timɔtée wemata 3 kpo mɛ lɛ é wu .
Le 27 avril 1986 ,je me suis fait baptiser dans une baignoire en secret car ,à cette époque ,l’œuvre des Témoins de Jéhovah était interdite en Allemagne de l’Est .	Bɔ ɖò 27 Avril 1986 ɔ ,un bló baptɛm ɖò nǔglɔ ɖò wǔlɛdo baignoire ɖé mɛ ,ɖó è gbɛ́ Kúnnuɖetɔ́ lɛ sín azɔ̌ hwenɛnu ɖò Allemagne de l’Est wutu .
Mais contre toute attente ,les autorités m’ont permis de voyager en Allemagne de l’Ouest où l’œuvre des Témoins n’était pas interdite .	Un ɖó nukún tɔn ǎ ,bɔ Acɛkpikpa lɛ yí gbè nú mì bɔ un na yì Allemagne de l’Ouest è gbɛ̀ azɔ̌ Kúnnuɖetɔ́ lɛ tɔn ɖò finɛ ǎ .
Après la chute du mur de Berlin ,l’interdiction qui frappait les Témoins de Jéhovah a été levée .	Dǒ Berlin Tɔn j’ayǐ gudo é ɔ ,è yí gbè nú azɔ̌ Kúnnuɖetɔ́ Jehovah Tɔn lɛ tɔn .
J’ai alors voulu m’investir davantage dans l’activité d’évangélisation .	Un ba bo na ɖó alɔ ɖò Mawuxóɖiɖɔzɔ́ ɔ mɛ hú ɖ’ayǐ tɔn .
Mais en 1992 ,en un mois ,j’ai essayé de consacrer 60 heures à proclamer la bonne nouvelle .	Amɔ̌ ,ɖò 1992 ɔ ,un tɛ́n ganxixo 60 zinzan dó ɖɔ Mawuxó na ɖò sun ɖokpo mɛ kpɔ́n .
Dieu a - ​ t - ​ il créé Satan	Dieu a - t - il créé Satan
À retrouver sous LA BIBLE ET VOUS QUESTIONS BIBLIQUES .	Zǐn LA BIBLU ET VOUS QUESTIONS BIBLIQUES
Les sphèun monde qui intrigue 3	Nùkanbyɔ Ðěɖee Kúnkplá Nùɖíɖó Gbigbɔ Tɔn lɛ É 3
Visions de ceux qui peuplent les cieux invisibles 4	Nǔmimɔ lɛ Dó Mɛ E Ðò Jixwé lɛ É Wu 4
Tirons des leçons des oiseaux 8	Xɛ lɛNǔ E Ye Sixu Kplɔ́n Mǐ lɛ É 8
Lefèvre d’Éil voulait que les gens du peuple connaissent la Parole de Dieu 10	Lefèvre d’ÉÉ Ba Ðɔ Gbɛtɔ́ Kpaà lɛ Ni Mɔ Nukúnnú Jɛ Xó Mawu Tɔn Mɛ 10
J’embrasse la vérité sans mains ni bras 13	Un Zunfan Nugbǒ Biblu Tɔn Alɔ kpo Awa kpo Mɛvo 13
Jéhovah se soucie de toi	Jehovah Ðò Nukún Kpé Dó Mi Wu Wɛ
Reconnaissons en Jéhovah notre Potier	Sɔ́ Jehovah Dó Ðó Zɛ̌nmɛtɔ́ Towe
Te laisses - ​ tu façonner par le Grand Potier	A ka Nɔ Yí Gbè Bɔ Zɛ̌nmɛtɔ́ Ðaxó ɔ Nɔ W’azɔ̌ Ðò Wǔ We À
Questions des lecteurs	Nǔ E Nǔxatɔ́ lɛ Kanbyɔ lɛ É
Jéhovah notre Dieu est un seul Jéhovah	Jehovah Mawu Mǐtɔn ɔ ,Jehovah Ðokpo Wɛ
Ne laisse pas les imperfections des autres te faire trébucher	Nùwanyido Mɛ Ðevo lɛ Tɔn Ni Ma Nyí Afɔklɛ́nnú nú We Ó
Une qualité divine plus précieuse qu’un diamant	Jijɔ Mawu Tɔn Ee Xɔ Akwɛ Hú Diamáa É Ðé
Vous en souvenez - ​ vous	A ka Flín À
Il examine le cœur ,la personne intérieure lire 1 Samuel 167b .	É nyɔ́ wà ɔ ,ayi mɛ wɛ é nɔ kpɔ́n ,é wɛ nyí ɖɔ nǔ e è nyí ɖò xomɛ é .Xà 1 Samuwɛli 167b .
Voyons l’exemple de Michael .	Lin tamɛ dó nya e nɔ nyí Michael é sín kpɔ́ndéwú jí .
a Que nous enseigne Jéhovah aujourd’hui	Nɛ̌ Jehovah ka ɖò mǐ kplɔ́n wɛ gbɔn ɖò égbé
Tel un habile potier ,Jéhovah connaît la qualité de l ’ argile qu’il a devant lui ,et la modèle en conséquence lire Psaume .	Ði zɛ̌nmɛtɔ́ alɔsekpɛ́nnanɔ ɖé ɖɔhun ɔ ,Jehovah tuùn ko alɔkpa e ɖò asá tɔn mɛ é ,lobo nɔ w’azɔ̌ ɖ’ewu lee é jɛ gbɔn é .Xà Ðɛhan .
De même ,notre Potier nous travaille attentivement et patiemment ,nous modelant par ses conseils et observant notre réaction lire Psaume 328 .	Xà Ðɛhan 328 .
Aujourd’hui ,les vrais adorateurs reconnaissent en Jéhovah le Souverain de l’univers ,celui qui a autorité pour modeler les peuples et les nations lire Jérémie 186 .	Xà Jelemíi 186 .
Comment cultiver les qualités qui nous aident à rester souples et soumis	Nɛ̌ mǐ ka sixu tɛnkpɔn bo ɖó jijɔ ɖěɖee na d’alɔ mǐ bɔ mǐ na bɔ bo hwíhwɛ́ mǐɖée é gbɔn
Comment les parents chrétiens peuvent - ​ ils se soumettre à Dieu en ce qui concerne le modelage de leurs enfants	Nɛ̌ mɛjitɔ́ Klisanwun lɛ ka sixu hwíhwɛ́ yeɖée dó Mawu glɔ hwenu e ye ɖò azɔ̌ wà ɖò vǐ yetɔn lɛ wu wɛ é gbɔn
Plus que toute autre chose qu’on doit garder ,préserve ton cœur ,car de lui viennent les sources de la vie ,déclare Proverbes 423 .	Hɛn ayi towe hú nǔ bǐ ,ɖó fí e gbɛ̀ towe sín azinkan ɖè ɔ nɛ ,wɛ Nùnywɛxó 423 ɖɔ .
Ouzziya ,roi de Juda ,a manifesté de l’orgueil lire 2 Chroniques ,.	Judáa xɔsu Oziyasi wà nǔ kpo goyiyi kpo .Xà 2 Tan ,.
Considérons le cas de Jim ,un ancien qui était en désaccord avec les autres anciens de sa congrégation sur une certaine question .	Lin tamɛ dó mɛxo agun tɔn e nɔ nyí Jim ,bo ma ɖó gbè kpɔ́ xá mɛxo agun tɔn hàtɔ́ tɔn lɛ dó agun ɔ sín xó ɖé wu ǎ é sín kpɔ́ndéwú jí .
a Comment l’exemple des Israélites montre - ​ t - ​ il que le manque de foi endurcit le cœur	a Nɛ̌ Izlayɛli - ví hwexónu tɔn lɛ sín kpɔ́ndéwú ka xlɛ́ lee nǔmaɖi nɔ hɛn nǔ gblé dó mɛ wu gbɔn é gbɔn
Nous pourrions analyser notre façon de considérer les paroles de Jésus en Matthieu 633 .	Ði kpɔ́ndéwú ɔ ,mǐ sixu ba dò nú nǔ e mǐ nɔ lin dó xó e Jezu ɖɔ ɖò Matie 633 mɛ é wu é .
Tire profit des dispositions de Dieu pour t’aider à rester malléable voir paragraphes .	Zǎn nǔ e Mawu sɔnǔ na lɛ é bo dó nɔ bibɔ jí tɛgbɛ Kpɔ́n akpáxwé
Jim ,mentionné précédemment ,a commencé à s’adoucir lorsqu’un ancien s’est intéressé à lui .	Jim e xó mǐ ɖɔ wá yì é jɛ sìn dó walɔ tɔn jí jí hwenu e mɛxo agun tɔn ɖé sɔ́ ayi ɖó jǐ tɔn bo d’alɔ ɛ é .
Nous sommes l’argile ,et tu es notre Potier nous sommes tous l’œuvre de ta main .	Mǐdɛɛ lɛ ɔ ,ko wɛ mǐ nyí ,hwi wɛ ka nyí zɛ̌nmɛtɔ́ ɔ mǐ bǐ wɛ nyí alɔ towe nǔwiwa .
Cette prophétie a été énoncée en 612 av . n . è .	Xwè 612 J.H.M .wɛ è ɖɔ nǔɖɔɖ’ayǐ enɛ ,bɔ jijɛ tɔn nukɔntɔn ɔ wɛ nyí kún e ahwangɔnu Babilɔnu tɔn sú dó nú Jeluzalɛmu é xwè atɔ́ɔ́n gudo kpowun jɛn nǔ enɛ jɛ .
Selon Matthieu ,c’est Jésus qui juge les gens .	Sɔgbe kpo nǔ e è ɖɔ ɖò Matie mɛ é kpo ɔ ,Jezu wɛ nyí mɛ e nɔ ɖɔhwɛ xá togun lɛ é .
a Pourquoi les paroles de Deutéronome 64 sont - ​ elles connues	a Etɛwu è ka tuùn xó e ɖò Sɛ́nflínmɛ 64 mɛ lɛ é ganji
DEPUIS des siècles ,les six mots du texte hébraïque de Deutéronome 64 sont prononcés par les personnes de confession juive dans une prière de dévotion .	SINSƐN Jwifu lɛ tɔn ko zán xókwin Ebléegbe tɔn ayizɛ́n e ɖò Sɛ́nflínmɛ 64 mɛ lɛ é nú xwè kanweko mɔkpan ,b’ɛ nyí ɖɛ sinsɛn - biblo tɔn sín akpáxwé ɖé .
Ces paroles font partie du discours d’adieu de Moïse à la nation d’Israël rassemblée dans les plaines de Moab en 1473 av . n . è .	Xókwin enɛ lɛ tɔ́n ɖò xó gudogudo tɔn e Mɔyizi ɖɔ nú togun Izlayɛli tɔn e kplé ɖò ayikúngban wɛnjɛ Mɔwabu tɔn jí ɖò 1473 J.H.M .é mɛ .
Et que signifient pour nous aujourd’hui les paroles de Deutéronome	Etɛ xó e ɖò Sɛ́nflínmɛ mɛ é ka kplɔ́n mǐ ɖò égbé
a Que veut Jéhovah de ses adorateurs	a Etɛ Jehovah ka byɔ ɖò mɛsɛntɔ́ tɔn lɛ sí
C’est précisément ce que Jésus Christ a dit à un homme venu l’interroger lire Marc .	Xósin e Jezu Klisu tlɛ na nya e kàn nǔ byɔ ɛ é ɖé é nɛ .Xà Maki .
a Que signifie adorer Jéhovah de façon exclusive	a Ali tɛ nu mǐ ka nɔ sɛ̀n Jehovah kɛɖɛ ɖè
Il est le seul que l’on doit adorer lire Révélation 411 .	Jehovah kɛɖɛ wɛ è ɖó na sɛ̀n . Xà Nǔɖexlɛ́mɛ 411 .
De quoi pourrait - ​ il s’agir	Etɛ nǔ mɔhun lɛ ka sixu nyí
Colossiens 35 lire donne aux chrétiens un conseil vigoureux concernant ce qui pourrait rompre leur relation exclusive avec Jéhovah .	Ðò Kolosinu lɛ 35 xà mɛ ɔ ,mǐ mɔ wěɖexámɛ syɛnsyɛn ɖé dó nǔ e sixu zɔ́n bɔ kancica e ɖò Klisanwun lɛ kpo Jehovah kpo tɛntin é gblé é wu .
L’apôtre Paul a donc jugé bon de leur rappeler que les chrétiens ont un seul Dieu ,Jéhovah lire 1 Corinthiens .	Mɛsɛ́dó Pɔlu mɔ ɖɔ é jɛxa ɖɔ è ni flín ye ɖɔ Mawu ɖokpo wɛ Klisanwun lɛ ɖó ,é wɛ nyí Jehovah . Xà 1 Kɔlɛntinu lɛ .
a Quels conseils sont donnés en Éphésiens	a Wěɖexámɛ tɛ ka ɖò Efɛzinu lɛ mɛ
Chacun de nous doit considérer qu’il est de sa responsabilité de contribuer à entretenir l’unité de la congrégation .	Mǐ mɛ ɖokpo ɖokpo ɖó na nɔ mɔ ɖɔ azɔ̌ mǐtɔn wɛ é nyí ɖɔ mǐ ni wà nǔ bonu buténinɔ agun ɔ tɔn ni nɔte .
Watch Tower Bible and Tract Society of Pennsylvania	Watch Tower Bible and Tract Society of Pennsylvania
Les côtes de la Trinité et de Tobago comptent de nombreux villages de pêcheurs .	Gletoxo e mɛ è nɔ hu hwe ɖè é gègě wɛ gbɔn xutó Trinité - et - Tobago tɔn lɛ .
ASSISTANTS AU MÉMORIAL 2015	MƐ NABI E WÁ FLǏN É 2015
En 1914 ,au début des derniers jours du système actuel ,les serviteurs de Dieu sur terre étaient relativement peu nombreux .	Hwenu e azǎn gudogudo tɔn gbɛ̀ elɔ tɔn lɛ bɛ́ ɖò 1914 é ɔ ,Mawu sɛntɔ́ nugbǒ lɛ kpɛɖé jɛn ɖò ayikúngban jí .
À elle seule ,la Seconde Guerre mondiale a fait 55 millions de morts .	Ði kpɔ́ndéwú ɔ ,gbɛtɔ́ livi 55 mɔ̌ wɛ Wɛkɛ Hwan Wegɔ ɔ kɔ́kɔ́ɖɔ́kɔ́ hu .
Mais les Témoins de Jéhovah n’ont pas pris part à ce massacre planétaire lire Mika .	Amɔ̌ ,Kúnnuɖetɔ́ Jehovah Tɔn lɛ ɖ’alɔ ɖò kún e è sú dó nú mɛ gbɔn gbɛ̀ ɔ bǐ mɛ mɔ̌ é mɛ ǎ .Xà Micée .
Judas Iscariote était l’un d’eux .	Judasi Isikaliɔti ɖò ye mɛ .
a Pourquoi devrions - ​ nous être patients les uns envers les autres	a Etɛwu mǐ ka ɖó na nɔ ɖó suúlu dó mǐɖée lɛ wu
Si nous nous apercevons que nous avons offensé quelqu’un ,la Bible nous demande d’aller voir la personne et d’essayer de résoudre la situation lire Matthieu .	Xà Matie .
Colossiens 313 Continuez à vous supporter les uns les autres et à vous pardonner volontiers les uns aux autres ,si quelqu’un a un sujet de plainte contre un autre .	Kolosinu lɛ 313 byɔ mǐ ɖɔ Mi nɔ mɔ miɖée gbɔ enyi mɛɖé wà nǔ nyì dò nú mɛɖé ɖò mi mɛ hweɖebǔnu hǔn ,mi nɔ sɔ́ kɛ miɖée .
L’amour chrétien ne tient pas compte du mal subi ,fait remarquer 1 Corinthiens 135 .	Wanyiyi Klisanwun tɔn nɔ lɛ́ hɛn mɛ dó xomɛ ǎ ,wɛ 1 Kɔlɛntinu lɛ 135 ɖɔ .
Assurément ,face aux imperfections des autres ,la conduite chrétienne est d’imiter la miséricorde que notre Père nous témoigne quand nous faisons des erreurs lire Psaume .	Nugbǒ ɔ ,hwenu e mǐ jló na ɖeɖɛ nùwanyido mɛ ɖevo lɛ tɔn é ɔ ,lee mǐ na wà nǔ Klisanwun ɖɔhun gbɔn é wɛ nyí ɖɔ ,mǐ na xwedó lee Tɔ́ mǐtɔn nùblawukúnúmɛtɔ́ ɔ nɔ wà nǔ xá mǐ gbɔn hwenu mǐ hu hwɛ é sín kpɔ́ndéwú . Xà Ðɛhan .
On lit en Proverbes Heureux l’homme qui a trouvé la sagesse ,et l’homme qui obtient le discernement ,car mieux vaut l’avoir comme gain que d’avoir comme gain de l’argent ,et mieux vaut l’avoir comme produit que d’avoir de l’or .	Nùnywɛxó ɖɔ jí Nǔ nyɔ́ nú mɛ e huzu nùnywɛtɔ́ é
L’exemple de Gagik l’illustre bien .	Kpɔ́ndéwú Gagik tɔn ɖè enɛ xlɛ́ céɖécéɖé .
Ils se sont offerts volontairement . . . au Ghana	Ye Zé Yeɖée Jó Kpo JlǒÐò Ghana
Cherche le Royaume ,pas les choses matérielles	Ba Axɔsuɖuto ɔ ,Ni Ma Nyí Nǔ lɛ Ó
Réfléchis aux paroles encourageantes de Jésus en Matthieu ,qui font partie du Sermon sur la montagne .	Lin tamɛ dó wusyɛn dó lanmɛ nú mɛ sín xó Jezu tɔn e ɖò Matie mɛ ,b’ɛ ɖɔ ɖò Xóɖiɖɔ Só Jí Tɔn ɔ hwenu é jí .
Pourquoi devons - ​ nous veiller	Etɛwu Mǐ ka Ðó Na Nɔ Acéjí
N’aie pas peur . Moi ,je t’aiderai	Ma Ði Xɛsi Ó ,Un Na Gɔ́ Alɔ nú We
Reconnaissants pour la faveur imméritée de Dieu	Fɛ́nú Mawu Tɔn Nɔ Sù Nukún Mǐtɔn Mɛ
Répands la bonne nouvelle de la faveur imméritée	Jla Wɛnɖagbe Fɛ́nú Mawu Tɔn Tɔn
Questions des lecteurs	Nǔ E Nǔxatɔ́ lɛ Kanbyɔ lɛ É
En 2004 ,un couple de pionniers servant au Bélize m’a invitée à venir prêcher avec eux pendant un mois .	Ðò 2004 ɔ ,asú kpo asì kpo e ɖò sinsɛnzɔ́ wà wɛ ɖò Bélize é ɖé ylɔ mì ɖɔ má wá wà gbexosin - alijitɔ́zɔ́ xá emi nú sun ɖokpo .
Il y a quelques années ,Stephanie ,qui a aujourd’hui presque 30 ans et vient aussi des États - Unis ,s’est dit ,après avoir analysé Je suis en bonne santé et je n’ai aucune obligation familiale .	Xwè ɖé lɛ ɖíe ɔ ,Stephanie e ko ɖibla ɖó xwè 30 dìn ,bɔ é lɔ gosin États - Unis é gbéjé ninɔmɛ tɔn kpɔ́n ganji bo lin ɖɔ Lanmɛ ce ɖò ganji bɔ xwédo sín agban ɖé ka ɖò kɔ ce ǎ .
En 2008 ,ils se sont installés au Ghana ,où ils sont restés plus de trois ans .	Ðò 2008 ɔ ,ye sɛ̀ tɛn yì Ghana bo wà sinsɛnzɔ́ ɖò finɛ nú nǔ hú xwè atɔn .
En 2005 ,après le passage de l’ouragan Katrina ,le couple a participé à des opérations de secours .	Ðò 2005 ɔ ,ye yì d’alɔ mɛ lɛ hwenu e Jɔhɔn Ðaxó Katrina gbà nǔ é .
En 2012 ,ils sont partis au Ghana et ont pu y rester quatre mois pour aider une congrégation de langue des signes .	Ðò 2012 ɔ ,ye yì Ghana bo wà sinsɛnzɔ́ ɖò dɔ̌n nú sun ɛnɛ ,lobo d’alɔ agun tokunɔgbe tɔn ɖé .
Ces décisions leur ont permis de s’installer au Ghana en 2004 .	Gbeta enɛ lɛ e kɔn ye wá é zɔ́n bɔ ye sɛ̀ tɛn yì Ghana ɖò 2004 .
En 2014 ,Stephanie a épousé Aaron ,et aujourd’hui ils servent tous les deux à la filiale du Ghana .	Ðò 2014 ɔ ,Stephanie kpo Aaron kpo wlí alɔ ,bɔ égbé dìn ɔ ,ye nɔ wà sinsɛnzɔ́ ɖò alaxɔ Ghana tɔn mɛ .
J’enseignais un jeune homme prénommé Michael .	Filip ɖɔ Un kplɔ́n nú xá nyaví ɖé b’ɛ nɔ nyí Michael .
Ils aident ainsi certains des plus de 300 proclamateurs et étudiants sourds du pays .	Ye ɖò tokunɔgbe sín agun ɖé mɛ bo nɔ d’alɔ tokunɔ wɛnjlatɔ́ kpo jlǒɖotɔ́ kpo 300 jɛji e ɖò tò ɔ mɛ é ɖé lɛ .
Tout comme les 17 frères et sœurs renforts venus y prêcher ,des milliers d’évangélisateurs dans le monde s’offr ent volontairement ,motivés par l’amour pour Jéhovah .	Ði lee é nyí gbɔn nú mɛ 17 e sɛ̀ tɛn yì Ghana bo nɔ d’alɔ ɖò fí e hudo sukpɔ́ ɖè lɛ é ɖɔhun ɔ ,wǎn yí nú Jehovah ko sísɛ́ wɛnɖagbejlatɔ́ afatɔ́n mɔkpan gbɔn gbɛ̀ ɔ bǐ mɛ bɔ ye zé yeɖée jó kpo jlǒ kpo .
dans nos numéros du 15 avril et du 15 décembre 2009 .	kpo . Atɔxwɛ Gungbe Lidosun 15 kpo Woosun tɔn kpo .
En Éphésiens 27 ,on lit que Dieu démontrerait sa faveur imméritée dans les systèmes de choses à venir .	Ðò Efɛzinu lɛ 27 mɛ ɔ ,mǐ xà ɖɔ Mawu na ɖè fɛ́nú tɔn xlɛ́ ɖò ayǐ e na wá hɔ́n ɖò sɔgudo lɛ ɔ mɛ .
Watch Tower Bible and Tract Society of Pennsylvania	Watch Tower Bible and Tract Society of Pennsylvania
ASSISTANTS AU MÉMORIAL 2015	MƐ NABI E WÁ FLǏN É 2015
Qu’est - ​ ce que le matérialisme	Etɛ ka nɔ nyí nukúnkɛ́ndídó
Qu’est - ​ ce que le matérialisme	Etɛ ka nɔ nyí nukúnkɛ́ndídó
Lire Matthieu 625 .	Xà Matie 625 .
Si nous n’avons pas les moyens de nous procurer ces choses ,n’est - ​ il pas naturel de nous inquiéter	Enyi ɖěwagbɛn bo mɔ nǔ enɛ lɛ glo ɔ ,ado na hu mǐ à cé
Lire Matthieu 626 .	Xà Matie 626 .
Qu’est - ​ ce qui prouve que nous valons plus que les oiseaux du ciel	Etɛ ka ɖexlɛ́ ɖɔ mǐ xɔ akwɛ hú xɛ lɛ
Lire Matthieu 627 .	Xà Matie 627 .
a Quelle leçon tirons - ​ nous de la façon dont Jéhovah s’occupe des lis des champs	a Etɛ lee Jehovah nɔ kpé nukún dó folowa gbehan mɛ tɔn lɛ wu gbɔn é ka kplɔ́n mǐ
Lire Matthieu .	Xà Matie .
Lire Matthieu .	Xà Matie .
Lire Matthieu 633 .	Xà Matie 633 .
Lire Matthieu 634 .	Xà Matie 634 .
Nous n’aurons alors jamais à nous inquiéter de nos besoins .	Mɔ̌ mɛ ɔ ,ado na nɔ hu mǐ dó hudo agbaza tɔn mǐtɔn lɛ wu gbeɖé ǎ .
Voir l’encadré Comment monter un budget ,dans Réveillez - vous	Kpɔ́n gbàví Comment monter un budget ɖò Réveillez - vous
de juillet 2010 ,p .	Juillet 2010 tɔn mɛ ,wex .
De quel évènement s’agit - ​ il	Etɛ ka nyí nǔ ɔ
Elle ne sera pas en retard lire Habaqouq .	Xà Xabakuku .
Un exemple tiré de l’histoire antique nous enseigne l’importance de veiller .	Nǔ e jɛ hwexónu lɛ é sixu kplɔ́n nùɖé mǐ dó nǔ e wu acéjíninɔ ɖò taji é wu .
Aujourd’hui ,qu’est - ​ ce que la plupart des humains ne savent pas	Etɛ mɛ mɛ gègě ma ka mɔ nukún jɛ ɖò égbé ǎ
