input	target
Uko turushaho gukunda Imana ,ni ko turushaho kuyizera ,atari ukwizera ko ibaho gusa ,ahubwo nanone tukizera ko igororera abo ikunda . Soma mu Baheburayo 116 .	Bǎ e mɛ mǐ yí wǎn nú Mawu ɖó é wɛ nùɖiɖi mǐtɔn nɔ lidǒ ɖó mǐ ka ɖi nǔ ɖɔ é tíìn kɛɖɛ wɛ ǎ ,loɔ ,mǐ lɛ́ ɖi nǔ ɖɔ é nɔ d’ajɔ mɛ e é yí wǎn na lɛ é jɛn wɛ . Xà Eblée lɛ 116 .
Ni irihe sezerano riboneka muri Malaki 310	Akpá tɛ ka ɖò Malacíi 310 mɛ
Kuki dushobora kwiringira amagambo ya Yesu ari muri Matayo 633	Etɛwu mǐ ka sixu ɖeji dó ganjɛwu e Jezu na mɛ ɖò Matie 633 mɛ é wu
Soma muri Matayo 633 .	Xà Matie 633 .
Twiringira tudashidikanya ko Yehova aha agaciro ibyo dukora byose kugira ngo dukomeze kumubera indahemuka . Soma mu Baheburayo .	Mǐ sixu ɖeji bǐ mlɛ́mlɛ́ ɖɔ Jehovah nɔ ɖ’ayi nǔ e mɛsɛntɔ́ tɔn lɛ nɔ wà bo na nɔ gbeji n’i lɛ é wu . Xà Eblée lɛ .
Ni irihe humure dusanga muri 1 Yohana	Gbɔdónúmɛ tɛ mǐ ka mɔ ɖò 1 Jaan mɛ
Soma muri 1 Yohana .	Xà 1 Jaan .
Afite imyaka 70 kandi arwaye indwara ikomeye y’uruti rw’umugongo .	Lɛ̌vɔ lin tamɛ kpɔ́n dó Paula e ɖó xwè 70 bo nɔ nɔ Canada ,lobɔ kplibɔzɔn ɖò ya dó na wɛ syɛnsyɛn é sín kpɔ́ndéwú jí .
Twiringiye tudashidikanya ko Yehova azaduha ingororano ikwiriye . Soma mu Bakolosayi .	Mǐ sixu bló mɔ̌ ,bo tuùn ɖɔ ɖɔ Jehovah wɛ na na mǐ ajɔ e mǐ jɛxa é . Xà Kolosinu lɛ .
Kuki dushobora kuvuga ko ‘ twapfuye ku cyaha ’	Etɛwu mǐ ka sixu ɖɔ ɖɔ mǐ ko kú ɖò hwɛhuhu sín alixo
Ku bw’ibyo ,ntitugomba gukomeza guhangayikishwa n’amakosa Imana yatubabariye .	Enɛ wu ɔ ,mǐ ɖó hwɛjijɔ ɖebǔ bo na nɔ ɖò hwɛ e Mawu ko sɔ́ kɛ mǐ lɛ é flín wɛ gbɛmɛ kpowun ǎ .
a Ni iki kidufasha gusobanukirwa ibivugwa mu Baroma 512	a Etɛ ka tá weziza dó tinmɛ Hlɔmanu lɛ 512 tɔn jí
b ‘ Ubuntu butagereranywa ’ buvugwa mu Baroma 324 ,busobanura iki	b Etɛ ka nyí fɛ́nú e xó è ɖɔ ɖò Hlɔmanu lɛ 324 mɛ é
Yehova azambabarira .	Jehovah na sɔ́ kɛ mì .
Soma muri Yuda 4 .	Xà Judi 4 .
Soma mu Baroma .	Xà Hlɔmanu lɛ .
Soma mu Baroma .	Xà Hlɔmanu lɛ .
Soma mu Migani 145 Abefeso 425 .	Xà Nùnywɛxó 145 Efɛzinu lɛ 425 .
ESE wigeze usoma mu Baroma ,mu gihe cy’Urwibutso rw’urupfu rwa Yesu ruba buri mwaka	A KA ko xà Hlɔmanu lɛ ɖó kú Jezu tɔn sín nǔwiwa xwewu xwewu tɔn wutu à
Ariko se ibivugwa mu Baroma igice cya 8 bireba gusa abasutsweho umwuka ,cyangwa nanone bireba Abakristo bafite ibyiringiro byo kuzaba ku isi	Alǒ é lɛ́vɔ kàn Klisanwun e ɖò nukún ɖó wɛ bá nɔ gbɛ̀ ɖò ayikúngban jí lɛ é
Soma mu Baroma .	Xà Hlɔmanu lɛ .
Bityo rero ,inama ziboneka mu Baroma igice cya 8 zishobora kubagirira akamaro .	Enɛ wu ɔ ,wěɖexámɛ e è na hwɛjijɔnɔ lɛ ɖò Hlɔmanu lɛ wemata 8gɔ́ ɔ mɛ é sixu hɛn lè wá nú ye .
Ibivugwa mu Baroma 821 byagombye gutuma twibaza iki	Nùkanbyɔ tɛ jí Hlɔmanu lɛ 821 ka ɖó na sísɛ́ mǐ bɔ mǐ na lin tamɛ kpɔ́n dó
Ni ikihe kibazo gikomeye Pawulo yagaragaje mu Baroma	Ðò Hlɔmanu lɛ mɛ ɔ ,nǔ titewungbe tɛ jí Pɔlu ka ɖɔ xó dó
Soma mu Baroma .	Xà Hlɔmanu lɛ .
b Mu Baroma ,Pawulo yakoresheje ijambo umubiri ashaka kuvuga iki	Etɛ ka nyí tinmɛ xógbe hwɛhuhu sín ninɔmɛ e Pɔlu zán ɖò Hlɔmanu lɛ mɛ é tɔn
Ni iki amagambo ya Pawulo ari mu Baroma 86 aterekezaho	Etɛ lɛ akpágbánúmɛ Pɔlu tɔn e ɖò Hlɔmanu lɛ 86 mɛ é ma ka kàn ǎ
Reba paragarafu ya 10 n’iya 11	Kpɔ́n akpáxwé 10 kpo 11 kpo
a Pawulo yaduteye inkunga yo guhoza ubwenge ku ki	a Enyi è ma jló na sɔ́ ayi ɖó hwɛhuhu sín ninɔmɛ e mǐ ɖó é jí ǎ ɔ ,etɛ è ka sixu bló
Soma mu Byakozwe ,.	Xà Mɛsɛ́dó ,.
Abakristo b’i Roma bagombaga kumwigana kandi natwe ni uko . Rom .	Hlɔmanu lɛ ɖó na wà nǔ éɖɔhun ,bɔ mɔ̌ wɛ mǐ lɔ ɖó na wà é nɛ . Hlɔ .
Mu Baroma 86 havuga ko ‘ guhoza ubwenge ku bintu by’umwuka bizana ubuzima n’amahoro .	Xósin e Hlɔmanu lɛ 86 na é ɖò wɛ Ayixa mɛtɔn .ɖò gbigbɔ ɔ sín nǔ lɛ jí ɔ ,é nɔ kplá mɛ bɔ è nɔ mɔ gbɛ̀ ,bo nɔ mɔ fífá .
Umuhanuzi Yesaya yaravuze ati ‘ umuntu w’umutima ushikamye Yehova azamurindira mu mahoro ahoraho ,kuko ari we yiringiye . ’ — Yes 263 soma mu Baroma 51 .	Ezayíi wlan xógbe ɖé lɛ bɔ ye sɔgbe xá hwetɔnnu ,bo ka nɔ lɛ́vɔ jɛ ɖò ali e gbló ada hú mɔ̌ é ɖé nu ɖò égbé Mawu ,mɛ e ɖeji dó wǔ we kpo ayi tɔn bǐ kpo ,bo ma nɔ huzu ǎ ɔ ,a nɔ na ɛ ayi jɛ ayǐ . Eza .263 xà Hlɔmanu lɛ 51 .
Kuki wishimira inama iboneka mu Baroma igice cya 8	Etɛwu a ka na dokú nú Mawu nú wěɖexámɛ e ɖò Hlɔmanu lɛ wemata 8gɔ́ ɔ mɛ é
Bityo rero ,twaba twarasutsweho umwuka cyangwa dufite ibyiringiro byo kuzaba ku isi izahinduka paradizo ,inama yahumetswe iri mu Baroma igice cya 8 itugirira akamaro twese .	Enyi mɛ yí ami dó ɖè wɛ mǐ nyí alǒ mǐ ɖò nukún ɖó wɛ bo na nɔ gbɛ̀ kaka sɔyi ɖò palaɖisi mɛ ɖò ayikúngban jí wɛ ɔ ,mǐ sixu dokú nú Mawu nú wěɖexámɛ tɔn e ɖò Hlɔmanu lɛ wemata 8gɔ́ ɔ mɛ é .
Ariko Toñi ntiyari yakererewe .	Toñi gbɔhwenu ǎ .
Gusubizanya ineza bihosha uburakari ,ariko ijambo ribabaza ribyutsa umujinya . Imig 151 .	È sɔ́ gbè fífá dó na xósin mɛ ɔ ,xomɛ nɔ fá è ka kán gbè nú mɛ ɔ ,xomɛsin ɔ ɖě nɔ jɛ ɖě jí . Nùx .151 .
Adolfo avuga ko yishimira ko yahindutse .	Adolfo ɖɔ ɖɔ xomɛ hun emi tawun nú huzuhuzu ɖěɖee emi kpéwú bo bló lɛ é .
Mwana wanjye ,gira ubwenge kandi ushimishe umutima wanjye ,kugira ngo mbashe gusubiza untuka . Imig 2711 .	Vǐ ce ,yǐ nùnywɛ ,bonu xomɛ na hun mì enɛ ɔ ,un hɛn ɔ ,un na kɛnu nú mɛ e nɔ ɖò nǔ ce ɖɔ wɛ é . Nùx .2711 .
Ese nihatira kwirinda imirimo ya kamere ,urugero nk’uburakari no gushyamirana ​ — Gal .	Un ka ɖò tintɛnkpɔn wɛ bá nyì alɔ nú nǔ nyanya e gbɛtɔ́ nɔ wà lɛ é ,ɖi majijɛ kpo jlɛɖiɖɔ kpo à ​ — Gal .
JYA UFATA IGIHE CYO GUTEKEREZA .	NƆ YÌ AGBƆ̌N JÍ BO LIN TAMƐ .
Ese nshobora kwirengagiza akarengane kugira ngo nshake amahoro ​ — Imig 1911 .	Un ka sixu myɔ nukún dó agɔ e è jɛ dó mì é ,bonu fífá ni dó sixu tíìn à ​ — Nùx .1911 .
Nidusenga ubudacogora ,’ Yehova azadusubiza . Rom 1212 .	Mɔ̌ ɖokpo ɔ ,enyi mǐ nɔ ɖókan dó ɖɛxixo wu ɔ ,Jehovah na sè ɖɛ vívɛ́ e mǐ nɔ xò bo nɔ byɔ gbigbɔ mímɛ́ lɛ é . Hlɔ .1212 .
Ni ikihe cyaha Yesu yavugaga gikemurwa hakurikijwe inama iri muri Matayo	Hwɛ alɔkpa tɛ xó ɖɔ wɛ Jezu ka ɖè ɖò wěɖexámɛ e ɖò Matie mɛ é mɛ
Agahinda kagenda gashira buhoro buhoro . wp16.3 ,ipaji ya 4 .	Bǐb .232 ,nwt É wá yá ɔ ,aluwɛ ɔ nɔ ɖekpo . w16.05 ,wex .4 .
Gabanya igihe umara ku kazi kandi utekereze uko wakwagura umurimo . w16.07 ,ipaji ya 10 .	Ðè kàn kpò nú agbazazɔ́ e a nɔ wà é ,bo bló tuto nú lee a na gbló ada nú sinsɛnzɔ́ towe gbɔn é . w16.07 ,wex .10 .
Muri Yobu hagaragaza ko ubwenge buva ku Mana burusha agaciro zahabu cyangwa ifeza .	Jɔbu xlɛ́ ɖɔ nùnywɛ Mawu tɔn xɔ akwɛ hú siká alǒ kpatagan .
Mu gihe ubushaka ,komeza kwicisha bugufi no kugira ukwizera gukomeye . w16.08 ,ipaji ya .	Hwenu e a na ɖò biba wɛ é ɔ ,tɛnkpɔn bo nɔ sɔ́ hwiɖée hwe lobo lidǒ ɖò nùɖiɖi mɛ . w16.08 ,wex .
Goliyati arusha santimetero 15 umuntu muremure wabayeho muri iki gihe .	Santimɛtlu 15 jɛn Goliyati ɖi ga na hugǎn mɛ e ɖi ga hú mɛ bǐ ɖò hwe mǐtɔn nu bɔ è tuùn é .
Ariko umuntu ufite ubwenge we ,akora ibihuje n’ubumenyi n’ibyo asobanukiwe . w16.10 ,ipaji ya 18 .	Amɔ̌ ,mɛ e ɖó nùnywɛ é nɔ kpéwú bo nɔ zán nùtuùntuùn kpo nukúnnúmɔjɛnǔmɛ kpo ɖó kpɔ́ ganji . w16.10 ,wex .18 .
Lefèvre d’Étaples yari umuhinduzi ,No .	Lefèvre d’Étaples lilɛdogbeɖevomɛtɔ́ ,No .
Mutke ,No .	Mutke ,No .
De la Fuente ,No .	De la Fuente ,No .
Watch Tower Bible and Tract Society of Pennsylvania	Watch Tower Bible and Tract Society of Pennsylvania
ABATERANYE KU RWIBUTSO 2015	MƐ NABI E WÁ FLǏN É 2015
Watch Tower Bible and Tract Society of Pennsylvania	Watch Tower Bible and Tract Society of Pennsylvania
Iyi gazeti yatangiye kwandikwa mu mwaka wa 1879 ,kandi ntiyivanga muri politiki .	Sín 1879 wɛ è ko ɖò xójlawema elɔ ɖetɔ́n wɛ .
Kuki wagombye gusoma Bibiliya	Etɛwu È ka Ðó Na Xà Biblu
Wakora iki ngo gusoma Bibiliya bigushimishe	Etɛ ka Na Zɔ́n Bɔ A Na Ðu Vivǐ Tɔn
Icyo wakora ngo Bibiliya ihindure imibereho yawe	Nɛ̌ Biblu ka Sixu Hɛn Gbɛzán Ce Kpɔ́n Te Gbɔn
BIBILIYA IHINDURA IMIBEREHO Y’ABANTU	BIBLU NƆ HUZU GBƐZÁN MƐTƆN
TWIGANE UKWIZERA KWABO HENOKI	ÐI NǓ YE ÐƆHUN HENƆCI
ESE KUMVA BIBILIYA UKO ITARI HARI ICYO BITWAYE	NUKÚNNÚMƆJƐNǓMƐ AGƆ KLEWUN ÐÉ KPOWUN WƐ À
BIBILIYA IBIVUGAHO IKI	ETƐ BIBLU KA ÐƆ
Bibiliya ubwayo igira iti Ibyanditswe byera byose byahumetswe n’Imana ,kandi bifite akamaro . 2 Timoteyo .	Biblu ɔ ɖesu ɖɔ Nǔ e è wlan dó Mawuxówema ɔ mɛ é bǐ wɛ gosin Mawu gɔ́n bo ɖó lè .’ ​ — 2 Timɔtée ,nwt .
Numvaga ko ntashobora gusobanukirwa Bibiliya . Jovy	Un nɔ lin ɖɔ é na vɛwǔ tawun ɖɔ è ni mɔ nukúnnú jɛ Biblu ɔ mɛ . Jovy
Natekerezaga ko gusoma Bibiliya bizandambira . Queennie	Un nɔ mɔ ɖɔ xixa tɔn kún na víví ó . Queennie
Iyo nabonaga ukuntu Bibiliya ari nini ,numvaga ntashaka kuyisoma . Ezekiel	Nú un mɔ lee Biblu ɔ d’agba sɔ é ɔ ,xixa tɔn sɔ́ nɔ jló mì ɖebǔ ǎ . Ezekiel
Ezekiel uri mu kigero cy’imyaka 20 ,yaravuze ati kera nari meze nk’umuntu utwaye imodoka ,ariko atazi iyo ajya .	Ezekiel e ko ɖó xwè 20 jɛji é ɖɔ Ð’ayǐ ɔ ,un cí mɛ e ɖò mɔ̌to kun wɛ bo ma ka tuùn fí e é xwè tawun é ǎ é ɖɔhun .
Frieda na we uri mu kigero cy’imyaka 20 ,yaravuze ati mbere nakundaga kurakazwa n’ubusa .	Frieda e ko ɖó hú xwè 20 é lɔmɔ̌ tinmɛ ɖɔ Un nɔ lin tamɛ cobo nɔ wà nǔ ǎ .
Umugore witwa Eunice uri mu kigero cy’imyaka 50 ,yavuze ko Bibiliya yamufashije kuba umuntu mwiza no gucika ku ngeso mbi .	Nawe e nɔ nyí Eunice bo ɖó hú xwè 50 é ɖɔ dó Biblu ɔ wu ɖɔ ,É ɖò alɔ dó mì wɛ bɔ un ɖò te kpɔ́n d’eji wɛ ,bo ɖò jijɔ ce nyanya lɛ ɖyɔ wɛ .
Ishobora kugufasha 1 gufata imyanzuro myiza ,2 kugira incuti nziza ,3 guhangana n’imihangayiko ,kandi ikiruta byose ,izagufasha 4 kumenya Imana by’ukuri .	Ezayíi Biblu sixu d’alɔ we bɔ 1 a na nɔ wá gbeta ɖagbe lɛ kɔn ,2 a na ɖó xɔ́ntɔn jɔ xɔ́ntɔn lɛ ,3 a na ɖí xwi xá adohu adohu ,bɔ 4 ee nyɔ́ hú bǐ é ɔ ,a na tuùn nugbǒ ɔ dó Mawu wu .
Niba hari ibintu wishyizemo byatuma udasoma Bibiliya ,ujye ubyikuramo kugira ngo Imana ibone uko ikwigisha . Zaburi 254 .	Enyi a ko ɖó linlin masɔgbe ɖebǔ dó Biblu wu hǔn ,tɛnkpɔn bo xò ye nyì kɛ́n ,enɛ ɔ ,Mawu na kplɔ́n nǔ we . Ðɛhan 254 .
Iyo Bibiliya yahinduwe n’Abahamya ba Yehova iboneka mu ndimi zirenga 130 .	Biblu enɛ e Kúnnuɖetɔ́ Jehovah Tɔn lɛ ɖetɔ́n é ɖò gbè hugǎn 130 mɛ .
Samweli igice cya 25	Samuwɛli wemata 25
Esiteri igice cya ,	Ɛsitɛ́ɛ wemata ,
nyina wa Yesu Matayo igice cya Luka igice cya reba nanone Yohana Ibyakozwe	Jezu sín nɔ Matie wemata Luki wemata lɛ̌ kpɔ́n Jaan Mɛsɛ́dó
Yosuwa igice cya reba nanone mu Baheburayo no muri Yakobo	Jozuwée wemata lɛ̌ kpɔ́n Eblée lɛ Jaki
Intangiriro igice cya ,23 reba nanone mu Baheburayo 1111 1 Petero	Bǐbɛ̌mɛ wemata ,23 lɛ̌ kpɔ́n Eblée lɛ 1111 1 Piyɛ́ɛ
Intangiriro igice cya reba nanone igice cya	Bǐbɛ̌mɛ wemata lɛ̌ kpɔ́n
Samweli igice cya 2 Samweli igice cya 1 Abami igice cya	Samuwɛli wemata 2 Samuwɛli wemata 1 Axɔsu lɛ wemata
Kuva igice cya ,- 34 Kubara igice cya ,Gutegeka kwa Kabiri igice cya 34	Tíntɔ́n wemata ,- 34 Kɛ́nsísɔ́ wemata ,Sɛ́nflínmɛ wemata 34
Ibyakozwe igice cya ,	Mɛsɛ́dó wemata ,
Matayo igice cya ,- Ibyakozwe igice cya ,	Matie wemata ,- Mɛsɛ́dó wemata ,
Étude perspicace des Écritures ​ — Ni igitabo gitanga ibisobanuro by’abantu n’ibintu bivugwa muri Bibiliya	Étude perspicace des Écritures ​ — Xókwintinmɛwegbo Biblu tɔn akpáxwé wenɔ ɖé wɛ ,bo tinmɛ nǔ dó mɛ lɛ ,fí lɛ kpo xógbe e ɖò Biblu mɛ lɛ é kpo wu
Parole de Dieu ou des hommes ​ — Ni igitabo kirimo ibimenyetso bifatika byemeza ko Bibiliya yahumetswe n’Imana	Parole de Dieu ou des hommes ​ — Wema nǔbiba tɔn kpɛví elɔ gbéjé kúnnuɖenú ɖěɖee xlɛ́ ɖɔ Mawu gɔ́n wɛ Biblu ɔ gosin nugbǒ é kpɔ́n
Bibiliya — Irimo ubuhe butumwa ​ — Ni agatabo k’amapaji 32 kavuga muri make ibikubiye muri Bibiliya	La Bible ​ — Quel est son message ​ — Alɔnuwema wexwɛ 32 nɔ e sɛ̀ sìn xwè nú xota Biblu tɔn ɔ blebu é ɖé wɛ
Imibanire yawe n’abandi . Abefeso ,.	Kancica e è na ɖó xá hagbɛ̌ xwédo tɔn mɛtɔn lɛ kpo mɛ ɖevo lɛ kpo é . Efɛzinu lɛ ,.
Uko wagira umutuzo n’ubuzima bwiza . Zaburi 378 Imigani 1722 .	Ganjininɔ ɖò ayi kpo agbaza kpo mɛ . Ðɛhan 378 Nùnywɛxó 1722 .
Uko wakwitoza imico myiza . 1 Abakorinto .	Walɔ ɖagbe lɛ ɖiɖó . 1 Kɔlɛntinu lɛ .
Uko wacunga umutungo . Imigani 104 2819 Abefeso 428 .	Lee è na mɔ nǔ agbaza tɔn e sín hudo è ɖó lɛ é gbɔn é . Nùnywɛxó 104 2819 Efɛzinu lɛ 428 .
Nagize imyaka 11 naramaze kuba umusinzi .	Hwenu e un ɖó xwè 11 é ɔ ,un jɛ ahan syɛnsyɛn nu jí .
Nahise ntwita ,mbyara imfura yacu mfite imyaka 16 gusa .	É lín cobɔ un mɔ xò ǎ ,bɔ un jì vǐ sunnu mǐtɔn hwenu e un ɖò xwè 16 ɖó wɛ é .
Ibyo byatumye ngira ibyiringiro byo kuzabaho iteka ku isi izahinduka paradizo . Zaburi 3729 .	Un jɛ nǔ ɖi jí ɖɔ un hɛn ɔ ,un na ɖó nukúnɖiɖo bo na nɔ gbɛ̀ ɖò Palaɖisi mɛ ɖò ayikúngban jí kaka sɔyi . Ðɛhan 3729 .
Uretse ibyo ,nashakishije incuti nziza zari kumfasha kugira imico myiza no guhinduka . Imigani 1320 .	Un ba xɔ́ntɔn yɔyɔ̌ ɖevo ɖěɖee jijɔ yetɔn na d’alɔ mì ɖò gbɛzán ce yɔyɔ̌ ɔ mɛ lɛ é bo dó gbɛ̌ xá . Nùnywɛxó 1320 .
Twashyingiranywe mu mwaka wa 1982 .	Mǐ wlí alɔ ɖò 1982 .
Amaherezo jye na Tony twabatijwe muri Nyakanga 1982 ,maze tuba Abahamya ba Yehova .	Nyɛ kpo Tony kpo bló baptɛm bo huzu Kúnnuɖetɔ́ Jehovah Tɔn ɖò Juillet 1982 .
Twe ntidushobora kwiyumvisha ukuntu abantu bashobora kurama imyaka igera kuri 365 ,ni ukuvuga imyaka ikubye incuro zirenga enye iy’abantu barama muri iki gihe .	É sixu vɛwǔ bɔ mǐ na ɖi nǔ na ,amɔ̌ ,nya enɛ nɔ gbɛ̀ nú xwè 365 mɔ̌ ,xwè nabi e è nɔ dɔ́ji na ɖò égbé é donu ɛnɛ jɛji wɛ nyí enɛ
Umuntu wa mbere ari we Adamu ,yaramye imyaka irenga 600 mbere y’uko Henoki avuka ,na nyuma yaho abaho indi myaka 300 .	Adamu ,gbɛtɔ́ nukɔntɔn ɔ ,nɔ gbɛ̀ nú xwè 600 jɛji cobɔ è wá jì Henɔci ,b’ɛ ka lɛ́ bló xwè 300 ɖevo d’eji
Bityo rero ,Henoki yagize imyaka 365 akiri umusore washoboraga kubaho indi myaka myinshi .	Enɛ wu ɔ ,Henɔci ɖó xwè 365 có ,é sixu lɛ́ ɖó hlɔnhlɔn ganji ,bo cí mɛ e kpò ɖò anyǔ mɛ é ɖɔhun .
Ese yaba yaratekerezaga umugore we n’abakobwa be cyangwa umuhungu we Metusela ,n’umwuzukuru we Lameki	É ka flín asì tɔn kpo vǐ nyɔnu tɔn lɛ kpo ,vǐ sunnu tɔn Mɛtucɛlaxi alǒ vivǔ tɔn Lamɛki wɛ à
Bakoreshaga izina ryera ry’Imana mu buryo budakwiriye ,bakaritukisha . Intangiriro - 26 .	É ɖò wɛn ɖɔ ye nɔ zán nyikɔ mímɛ́ Mawu tɔn kpo mɛmasi kpo bo nɔ nyla nu dó wǔ tɔn . Bǐbɛ̌mɛ - 26 .
Ubwo rero ,Henoki yagize imyaka 65 yarabyaye .	Enɛ wu ɔ ,hwenu e Henɔci ɖó xwè 65 mɔ̌ é ɔ ,é ko nyí xwétɔ́ ɖé .
Iby’ukwizera kwe ,Nowa ashobora kuba yarabibwiwe na se Lameki ,cyangwa sekuru Metusela cyangwa se wa Henoki ari we Yeredi ,wapfuye Nowa afite imyaka 366 . Intangiriro 69 91 .	Nɔwée sín tɔ́ Lamɛki alǒ tɔ́gbó tɔn Mɛtucɛlaxi alǒ boya Henɔci sín tɔ́ Yɛlɛdi e kú hwenu e Nɔwée ɖó xwè 366 é wɛ sixu ko kplɔ́n nǔ Nɔwée dó gǔ enɛ wu . Bǐbɛ̌mɛ 69 91 .
Adamu yapfuye Henoki afite imyaka 308 .	Adamu kú hwenu e Henɔci ɖó xwè 308 é .
Uko biri kose ,Henoki yagendanaga n’Imana y’ukuri . Intangiriro 524 .	É na bo nyí gbɔn ɖebǔ ɔ ,Henɔci nɔ yì xá Mawu . Bǐbɛ̌mɛ 524 .
Ni yo mpamvu yabivuze nk’aho byamaze kuba . Yesaya 4610 .	Nǔ ɔ wɛ nyí ɖɔGbeyiɖɔ ɔ ɖò xó ɖɔ dó nǔ e jí é kú dó ɖɔ é na jɛ dandan é ɖé wu wɛ ɖó alɔkpa ɖé bɔ é cí ɖɔ nǔ ɔ ko jɛ wɛ ɖɔhun ​ — Ezayíi 4610 .
Ariko ibyo ntibyaba ari byo ,kuko Bibiliya igaragaza ko Yesu Kristo ari we wa mbere wazutse akajya mu ijuru . Yohana 313 .	Biblu ɖexlɛ́ ɖɔ Jezu Klisu wɛ nyí mɛ nukɔntɔn e è fɔ́n dó jixwé é . Jaan 313 .
Uko ni ko Imana yarinze umubiri wa Mose n’uwa Yesu ,kugira ngo badahura n’ibibazo nk’ibyo.z ​ — Gutegeka kwa Kabiri Luka Yuda 9 .	Nǔ ɖokpo ɔ wɛ Mawu na ko bló nú cyɔ Mɔyizi kpo Jezu kpo tɔn ,bonu è ni ma sɔ́ ye dó wà nǔ masɔgbe mɔhun lɛ na ó . Sɛ́nflínmɛ Luki Judi 9 .
Urugero ,gukurikiza Ijambo ry’Imana biturinda kwishora mu ngeso zangiza ubuzima bwacu ,nk’ubusinzi n’ubwiyandarike . 1 Abakorinto .	Sísí ɖó nú Xó Mawu Tɔn na sísɛ́ mǐ bɔ mǐ na nyì alɔ nú walɔ nyanya lɛ ɖi ahannumu kpo nùblibliwiwa kpo . 1 Kɔlɛntinu lɛ .
Ahubwo yashyiriyeho isi imfatiro zihamye ntizigera inyeganyega kugeza ibihe bitarondoreka ,ndetse iteka ryose Zaburi 1045 Yesaya 4518 .	Ðɛhan 1045 Ezayíi 4518 Gbɛtɔ́ nyanya lɛ kpo nǔ nyanya lɛ kpo wɛ na wá vivɔnu kaka sɔyi ,cí nǔ ɖɔ myɔ wɛ è zé dó sú kún yetɔn dó na ɖɔhun ,é nyí ayikúngban ɔ wɛ ǎ .
Nanone umwuka wera ufasha Abakristo bafite ubumenyi kwigisha Bibiliya abandi bantu bifuza kuyisobanukirwa . Ibyakozwe .	Gbigbɔ mímɛ́ ɔ nɔ lɛ́vɔ sísɛ́ Klisanwun e mɔ nukúnnú jɛ nǔ wu ganji lɛ é bɔ ye nɔ d’alɔ mɛ ɖěɖee ɖò biba wɛ bá mɔ nukúnnú jɛ nǔ mɛ d’eji lɛ é . Mɛsɛ́dó .
Iyo babigenje batyo ,baba biganye intumwa za Kristo zahinduraga imitekerereze iyo yabaga azikosoye . Ibyakozwe .	Mɔ̌ mɛ ɔ ,ye ɖi nǔ ɖɔ emi nɔ wà nǔ mɛsɛ́dó Klisu tɔn lɛ ɖɔhun ,yedɛɛ lɛ nɔ sɔ́ yeɖée hwe bo nɔ jla linlin yetɔn lɛ ɖó hweɖebǔnu e Jezu gbɛ́ nǔ nú ye é . Mɛsɛ́dó .
Bibiliya itanga isezerano rivuga ko ‘ niba uhamagara ushaka gusobanukirwa . . . ,uzamenya Imana . ’ — Imigani .	Biblu d’akpá ɖɔ Ylɔ̌ nùtuùntuùn ɖɔ é ni wá gɔ́ alɔ nú emi ,.enɛ ɔ ,.a na mɔ nǔ jɛ lee è nɔ tuùn Mawu gbɔn é wu . Nùnywɛxó .
Satani umutware w’isi ,ni we nyirabayazana w’ibibi bikorerwa kuri iyi si . Yohana 1430 .	Satáan Awovi ,axɔsu gbɛ̀ elɔ tɔn ɔ wɛ nyí mɛ taji e nɔ zɔ́n wuvɛ̌ mimɔ lɛ é . Jaan 1430 .
Nanone imibabaro ishobora guterwa n’ibikorwa bibi abantu bakora . Yakobo .	Wuvɛ̌ mimɔ lɛ kpo nǔ nyanya lɛ kpo nɔ lɛ́ sín gbeta nyanya e kɔn gbɛtɔ́ lɛ nɔ wá é wu hwɛhwɛ . Jaki .
Urupfu ntiruzabaho ukundi ,kandi kuboroga cyangwa gutaka cyangwa kubabara ntibizabaho ukundi . Ibyahishuwe .	Kú sɔ́ na tíìn ǎ ,aluwɛ sɔ́ na tíìn ǎ ,alěnina sɔ́ na tíìn ǎ ,wuvɛ̌ mimɔ sɔ́ na tíìn ǎ . Nǔɖexlɛ́mɛ .
Imana izakoresha Yesu ,ikureho imibabaro yatewe na Satani . 1 Yohana 38 .	Mawu na zán Jezu dó jla wuvɛ̌ mimɔ ɖěɖee Awovi zɔ́n lɛ é ɖó . 1 Jaan 38 .
Abantu beza bazaba ku isi iteka mu mahoro . Zaburi ,29 .	Mɛ ɖagbe lɛ na nɔ ayikúngban jí ɖò fífá mɛ kaka sɔyi . Ðɛhan ,29 .
Watch Tower Bible and Tract Society of Pennsylvania	Watch Tower Bible and Tract Society of Pennsylvania
Iyi gazeti yatangiye kwandikwa mu mwaka wa 1879 ,kandi ntiyivanga muri politiki .	Sín 1879 wɛ è ko ɖò xójlawema elɔ ɖetɔ́n wɛ .
Impano iruta izindi	Nùnina E Ma Kpé Wè Ǎ É Ðé
Kuki incungu ari yo mpano y’agaciro kenshi Imana yatanze	Nùnina Mawu Tɔn E Hugǎn Bǐ ÉEtɛwu É ka Xɔ Akwɛ Sɔmɔ̌
Twagaragaza dute ko duha agaciro iyo mpano	Nɛ̌ A ka Na Yí Gbè nú Nùnina Ðaxó Hugǎn Bǐ E Mawu Na Mǐ É Gbɔn
ESE ABIHAYIMANA BAGOMBA KUBA ABASERIBATERI	DANDAN WƐ SINSƐNZƆ́WATƆ́ KLISANWUN LƐ NA NƆ TLƐNMƐ À
AMATEKA Y’UBUCAKARA N’UKO BUZAVAHO	KANNUMƆÐÒ HWEXÓNU KPO ÉGBÉ KPO
GUTANGA BIHESHA IMIGISHA	ÐU VIVǏ LÈ E NÙNAMƐ NƆ HƐN WÁ LƐ É TƆN
Bibiliya igira iti Imana yakunze isi cyane ku buryo yatanze Umwana wayo w’ikinege . Yohana 316 .	Biblu ɖɔ Mawu yí wǎn nú gbɛtɔ́ sɔmɔ̌ ,bo sɔ́ Vǐɖokponɔ tɔn jó . Jaan 316 .
Bibiliya ivuga iby’impano ifite agaciro kenshi cyane mu magambo azwi n’abantu benshi ,igira iti Imana yakunze isi cyane ku buryo yatanze Umwana wayo w’ikinege ,kugira ngo umwizera wese atarimbuka ,ahubwo abone ubuzima bw’iteka . Yohana 316 .	Biblu tinmɛ nùnina e akwɛ ma sixu xɔ ǎ é ɖé ɖò xógbe elɔ lɛ mɛ Mawu yí wǎn nú gbɛtɔ́ sɔmɔ̌ ,bo sɔ́ Vǐɖokponɔ tɔn jó ,bonu mɛ e na ɖi nǔ n’i lɛ ɖebǔ ma dɔn ó loɔ ,ye bǐ ni mɔ gbɛ̀ mavɔmavɔ . Jaan 316 .
Icyo gitambo cyitwa incungu ,gituma abantu bose bizera Yesu biringira kuzabona ubuzima bw’iteka . Abaroma 324 .	Gbɔn vɔsisa enɛ e è nɔ ylɔ ɖɔ gbɛxixɔ ɔ ’ é gblamɛ ɔ ,mɛ ɖěɖee ɖi nǔ nú Jezu lɛ é bǐ na mɔ gbɛ̀ mavɔmavɔ . Hlɔmanu lɛ 324 .
Ibyo bituma iyo mpano igira agaciro ,kuko nta wukomeye kuruta Imana .	Jaan 49 Nǔ enɛ zɔ́n bɔ nùnina elɔ xɔ akwɛ nugbǒ .
Imana yatugiriye ubuntu butagereranywa ,itanga Kristo Yesu ngo abe ‘ incungu . ’ — Abaroma 324 .	Fɛ́nú Mawu tɔn sín xlɛ̌ wɛ nyí gbɛxixɔ sín axɔ e Klisu Jezu sú é . Hlɔmanu lɛ 324 ,nwt .
Yesu ni ‘ ishusho y’Imana itaboneka ’ akaba n ’ ‘ Umwana ikunda ’ .	Nùnywɛxó 830 ,nwt Jezu nyí Vǐ vívɛ́ná ’ Mawu tɔn bo lɛ́ nyí akpajlɛ Mawu e è ma nɔ mɔ ǎ é tɔn .
Uretse n’ibyo ,nta yindi mpano yagira agaciro nk’ak’incungu .	Nugbǒ ɔ ,è sixu jlɛ́ nùnina ɖebǔ dó akwɛ e gbɛxixɔ ɔ xɔ é wu ǎ .
Yapfiriye bose kugira ngo abariho badakomeza kubaho ku bwabo ,ahubwo babeho ku bw’uwo wabapfiriye . 2 Abakorinto .	É kú dó mɛ bǐ tamɛ ,bonu mɛ e ɖò gbɛ̀ lɛ ɔ ,ye ma sɔ́ nɔ gbɛ̀ nú yeɖesunɔ ó loɔ ,ye ni nɔ gbɛ̀ nú mɛ e kú dó ye tamɛ é . 2 Kɔlɛntinu lɛ .
Bibiliya igira iti mwegere Imana na yo izabegera . Yakobo 48 .	Biblu dó wusyɛn lanmɛ nú mǐ ɖɔ Mi sɛkpɔ Mawu enɛ ɔ é na sɛkpɔ mi . Jaki 48 .
Umwaka ushize ,abantu bagera hafi kuri miriyoni 20 bo hirya no hino ku isi bitabiriye uwo muhango .	Ðò xwè e wá yì é mɛ ɔ ,gbɛtɔ́ livi 20 mɔ̌ wɛ wá Flǐn tɛnmɛ .
Yamushinje ko yashatse kumufata ku ngufu maze afungwa arengana . Intangiriro Zaburi .	È wlí i dó gankpa mɛ lobo dó gɛdɛ ɛ . Bǐbɛ̌mɛ Ðɛhan .
Urugero ,umucakara wakoraga mu birombe by’Abaroma ,nta cyizere yabaga afite cyo kubaho imyaka irenze 30 .	Ði kpɔ́ndéwú ɔ ,kannumɔ Hlɔma tɔn e è nɔ zán dó ba ayǐdɔkun na lɛ é dɔ́ji dín ɔ wɛ nyí xwè 30 mɔ̌ .
Ishami ry’Umuryango w’Abibumbye ryita ku Burezi ,Ubumenyi n’Umuco ryavuze ko ugereranyije ,abagabo ,abagore n’abana bari hagati ya miriyoni 25 na 30 ,bashimuswe bakagurishwa .	Gbeɖiɖó UNESCO tɔn ɖé ɖɔ ɖɔ sunnu ,nyɔnu ,kpo yɔkpɔvu kpo livi 25 jɛ 30 mɔ̌ wɛ è wlí gannugánnú bo sà .
Umuryango Mpuzamahanga Wita ku Murimo wagaragaje ko abagabo ,abagore n’abana bagera kuri miriyoni 21 ,bagikoreshwa imirimo y’uburetwa ,bagahembwa intica ntikize cyangwa ntibahabwe n’urupfusha .	Sɔgbe kpo OIT Organisation internationale du travail kpo ɔ ,sunnu ,nyɔnu ,kpo yɔkpɔvu kpo livi 21 mɔ̌ wɛ kpó ɖò kannumɔ nyí wɛ ,bo sixu hɔn ǎ ,bɔ è nɔ sú akwɛ kpɛɖé ye alǒ è nɔ lɛ́ nɔ akwɛ ɖebǔ má sú ye lɔ .
Kuba abo bacakara bakoraga mu mirima y’ibisheke barafatwaga nabi ,byateje imyivumbagatanyo yamaze imyaka 13 ,irangira Hayiti ibonye ubwigenge mu mwaka wa 1804 .	Daka e xò kannumɔ lɛ wu wɛ è ɖè ɖò lekegbo lɛ mɛ é zɔ́n bɔ è fun tohwan ɖé nú xwè 13 ,bɔ gudo mɛ ɔ ,è wá ɖó tò Haïti tɔn e jɛ éɖesu sí é ayǐ ɖò 1804 .
Inkuru ishishikaje ivuga ibya Yozefu ,iboneka mu gitabo cya Bibiliya cy’Intangiriro igice cya 39 kugeza ku cya 41 .	A sixu mɔ tan Jozɛfu tɔn e jiwǔ tawun é ɖò wema Biblu tɔn e nyí Bǐbɛ̌mɛ é wemata 39 jɛ 41 mɛ .
Alonso yari mu bucakara bw’ibindi bintu .	Alonso nyí kannumɔ alɔkpa ɖevo .
Alonso amaze imyaka 30 yarabaswe n’ibiyobyabwenge ,yaje kwigana Bibiliya n’Abahamya ba Yehova .	Ee Alonso nyí kannumɔ nú gěe nunu nú xwé 30 gudo é ɔ ,é wá jɛ Biblu kplɔ́n xá Kúnnuɖetɔ́ Jehovah tɔn lɛ jí .
Yesu yasuye nyirabukwe wa Petero aramukiza . Matayo Mariko	Jezu yì ba Piyɛ́ɛ sín asinɔ kpɔ́n bo gbɔ azɔn n’i . Matie Maki
Mu mwaka wa 2006 ,Papa Benedigito wa XVI yabwiye abayobozi bakuru ba Kiliziya Gatolika ko ubuseribateri ari umugenzo watangiye ahagana mu gihe cy’intumwa .	Ðò xóɖiɖɔ e Pápà Benoît XVI xwlé Sinsɛngán Katolika Hlɔma tɔn tɔn lɛ ɖò 2006 é mɛ ɔ ,é ɖɔ ɖɔ tlɛnmɛninɔ dandan ɔ nyí aca ɖé bɔ è ko ɖò xwixwedó wɛ sín hwenu e mɛsɛ́dó lɛ kú gudo tlolo é ɖokpoo .
Ahubwo intumwa Pawulo wabayeho mu kinyejana cya mbere ,yabwiye Abakristo bagenzi be ko bagombaga kwirinda abantu bavugaga ‘ amagambo ayobya yahumetswe n’abadayimoni ,babuzanya gushyingiranwa . ’ — 1 Timoteyo .	Nugbǒ ɔ ,mɛsɛ́dó Pɔlu e nɔ gbɛ̀ ɖò xwè kanweko nukɔntɔn ɔ mɛ é gb’akpá nú nùɖitɔ́ lɛ dó sunnu ɖěɖee nɔ flú mɛ lɛ kpodo yɛ nyanya lɛ sín nùkplɔnmɛ kpo bo nɔ dó sɛ́n ɖɔ è ma da asú ó ,è ma ka da asì ó lɛ é wu . 1 Timɔtée .
