input	target
Mu mwaka wa 1962 ,umukozi w’ikigo cyafataga amajwi yanze gukorana n’itsinda ry’abaririmbyi bari bagezweho bitwaga Beatles ,kuko yatekerezaga ko abacuranga gitari batari gukomeza gukundwa .	Mɛ e nɔ w’azɔ̌ ɖò azɔ̌xwé e nɔ nyí Decca bo nɔ ɖè agbǎnxwɛ tɔ́n ,bo jó gbɛ̌ta nùxixo tɔn Beatles dó ɖò 1962 é ɖé ɖɔ ɖɔ gbɛ̌ta e nɔ xò giwuntá lɛ é kún sɔ́ na tíìn ó .
Abaragurisha inyenyeri bashyira abantu mu byiciro 12 bakurikije amatariki bavukiyeho .	Dò biba nú sun sín wuntun lɛ nɔ tò gbɛtɔ́ lɛ dó gbɛ̌nu 12 lɛ ɖokpo mɛ ,alǒ du e jí è ɖè é sín wuntun lɛ mɛ ,sɔgbe xá azǎn e jí è jì mɛ ɔ é .
Bibiliya ivuga ko dufite uburenganzira bwo kwihitiramo ibyo twemera n’ibyo dukora kandi ko amahitamo tugira ashobora kugena uko ibintu bizatugendekera mu gihe kizaza . Yosuwa 2415 .	Biblu ɖɔ nú mǐ ɖɔ mǐ ɖó nǔwukpikpé bo na ɖɔ nǔ e mǐ na ɖi nǔ na lɛ é ,alǒ nǔ e mǐ na wà é ,bɔ gbeta e kɔn mǐ nɔ wá lɛ é nɔ kúnkplá sɔgudo mǐtɔn . Jozuwée 2415 .
— Gutegeka kwa Kabiri . Yehova ni izina ry ’ Usumbabyose mu isi yose . Zaburi 8318 .	Ðó mɛ e nɔ wà nǔ mɔhun lɛ nɔ vɛ́ mɔ nú Mawu Mavɔmavɔ . Sɛ́nflínmɛ .
Umuhanuzi w’Umuheburayo witwaga Yesaya ,yahanuye ko Kuro yari gutsinda umurwa ukomeye wa Babuloni ,kandi ibyo yabihanuye hasigaye imyaka 200 yose ngo uwo mwami avuke .	Xwè 200 mɔ̌ cobɔ è na jì axɔsu Silusi ɔ ,Ezayíi e nyí gbeyiɖɔ Eblée ɖé é ko ɖɔ nyikɔ tɔn kpo lee é na ɖu ɖò toxo ɖaxó Babilɔnu jí gbɔn é kpo ɖ’ayǐ .
Yesaya ,28 Yehova . . . aravuga ati . . . ‘ ni jye ubwira imuhengeri nti kama kandi nzakamya inzuzi zawe zose .	Ezayíi ,28 Xó e Jehovah ɖɔ ɔ ɖí.
Kuro amaze kwigarurira uwo mugi ,yarekuye Abayahudi bari barajyanywe mu bunyage i Babuloni ,abemerera gusubira i Yerusalemu bakongera kubaka uwo mugi wari umaze imyaka 70 usenywe .	Ee Silusi yí toxo ɔ gudo é ɔ ,é jó kàn Jwifu ɖěɖee ɖò kannumɔgbenu ɖò Babilɔnu lɛ é ,bo na gbè ye bɔ ye lɛkɔ yì Jeluzalɛmu e è ko sú kún dó na sín xwè 70 ɖíe é bo vɔ́ gbá .
Yesaya 451 Uku ni ko Yehova yabwiye Kuro uwo yitoranyirije ,uwo nafashe ukuboko kw’iburyo kugira ngo muneshereze amahanga imbere ye ,nkenyuruze abami ,mukingurire inzugi ,ndetse n’amarembo ntazigere akingwa .	Ezayíi 451 Mawu Mavɔmavɔ ɖɔ nú Silusi ,axɔsu e é sɔ́ é ɖɔ Un na na ganjɛwu we ,bo na bɛ́ akɔta lɛ dó acɛ towe glɔ́ ,un na yí acɛ sín axɔsu lɛ sí un na hun toxo lɛ sín hɔntogbo e ɖò súsú lɛ nú we .’
Ni jye uhera mu ntangiriro nkavuga iherezo ,ngahera mu bihe bya kera nkavuga ibitarakorwa . Yesaya 4610 .	Nǔ e ma ko jɛ ǎ ,bo ka na wá jɛ ɔ ,un ko ɖɔ ɖ’ayǐ sín tɛgbɛ . Ezayíi 4610 .
Matayo Muzumva iby’intambara n’inkuru zivuga iby’intambara . . . .	Matie Mi na wá sè ahwanfunfun sín zingidi ɖò fí e sɛkpɔ mi lɛ ,bo na nɔ sè ahwanfunfun sín xó ɖò fí e lín dó mi lɛ .
Hari abavuga ko abaguye mu ntambara zabayeho kuva mu mwaka wa 1914 ,barenga miriyoni 100 ,bakaba baruta umubare w’abaturage bo mu bihugu byinshi .	Sɔgbe kpo nǔlinlɛn ɖé kpo ɔ ,mɛ nabi e ahwan lɛ kpo tohwan lɛ kpo ko hu sín 1914 é hú livi 100 ,kɛ́n enɛ zɛ toví e ɖò tò gègě mɛ lɛ é bǐ sín kɛ́n wu .
Matayo 247 Hazabaho inzara .	Matie 247 Adɔ na tɔ́n .
Raporo y’Ishami ry’Umuryango w’ Nubwo ku isi hari ibiribwa byahaza abayituye bose ,abantu miriyoni 815 baraburara buri munsi ,ni ukuvuga umuntu umwe mu bantu ikenda .	Tutomɛ gbɛ̀ ɔ tɔn e nɔ kpé nukún dó nùɖuɖu xó wu é ɖɔ Ðò gbɛ̀ elɔ e mɛ mǐ nɔ sɔnǔ nú nùɖuɖu gègě nú gbɛtɔ́ livi 815 mɔ̌ ɖè é mɛ ɔ ,mɛ ɖokpo ɖò tɛnnɛ jí kpó ɖò xovɛ dɔ́ yì xɔ wɛ ayihɔngbe ayihɔngbe .
Luka 2111 Hazabaho imitingito ikomeye .	Luki 2111 Ayikúngban na danwǔ ɖesu .
Igera ku 100 muri yo yangiza cyane amazu ,kandi buri mwaka haba nibura umutingito umwe ukomeye cyane .	Ayikúngban danwǔ 100 mɔ̌ nɔ hɛn xɔ lɛ gblé tawun ,bɔ ayikúngban danwǔ ɖaxó ɖokpo nɔ tíìn xwewu xwewu .
Abahamya ba Yehova barenga miriyoni umunani ,babwiriza ubutumwa bwiza bw’Ubwami bw’Imana mu bihugu bigera kuri 240 .	Kúnnuɖetɔ́ Jehovah tɔn lɛ e kɛ́n yetɔn hú livi tantɔn é ko ɖò Axɔsuɖuto Mawu tɔn sín wɛnɖagbe jla wɛ ,bo lɛ́ ɖò kúnnu ɖè na wɛ gbɔn ayikúngban ɔ bǐ jí ɖò tò 240 mɔ̌ mɛ .
Icyakora mu mwaka wa 33 Yesu Kristo yavuze ko Yerusalemu yari yugarijwe n’akaga .	Amɔ̌ ,ɖò 33 H.M .tɔn ɔ ,Jezu Klisu ɖɔ ɖɔ awě ɖé na wá xò Jeluzalɛmu .
Bazaguhonda hasi wowe n’abana bawe kandi ntibazagusigira ibuye rigeretse ku rindi . Luka .	Ye na vɔ mi bǐ ,bo na gbà toxo ɔ ,bɔ awinnya e è dó mɛ xɔ lɛ na ɔ ,ɖě sɔ́ na kpó ɖò ɖě jí ǎ ɖó hwenu e Mawu wá ba jonɔ mi ɔ ,mi tuùn ǎ . Luki .
Kandi koko ,amwe mu mabuye yari yubatse urwo rusengero yari afite metero 11 z’uburebure ,metero 5 z’ubugari na metero 3 z’ubuhagarike .	Nugbǒ ɔ ,tɛmpli ɔ sín awinnya ɖé lɛ ɖiga nú mɛtlu 11 mɔ̌ ,gbló nú mɛtlu 5 mɔ̌ ,bo yì jǐ nú mɛtlu 3 mɔ̌
Dore ibi bintu byose mureba ,igihe kizaza ubwo hatazasigara ibuye rigeretse ku rindi ,ritajugunywe hasi . Mariko 131 Luka 216 .	É ɖò mɔ̌ có ,Jezu ɖɔ Nǔ enɛ lɛ e mɔ wɛ mi ɖè dìn ɔ ,hweɖenu na wá sù ,bɔ awinnya lɛ ɖě sɔ́ na kpò ɖò ɖě jí ǎ bǐ wɛ è na mu . Maki 131 Luki 216 .
Icyakora ,mu wa 66 igihe umutegetsi w’Umuroma witwaga Gessius Florus wategeka Yudaya yatwaraga amafaranga yo mu bubiko bw’amaturo bwo mu rusengero rwera ,Abayahudi bararakaye cyane bananirwa kwihangana .	Amɔ̌ ,ɖò 66 H.M tɔn ,hwenu e tokpɔngán Hlɔma tɔn Gessius Florus ,ee kp’acɛ dó Judée nu é wá bɛ́ akwɛ ɖò tɛmpli mímɛ́ ɔ sín akwɛgbá mɛ é ɔ ,xomɛ sìn Jwifu lɛ tawun .
Abakristo baboneyeho kumvira umuburo wa Yesu ,bava muri Yerusalemu bahungira mu misozi yo hakurya y’uruzi rwa Yorudani . Matayo .	Hwenu e ahwanfuntɔ́ Hlɔma tɔn lɛ kpo Jwifu gǔfɔntɔ́ lɛ kpo jó toxo ɔ dó é ɔ ,Klisanwun ɖěɖee hɛn akpágbánúmɛ Jezu tɔn ayi mɛ lɛ é hɔn sín Jeluzalɛmu bo tunta só lɛ jí ɖò Judɛ́ɛn Tɔ̀ ɔ gudo . Matie .
Muri Kamena mu mwaka wa 70 ,Titus yategetse abasirikare be gutema ibiti by’i Yudaya abikoresha yubaka uruzitiro rw’ibisongo rwa kirometero 7 rwo kugota Yerusalemu .	Ðò juin 70 H.M .tɔn ɔ ,Titus ɖegbe nú ahwanfuntɔ́ tɔn lɛ ɖɔ ye ni gbò atín ɖěɖee ɖò Judée gbéjí lɛ é ,bɔ ye sɔ́ dó xá dǒ Jeluzalɛmu tɔn lɛ na nú kilomɛtlu 7 lɛlɛ̌ dó .
Mu wa 71 ,Titus yasubiye i Roma abaturage baho bamwakirana ibyishimo byinshi cyane .	Ðò 71 H.M .tɔn ɔ ,Titus lɛkɔ yì Italie bɔ toví Hlɔma tɔn lɛ xɔ susu ɖaxó ɖé n’i .
Mu mwaka wa 79 Titus yazunguye se Vespasien ku ngoma .	Titus jɛ tɔ́ tɔn Vespasien sín tɛnmɛ ɖò 79 H.M .tɔn bo nyí dada .
Ni ikimenyetso kemeza ko ubuhanuzi bwa Bibiliya busohora kandi ko bwaturutse ku Mana . 2 Petero .	Kúnnuɖenú e xlɛ́ ɖɔ Mawu gɔ́n wɛ nǔɖɔɖ’ayǐ Biblu tɔn lɛ gosin ,bo sɔgbe bɔ è sixu lɛ́ ɖeji dó ye wu lɛ é ɖé wɛ . 2 Piyɛ́ɛ .
Yesaya 3324 Nta muturage waho uzavuga ati ‘ ndarwaye . ’	Ezayíi 3324 Toví ɖé sɔ́ na ɖɔ Un ɖò azɔn jɛ wɛ ’ ǎ .
Ibyahishuwe 214 Imana izahanagura amarira yose ku maso yabo ,kandi urupfu ntiruzabaho ukundi ,kandi kuboroga cyangwa gutaka cyangwa kubabara ntibizabaho ukundi .	Nǔɖexlɛ́mɛ 214 Mawu na súnsún ɖasin bǐ sín nukún yetɔn mɛ kú sɔ́ na tíìn ǎ ,aluwɛ sɔ́ na tíìn ǎ ,alěnina sɔ́ na tíìn ǎ ,wuvɛ̌ mimɔ sɔ́ na tíìn ǎ nǔ xóxó lɛ ko bú .
Kugira ngo Yehova adufashe kwiringira ko ibyo yasezeranyije byose bizasohora ,yagize icyo avuga ku ijambo rye ,Ntirizagaruka ubusa ,ahubwo rizakora ibyo nishimira ,risohoze ibyo naritumye . Yesaya 5511 .	Bo na dó d’alɔ mǐ bonu mǐ na kú dó akpá e Mawu dó lɛ é bǐ jí ɔ ,é dó zǒgbe xó e é ɖɔ é jí bo ɖɔ É na lɛkɔ wá gɔ̌n ce agba ǎ é na bló nǔ e un lɛ́n é ,é na bló nǔ e gbé un sɛ́ ɛ dó é . Ezayíi 5511 .
Ibyo byaba binyuranye n’imico y’Imana .	Mawu gbejinɔtɔ́ wɛ .
Ni Imana yiringirwa kandi itarenganya irakiranuka kandi ntibera . Gutegeka kwa Kabiri 324 .	É jlɔ́ bo ɖò xwi jí . Sɛ́nflínmɛ 324 .
Ijuru ni irya Yehova ,ariko isi yayihaye abantu . Zaburi 11516	Jixwé ɔ ,jixwé Mawu Mavɔmavɔ ɖokponɔ géé tɔn wɛ ,loɔ ,é na ayikúngban ɔ gbɛtɔ́ lɛ . Ðɛhan 11516
Nguko uko batakaje ibyiringiro byo kubaho iteka muri Paradizo yari hano ku isi . Intangiriro 217 55 .	Ye hɛn gbɛ̀ mavɔmavɔ ɖò Palaɖisi mɛ ɖò ayikúngban jí sín nukúnɖiɖo bú . Bǐbɛ̌mɛ 217 55 .
Uzahitemo ubuzima kugira ngo ukomeze kubaho ,wowe n’abazagukomokaho ,ukunda Yehova Imana yawe ,wumvira ijwi rye kandi umwifatanyaho akaramata . Gutegeka kwa Kabiri ,20 .	Dìn ɔ ,mi sɔ́ gbɛ̀ ɔ ,bonu mi kpo vǐ mitɔn lɛ kpo na nɔ gbɛ̀ ,bo na yí wǎn nú Mawu Mavɔmavɔ ,Mawu mitɔn ,bo na nɔ sè xó tɔn ,bo na nɔ gbeji n’i alǒ tɛ́ dó wutu tɔn . Sɛ́nflínmɛ ,20 .
Uzahitemo ubuzima . Gutegeka kwa Kabiri 3019	Dìn ɔ ,mi sɔ́ gbɛ̀ ɔ . Sɛ́nflínmɛ 3019
Nubwo tudashobora kumva ijwi ry’Imana ,twumva ibyo ivuga mu gihe dusoma Bibiliya kandi tugakurikiza ibyo dusoma . 1 Yohana 53 .	Mǐ sixu sè gbè Mawu tɔn tlɔlɔ ǎ có ,mǐ ka nɔ ɖótó è gbɔn Xó tɔn Biblu ɔ xixa kpo nǔ e ɖ’emɛ lɛ é zinzan kpo gblamɛ . 1 Jaan 53 .
Si ugukurikiza ubutabera ,ugakunda kugwa neza kandi ukagendana n’Imana yawe wiyoroshya ​ — Mika 68 .	A na nɔ yí wǎn nú nǔwiwa kpo xomɛnyínyɔ́ kpo ,bo na nɔ zán gbɛ̀ ɖò mɛɖesɔhwe mɛ ɖò Mawu towe nukɔn . Micée 68 .
Twagombye kwifata dute mu gihe abantu baturenganyije — Umurongo wa .	Nɛ̌ mǐ ka ɖó na wà nǔ xá mɛ ɖěɖee nɔ xò daka mǐ wǔ lɛ é gbɔn ​ — Wemafɔ .
Ni iki kizagera ku bantu babi ​ — Umurongo wa 10 .	Etɛ ka na jɛ dó mɛdídá lɛ wu ​ — Wemafɔ 10 .
Ni iyihe migisha abantu bakora ibyiza bazabona ​ — Umurongo wa .	Sɔgudo tɛ ka ɖò te kpɔ́n nǔjlɔjlɔwatɔ́ lɛ ​ — Wemafɔ .
Ni iki twakora duhereye ubu ​ — Umurongo wa 34 .	Etɛ mǐ ka ɖó na wà dìn ​ — Wemafɔ 34 .
Watch Tower Bible and Tract Society of Pennsylvania	Watch Tower Bible and Tract Society of Pennsylvania
Iyi gazeti yatangiye kwandikwa mu mwaka wa 1879 ,kandi ntiyivanga muri politiki .	Sín 1879 wɛ è ko ɖò xójlawema elɔ ɖetɔ́n wɛ .
Ubu koko Imana yari iri he	Fitɛ Mawu ka Ðè
Ese Imana irakureba	Mawu ka Nɔ Ðó Kɛ́n Jǐ Towe À
Ese Imana irakumva	Mawu ka Nɔ Mɔ Nukúnnú Jɛ Wǔ We À
Ese Imana yishyira mu mwanya wawe	Mawu ka Nɔ Sè Wuvɛ̌ Xá Mɛ À
Ese imibabaro ni igihano gituruka ku Mana	Wuvɛ̌ MimɔTódɔnnúmɛ Mawu Tɔn Wɛ À
Ni nde uduteza imibabaro	Mɛ̌ Wu Wuvɛ̌ Mimɔ ka Sín
Imana igiye gukuraho imibabaro yose	Mawu Na Ðó Nǔ Wuvɛ̌ lɛ Bǐ Nu Zaanɖé
Kuba Imana ikwitaho bigufitiye akamaro	Lee A Sixu Ðu Nukúnkpédómɛwu Mawu Tɔn Sín Lè Gbɔn É
Imana yumva imeze ite iyo ibonye ubabaye	Etɛ Mawu ka Nɔ Lin Dó Wuvɛ̌ E Mɔ Wɛ A Ðè lɛ É Wu
Uko ugenda utekereza ku byaremwe kandi ugasoma Ijambo ry’Imana ,ni na ko urushaho ‘ kumenya ’ Imana ,bigatuma wizera ko ‘ ikwitaho . ’ ​ — 1 Yohana 23 1 Petero 57 .	Ee a na ɖò tuùntuùn ’ i d’eji wɛ gbɔn nùɖíɖó tɔn lɛ kpo Xó tɔn kpo gblamɛ é ɔ ,mɔ̌ wɛ a na ɖò jiɖe ɖó d’eji wɛ ɖɔ é ɖò nukún kpé dó wǔ we wɛ é nɛ . 1 Jaan 23 1 Piyɛ́ɛ 57 .
Murusha ibishwi byinshi agaciro . MATAYO 1031	You are worth more . MATTHEW 1031
Niba Imana yarakoze ibyo byose ngo umubyeyi akunde umwana we kandi amwiteho ,ubwo ntibitwereka ko itwitaho kuko turi urubyaro rwayo ​ — Ibyakozwe 1729 .	LIN TAMƐ D’Enyi Mawu sɔnǔ nú tuto gɛ́dɛ́ gɛ́dɛ́ mɔhun ɖé ,bo na dó mɔ nǔ jɛ wu ɖɔ vǐnɔ e nyí gbɛtɔ́ ɖé é na kpé nukún dó vǐ tɔn wu bo lɛ́ sú vǐ ɔ sín hudo lɛ sín dò ɔ ,é sɔgbe ɖɔ Mawu ɖesunɔ na ɖó ayi mǐ mɛ e nyí vǐ tɔn lɛ é wu à cé ​ — Mɛsɛ́dó 1729 .
Ku bw’ibyo rero ,ntimutinye murusha ibishwi byinshi agaciro . Matayo .	Hǔn ,mi bo ma ɖi xɛsi ó ,ɖó mi xɔ akwɛ hú gboli gègě . Matie .
Amaso ya Yehova ari hose ,yitegereza ababi n’abeza . IMIGANI 153 .	Mawu Mavɔmavɔ sín nukún mɔ nǔ jɛ fí bǐ é nɔ ɖò mɛdídá kpo mɛ ɖagbe kpo kpɔ́n wɛ . NÙNYWƐXÓ 153 .
yo ku itariki ya 8 Kamena 2003 ,mu Gifaransa .	juin 2003 tɔn mɛ .
Bibiliya ivuga ko izina ry’Imana ari Yehova . Zaburi 8318 .	Jehovah wɛ Mawu nɔ nyí bɔ Biblu ɖexlɛ́ . Ðɛhan 8318 ,nwt .
Amaso yawe yabonye urusoro rwanjye . ZABURI 13916	Hwenu e kɛ́n jɛ nɔ ce wu é jɛn a ko mɔ mì . ÐƐHAN 13916
Kubera ko Imana ari yo yaduhaye ubushobozi bwo kugaragaza urukundo ,iyo ibitekerezo byacu n’intego zacu bishingiye ku rukundo ,birayishimisha cyane . 1 Yohana .	É ɖò wɛn ɖɔ ɖó Mawu dá mǐ kpo wanyiyi kpo wutu ɔ ,é nɔ ɖò gbesisɔmɛ bɔ akpàkpà tlɛ nɔ sɔ́ ɛ b’ɛ na mɔ nukúnnú jɛ linlin mǐtɔn lɛ kpo nǔ e nɔ sísɛ́ mǐ bɔ mǐ nɔ wà nǔ kpo wanyiyi kpo é kpo mɛ . 1 Jaan .
Amaso ya Yehova ari ku bakiranutsi ,kandi amatwi ye yumva ibyo basaba binginga . 1 PETERO 312 .	Aklunɔ sín nukún ɖò mɛ e nɔ wà nǔ jlɔjlɔ lɛ jí ,é ɖò gbesisɔmɛ ,bo na ɖótó ɖɛ yetɔn . 1 PIYƐ́Ɛ 312 .
Nzatuma ugira ubushishozi ,nkwigishe inzira ukwiriye kunyuramo . Nzakugira inama kandi ijisho ryanjye rizakugumaho . ZABURI 328 .	Mawu d’akpá ɖɔ Un na na nukúnnúmɔjɛnǔmɛ we ,un na xlɛ́ ali e a ɖó na gbɔn ɔ we un na kplɔ́n nǔ we nukún ce na ɖò jǐ towe . ÐƐHAN 328 .
Natekereje ku mirongo y’Ibyanditswe itandukanye ,urugero nk’uwo mu Bafilipi ,‘ Amahoro y’Imana asumba cyane ibitekerezo byose ,azarinda imitima yanyu n’ubushobozi bwanyu bwo kwiyumvisha ibintu .	Un nɔ lin tamɛ kpɔ́n dó wemafɔ ɖé lɛ jí ɖi Filipunu lɛ ,finɛ ɖɔ fífá Mawu tɔn e hugǎn nukúnnúmɔjɛnǔmɛ gbɛtɔ́ tɔn bǐ ɔ na bló ayixa mitɔn kpodo linlin mitɔn lɛ kpo ɖó .
Muri Yakobo 511‘ Tuvuga ko abihanganye ari bo bahiriwe .	Jaki 511 na ganjɛwu mǐ ɖɔ Mǐ nɔ ylɔ ye ɖɔ nǔnyɔnanɔ ,ɖó ye dɛ ɖò ya e ye jì lɛ nu .
Ubwo rero ,iyo abantu bishyira mu mwanya w’abandi kandi bakabitaho ,baba bigana Yehova ,Umuremyi wabo . Imigani 1431 .	Enɛ wu ɔ ,enyi wuvɛ̌sexámɛ nɔ sísɛ́ gbɛtɔ́ lɛ bonu ye nɔ d’alɔ mɛ ɖevo lɛ hǔn ,wuvɛ̌sexámɛ Gbɛɖotɔ́ yetɔn Jehovah Mawu tɔn xwedó wɛ ye ɖè nɛ . Nùnywɛxó 1431 .
Igihe Abisirayeli bari mu buretwa muri Egiputa ,hanyuma bakamara imyaka 40 mu butayu ,Bibiliya ivuga ko ‘ igihe cyose babaga bafite imibabaro ,na yo byayibabazaga ’ .	Biblu ɖɔ dó kannumɔgbenu syɛnsyɛn e togun Izlayɛli hwexónu tɔn nɔ ɖò Ejipu ,kpo xwè 40 e ye dó nɔ wuvɛ̌ mɛ na ɖò gbetótló mɛ é kpo wu ɖɔ Ye ɖò aluwɛ mɛ ɔ ,éɖesu nɔ nɔ aluwɛ mɛ xá ye .
Wahamagara Yehova akakwitaba watabaza akakubwira ati ‘ ndi hano ’ ​ — YESAYA 589 .	A súxó bo byɔ alɔgɔ́ ɔ ,é na ɖɔ nú we ɖɔ Un ɖò fí .’ ​ — EZAYÍI 589 .
Muzampamagara muze munsenge ,kandi nzabumva . ’ ​ — YEREMIYA .	Hwenɛnu ɔ ,mi na súxó ylɔ mì ,bo na xwedó mì ,lobo na savo nú mì ,bɔ un na ɖótó mi . JELEMÍI .
Igihe umuhungu wange w’imyaka 18 yarwaraga kanseri nyuma y’imyaka ibiri ikamuhitana ,numvaga nanze ubuzima kandi ntacyo maze .	Ee vǐ sunnu ce xwè 18 mɛví ɔ jɛ kansɛ́ɛzɔn nú xwè wè bo kú gudo é ɔ ,un sè wuvɛ̌ tawun bo mɔ ɖɔ gbɛ̀ gb’acɛ wǔ yè .
Yamaze amasaha menshi anteze amatwi ,hanyuma anyibutsa umurongo wo muri 1 Yohana ,kandi waramfashije .	É wɛ nyí 1 Jaan ,é ɖɔ Mawu hugǎn ayi mǐtɔn ,lobo tuùn nǔ bǐ .
Nyuma naje gusoma muri Zaburi ya 9419 ,‘ Igihe ibitekerezo bimpagarika umutima byambagamo byinshi ,ihumure riguturukaho ryatangiye gukuyakuya ubugingo bwanjye .	Enɛ wu ɔ ,un xà Ðɛhan 9419 ,é ɖɔ Enyi nǔ gègě ɖò hǔn mɛ nú mì ɔ ,gbɔ e a nɔ dó nú mì é wɛ nɔ dó xomɛhunhun nú mì .
Igihe yari afite imyaka 16 ,Imana yaguteje iyo ndwara kuko wasuzuguye nyoko .	Hwenu e Luzia ɖó xwè 16 é ɔ ,nawe e é nɔ wà azɔ̌ na é ɖé ɖɔ n’i ɖɔ Mawu dɔn tó nú we bɔ a bɛ́ kplíbɔzɔn ɖó a setónú nú nɔ towe ǎ ,bo lɛ́ xò daka wǔ tɔn wutu .
Nkora ibimushimisha kandi ‘ uko Data yantegetse gukora ni ko nkora . ’ ​ — Yohana 829 1431 .	É ɖɔ Nǔ e nyɔ́ nukún tɔn mɛ ɔ wɛ un nɔ bló tɛgbɛ bo nɔ wà nǔ lee Tɔ́ ɔ zɔ́n mì gbɔn é . Jaan 829 1431 .
Nanone Bibiliya ivuga ko ‘ Imana idakora ibibi ’ cyangwa ngo igire uwo irenganya . Yobu .	Bǐbɛ̌mɛ Biblu lɛ́vɔ ɖɔ ɖɔ Mawu kún nɔ wà nǔ nyanya ó lé é kún nɔ wà nǔ agɔ ó . Jɔbu .
Yesu arabasubiza ati ‘ yaba uyu muntu cyangwa ababyeyi be ,nta wakoze icyaha ,ahubwo byabereyeho kugira ngo imirimo y’Imana igaragarire kuri we . ’ ​ — Yohana .	Jezu ka yí gbè nú ye ɖɔ Éɖesunɔ ɔ hu hwɛ wu wɛ ǎ ,mɛ e jì i lɛ ɖě ka hu hwɛ wu wɛ ǎ é tɔ́n nukún ,bonu Mawu na dó ɖè hlɔnhlɔn tɔn xlɛ́ dó wutu tɔn .’ ​ — Jaan .
Ibya kera byavuyeho . IBYAHISHUWE .	Mawu na súnsún ɖasin bǐ sín nukún yetɔn mɛ kú sɔ́ na tíìn ǎ ,aluwɛ sɔ́ na tíìn ǎ ,alěnina sɔ́ na tíìn ǎ ,wuvɛ̌ mimɔ sɔ́ na tíìn ǎ nǔ xóxó lɛ ko bú . NǓÐEXLƐ́MƐ .
Ntibikabeho ko Imana y’ukuri ikora ibibi ,n’Ishoborabyose ngo igire uwo irenganya ​ — Yobu 3410 .	Nǔbǐwukpétɔ́ ɔ na wà nǔ agɔ gbeɖé ǎ ,b’ɛ sɔgbe xá lee é nɔ wà nǔ kpo wanyiyi kpo gbɔn é . Jɔbu 3410 .
Imana yijeje Habakuki ko yashyizeho igihe ntarengwa cyo gukuraho imibabaro . Habakuki .	Mawu na jiɖe Xabakuku ɖɔ emi ko sɔ́ hwenu ɖé bo na ɖó nǔ wuvɛ̌ lɛ nu . Xabakuku .
Nuko umuyaga urahosha ,maze haba ituze ryinshi . Mariko .	Jɔhɔn ɔ xwɛ ,bɔ fí bǐ cí tóó . Maki .
Yakijije abari bamerewe nabi bose . ’ ​ — Matayo 816 .	É gbɔ azɔn nú azinzɔnnɔ lɛ bǐ . Matie 816 .
Bibiliya igaragaza ko inshuro ebyiri ,Yesu yagaburiye abantu babarirwa mu bihumbi bararya barahaga . Matayo .	Biblu ɖɔ ɖɔ azɔn wè wɛ é na nùɖuɖu gbɛtɔ́ afatɔ́n mɔkpan ɖò sinsɛnzɔ́ tɔn hwenu . Matie .
Hari n’uwo Yesu yazuye amaze iminsi ine apfuye ​ — Mariko Luka Yohana .	Mɛ ɖěɖee é fɔ́n sín kú wá gbɛ̀ lɛ é ɖokpo ko kú bɔ é bló azǎn ɛnɛ có ,é ka fɔ́n ɛ . Maki Luki Jaan .
Mu bintu byose ,ngira imbaraga binyuze ku umpa imbaraga . Abafilipi ,.	É lɛ́ ɖɔ gɔ́ na ɖɔ Mɛ e nɔ na hlɔnhlɔn mì ɔ wɛ nɔ zɔ́n ,bɔ un nɔ sixu kpé nǔ enɛ lɛ bǐ wu . Filipunu lɛ ,.
Urugero ,mu Byahishuwe hatubwira ibyo azakora n’impamvu twagombye kwiringira ko azabikora .	Ði kpɔ́ndéwú ɔ ,Nǔɖexlɛ́mɛ ɖɔ nǔ e é na wá wà é kpo nǔ e wu mǐ sixu ɖeji dó wǔ tɔn ɖɔ é na bló é kpo nú mǐ
Arongera aravuga ati ‘ andika ,kuko ayo magambo ari ayo kwizerwa n’ay’ukuri . ’ — Ibyahishuwe .	É lɛ́ ɖɔ nú mì ɖɔ Wlǎn ,ɖó xó nugbǒ wɛ nyí xó enɛ lɛ ,bo nyí xó e wu è na ɖeji dó lɛ .’ ​ — Nǔɖexlɛ́mɛ .
Aradukunda kandi akadufasha mu gihe twacitse intege . Zaburi 13623 .	É nɔ kpé nukún dó mǐ wu ,bo nɔ hwlɛn mǐ gán hwenu e adǎn ɖò mǐ gbò wɛ é . Ðɛhan 13623 .
Yehova abona ko ububi bw’abantu bwari bwogeye mu isi ,. . . ,bimushengura umutima . Intangiriro .	Mawu Mavɔmavɔ mɔ ɖɔ dakaxixo gbɛtɔ́ tɔn sukpɔ́ .bɔ akpɔ̀ ɖó é . Bǐbɛ̌mɛ .
Ariko abicisha bugufi bo bazaragwa isi ,kandi bazishimira amahoro menshi . Zaburi .	Tò ɔ ka na nyí mɛ e nɔ sɔ́ yeɖée hwe lɛ tɔn ,bɔ fífá ma ɖó dogbó e ye na mɔ ɔ wɛ na nyí nǔ e na nɔ víví nú ye é . Ðɛhan .
Muzampamagara muze munsenge ,kandi nzabumva . ’ ​ — Yeremiya .	Hwenɛnu ɔ ,mi na súxó ylɔ mì ,bo na xwedó mì ,lobo na savo nú mì ,bɔ un na ɖótó mi . Jelemíi .
Mwegere Imana na yo izabegera . Yakobo 48 .	Mi sɛkpɔ Mawu enɛ ɔ é na sɛkpɔ mi . Jaki 48 .
Bitanze babikunze ​ — Muri Madagasikari	Ye Zé Yeɖée Jó kpo Jlǒ Kpo — Ðò Madagascar
Ni we uha unaniwe imbaraga	É Nɔ Na Hlɔnhlɔn Ðevo Mɛ E Nǔ Cikɔ Na É
Iki gice gisesengura isomo ry’umwaka wa 2018 kandi kigaragaza impamvu tugomba kureka Yehova akaduha imbaraga ,n’uko azaziduha .	Xota elɔ ɖɔ xó dó xota xwè 2018 tɔn mǐtɔn wu ,bo xlɛ́ nǔ e wu mǐ ɖó na jó Jehovah dó bɔ é na mɔ ali bo dó wusyɛn lanmɛ nú mǐ é kpo lee é na wà mɔ̌ gbɔn é kpo .
Uko Urwibutso rudufasha kunga ubumwe	Flǐn ɔ Nɔ Zɔ́n Bɔ Togun Mawu Tɔn Nɔ Nɔ Bǔ
Umunsi mukuru uba buri mwaka w’Urwibutso rw’urupfu rwa Kristo ,uzaba ku wa Gatandatu tariki ya 31 Werurwe 2018 .	È na bló Flǐn kú Klisu tɔn tɔn ɖò Samedi 31 Mars 2018 .
Kuki tugomba kugira ibyo duha Imana kandi ifite byose	Etɛwu È ka Na Na Nǔ Mɛ E Ko Ðó Nǔ Bǐ É
Ni uruhe rukundo rutuma abantu bagira ibyishimo nyakuri	Wanyiyi Alɔkpa Tɛ ka Nɔ Na Awǎjijɛ Adodwé ɔ Mɛ
Ese ubona itandukaniro mu bantu	Mɔ Vogbingbɔn ɔ Ðò Gbɛtɔ́ lɛ Tɛntin
Ese wari ubizi	A ka Tuùn À
Mu myaka isaga icumi ishize ,ababwiriza barangwa n’ishyaka n’abapayiniya basaga 70 bakomoka mu bihugu 11 ,bagiye kubwiriza muri iyo fasi irumbuka yo muri Afurika ,irimo abantu benshi bubaha Bibiliya .	Ðò xwè wǒ e wá yì lɛ é vlamɛ ɔ ,wɛnjlatɔ́ kanɖodonǔwutɔ́ kpo gbexosin - alijitɔ́ kanɖodonǔwutɔ́ kpo 70 jɛji gosin tò 11 mɛ bo yì wà sinsɛnzɔ́ ɖò fí enɛ e nɔ ɖè sínsɛ́n tɔ́n ɖò Aflika ,bɔ mɛ gègě nɔ ɖó sísí nú Biblu ɖè é .
Perrine na Louis	Perrine kpo Louis kpo
Louis n’umugore we Perrine bari mu kigero k’imyaka isaga 30 ,bavuye mu Bufaransa bajya muri Madagasikari .	Louis kpo Perrine kpo e nyí asú kpo asì kpo ɖé ,bo ɖó xwè 30 jɛji é gosin France bo yì Madagascar .
Mu mwaka wa 2012 ,Perrine yagize ubutwari ,maze we n’umugabo we Louis barimuka .	Ðò 2012 ɔ ,Perrine sɔnǔ nú akɔnkpinkpan bɔ é kpo Louis kpo sɛ̀ tɛn .
Mu Kwakira 2014 ,twize Ishuri rya Bibiliya ry’Abakristo Bashakanye ,mu Bufaransa .	Louis ɖɔ Ðò Octobre 2014 ɔ ,mǐ yì Wemaxɔmɛ Biblu Kpinkplɔn Tɔn nú Asú kpo Asì kpo Lɛ ɖò France .
Nadine na Didier	Nadine kpo Didier kpo
Igihe Didier n’umugore we Nadine bo mu Bufaransa bajyaga muri Madagasikari mu mwaka wa 2010 ,bari mu kigero k’imyaka isaga 50 .	Hwenu e Didier kpo Nadine kpo ee nyí asú kpo asì kpo ɖé é sɛ̀ tɛn sín France bo yì Madagascar ɖò 2010 é ɔ ,xwè 50 mɔ̌ ɖó wɛ ye ɖè .
Mu ikoraniro ryabaye mu mwaka wa 2005 ,Thierry n’ Kurikirana intego zihesha Imana icyubahiro .	Ðò kpléɖókpɔ́ ɖaxó ɖé jí ɖò 2005 ɔ ,Thierry kpo asì tɔn Nadia kpo kpɔ́n nùkpinkpɔn - dó - kplɔ́n - nǔ Nya Nǔ E Nɔ Sɔ́ Mawu Sù lɛ É Gbé .
Bageze muri Madagasikari mu mwaka wa 2006 kandi bahise bishimira kuhakorera umurimo .	Ye wá Madagascar ɖò 2006 bo jɛ vivǐ sinsɛnzɔ́ yetɔn tɔn ɖu jí sín hwenɛnu .
Nubwo yari afite imyaka 80 ,yarabyishimiye cyane .	É ko ɖó xwè 80 hwenɛnu có ,é ka sɔ ylɔ̌ ɔ kpo awǎjijɛ kpo .
Yari ahangayikishijwe n’iki	Etɛwu é ka lin nǔ gbɔn mɔ̌
Ukuguru kwange kw’iburyo gusumba ukw’ibumoso ho santimetero 9 .	É tinmɛ ɖɔ Afɔ ce amyɔxwé tɔn ɔ hwedo ɖisixwé tɔn ɔ wu nú santimɛtlu 9 .
Sylviana ibumoso na Sylvie Ann iburyo bari hamwe na Doratine yabatijwe	Sylviana amyɔxwé kpo Sylvie Ann kpo aɖisixwé gɔ́ nú Doratine ɖò azǎn e gbè é bló baptɛm é
Nubwo bimeze bityo ariko ,mu mwaka wa 2014 Sylviana n’undi mushiki wacu w’umupayiniya ukiri muto wo mu itorero rye witwa Sylvie Ann ,bimukiye mu mudugudu muto uri ku birometero 85 .	É ɖò mɔ̌ có ,ɖò 2014 ɔ ,Sylviana gɔ́ nú Sylvie Ann ee nyí nɔví nyɔnu gbexosin - alijitɔ́ ɖé ɖò agun tɔn mɛ é ,bɔ ye sɛ̀ tɛn yì gletoxo kpɛví e ɖó kilomɛtlu 85 dó jɔtɛn yetɔn é ɖé mɛ .
Babaze amakuru yabo n’uko umurimo umeze . Imig 1717 2525 .	Nɔ kàn nǔ byɔ ye dó sinsɛnzɔ́ yetɔn kpo ganjininɔ yetɔn kpo wu . Nùx .1717 ,nwt 2525 .
Ese ushobora kubacumbikira mu gihe bagarutse mu gihugu cyabo ,baje gushaka akazi cyangwa gusura abantu — 3 Yoh .	Hwenu e ye lɛkɔ wá jɔtɛn yetɔn bo na w’azɔ̌ alǒ bo na ɖi sà klewun é ɔ ,a ka sixu mɔ xɔ ɖé nú ye à ​ — 3 Jaan .
Bafashe kumva bisanzuye . Mat 1929 .	D’alɔ ye bonu ye ni vo cí ɖɔ xwé wɛ ye ɖè ɖɔhun . Mat .1929 .
Amagambo yo muri Yesaya 4029 aduhumuriza ate	Wusyɛn tɛ Ezayíi 4029 ka dó lanmɛ nú mǐ
Nimucyo tubanze turebe ukuntu Yehova ashobora kudufasha ,nk’uko bigaragara muri Yesaya .	Amɔ̌ jɛ nukɔn hwɛ̌ ɔ ,mi nú mǐ ni ɖɔ xó dó nǔwukpikpé e Jehovah ɖó bo na na hlɔnhlɔn mǐ bɔ è ɖexlɛ́ ɖò Ezayíi mɛ é wu .
Muri Yesaya 4026 hatwigisha iki	Etɛ Ezayíi 4026 ka sixu kplɔ́n mǐ
Soma muri Yesaya 4026 .	Xà Ezayíi 4026 .
Abahanga bavuga ko mu rujeje rwacu rwitwa Inzira Nyamata honyine ,harimo inyenyeri zisaga Miriyari 400 .	Nùnywɛ xwitixwitizɔ́watɔ́ lɛ ɖi ɖɔ sunví liva 400 wɛ ɖò sunvísɛ́kplé mǐtɔn voie lactée ɔ kɔ́kɔ́ɖɔ́kɔ́ mɛ .
Soma muri Yesaya 4028 .	Xà Ezayíi 4028 .
Soma muri Yesaya 4029 .	Xà Ezayíi 4029 .
Vuga inkuru zigaragaza ko amagambo yo muri Matayo ari ukuri .	Nǎ kpɔ́ndéwú e xlɛ́ ɖɔ xó e è ɖɔ ɖò Matie mɛ é nyí nugbǒ é ɖé .
Soma muri Yesaya 4030 .	Xà Ezayíi 4030 .
Soma muri Yesaya 4031 .	Xà Ezayíi 4031 .
a Kuki hari igihe Abakristo bagira ibyo batumvikanaho	a Etɛwu tagba ka nɔ wá tɔ́n ɖò Klisanwun lɛ tɛntin
b Inkuru y’ibyabaye kuri Yozefu itwigisha iki ku byerekeye Yehova	b Etɛ Jozɛfu sín tan ka kplɔ́n mǐ dó Jehovah wu
Ariko se Imana yatereranye Yozefu	Amɔ̌ ,é ka jó Jozɛfu dó gbeɖé ǎ .
Soma mu Befeso 426 .	Xà Efɛzinu lɛ 426 .
